,status_id,link_name,status_type,status_link,status_published,num_reactions,num_comments,num_shares,num_likes,num_loves,num_wows,num_hahas,num_sads,num_angrys,num_special,status_message_cleaned,hashtags,urls,text_filtered,text_tokenized,text_stemmed,text_original,category,score,average_sentiment_score,language
47,242079006274865_300675507081881,Photos from Canadian Coast Guard's post,photo,https://www.facebook.com/CanadianCoastGuard/photos/a.261340221015410.1073741829.242079006274865/300675350415230/?type=3,2017-10-26 19:45:17,84,2,26,84,0,0,0,0,0,0,"Today we were again on the water east of Salt Spring Island, British Columbia, with partners, participating in day two of a two-day major maritime exercise called “Exercise Salish Sea”. Our Canadian Coast Guard Ship Bartlett stood in for the ferry which was on scene yesterday. Partners practiced working together on marine environmental response techniques. This two day exercise involved approximately people from more than government and non-governmental organizations – including local Indigenous peoples from several Coastal First Nations. A total of vessels and four aircraft were employed. Big thanks to everyone who worked with us on both days! Canadian Armed Forces Transport and Infrastructure in Canada BCFerries BC Emergency Health Services, Emergency Management BC, BC Ministry of Environment, Royal Canadian Marine Search and Rescue U.S. Coast Guard Western Canada Marine Response Organization.",[],[],Today water east Salt Spring Island British Columbia partners participating day two two day major maritime exercise called Exercise Salish Canadian Coast Guard Ship Bartlett stood ferry scene yesterday Partners practiced working together marine environmental response techniques two day exercise involved approximately 500 people 20 government non governmental organizations including local Indigenous peoples several Coastal First Nations total 15 vessels four aircraft employed Big thanks everyone worked us days Canadian Armed Forces Transport Infrastructure Canada BCFerries BC Emergency Health Services Emergency Management BC BC Ministry Environment Royal Canadian Marine Search Rescue Coast Guard Western Canada Marine Response Organization,"['Today', 'water', 'east', 'Salt', 'Spring', 'Island', 'British', 'Columbia', 'partners', 'participating', 'day', 'two', 'two', 'day', 'major', 'maritime', 'exercise', 'called', 'Exercise', 'Salish', 'Canadian', 'Coast', 'Guard', 'Ship', 'Bartlett', 'stood', 'ferry', 'scene', 'yesterday', 'Partners', 'practiced', 'working', 'together', 'marine', 'environmental', 'response', 'techniques', 'two', 'day', 'exercise', 'involved', 'approximately', '500', 'people', '20', 'government', 'non', 'governmental', 'organizations', 'including', 'local', 'Indigenous', 'peoples', 'several', 'Coastal', 'First', 'Nations', 'total', '15', 'vessels', 'four', 'aircraft', 'employed', 'Big', 'thanks', 'everyone', 'worked', 'us', 'days', 'Canadian', 'Armed', 'Forces', 'Transport', 'Infrastructure', 'Canada', 'BCFerries', 'BC', 'Emergency', 'Health', 'Services', 'Emergency', 'Management', 'BC', 'BC', 'Ministry', 'Environment', 'Royal', 'Canadian', 'Marine', 'Search', 'Rescue', 'Coast', 'Guard', 'Western', 'Canada', 'Marine', 'Response', 'Organization']","[u'today', u'water', u'east', u'salt', u'spring', u'island', u'british', u'columbia', u'partner', u'particip', u'day', u'two', u'two', u'day', u'major', u'maritim', u'exercis', u'call', u'exercis', u'salish', u'canadian', u'coast', u'guard', u'ship', u'bartlett', u'stood', u'ferri', u'scene', u'yesterday', u'partner', u'practic', u'work', u'togeth', u'marin', u'environment', u'respons', u'techniqu', u'two', u'day', u'exercis', u'involv', u'approxim', u'500', u'peopl', '20', u'govern', u'non', u'government', u'organ', u'includ', u'local', u'indigen', u'peopl', u'sever', u'coastal', u'first', u'nation', u'total', '15', u'vessel', u'four', u'aircraft', u'employ', u'big', u'thank', u'everyon', u'work', 'us', u'day', u'canadian', u'arm', u'forc', u'transport', u'infrastructur', u'canada', u'bcferri', 'bc', u'emerg', u'health', u'servic', u'emerg', u'manag', 'bc', 'bc', u'ministri', u'environ', u'royal', u'canadian', u'marin', u'search', u'rescu', u'coast', u'guard', u'western', u'canada', u'marin', u'respons', u'organ']","Today we were again on the water east of Salt Spring Island, British Columbia, with partners, participating in day two of a two-day major maritime exercise called “Exercise Salish Sea”. Our Canadian Coast Guard Ship Bartlett stood in for the ferry which was on scene yesterday. Partners practiced working together on marine environmental response techniques.

This two day exercise involved approximately 500 people from more than 20 government and non-governmental organizations – including local Indigenous peoples from several Coastal First Nations. A total of 15 vessels and four aircraft were employed. 

Big thanks to everyone who worked with us on both days! Canadian Armed Forces Transport and Infrastructure in Canada BCFerries BC Emergency Health Services, Emergency Management BC, BC Ministry of Environment, Royal Canadian Marine Search and Rescue U.S. Coast Guard Western Canada Marine Response Organization.",Environmental,112,0.5,en
48,242079006274865_313101322505966,Photos from Canadian Coast Guard's post,photo,https://www.facebook.com/CanadianCoastGuard/photos/a.258864731262959.1073741828.242079006274865/313100172506081/?type=3,2017-11-28 10:50:42,91,3,18,86,4,1,0,0,0,0,"We are currently doing the fall markup on the St. Lawrence River. We remove summer buoys and replace some with winter buoys. Since buoys are installed at the safe limits of the channels the marking is a risky operation. It is necessary to maneuver the ship in all kinds of conditions, while considering the risks incurred by the crew. Especially when the bridge is iced, water is dripping from the buoys and the ship is moving, the safety of the crew must remain a priority.",[],[],currently fall markup St Lawrence River remove summer buoys replace winter buoys Since buoys installed safe limits channels marking risky operation necessary maneuver ship kinds conditions considering risks incurred crew Especially bridge iced water dripping buoys ship moving safety crew must remain priority,"['currently', 'fall', 'markup', 'St', 'Lawrence', 'River', 'remove', 'summer', 'buoys', 'replace', 'winter', 'buoys', 'Since', 'buoys', 'installed', 'safe', 'limits', 'channels', 'marking', 'risky', 'operation', 'necessary', 'maneuver', 'ship', 'kinds', 'conditions', 'considering', 'risks', 'incurred', 'crew', 'Especially', 'bridge', 'iced', 'water', 'dripping', 'buoys', 'ship', 'moving', 'safety', 'crew', 'must', 'remain', 'priority']","[u'current', u'fall', u'markup', 'st', u'lawrenc', u'river', u'remov', u'summer', u'buoy', u'replac', u'winter', u'buoy', u'sinc', u'buoy', u'instal', u'safe', u'limit', u'channel', u'mark', u'riski', u'oper', u'necessari', u'maneuv', u'ship', u'kind', u'condit', u'consid', u'risk', u'incur', u'crew', u'especi', u'bridg', u'ice', u'water', u'drip', u'buoy', u'ship', u'move', u'safeti', u'crew', u'must', u'remain', u'prioriti']","We are currently doing the fall markup on the St. Lawrence River. We remove summer buoys and replace some with winter buoys. Since buoys are installed at the safe limits of the channels the marking is a risky operation. It is necessary to maneuver the ship in all kinds of conditions, while considering the risks incurred by the crew. Especially when the bridge is iced, water is dripping from the buoys and the ship is moving, the safety of the crew must remain a priority.",Environmental,112,0.5805555555555556,en
49,242079006274865_320681858414579,,photo,https://www.facebook.com/CanadianCoastGuard/photos/a.258864731262959.1073741828.242079006274865/320681685081263/?type=3,2017-12-26 11:00:00,100,2,9,95,5,0,0,0,0,0,"The red and white ships of the Canadian Coast Guard are a visible symbol of our identity, and have been familiar and comforting sights to coastal communities since .",[],['ow.ly/rOHl30hcwhn'],red white ships Canadian Coast Guard visible symbol identity familiar comforting sights coastal communities since 1962 ow ly rOHl30hcwhn,"['red', 'white', 'ships', 'Canadian', 'Coast', 'Guard', 'visible', 'symbol', 'identity', 'familiar', 'comforting', 'sights', 'coastal', 'communities', 'since', '1962', 'ow', 'ly', 'rOHl30hcwhn']","[u'red', u'white', u'ship', u'canadian', u'coast', u'guard', u'visibl', u'symbol', u'ident', u'familiar', u'comfort', u'sight', u'coastal', u'communiti', u'sinc', u'1962', 'ow', 'ly', u'rohl30hcwhn']","The red and white ships of the Canadian Coast Guard are a visible symbol of our identity, and have been familiar and comforting sights to coastal communities since 1962. ow.ly/rOHl30hcwhn",Environmental,111,0.14285714285714285,en
50,242079006274865_300511523764946,"Caitlin Powers, Project Manager for CCG's Helicopter Team",video,https://www.facebook.com/CanadianCoastGuard/videos/300511523764946/,2017-10-26 10:00:00,86,4,20,74,11,1,0,0,0,0,Caitlin Powers is the Project Manager for CCG’s Helicopter team and has been a proud Coast Guard Employee for over years! Check out her video to learn about some of her amazing eeriences with the Coast Guard! Claim Your Place! Women in Canada,[],[],Caitlin Powers Project Manager Helicopter team proud Coast Guard Employee 10 years Check video learn amazing experiences Coast Guard Claim Place Women Canada,"['Caitlin', 'Powers', 'Project', 'Manager', 'Helicopter', 'team', 'proud', 'Coast', 'Guard', 'Employee', '10', 'years', 'Check', 'video', 'learn', 'amazing', 'experiences', 'Coast', 'Guard', 'Claim', 'Place', 'Women', 'Canada']","[u'caitlin', u'power', u'project', u'manag', u'helicopt', u'team', u'proud', u'coast', u'guard', u'employe', '10', u'year', u'check', u'video', u'learn', u'amaz', u'experi', u'coast', u'guard', u'claim', u'place', u'women', u'canada']",Caitlin Powers is the Project Manager for CCG’s Helicopter team and has been a proud Coast Guard Employee for over 10 years! Check out her video to learn about some of her amazing experiences with the Coast Guard! Claim Your Place! Women in Canada,Environmental,110,0.11666666666666665,en
51,242079006274865_303328553483243,,photo,https://www.facebook.com/CanadianCoastGuard/photos/a.258864731262959.1073741828.242079006274865/303328310149934/?type=3,2017-11-06 10:00:00,94,7,6,91,3,0,0,0,0,0,"Rick Fougère grew up in Shediac, New-Brunswick. In , at the age of , he enrolled in the Canadian Armed Forces as an Armoured Crewman. During his career, he specialized in light armoured reconnaissance with the Royal Canadian Dragoons until . He completed tours in the former Yugoslavia and retired in . After years of service, he transfered to the Coast Guard and is now working as an Incident Command System Officer. Thank you for your service, Rick. Veterans Affairs Canada",[],[],Rick grew Shediac New Brunswick 1991 age 20 enrolled Canadian Armed Forces Armoured Crewman career specialized light armoured reconnaissance Royal Canadian Dragoons 2016 completed tours former Yugoslavia retired 2016 25 years service transfered Coast Guard working Incident Command System Officer Thank service Rick Veterans Affairs Canada,"['Rick', 'grew', 'Shediac', 'New', 'Brunswick', '1991', 'age', '20', 'enrolled', 'Canadian', 'Armed', 'Forces', 'Armoured', 'Crewman', 'career', 'specialized', 'light', 'armoured', 'reconnaissance', 'Royal', 'Canadian', 'Dragoons', '2016', 'completed', 'tours', 'former', 'Yugoslavia', 'retired', '2016', '25', 'years', 'service', 'transfered', 'Coast', 'Guard', 'working', 'Incident', 'Command', 'System', 'Officer', 'Thank', 'service', 'Rick', 'Veterans', 'Affairs', 'Canada']","[u'rick', u'grew', u'shediac', u'new', u'brunswick', u'1991', u'age', '20', u'enrol', u'canadian', u'arm', u'forc', u'armour', u'crewman', u'career', u'special', u'light', u'armour', u'reconnaiss', u'royal', u'canadian', u'dragoon', u'2016', u'complet', u'tour', u'former', u'yugoslavia', u'retir', u'2016', '25', u'year', u'servic', u'transfer', u'coast', u'guard', u'work', u'incid', u'command', u'system', u'offic', u'thank', u'servic', u'rick', u'veteran', u'affair', u'canada']","Rick Fougère grew up in Shediac, New-Brunswick. In 1991, at the age of 20, he enrolled in the Canadian Armed Forces as an Armoured Crewman. 

During his career, he specialized in light armoured reconnaissance with the Royal Canadian Dragoons until 2016. He completed 4 tours in the former Yugoslavia and retired in 2016. After 25 years of service, he transfered to the Coast Guard and is now working as an Incident Command System Officer. 

Thank you for your service, Rick.

Veterans Affairs Canada",Environmental,107,-0.030952380952380936,en
52,242079006274865_320796681736430,ACGF_Eng,video,https://www.facebook.com/CanadianCoastGuard/videos/320796681736430/,2017-12-20 09:00:00,68,6,32,65,1,2,0,0,0,0,"For the EIGHTH day of our day holiday countdown ️... EIGHT State Members at the Arctic Coast Guard Forum, keeping our waters safe and navigable for all to enjoy! This past September, we proudly participated in the Arctic Coast Guard Forum with partners from Demark, Finland, Iceland, Norway, Russia, Sweden and the USA. Here are some highlights of the -day Arctic Guardian exercise in Iceland! c",[],['http://ow.ly/UJai30hj03'],EIGHTH day 12 day holiday countdown EIGHT State Members 2017 Arctic Coast Guard Forum keeping waters safe navigable enjoy past September proudly participated Arctic Coast Guard Forum partners Demark Finland Iceland Norway Russia Sweden USA highlights day Arctic Guardian exercise Iceland http ow ly UJai30hj03c,"['EIGHTH', 'day', '12', 'day', 'holiday', 'countdown', 'EIGHT', 'State', 'Members', '2017', 'Arctic', 'Coast', 'Guard', 'Forum', 'keeping', 'waters', 'safe', 'navigable', 'enjoy', 'past', 'September', 'proudly', 'participated', 'Arctic', 'Coast', 'Guard', 'Forum', 'partners', 'Demark', 'Finland', 'Iceland', 'Norway', 'Russia', 'Sweden', 'USA', 'highlights', 'day', 'Arctic', 'Guardian', 'exercise', 'Iceland', 'http', 'ow', 'ly', 'UJai30hj03c']","[u'eighth', u'day', '12', u'day', u'holiday', u'countdown', u'eight', u'state', u'member', u'2017', u'arctic', u'coast', u'guard', u'forum', u'keep', u'water', u'safe', u'navig', u'enjoy', u'past', u'septemb', u'proud', u'particip', u'arctic', u'coast', u'guard', u'forum', u'partner', u'demark', u'finland', u'iceland', u'norway', u'russia', u'sweden', u'usa', u'highlight', u'day', u'arctic', u'guardian', u'exercis', u'iceland', u'http', 'ow', 'ly', u'ujai30hj03c']","For the EIGHTH day of our 12 day holiday countdown ☃️... EIGHT State Members at the 2017 Arctic Coast Guard Forum, keeping our waters safe and navigable for all to enjoy!

This past September, we proudly participated in the Arctic Coast Guard Forum with partners from Demark, Finland, Iceland, Norway, Russia, Sweden and the USA. Here are some highlights of the 3-day Arctic Guardian exercise in Iceland! http://ow.ly/UJai30hj03c",Environmental,106,0.3583333333333333,en
53,242079006274865_278691632613602,Timeline Photos,photo,https://www.facebook.com/CanadianCoastGuard/photos/a.258864731262959.1073741828.242079006274865/278691632613602/?type=3,2017-08-24 08:01:22,53,2,49,53,0,0,0,0,0,0,This could be your office! Check out a wide variety of seagoing and shore-based jobs with the Canadian Coast Guard. Interested? We’re hiring! 8,[],['http://ow.ly/vR6F30dJNr'],could office Check wide variety seagoing shore based jobs Canadian Coast Guard Interested hiring http ow ly vR6F30dJNr8,"['could', 'office', 'Check', 'wide', 'variety', 'seagoing', 'shore', 'based', 'jobs', 'Canadian', 'Coast', 'Guard', 'Interested', 'hiring', 'http', 'ow', 'ly', 'vR6F30dJNr8']","[u'could', u'offic', u'check', u'wide', u'varieti', u'seago', u'shore', u'base', u'job', u'canadian', u'coast', u'guard', u'interest', u'hire', u'http', 'ow', 'ly', u'vr6f30djnr8']",This could be your office! Check out a wide variety of seagoing and shore-based jobs with the Canadian Coast Guard. Interested? We’re hiring! http://ow.ly/vR6F30dJNr8,Environmental,104,-0.07738095238095237,en
54,242079006274865_290534718095960,,photo,https://www.facebook.com/CanadianCoastGuard/photos/a.258864731262959.1073741828.242079006274865/290534614762637/?type=3,2017-09-27 09:48:38,85,7,12,76,5,4,0,0,0,0,"In , a team of hydrographers conducted survey work of Allen Bay, aboard CCGS Henry Larsen. They left a time capsule, ashore, beside one of the benchmarks that they used during the survey. It contained a full crew list and a list of the names of the hydrographic team. Byron Briggs, the current Commanding Officer of CCGS Henry Larsen, was part of that crew list as the Second Officer. The time capsule was later discovered in by the Bulford family that was hiking in the area. They contacted the Coast Guard shortly after the discovery, to share news of their find. In , the Bulfords will complete the last year of deployment in Resolute Bay and wondered if CCGS Henry Larsen was going to be in the area this summer, and if the ship’s crew wanted to see the time capsule before returning it safely to where it was found before winter set in. A crew change in mid-September of enabled Captain Briggs to return to the ship, in Resolute Bay, in time to welcome all five Bulford family members onboard the icebreaker. The time capsule was updated with a ship’s crew list and a list of CHS hydrographers. The Bulfords also included the story of how/when they found it. Who knows when it will be “rediscovered” or by who? Photo caption: A photographic keepsake of a great visit aboard CCGS Henry Larsen. Captain Byron Briggs and the Bulford family. In purple, young Lily is seen holding the time capsule she discovered in .",[],[],1997 team hydrographers conducted survey work Allen Bay aboard CCGS Henry Larsen left time capsule ashore beside one benchmarks used survey contained full crew list list names hydrographic team Byron Briggs current Commanding Officer CCGS Henry Larsen part 1997 crew list Second Officer time capsule later discovered 2016 Bulford family hiking area contacted Coast Guard shortly discovery share news find 2017 Bulfords complete last year deployment Resolute Bay wondered CCGS Henry Larsen going area summer crew wanted see time capsule returning safely found winter set crew change mid September 2017 enabled Captain Briggs return ship Resolute Bay time welcome five Bulford family members onboard icebreaker time capsule updated 2017 crew list list CHS hydrographers Bulfords also included story found knows Photo caption photographic keepsake great visit aboard CCGS Henry Larsen Captain Byron Briggs Bulford family purple young Lily seen holding time capsule discovered 2016,"['1997', 'team', 'hydrographers', 'conducted', 'survey', 'work', 'Allen', 'Bay', 'aboard', 'CCGS', 'Henry', 'Larsen', 'left', 'time', 'capsule', 'ashore', 'beside', 'one', 'benchmarks', 'used', 'survey', 'contained', 'full', 'crew', 'list', 'list', 'names', 'hydrographic', 'team', 'Byron', 'Briggs', 'current', 'Commanding', 'Officer', 'CCGS', 'Henry', 'Larsen', 'part', '1997', 'crew', 'list', 'Second', 'Officer', 'time', 'capsule', 'later', 'discovered', '2016', 'Bulford', 'family', 'hiking', 'area', 'contacted', 'Coast', 'Guard', 'shortly', 'discovery', 'share', 'news', 'find', '2017', 'Bulfords', 'complete', 'last', 'year', 'deployment', 'Resolute', 'Bay', 'wondered', 'CCGS', 'Henry', 'Larsen', 'going', 'area', 'summer', 'crew', 'wanted', 'see', 'time', 'capsule', 'returning', 'safely', 'found', 'winter', 'set', 'crew', 'change', 'mid', 'September', '2017', 'enabled', 'Captain', 'Briggs', 'return', 'ship', 'Resolute', 'Bay', 'time', 'welcome', 'five', 'Bulford', 'family', 'members', 'onboard', 'icebreaker', 'time', 'capsule', 'updated', '2017', 'crew', 'list', 'list', 'CHS', 'hydrographers', 'Bulfords', 'also', 'included', 'story', 'found', 'knows', 'Photo', 'caption', 'photographic', 'keepsake', 'great', 'visit', 'aboard', 'CCGS', 'Henry', 'Larsen', 'Captain', 'Byron', 'Briggs', 'Bulford', 'family', 'purple', 'young', 'Lily', 'seen', 'holding', 'time', 'capsule', 'discovered', '2016']","[u'1997', u'team', u'hydrograph', u'conduct', u'survey', u'work', u'allen', u'bay', u'aboard', u'ccgs', u'henri', u'larsen', u'left', u'time', u'capsul', u'ashor', u'besid', u'one', u'benchmark', u'use', u'survey', u'contain', u'full', u'crew', u'list', u'list', u'name', u'hydrograph', u'team', u'byron', u'brigg', u'current', u'command', u'offic', u'ccgs', u'henri', u'larsen', u'part', u'1997', u'crew', u'list', u'second', u'offic', u'time', u'capsul', u'later', u'discov', u'2016', u'bulford', u'famili', u'hike', u'area', u'contact', u'coast', u'guard', u'short', u'discoveri', u'share', u'news', u'find', u'2017', u'bulford', u'complet', u'last', u'year', u'deploy', u'resolut', u'bay', u'wonder', u'ccgs', u'henri', u'larsen', u'go', u'area', u'summer', u'crew', u'want', u'see', u'time', u'capsul', u'return', u'safe', u'found', u'winter', u'set', u'crew', u'chang', u'mid', u'septemb', u'2017', u'enabl', u'captain', u'brigg', u'return', u'ship', u'resolut', u'bay', u'time', u'welcom', u'five', u'bulford', u'famili', u'member', u'onboard', u'icebreak', u'time', u'capsul', u'updat', u'2017', u'crew', u'list', u'list', u'chs', u'hydrograph', u'bulford', u'also', u'includ', u'stori', u'found', u'know', u'photo', u'caption', u'photograph', u'keepsak', u'great', u'visit', u'aboard', u'ccgs', u'henri', u'larsen', u'captain', u'byron', u'brigg', u'bulford', u'famili', u'purpl', u'young', u'lili', u'seen', u'hold', u'time', u'capsul', u'discov', u'2016']","In 1997, a team of hydrographers conducted survey work of Allen Bay, aboard CCGS Henry Larsen. They left a time capsule, ashore, beside one of the benchmarks that they used during the survey. It contained a full crew list and a list of the names of the hydrographic team. Byron Briggs, the current Commanding Officer of CCGS Henry Larsen, was part of that 1997 crew list as the Second Officer. The time capsule was later discovered in 2016 by the Bulford family that was hiking in the area. They contacted the Coast Guard shortly after the discovery, to share news of their find. 

In 2017, the Bulfords will complete the last year of deployment in Resolute Bay and wondered if CCGS Henry Larsen was going to be in the area this summer, and if the ship’s crew wanted to see the time capsule before returning it safely to where it was found before winter set in. A crew change in mid-September of 2017 enabled Captain Briggs to return to the ship, in Resolute Bay, in time to welcome all five Bulford family members onboard the icebreaker.  The time capsule was updated with a 2017 ship’s crew list and a list of CHS hydrographers. The Bulfords also included the story of how/when they found it. Who knows when it will be “rediscovered” or by who? 

Photo caption: A photographic keepsake of a great visit aboard CCGS Henry Larsen. Captain Byron Briggs and the Bulford family. In purple, young Lily is seen holding the time capsule she discovered in 2016.",Social,104,0.5029761904761905,en
55,242079006274865_286447365171362,,photo,https://www.facebook.com/CanadianCoastGuard/photos/a.258864731262959.1073741828.242079006274865/286447308504701/?type=3,2017-09-16 08:00:00,89,3,10,84,4,1,0,0,0,0,"Did you know that the Louis S. St-Laurent, a heavy ice-breaking vessel, is the Canadian Coast Guard’s largest ship at metres long! The ship is currently on the move and is heading to the Arctic for icebreaking operations and scientific programming.",[],[],know Louis St Laurent heavy ice breaking vessel Canadian Coast largest ship 120 metres long ship currently move heading Arctic icebreaking operations scientific programming,"['know', 'Louis', 'St', 'Laurent', 'heavy', 'ice', 'breaking', 'vessel', 'Canadian', 'Coast', 'largest', 'ship', '120', 'metres', 'long', 'ship', 'currently', 'move', 'heading', 'Arctic', 'icebreaking', 'operations', 'scientific', 'programming']","[u'know', u'loui', 'st', u'laurent', u'heavi', u'ice', u'break', u'vessel', u'canadian', u'coast', u'largest', u'ship', u'120', u'metr', u'long', u'ship', u'current', u'move', u'head', u'arctic', u'icebreak', u'oper', u'scientif', u'program']","Did you know that the Louis S. St-Laurent, a heavy ice-breaking vessel, is the Canadian Coast Guard’s largest ship at 120 metres long! The ship is currently on the move and is heading to the Arctic for icebreaking operations and scientific programming.",Environmental,102,0.27142857142857146,en
