,comment_id,status_id,parent_id,comment_published,num_reactions,num_likes,num_loves,num_wows,num_hahas,num_sads,num_angrys,num_special,comment_message_cleaned,hashtags,urls
305,10156106657202975_10156116315932975,401846167974_10156106657202975,,2017-12-23 07:48:00,1,0,0,0,1,0,0,0,I’ll come get it no one claims!,[],[]
306,10156105735727975_10156115520882975,401846167974_10156105735727975,,2017-12-22 23:12:02,3,3,0,0,0,0,0,0,Just like everything else that comes out of his face... a lie,[],[]
307,10156105735727975_10156116312697975,401846167974_10156105735727975,,2017-12-23 07:45:37,1,1,0,0,0,0,0,0,nan,[],[]
308,10156105735727975_10156116320657975,401846167974_10156105735727975,,2017-12-23 07:50:50,1,0,0,0,1,0,0,0,Rxmeen Rxzwan,[],[]
309,10156105735727975_10156116634767975,401846167974_10156105735727975,10156105735727975_10156116320657975,2017-12-23 10:21:01,0,0,0,0,0,0,0,0,Hehe.,[],[]
310,10156105735727975_10156116452952975,401846167974_10156105735727975,,2017-12-23 08:55:06,5,5,0,0,0,0,0,0,Can Santa bring back all the money JT blew these past years?,[],[]
311,10156105735727975_10156117048277975,401846167974_10156105735727975,,2017-12-23 12:52:46,3,3,0,0,0,0,0,0,Not even Santa wants to talk to trudumb.,[],[]
312,10156105735727975_10156117582762975,401846167974_10156105735727975,,2017-12-23 17:07:06,0,0,0,0,0,0,0,0,No junior Santa does not talk to bad little boys or don't you remember that Oh right no one taught you much as a kid except how to steel and cheat,[],[]
313,10156105735727975_10156117679192975,401846167974_10156105735727975,,2017-12-23 17:59:30,1,1,0,0,0,0,0,0,Maybe he’s trying to reach Santa so he can transport him to the Aga Khan’s island this year instead of a private helicopter. That way he can avoid the ethics commissioner in !,[],[]
314,10156105735727975_10156118209072975,401846167974_10156105735727975,,2017-12-23 21:28:59,2,2,0,0,0,0,0,0,Yeah. Santa can see who's calling and just doesn't feel like talking to an idiot...,[],[]
315,10156105735727975_10156123237547975,401846167974_10156105735727975,,2017-12-25 13:14:51,0,0,0,0,0,0,0,0,I’m surprised Trudeau isn’t telling Canadians to stop saying Merry Christmas!,[],[]
316,10156105735727975_10156125007367975,401846167974_10156105735727975,,2017-12-25 23:55:14,0,0,0,0,0,0,0,0,Found guilty on all counts. Santa doesn’t answer little boys who are on the naughty list 🤥,[],[]
317,10156105735727975_10156132019622975,401846167974_10156105735727975,,2017-12-28 16:30:35,0,0,0,0,0,0,0,0,"Trudeau actually said "" MERRY CHRISTMAS"".",[],[]
318,10155656023722975_10156153105122975,401846167974_10155656023722975,,2018-01-04 18:46:09,0,0,0,0,0,0,0,0,Yuki Echizen,[],[]
319,10155368018762975_10156184547652975,401846167974_10155368018762975,,2018-01-15 23:23:39,0,0,0,0,0,0,0,0,Ashley Marie Murphy,[],[]
320,10155368018762975_10156184566332975,401846167974_10155368018762975,10155368018762975_10156184547652975,2018-01-15 23:39:04,0,0,0,0,0,0,0,0,Nick Humber is this what we have our car booked in for already?,[],[]
321,10155368018762975_10156184567477975,401846167974_10155368018762975,10155368018762975_10156184547652975,2018-01-15 23:39:37,0,0,0,0,0,0,0,0,Ashley Marie Murphy ours is but yes,[],[]
