,status_id,link_name,status_type,status_link,status_published,num_reactions,num_comments,num_shares,num_likes,num_loves,num_wows,num_hahas,num_sads,num_angrys,num_special,status_message_cleaned,hashtags,urls
392,460123390028_10159096938415029,Timeline Photos,photo,https://www.facebook.com/EnvironnementetressourcesnaturellesauCanada/photos/a.481746145028.384353.460123390028/10159096938415029/?type=3,2017-07-24 10:39:48,1,0,0,0,1,0,0,0,0,0,"Avec un bassin versant qui s’étend sur quatre provinces et quatre États, le lac Winnipeg est le sixième lac en importance du Canada et représente une ressource précieuse pour les Canadiens. Il revêt aussi une importance culturelle, sociale et économique pour la santé des Autochtones et de leurs collectivités. Le lac Winnipeg est important pour l’économie canadienne, générant des millions de dollars de recettes dans les secteurs de l’hydroélectricité, des loisirs et de la pêche commerciale en eau douce. Voilà pourquoi le gouvernement du Canada investit ,7 millions de dollars dans le Programme du bassin du lac Winnipeg. Dans le cadre de ce programme, des mesures seront prises pour réduire la charge nutritive et améliorer la qualité de l’eau du bassin. De plus, des collaborateurs et des partenaires autochtones de tous les niveaux au Canada et aux États Unis seront mobilisés afin que des mesures énergiques soient prises pour protéger les eaux du lac Winnipeg communes aux deux pays.",[],['http://ow.ly/LsGb30dRUte']
393,460123390028_10159079190335029,Timeline Photos,photo,https://www.facebook.com/EnvironnementetressourcesnaturellesauCanada/photos/a.481746145028.384353.460123390028/10159079190335029/?type=3,2017-07-21 13:05:10,3,0,0,3,0,0,0,0,0,0,"Bientôt, un nouveau jeu-questionnaire énÉnergie! Évaluez votre connaissance du dossier de l’énergie au Canada en répondant au jeu actuel :",['#G'],['http://ow.ly/5whb30dOJfm']
394,460123390028_10159078107620029,Timeline Photos,photo,https://www.facebook.com/EnvironnementetressourcesnaturellesauCanada/photos/a.481746145028.384353.460123390028/10159078107620029/?type=3,2017-07-21 09:15:06,3,0,1,3,0,0,0,0,0,0,"Grêle – Ne la laissez pas briser vos plans! Consultez vos prévisions, veilles et avertissements météo locales pour connaître les possibilités d’orages avec grêle.",[],['http://ow.ly/x9ob30dINyA']
395,460123390028_10159077609450029,Timeline Photos,photo,https://www.facebook.com/EnvironnementetressourcesnaturellesauCanada/photos/a.481746145028.384353.460123390028/10159077609450029/?type=3,2017-07-21 07:50:05,2,0,0,2,0,0,0,0,0,0,"Avez-vous une maison pour moi? Dans le cadre du Programme d’intendance de l’habitat du Canada, la fiducie foncière locale, Habitat Acquisition Trust de Victoria, collabore avec les propriétaires fonciers pour construire dortoirs de chauves-souris – pour des espèces comme cette grande chauve-souris brune. Ils ont évalué les colonies de chauves-souris et les ont retirées des bâtiments en toute sécurité. Lisez d’autres histoires :",[],['http://ow.ly/8XAH30dO86H']
396,460123390028_10159067226925029,Timeline Photos,photo,https://www.facebook.com/EnvironnementetressourcesnaturellesauCanada/photos/a.481746145028.384353.460123390028/10159067226925029/?type=3,2017-07-19 10:40:06,2,0,1,1,1,0,0,0,0,0,La ville abrite une biodiversité étonnante! Découvrez la nature tout en vous rendant au parc. La BioTrousse Urbaine peut vous aider à évaluer la biodiversité de votre quartier.,[],['http://ow.ly/zTYb30dIKeA']
397,460123390028_10159062987595029,Timeline Photos,photo,https://www.facebook.com/EnvironnementetressourcesnaturellesauCanada/photos/a.481746145028.384353.460123390028/10159062987595029/?type=3,2017-07-18 16:00:17,4,1,0,4,0,0,0,0,0,0,"À ne pas manquer DEMAIN! Sur le compte Instagram de Ressources Naturelles Canada (RNCan), la géophysicienne Victoria Tschirhart nous donnera un aperçu de la vie de terrain de nos scientifiques l’été. Elle nous décrira sa journée au fil de son déroulement. Suivez la page Instagram de RNCan pour ne rien manquer!",[],['http://ow.ly/cyu530dHtfN']
398,460123390028_10159061112195029,Timeline Photos,photo,https://www.facebook.com/EnvironnementetressourcesnaturellesauCanada/photos/a.481746145028.384353.460123390028/10159061112195029/?type=3,2017-07-18 09:25:04,5,0,0,3,0,2,0,0,0,0,Juillet est habituellement le mois de l’année où il tombe le plus de grêle. Surveillez les alertes météorologiques publiques pour le Canada afin de connaître les alertes et les veilles d’orage dans votre région.,[],['http://ow.ly/7HiO30dIJ7o']
399,460123390028_10159057045785029,Timeline Photos,photo,https://www.facebook.com/EnvironnementetressourcesnaturellesauCanada/photos/a.481746145028.384353.460123390028/10159057045785029/?type=3,2017-07-17 15:45:06,5,1,0,4,1,0,0,0,0,0,"La docteure Roberta Bondar de la Roberta Bondar Foundation s’est jointe aux chercheurs du Service canadien de la faune au campement de l’île Country Island en Nouvelle-Écosse. Le projet de rétablissement de la population de sternes à Country Island en est à sa e année d’existence. La fondation utilise la photographie et l’art pour rapprocher les gens de l’environnement. Combiner l’art et la science favorise l’apprentissage et éveille la curiosité! La Dre Bondar a été la première femme astronaute canadienne et elle a passé huit jours dans l’espace! Tout comme les chercheurs de Country Island, elle a une bonne idée de la vie dans des espaces restreints et des lieux éloignés!",[],[]
400,460123390028_10159056916305029,Timeline Photos,photo,https://www.facebook.com/EnvironnementetressourcesnaturellesauCanada/photos/a.481746145028.384353.460123390028/10159056916305029/?type=3,2017-07-17 15:20:05,2,0,1,2,0,0,0,0,0,0,"Des grêlons gros comme des pamplemousses sont déjà tombés au Canada. Cependant, même ceux de plus petites tailles peuvent être dangereux et causer de graves dommages en quelques minutes seulement. Renseignez-vous pour savoir comment rester en sécurité en cas de grêle. UD",[],['http://ow.ly/bm0630dGL']
401,460123390028_10159050432305029,Timeline Photos,photo,https://www.facebook.com/EnvironnementetressourcesnaturellesauCanada/photos/a.481746145028.384353.460123390028/10159050432305029/?type=3,2017-07-16 13:40:08,8,4,4,7,1,0,0,0,0,0,Savez-vous que les couleuvres peuvent libérer un liquide nauséabond lorsqu’elles sont dérangées? Réfléchissez bien avant d’en prendre une. Bonne journée mondiale du serpent!,[],[]
402,460123390028_10159043539025029,Timeline Photos,photo,https://www.facebook.com/EnvironnementetressourcesnaturellesauCanada/photos/a.481746145028.384353.460123390028/10159043539025029/?type=3,2017-07-15 09:45:05,4,0,1,4,0,0,0,0,0,0,Bonne Journée des parcs du Canada! C’est la journée idéale pour sortir et se rapprocher de la nature! Planifiez votre visite dès maintenant! 2 Parcs Canada,[],['http://ow.ly/dL8w30dDjk']
403,460123390028_10159037939625029,Timeline Photos,photo,https://www.facebook.com/EnvironnementetressourcesnaturellesauCanada/photos/a.481746145028.384353.460123390028/10159037939625029/?type=3,2017-07-14 11:01:14,3,0,0,3,0,0,0,0,0,0,"Saviez-vous que le Canada est en pointe dans le captage et le stockage du carbone, une écotechnologie qui permet de capter les émissions de CO2 d’importantes sources ponctuelles pour les séquestrer sous terre en toute sécurité. C’est une des nombreuses solutions qui aideront le Canada à atteindre ses cibles de réduction des émissions de gas à effet de serre. Pensez-vous qu’elle jouera un rôle important dans la lutte contre les changements climatiques dans le futur système énergétique du Canada? Nous voulons vos idées à énÉnergie!",['#G'],['http://ow.ly/v4t230dzD5j']
404,460123390028_10159037755200029,Timeline Photos,photo,https://www.facebook.com/EnvironnementetressourcesnaturellesauCanada/photos/a.481746145028.384353.460123390028/10159037755200029/?type=3,2017-07-14 10:15:06,5,0,1,5,0,0,0,0,0,0,"C’est la Journée de sensibilisation aux requins! Le Canada possède des ressources océaniques sans pareil, qui recèlent de toutes sortes d’espèces sauvages étonnantes. Certains problèmes, comme les changements climatiques, entraînent une hausse du niveau de la mer et une perte d’habitats marins. Il faut absolument protéger nos eaux. Le gouvernement du Canada est déterminé à accroître son réseau d’aires marines protégées, à régler les problèmes environnementaux et à assurer la santé à long terme des écosystèmes. Vous voulez en apprendre davantage sur les côtes et les océans du Canada? Jetez un coup d’œil à la Stratégie fédérale de développement durable!",['#FSDS'],['http://ow.ly/dVuV30dDcI7']
405,460123390028_10159030154470029,Timeline Photos,photo,https://www.facebook.com/EnvironnementetressourcesnaturellesauCanada/photos/a.481746145028.384353.460123390028/10159030154470029/?type=3,2017-07-13 15:13:07,3,0,1,2,0,1,0,0,0,0,"Le mars , à h , heure locale, une météorite a traversé le ciel près de Bruderheim, en Alberta, et a frappé le sol. L’impact s’est fait entendre sur plus de kilomètres carrés. Pesant plus de kilogrammes, la météorite de Bruderheim demeure la plus grosse jamais retrouvée au Canada. Il est juste de dire qu’avec ses quelque ,6 milliards d’années elle est un joyau dans notre Collection nationale de météorites.",[],['http://ow.ly/n5oZ30dC3u4']
406,460123390028_10159030107105029,Timeline Photos,photo,https://www.facebook.com/EnvironnementetressourcesnaturellesauCanada/photos/a.481746145028.384353.460123390028/10159030107105029/?type=3,2017-07-13 15:01:29,2,0,0,2,0,0,0,0,0,0,"C’est aujourd’hui la Journée internationale de la sensibilisation aux requins! Saviez-vous que les requins que nous retrouvons dans nos eaux canadiennes sont, la plupart du temps, sans défense? Par contre, ils pourraient être blessés par les bateaux. Alors gardez une certaine distance par rapport à eux lorsque vous naviguez sur l’eau. Pour en apprendre davantage sur les requins :",[],['http://ow.ly/pO7s30dC2tm']
407,460123390028_10159029600485029,,video,https://www.facebook.com/EnvironnementetressourcesnaturellesauCanada/videos/10159029600485029/,2017-07-13 13:26:57,2,0,5,2,0,0,0,0,0,0,"La ministre de l’Environnement et du Changement climatique Catherine McKenna veut connaître votre opinion! Le gouvernement du Canada a publié un document de travail qui décrit l’approche qu’il propose pour moderniser les processus environnementaux et réglementaires. Les Canadiens sont invités à lire le document de travail et à dire ce qu’ils en pensent d’ici au août . Pour en savoir plus, visitez le site",[],['http://ow.ly/L2tx30dBPW5']
408,460123390028_10159023777400029,,video,https://www.facebook.com/EnvironnementetressourcesnaturellesauCanada/videos/10159023777400029/,2017-07-12 14:06:25,3,0,1,3,0,0,0,0,0,0,La réunion de la Commission for Environmental Cooperation de cette année a souligné les solutions de locales qui se retrouvent sur l’Île-du-Prince-Édouard! Renseignez-vous.,['#TechnologiesPropres'],[]
409,460123390028_10159023584980029,,video,https://www.facebook.com/EnvironnementetressourcesnaturellesauCanada/videos/10159023584980029/,2017-07-12 13:41:40,3,1,1,3,0,0,0,0,0,0,"À la Commission for Environmental Cooperation la ministre de l’Environnement et Changement climatique du Canada, Catherine McKenna, a rencontré les gagnants canadiens du Défi innovation jeunesse. Adam Wali et Vanessa Fiore ont eliqué leur idée gagnante pour lutter contre les changements climatiques à l’échelle locale.",[],[]
410,460123390028_10159023035630029,Timeline Photos,photo,https://www.facebook.com/EnvironnementetressourcesnaturellesauCanada/photos/a.481746145028.384353.460123390028/10159023035630029/?type=3,2017-07-12 11:30:24,3,0,1,3,0,0,0,0,0,0,"Les changements climatiques seront l’un des grands défis du Canada pour les prochaines années. Par où commencer? Tout d’abord, vous pouvez nous aider à formuler un projet d’avenir pour l’énergie au Canada en lançant des idées à énÉnergie c Aidez à définir l’avenir énergétique de la prochaine génération!",['#G'],['http://ow.ly/ljrJ30dzBT']
411,460123390028_10159016495425029,Timeline Photos,photo,https://www.facebook.com/EnvironnementetressourcesnaturellesauCanada/photos/a.481746145028.384353.460123390028/10159016495425029/?type=3,2017-07-11 08:32:41,4,0,0,3,0,0,0,1,0,0,Avis aux biologistes et aux chercheurs dans le domaine de la conservation! L’éthanol joue un rôle important dans votre équipement mobile. Soyez prêt à recueillir des échantillons si vous voyez des amphibiens morts. Consultez cette feuille de renseignement et préparez-vous en conséquence : écontamination,['#D'],['http://ow.ly/j4bb30dxmlq']
412,460123390028_10159011413010029,Timeline Photos,photo,https://www.facebook.com/EnvironnementetressourcesnaturellesauCanada/photos/a.481746145028.384353.460123390028/10159011413010029/?type=3,2017-07-10 11:05:07,3,0,0,3,0,0,0,0,0,0,Félicitations à tous les récipiendaires qui recevront l’aide du gouvernement du Canada par l’intermédiaire du Fonds pour dommages à l’environnement. C’est formidable de voir autant d’organisations travailler afin de restaurer nos habitats naturels.,[],['http://ow.ly/2eNw30dv4EI']
413,460123390028_10158992906165029,Timeline Photos,photo,https://www.facebook.com/EnvironnementetressourcesnaturellesauCanada/photos/a.481746145028.384353.460123390028/10158992906165029/?type=3,2017-07-07 11:00:35,3,0,0,3,0,0,0,0,0,0,"Mesures de protection contre la chaleur et l’humidité : Maintenez un niveau de sel adéquat dans votre corps, buvez beaucoup d’eau, reposez-vous fréquemment lorsque vous travaillez dehors et évitez les aliments à haute teneur en protéines. Pour en apprendre davantage, visitez la page :",[],['http://ow.ly/IRrY30drnxG']
414,460123390028_10158987412290029,Timeline Photos,photo,https://www.facebook.com/EnvironnementetressourcesnaturellesauCanada/photos/a.481746145028.384353.460123390028/10158987412290029/?type=3,2017-07-06 13:25:08,0,0,0,0,0,0,0,0,0,0,Appel à tous les biologistes! Sauriez-vous déceler la maladie fongique du serpent? Saviez-vous que vous pouvez partager vos observations et envoyer des échantillons pour les faire analyser et nous aider à comprendre cette maladie? Sauvons nos serpents! C,[],['http://ow.ly/42yX30doAl']
415,460123390028_10158986480335029,Timeline Photos,photo,https://www.facebook.com/EnvironnementetressourcesnaturellesauCanada/photos/a.481746145028.384353.460123390028/10158986480335029/?type=3,2017-07-06 09:40:05,3,0,0,3,0,0,0,0,0,0,"Les campeurs et les randonneurs sont parmi les personnes les plus couramment frappées par la foudre. Lorsque vous voyez des éclairs, mettez-vous à l’abri, même si vous n’entendez pas le tonnerre! Trouvez immédiatement un endroit sécuritaire, soit dans un bâtiment avec plomberie et électricité, soit dans une voiture en métal (sans toit rétractable). VOTRE TENTE N’EST PAS UN LIEU SÛR.",[],['http://ow.ly/z55e30dozdH']
416,460123390028_10158982226020029,,video,https://www.facebook.com/EnvironnementetressourcesnaturellesauCanada/videos/10158982226020029/,2017-07-05 15:53:08,3,0,0,2,0,0,0,0,1,0,Vos commentaires guideront les prochaines étapes du processus sur le document de travail à,['#examenEE'],['http://ow.ly/nWuc30dndnL']
417,460123390028_10158979942320029,Timeline Photos,photo,https://www.facebook.com/EnvironnementetressourcesnaturellesauCanada/photos/a.481746145028.384353.460123390028/10158979942320029/?type=3,2017-07-05 08:15:22,9,1,4,8,1,0,0,0,0,0,Procurez-vous la BioTrousse Nature pour enregistrer vos découvertes et observer ce que la nature a de mieux à offrir! Une idée originale pour découvrir la biodiversité urbaine!,[],['http://ow.ly/kFZq30dlMNv']
418,460123390028_10158975462440029,,video,https://www.facebook.com/EnvironnementetressourcesnaturellesauCanada/videos/10158975462440029/,2017-07-04 15:00:00,2,0,0,2,0,0,0,0,0,0,L’engagement est au cœur de l’. Donnez votre point de vue sur le document de travail à :,['#examenEE'],['https://www.canada.ca/fr/services/environnement/conservation/evaluation/examens-environnementaux.html']
419,460123390028_10158975481430029,ExamenEE,video,https://www.facebook.com/EnvironnementetressourcesnaturellesauCanada/videos/10158975481430029/,2017-07-04 15:00:00,1,0,1,1,0,0,0,0,0,0,L’engagement est au cœur de l’. Donnez votre point de vue sur le document de travail à :,['#examenEE'],['http://ow.ly/2tYd30dkpOK']
420,460123390028_10158975475165029,Timeline Photos,photo,https://www.facebook.com/EnvironnementetressourcesnaturellesauCanada/photos/a.481746145028.384353.460123390028/10158975475165029/?type=3,2017-07-04 14:10:07,3,0,0,2,0,1,0,0,0,0,"En ce jour historique de , Arthur, un ouragan se déplaçant très lentement, a frappé les Maritimes. Des pluies diluviennes (pas moins de ,6 mm) se sont abattues sur Miramichi au Nouveau-Brunswick, et des rafales de km/h ont été enregistrées à Greenwood, en Nouvelle-Écosse le juillet.","['#Canada150', '#EnCeJour']",[]
421,460123390028_10158974380385029,Timeline Photos,photo,https://www.facebook.com/EnvironnementetressourcesnaturellesauCanada/photos/a.481746145028.384353.460123390028/10158974380385029/?type=3,2017-07-04 10:30:42,4,0,1,4,0,0,0,0,0,0,"Amis pêcheurs! En cette Semaine nationale de la pêche, assurez-vous de consulter les prévisions et les avertissements maritimes pour le Canada.",[],['http://ow.ly/cIqE30djCPM']
422,460123390028_10158956066045029,Timeline Photos,photo,https://www.facebook.com/EnvironnementetressourcesnaturellesauCanada/photos/a.481746145028.384353.460123390028/10158956066045029/?type=3,2017-07-01 14:40:03,0,0,0,0,0,0,0,0,0,0,"Vous organisez une fête pour le ? Essayez de faire des choix écolos, en fournissant à vos invités de la vaisselle et des ustensiles réutilisables, afin de réduire la quantité de déchet que vous produisez. Gardons le Canada propre et vert pour les prochaines années!",['#Canada150'],[]
423,460123390028_10158949307595029,une carte interactive de Ressources naturelles Canada,video,https://www.facebook.com/EnvironnementetressourcesnaturellesauCanada/videos/10158949307595029/,2017-07-01 13:00:00,3,0,2,3,0,0,0,0,0,0,"Bonne êteduCanada! Dans le cadre des célébrations , une carte interactive de Ressources naturelles Canada montre l’évolution du territoire canadien de à .","['#F', '#Canada150']",['http://ow.ly/q7lo30dcf9o']
424,460123390028_10158942971510029,,video,https://www.facebook.com/EnvironnementetressourcesnaturellesauCanada/videos/10158942971510029/,2017-07-01 10:20:00,4,0,1,4,0,0,0,0,0,0,Découvrez notre nature! Joyeux e Canada!,['#Canada150'],[]
425,460123390028_10158948679260029,Timeline Photos,photo,https://www.facebook.com/EnvironnementetressourcesnaturellesauCanada/photos/a.481746145028.384353.460123390028/10158948679260029/?type=3,2017-06-30 12:10:09,2,0,1,2,0,0,0,0,0,0,"En ce jour historique de , une tempête, connue sous le nom de « cyclone de Regina », s’est abattue sur cette ville. Elle a été classée F4 sur l’échelle de Fujita selon les dommages qui ont été signalés et les photographies historiques. Il s’agit de la tornade la plus meurtrière de l’histoire du Canada.","['#Canada150', '#EnCeJour']",[]
426,460123390028_10158943704460029,,video,https://www.facebook.com/EnvironnementetressourcesnaturellesauCanada/videos/10158943704460029/,2017-06-30 11:00:00,2,1,1,2,0,0,0,0,0,0,"Les griffons hydrothermaux constituent une importante caractéristique de nos océans et pourraient bien recéler le secret de l’origine de la vie sur Terre. Le nouveau grand site d’intérêt hauturier dans le Pacifique, au large de la Colombie-Britannique, vise à protéger toute une série de griffons hydrothermaux, similaires à ceux de la zone de protection marine du champ hydrothermal Endeavour. Regardez pour en apprendre davantage :",[],[]
427,460123390028_10158948259760029,EA Discussion Paper,video,https://www.facebook.com/EnvironnementetressourcesnaturellesauCanada/videos/10158948259760029/,2017-06-30 10:49:37,1,0,0,1,0,0,0,0,0,0,Commentez le document de travail sur l’approche proposée pour les processus environnementaux et réglementaires à,[],['http://ow.ly/E3wa30dbwk7']
428,460123390028_10158947280885029,Timeline Photos,photo,https://www.facebook.com/EnvironnementetressourcesnaturellesauCanada/photos/a.481746145028.384353.460123390028/10158947280885029/?type=3,2017-06-30 07:35:08,2,0,1,2,0,0,0,0,0,0,"Bonne éeDesMédiasSociaux! Merci d’échanger avec nous et de partager notre passion pour les espèces sauvages et l’environnement. Vous en voulez plus? Allez voir les publications du gouvernement du Canada sur Twitter, Instagram, Youtube, Pinterest et Flickr :",['#Journ'],['http://ow.ly/qI0930d8Yax']
429,460123390028_10158944010410029,EA Review,video,https://www.facebook.com/EnvironnementetressourcesnaturellesauCanada/videos/10158944010410029/,2017-06-29 16:19:27,3,0,3,3,0,0,0,0,0,0,Le document de travail sur l’examan des processus environnementaux et réglementaires est sorti! Vos points de vue à :,[],['http://ow.ly/DzIZ30d8RKX']
430,460123390028_10158937451885029,Timeline Photos,photo,https://www.facebook.com/EnvironnementetressourcesnaturellesauCanada/photos/a.481746145028.384353.460123390028/10158937451885029/?type=3,2017-06-28 14:15:14,4,0,0,4,0,0,0,0,0,0,"Cet été, venez découvrir la nature canadienne dans l’une de ces réserves nationales de faune.",['#Canada150'],['http://ow.ly/uG3P30d1E1L']
431,460123390028_10158936697310029,Timeline Photos,photo,https://www.facebook.com/EnvironnementetressourcesnaturellesauCanada/photos/a.481746145028.384353.460123390028/10158936697310029/?type=3,2017-06-28 12:15:06,3,0,1,3,0,0,0,0,0,0,Le Plan d’action Saint-Laurent est une source d’information scientifique de qualité qui permet aux gouvernements de combiner leurs efforts pour préserver les richesses du Saint-Laurent. Le suivi de l’état du Saint-Laurent a permis de constater une hausse de la population d’esturgeons jaunes. Pour suivre l’état de santé du fleuve :,[],['http://ow.ly/qCFv30d1Aa3']
432,460123390028_10158935541600029,Timeline Photos,photo,https://www.facebook.com/EnvironnementetressourcesnaturellesauCanada/photos/a.481746145028.384353.460123390028/10158935541600029/?type=3,2017-06-28 09:15:07,1,0,2,1,0,0,0,0,0,0,"Au cours de la saison estivale de temps violent, la météo peut changer très rapidement. Surveillez les alertes météo et gardez un œil sur le ciel.",[],['http://ow.ly/SX9y30d1eeX']
433,460123390028_10158934431100029,Environnement et ressources naturelles au Canada's cover photo,photo,https://www.facebook.com/EnvironnementetressourcesnaturellesauCanada/photos/a.10151461436230029.832066.460123390028/10158934429685029/?type=3,2017-06-28 06:27:10,4,1,1,3,1,0,0,0,0,0,nan,[],[]
434,460123390028_10158929255480029,Timeline Photos,photo,https://www.facebook.com/EnvironnementetressourcesnaturellesauCanada/photos/a.481746145028.384353.460123390028/10158929255480029/?type=3,2017-06-27 15:45:05,4,0,0,4,0,0,0,0,0,0,"N’oubliez pas! Demain, vous aurez l’occasion de participer à une visite guidée dans l’un des espaces naturels protégés les plus incroyables du Canada! Venez y rencontrer les membres de l’eédition du Canada C3 et les biologistes du Service canadien de la faune de la région!",['#Canada150'],['http://ow.ly/1bG930cWvNm']
435,460123390028_10158928785160029,Timeline Photos,photo,https://www.facebook.com/EnvironnementetressourcesnaturellesauCanada/photos/a.481746145028.384353.460123390028/10158928785160029/?type=3,2017-06-27 14:08:52,6,0,0,6,0,0,0,0,0,0,"La ministre de l’Environnement et du Changement climatique, Catherine McKenna, est à Charlottetown (Î.-P.-É.) pour ouvrir la séance annuelle de la Commission de coopération environnementale Comme la rencontre de cette année porte sur l’innovation et la croissance propre, quoi de mieux pour commencer qu’une visite dans un parc éolien? À Summerside (Î.-P.-É), % de l’énergie est générée par le vent. Voilà un excellent exemple d’énergie propre qui souffle la concurrence!",[],[]
436,460123390028_10158927573860029,« Pour l’amour des oiseaux »,photo,https://www.facebook.com/EnvironnementetressourcesnaturellesauCanada/photos/a.10158927568695029.1073741890.460123390028/10158927573860029/?type=3,2017-06-27 09:37:16,3,0,0,1,2,0,0,0,0,0,"L’eition « Pour l’amour des oiseaux » a reçu le prix Robert Bateman, qui rend hommage aux artistes qui aident à faire connaître et aimer la faune. Seize étudiants en arts visuels de l’université Mount Allison au Nouveau-Brunswick ont été récompensés pour leurs œuvres évoquant ans de conservation des oiseaux au Canada. Cette eition est le fruit d’une collaboration entre l’université et le Service canadien de la faune d’Environnement et Changement climatique Canada. Chapeau!",[],['http://ow.ly/z31j30cVSvY']
437,460123390028_10158927247905029,Timeline Photos,photo,https://www.facebook.com/EnvironnementetressourcesnaturellesauCanada/photos/a.481746145028.384353.460123390028/10158927247905029/?type=3,2017-06-27 08:35:04,3,0,1,3,0,0,0,0,0,0,"Votre opinion est importante! Le projet de règlement concernant la zone de protection marine du chenal Laurentien a fait l’objet d’une publication préalable dans la Partie I de la Gazette du Canada. Cela signifie qu’au cours des prochains jours, les Canadiens peuvent fournir leur opinion sur le projet de règlement concernant cet unique écosystème, qui se trouve au large de Terre-Neuve. Vous désirez partager vos commentaires ? Cliquez ici :",[],['http://ow.ly/eAtT30cVEJy']
