,status_id,link_name,status_type,status_link,status_published,num_reactions,num_comments,num_shares,num_likes,num_loves,num_wows,num_hahas,num_sads,num_angrys,num_special,status_message_cleaned,hashtags,urls
691,460123390028_10158290905470029,Timeline Photos,photo,https://www.facebook.com/EnvironnementetressourcesnaturellesauCanada/photos/a.481746145028.384353.460123390028/10158290905470029/?type=3,2017-02-24 17:18:00,3,0,0,3,0,0,0,0,0,0,Nous lançons un appel à tous les innovateurs du secteur des technologies propres. Voici votre chance de mettre en œuvre vos solutions climatiques canadiennes à l’échelle mondiale. Le gouvernement du Canada a investi millions de dollars dans des projets qui réduiront la pollution et les déchets au Mexique et au Chili. Soumettez vos propositions d’ici le mars.,[],['https://www.canada.ca/fr/services/environnement/meteo/changementsclimatiques/mesures-internationales-canada/mexico-chile-soutien-mise-en-oeuvre-contributions-determinees-niveau-national.html']
692,460123390028_10158290639655029,Timeline Photos,photo,https://www.facebook.com/EnvironnementetressourcesnaturellesauCanada/photos/a.481746145028.384353.460123390028/10158290639655029/?type=3,2017-02-24 15:01:10,2,0,0,2,0,0,0,0,0,0,Êtes-vous prêts à dévaler les pentes de ski cette fin de semaine? La météo peut changer rapidement lorsque vous voyagez. Assurez-vous de vérifier les conditions météorologiques et les alertes avant de partir.,[],['http://ow.ly/ROsj309hYkb']
693,460123390028_10158290352335029,,video,https://www.facebook.com/EnvironnementetressourcesnaturellesauCanada/videos/10158290352335029/,2017-02-24 13:50:12,6,3,2,6,0,0,0,0,0,0,"Vous êtes-vous déjà questionné sur l’état de votre environnement? Les indicateurs canadiens de durabilité de l’environnement fournissent des données et des renseignements sur l’état de l’environnement et permettent d’évaluer le rendement du Canada en matière d’enjeux liés à la durabilité environnementale tels que l’air et le climat, l’eau et la nature. Renseignez-vous sur les nouveautés! 8",[],['http://ow.ly/QmsP309kDW']
694,460123390028_10158286321125029,Timeline Photos,photo,https://www.facebook.com/EnvironnementetressourcesnaturellesauCanada/photos/a.481746145028.384353.460123390028/10158286321125029/?type=3,2017-02-23 15:30:17,5,0,0,5,0,0,0,0,0,0,"À l’heure actuelle, les dons écologiques s’étendent à toutes les régions du Sud du Canada et contribuent beaucoup à la création d’un réseau d’aires protégées! Ces dons aident à protéger le patrimoine naturel du Canada pour les générations à venir. Le don écologique Kofman – Moose Bay dans la réserve naturelle O’Donnell Point, qui fait partie du littoral de la baie Georgienne, lequel a été désigné comme réserve de la biosphère de l’UNESCO, en est un bel exemple. Cette aire protégée abrite cinq espèces de reptiles en péril. En acceptant les dons de terres écosensibles, la Georgian Bay Land Trust contribue à protéger les habitats rares et à conserver la biodiversité du Canada.",[],['http://ow.ly/91uq309iwH4']
695,460123390028_10158286267460029,Écologisation du gouvernement : écologiser la culture de travail,video,https://www.facebook.com/EnvironnementetressourcesnaturellesauCanada/videos/10158286267460029/,2017-02-23 15:22:49,3,2,3,3,0,0,0,0,0,0,"Vous êtes-vous déjà demandé comment les gouvernements, les industries et les entreprises s’y prennent pour réduire leur empreinte carbone? Que faites-vous dans votre lieu de travail pour réduire les émissions de gaz à effet de serre? Écoutez la table ronde sur l’écologisation de notre culture de travail, animée par l’honorable Scott Brison, président du Conseil du Trésor. Pour de plus amples renseignements, veuillez consulter .",[],['https://www.canada.ca/fr/secretariat-conseil-tresor/services/innovation/ecologiser-gouvernement.html']
696,460123390028_10158286236875029,Timeline Photos,photo,https://www.facebook.com/EnvironnementetressourcesnaturellesauCanada/photos/a.481746145028.384353.460123390028/10158286236875029/?type=3,2017-02-23 15:06:06,2,2,0,2,0,0,0,0,0,0,"Saviez-vous que le Canada protège actuellement ,6 % de ses zones terrestres et de ses eaux intérieures? Dans le cadre des Buts et objectifs canadiens pour la biodiversité d’ici , notre cible consiste à faire passer cette proportion à %. Constituées de parcs nationaux, de réserves nationales de faune, de refuges d’oiseaux migrateurs, de parcs et d’aires protégées provinciaux et territoriaux et de terres écosensibles protégées privées, ces aires protégées sont présentes dans l’ensemble des provinces et des territoires. Bien que chacun de nos gouvernements puisse apporter sa contribution, nous devrons travailler ensemble pour atteindre cette cible. Laissons un héritage naturel dans le cadre du e anniversaire du Canada, afin que la biodiversité du Canada soit préservée pour les générations à venir! 8 9",[],"['http://ow.ly/86uU309iwh', 'http://ow.ly/bcdT309iwi']"
697,460123390028_10158285281120029,,video,https://www.facebook.com/EnvironnementetressourcesnaturellesauCanada/videos/10158285281120029/,2017-02-23 10:32:22,1,1,2,1,0,0,0,0,0,0,"Découvrez la zone de protection marine du Gully, le plus grand canyon sous-marin à l’est de l’Amérique du Nord. Située au large de la Nouvelle-Écosse, ses parois abruptes nous réservent beaucoup de mystères. La continuité de la recherche et du suivi est essentielle pour assurer la conservation de cette importante région et de ses nombreux habitants.",[],['http://ow.ly/Dzco309hUI3']
698,460123390028_10158281838225029,Timeline Photos,photo,https://www.facebook.com/EnvironnementetressourcesnaturellesauCanada/photos/a.481746145028.384353.460123390028/10158281838225029/?type=3,2017-02-22 15:00:31,0,0,0,0,0,0,0,0,0,0,"Les partenaires fédéraux, provinciaux et territoriaux travaillent ensemble à la gestion des espèces etiques envahissantes et à la conservation de nos écosystèmes. Avec l’aide de notre Programme d’intendance de l’habitat (PIH) pour les espèces en péril (volet espèces en péril), la Corporation du district d’Oak Bay (C. B.) élimine le genêt à balais, l’ajonc d’Europe et la soliva sessile, trois espèces de plantes envahissantes qui constituent une menace sérieuse pour certaines espèces en péril dans le parc Uplands, sur l’île de Vancouver. Le projet s’attaque à diverses menaces pour espèces inscrites à la liste de la Loi sur les espèces en péril (LEP), comme l’entosthodon fasciculé, le triphysaire versicolore et le jonc de Kellogg. Pour en apprendre davantage sur le PIH, veuillez visiter :",[],['http://ow.ly/2IQm309fX1w']
699,460123390028_10158281643960029,Timeline Photos,photo,https://www.facebook.com/EnvironnementetressourcesnaturellesauCanada/photos/a.481746145028.384353.460123390028/10158281643960029/?type=3,2017-02-22 14:00:27,1,0,0,1,0,0,0,0,0,0,"Ce projet du Fonds national de conservation des milieux humides (FNCMH) dirigé par la Société protectrice du patrimoine écologique du Manitoba consiste à restaurer environ hectares dans le marais Delta, en réparant, en remplaçant et entretenant des barrières d’exclusion pour la carpe commune. En empêchant cette espèce envahissante d’entrer dans le marais, nous améliorons l’écosystème sur de nombreux plans. Renseignez-vous sur le FNCMH :",[],['http://ow.ly/JyRw309fWEk']
700,460123390028_10158281391385029,,video,https://www.facebook.com/EnvironnementetressourcesnaturellesauCanada/videos/10158281391385029/,2017-02-22 13:45:00,3,0,0,3,0,0,0,0,0,0,"Saviez-vous que les récifs d’éponges siliceuses du détroit d’Hécate et du bassin de la Reine-Charlotte remplissent une importante fonction de filtration de l’eau et fournissent un refuge, un habitat et des zones de croissance à de nombreuses espèces aquatiques, notamment les sébastes, les poissons et les mollusques et crustacés? Obtenez d’autres renseignements sur la plus récente zone de protection marine du Canada :",[],['http://ow.ly/6JCk309fX6y']
701,460123390028_10158275997845029,Timeline Photos,photo,https://www.facebook.com/EnvironnementetressourcesnaturellesauCanada/photos/a.481746145028.384353.460123390028/10158275997845029/?type=3,2017-02-21 08:45:34,5,0,3,5,0,0,0,0,0,0,"Saviez-vous que les rejets de polluants qui sont rejetés dans l’air, l’eau et au sol ont diminué de près de % dans les derniers ans? Apprenez-en plus au sujet des tendances annuelles concernant les polluants qui sont rejetés, éliminés ou transférés dans l’environnement en jetant un coup d’œil au rapport sommaire de l’Inventaire national des rejets de polluants :",[],['http://ow.ly/WIOJ309cUkx']
702,460123390028_10158272522495029,Timeline Photos,photo,https://www.facebook.com/EnvironnementetressourcesnaturellesauCanada/photos/a.481746145028.384353.460123390028/10158272522495029/?type=3,2017-02-20 14:10:09,5,0,0,5,0,0,0,0,0,0,"Avez-vous déjà visité une réserve nationale de faune, un refuge d’oiseaux migrateurs ou un parc national? Il s’agit d’endroits fantastiques où apprendre à connaître les espèces sauvages et la biodiversité impressionnantes du Canada. Consultez la Stratégie fédérale de développement durable -2019 pour connaître les mesures qui sont prises pour protéger les espèces sauvages et examiner d’autres priorités pour l’avenir durable du Canada. 8 é","['#FSDS', '#Durabilit']",['http://ow.ly/R7JX309b6B']
703,460123390028_10158272174760029,Timeline Photos,photo,https://www.facebook.com/EnvironnementetressourcesnaturellesauCanada/photos/a.481746145028.384353.460123390028/10158272174760029/?type=3,2017-02-20 12:30:16,5,2,0,5,0,0,0,0,0,0,"Aujourd’hui, nous célébrons la journée Aime ton animal de compagnie. Sortez faire une promenade et renouez avec la nature. N’oubliez surtout pas de lui donner des câlins! 🤗",[],['http://ow.ly/KpVW309b4KS']
704,460123390028_10158272075680029,Timeline Photos,photo,https://www.facebook.com/EnvironnementetressourcesnaturellesauCanada/photos/a.481746145028.384353.460123390028/10158272075680029/?type=3,2017-02-20 11:55:08,6,0,1,6,0,0,0,0,0,0,Vous avez les blues de l’hiver? Levez-vous et criez tout haut pour chasser le temps froid. Il ne reste plus qu’un mois avant le printemps.,"['#HoodieHoo', '#LePrintempsArrive']",[]
705,460123390028_10158271285035029,,video,https://www.facebook.com/EnvironnementetressourcesnaturellesauCanada/videos/10158271285035029/,2017-02-20 09:20:00,4,0,0,4,0,0,0,0,0,0,"Plongez dans la plus récente zone de protection marine du Canada : les récifs d’éponges siliceuses du détroit d’Hécate et du bassin de la Reine-Charlotte. Dans les eaux profondes et froides du détroit d’Hécate et du bassin de la Reine-Charlotte en Colombie-Britannique, au Canada, de magnifiques créatures – les éponges siliceuses – créent un écosystème de récifs dynamique et unique. Cette zone de protection marine aide à protéger un environnement aquatique important et unique au monde qui offre des habitats clés à la faune marine.",[],[]
706,460123390028_10158271270355029,Timeline Photos,photo,https://www.facebook.com/EnvironnementetressourcesnaturellesauCanada/photos/a.481746145028.384353.460123390028/10158271270355029/?type=3,2017-02-20 08:20:47,2,0,0,2,0,0,0,0,0,0,Inscrivez-vous pour participer aux réunions communautaires sur la modernisation de l’Office national de l’énergie à Fort St. John en Colombie-Britannique les et mars prochain. C,[],['http://ow.ly/ompO309aB3']
707,460123390028_10158256372565029,Timeline Photos,photo,https://www.facebook.com/EnvironnementetressourcesnaturellesauCanada/photos/a.481746145028.384353.460123390028/10158256372565029/?type=3,2017-02-17 11:10:08,4,0,0,4,0,0,0,0,0,0,"Le vendredi décembre marquait l’adoption du Cadre pancanadien sur la croissance propre et les changements climatiques. Cette réalisation historique du Canada est le tout premier plan fédéral, provincial et territorial consacré à la réduction des émissions de gaz à effet de serre, à la croissance de l’économie et au renforcement de la résilience à un climat changeant. Il place le Canada en bonne voie d'atteindre ses objectifs de et d’honorer son engagement mondial au titre de l’Accord de Paris. Bravo Canada! 🇨🇦",[],['http://ow.ly/PAuD3096tPv']
708,460123390028_10158256275040029,,video,https://www.facebook.com/EnvironnementetressourcesnaturellesauCanada/videos/10158256275040029/,2017-02-17 10:49:37,4,0,0,4,0,0,0,0,0,0,Le gouvernement du Canada est fier de désigner les récifs d’éponges siliceuses du détroit d’Hécate et du bassin de la Reine-Charlotte en tant que plus récente zone de protection marine du Canada. La désignation assurera la protection à long terme de ces anciens récifs uniques au monde. U,[],['http://ow.ly/2Die3096B5']
709,460123390028_10158251258695029,Recensement des oiseaux de Noël au Canada atlantique,photo,https://www.facebook.com/EnvironnementetressourcesnaturellesauCanada/photos/a.10158251257595029.1073741888.460123390028/10158251258695029/?type=3,2017-02-16 16:29:39,3,0,1,3,0,0,0,0,0,0,"Durant la période des Fêtes, Regina, Karel, Garry, Becky, Julie et Paul, biologiques d’Environnement et Changement climatique Canada, ont travaillé fort en Nouvelle-Écosse, à Terre-Neuve-et-Labrador et au Nouveau Brunswick afin de recueillir de l’information sur les oiseaux qui hivernent dans cette région. Chaque année, ils en apprennent un peu plus sur les espèces qui décident de braver des conditions climatiques hivernales qui sont parmi les plus inhospitalières au Canada.",[],[]
710,460123390028_10158251031690029,Timeline Photos,photo,https://www.facebook.com/EnvironnementetressourcesnaturellesauCanada/photos/a.481746145028.384353.460123390028/10158251031690029/?type=3,2017-02-16 15:42:45,4,0,0,3,1,0,0,0,0,0,Le rapport d’ paraîtra en mars. Suivront des consultations du public et des Autochtones et la participation des intervenants.,['#examenEE'],[]
711,460123390028_10158249644970029,Timeline Photos,photo,https://www.facebook.com/EnvironnementetressourcesnaturellesauCanada/photos/a.481746145028.384353.460123390028/10158249644970029/?type=3,2017-02-16 11:00:21,3,0,0,3,0,0,0,0,0,0,"Jim Carr, ministre des Ressources naturelles du Canada, parle de l’industrie forestière et de son aptitude à diriger l’innovation et combattre les changements climatiques pendant PaperWeek Canada à Montréal.",[],[]
712,460123390028_10158248969915029,Timeline Photos,photo,https://www.facebook.com/EnvironnementetressourcesnaturellesauCanada/photos/a.481746145028.384353.460123390028/10158248969915029/?type=3,2017-02-16 08:55:23,6,0,0,6,0,0,0,0,0,0,"Vous aimeriez contribuer aux efforts de conservation? Les scientifiques amateurs jouent un rôle important dans un grand nombre de nos programmes de surveillance et fournissent aux biologiques des données inestimables. Lors d’un récent séjour à Cuba, le photographe naturaliste et scientifique amateur Alan Chaplin ne savait pas que le Pluvier siffleur qu’il photographiait était spécial. C’est uniquement lorsqu’il a signalé le numéro qu’il a appris que cet oiseau avait vécu quatre fois plus longtemps que l’espérance de vie moyenne de son espèce! C’est près de ce même endroit que ce pluvier de ans avait été bagué en l’an par nos biologiques. Il avait ensuite niché sur la plage de Cavendish dans le parc national de l’Île-du-Prince-Édouard au début des années , après quoi il n’avait plus été signalé durant une décennie. Cette réobservation aidera grandement nos scientifiques à mieux comprendre cette espèce en péril. Le Pluvier siffleur continue d’être bagué au Canada, maintenant uniquement à l’aide de banderoles codées fixées à la patte. Pour obtenir de plus amples renseignements sur la manière de signaler un Pluvier siffleur bagué, jetez un coup d’œil à la fiche suivante : (en anglais seul.)",[],['http://ow.ly/Xy3n3090oMf']
713,460123390028_10158242878630029,Timeline Photos,photo,https://www.facebook.com/EnvironnementetressourcesnaturellesauCanada/photos/a.481746145028.384353.460123390028/10158242878630029/?type=3,2017-02-15 11:45:26,2,1,0,2,0,0,0,0,0,0,Vous voulez consulter la plus récente carte d’analyse des icebergs de la côte est? Le Service canadien des glaces diffuse des mises à jour quotidiennes! 9,[],['http://ow.ly/zuGw3090oe']
714,460123390028_10158237114800029,Timeline Photos,photo,https://www.facebook.com/EnvironnementetressourcesnaturellesauCanada/photos/a.481746145028.384353.460123390028/10158237114800029/?type=3,2017-02-14 08:20:17,10,0,1,10,0,0,0,0,0,0,"Vous ne connaissez peut-être pas la différence entre un conifère et un arbre à feuilles caduques, mais saviez-vous qu’environ Canadiens travaillent dans le secteur forestier? Nous devons protéger nos terres et nos forêts! Pour mieux comprendre comment le Canada administre ses terres et ses forêts de façon durable, consultez la Stratégie fédérale de développement durable -2019 :",[],['http://ow.ly/lxqa308Y7fr']
715,460123390028_10158233421915029,Timeline Photos,photo,https://www.facebook.com/EnvironnementetressourcesnaturellesauCanada/photos/a.481746145028.384353.460123390028/10158233421915029/?type=3,2017-02-13 11:40:07,6,1,1,6,0,0,0,0,0,0,Saviez-vous que les gouvernements du Canada réduisent la pollution par le carbone provenant de leurs bâtiments et de leurs flottes et augmentent leurs achats écologiques? Apprenez-en davantage ici : C,[],['http://ow.ly/kFSf308XAm']
716,460123390028_10158232689370029,Timeline Photos,photo,https://www.facebook.com/EnvironnementetressourcesnaturellesauCanada/photos/a.481746145028.384353.460123390028/10158232689370029/?type=3,2017-02-13 09:02:01,4,0,0,4,0,0,0,0,0,0,Vous devez être au fait des plus récentes observations météorologiques? Le réseau Radiométéo diffuse des renseignements sur les conditions météorologiques et environnementales heures par jour sur fréquences réservées au sein de la bande radio VHF de la fonction publique. Ce réseau fournit en continu des renseignements météorologiques et des mises à jour instantanées en cas de menace de temps violent. éeMondialeDeLaRadio,['#Journ'],['http://ow.ly/RvuM308XbFr']
717,460123390028_10158223769850029,Timeline Photos,photo,https://www.facebook.com/EnvironnementetressourcesnaturellesauCanada/photos/a.481746145028.384353.460123390028/10158223769850029/?type=3,2017-02-11 10:10:14,32,1,6,26,6,0,0,0,0,0,"Shirley est technicienne en écologie appliquée à Environnement et Changement climatique Canada. Son travail consiste à planifier et à réaliser plusieurs types d’inventaires aériens de sauvagine, dont le suivi des couples nicheurs au printemps, le suivi du Garrot d’Islande en hiver et de la population d’Eider à duvet à diverses périodes de l’année. Elle participe aussi à des activités de baguage de canards et bernaches, ce qui l’amène à voyager dans divers endroits au Québec. Ses tâches exigent de voler en hélicoptère à basse altitude, avec beaucoup de changements de direction (attention au mal de cœur!). Ce qu’elle apprécie de son travail, c’est l’alternance du travail sur le terrain et au bureau. Un conseil aux femmes intéressées : il faut prendre le temps de trouver une carrière qui permet d’allier ses intérêts, ses compétences et ses valeurs.",['#FemmesDeScience'],[]
718,460123390028_10158220054835029,Timeline Photos,photo,https://www.facebook.com/EnvironnementetressourcesnaturellesauCanada/photos/a.481746145028.384353.460123390028/10158220054835029/?type=3,2017-02-10 14:00:40,2,0,0,2,0,0,0,0,0,0,"Le ministre des Ressources naturelles du Canada, Jim Carr, et le ministre de la Croissance, de l’Entreprise et du Commerce du Manitoba, Cliff Cullen, ont annoncé officiellement aujourd’hui un accord en vertu duquel le gouvernement du Canada cède au gouvernement du Manitoba les droits miniers de la Commission d’établissement des soldats et les recettes connexes. Pour en savoir plus sur l’accord et la Commission d’établissement des soldats :",[],['http://ow.ly/X5dj308SMHQ']
719,460123390028_10158218642125029,Timeline Photos,photo,https://www.facebook.com/EnvironnementetressourcesnaturellesauCanada/photos/a.481746145028.384353.460123390028/10158218642125029/?type=3,2017-02-10 07:55:09,4,0,0,4,0,0,0,0,0,0,Adeptes de la chasse : Que pensez-vous des modifications proposées au Règlement sur les oiseaux migrateurs? ) Le gouvernement du Canada cesserait d’accorder des autorisations d’appâtage; ) Le gouvernement du Canada interdirait toute modification délibérée d’un champ agricole dans le but d’attirer les oiseaux migrateurs pour les chasser (par exemple l’inondation intentionnelle d’un champ de maïs debout non récolté). La période de consultation se terminera le février. Jetez un coup d’œil au document de consultation et faites nous part de votre point de vue!,[],['http://ow.ly/pUzf308Qbcq']
720,460123390028_10158215067960029,Timeline Photos,photo,https://www.facebook.com/EnvironnementetressourcesnaturellesauCanada/photos/a.481746145028.384353.460123390028/10158215067960029/?type=3,2017-02-09 12:00:57,0,0,0,0,0,0,0,0,0,0,"Mettez vos habits de neige, vos bottes et vos mitaines et allez jouer dehors! Profitez de la neige!",[],['http://ow.ly/qNmN308Q6Zm']
721,460123390028_10158209318965029,Timeline Photos,photo,https://www.facebook.com/EnvironnementetressourcesnaturellesauCanada/photos/a.481746145028.384353.460123390028/10158209318965029/?type=3,2017-02-08 08:10:19,1,0,1,1,0,0,0,0,0,0,"Vous êtes passionné de plein air? Le « snowkite » est une formidable activité hivernale, alors si vous ne l’avez pas encore essayé, c’est le moment idéal! Consultez d’abord les prévisions météo, habillez-vous chaudement et amusez-vous bien!",[],['http://ow.ly/6Aup308NRvT']
722,460123390028_10158199586065029,Timeline Photos,photo,https://www.facebook.com/EnvironnementetressourcesnaturellesauCanada/photos/a.481746145028.384353.460123390028/10158199586065029/?type=3,2017-02-06 11:05:18,1,0,0,1,0,0,0,0,0,0,Le Cadre pancanadien sur la croissance propre et les changements climatiques s’appuie sur la lancée de l’Accord de Paris. Il contribuera à renforcer l’économie et à réduire la pollution par le carbone. Apprenez-en davantage ici :,[],['http://ow.ly/nGDT308IZGJ']
723,460123390028_10158199094280029,,video,https://www.facebook.com/EnvironnementetressourcesnaturellesauCanada/videos/10158199094280029/,2017-02-06 09:29:46,1,0,0,0,1,0,0,0,0,0,"L’Arctique peut se vanter d’offrir toutes sortes de merveilleux et uniques phénomènes naturels, tels que le magnifique Arc en cristaux de glace, créé grâce à la réfraction lumineuse émanant de l’air océanique humide. Les scientifiques et les membres d’équipage du NGCC Louis S St. Laurent ont pu capter celui-ci alors qu’ils étaient, l’été dernier, en eédition en Arctique dans le cadre de l’UNCLOS.",[],[]
724,460123390028_10158183677135029,Environnement et ressources naturelles au Canada's cover photo,photo,https://www.facebook.com/EnvironnementetressourcesnaturellesauCanada/photos/a.10151461436230029.832066.460123390028/10158183676450029/?type=3,2017-02-03 07:48:18,1,1,0,1,0,0,0,0,0,0,nan,[],[]
725,460123390028_10158180278950029,,video,https://www.facebook.com/EnvironnementetressourcesnaturellesauCanada/videos/10158180278950029/,2017-02-03 06:55:00,3,0,2,3,0,0,0,0,0,0,"Notre magnifique pays aura ans cette année! Célébrons le patrimoine naturel du Canada. Visitez notre page régulièrement pour des faits divers, des histoires, anecdotes. retours en arrière et plus encore! Quelle sera VOTRE façon de célébrer?",[],[]
726,460123390028_10158179672060029,Timeline Photos,photo,https://www.facebook.com/EnvironnementetressourcesnaturellesauCanada/photos/a.481746145028.384353.460123390028/10158179672060029/?type=3,2017-02-02 14:25:11,1,0,2,1,0,0,0,0,0,0,"Le Canada et le Mexique comptent investir dans les énergies propres. Tous deux sont membres de Mission Innovation, initiative mondiale visant à accélérer l’innovation dans les énergies propres. En savoir plus :",[],['http://ow.ly/30cO308CmcE']
727,460123390028_10158177913880029,Timeline Photos,photo,https://www.facebook.com/EnvironnementetressourcesnaturellesauCanada/photos/a.481746145028.384353.460123390028/10158177913880029/?type=3,2017-02-02 11:05:14,3,0,0,3,0,0,0,0,0,0,"C’est la Journée mondiale des zones humides! Les milieux humides du Canada apportent d’énormes bienfaits à la population en assurant une protection contre les inondations, en améliorant la qualité et l’approvisionnement de l’eau, en limitant l’érosion et en procurant un environnement pour divers loisirs. Même si l’importance des milieux humides est de plus en plus reconnue, de nombreux milieux humides situés dans les zones habitées du Canada ont été perdus, et le Canada continue de voir disparaître ces habitats importants – tant en raison de phénomènes naturels que des activités humaines. Le Fonds national de conservation des milieux humides appuie les organisations et les collectivités de l’ensemble du Canada qui participent activement à la restauration et à l’amélioration des milieux humides dégradés. Par exemple, un projet du Fonds mené par Ducks Unlimited Canada a permis d’améliorer hectares d’habitats situés en milieux humides au Nouveau-Brunswick, en Nouvelle-Écosse et à l’Île-du-Prince-Édouard. Pour en savoir plus sur le Fonds national de conservation des milieux humides :",['#JMZH'],['http://ow.ly/FjDu308C3fi']
