,status_id,link_name,status_type,status_link,status_published,num_reactions,num_comments,num_shares,num_likes,num_loves,num_wows,num_hahas,num_sads,num_angrys,num_special,status_message_cleaned,hashtags,urls
973,460123390028_10157487270050029,Timeline Photos,photo,https://www.facebook.com/EnvironnementetressourcesnaturellesauCanada/photos/a.481746145028.384353.460123390028/10157487270050029/?type=3,2016-09-22 12:45:24,4,0,3,4,0,0,0,0,0,0,"Du septembre au octobre prochain, participez à l’activité « Gros plan sur les oies » et rencontrez les naturalistes passionnés de la réserve nationale de faune du Cap-Tourmente au Québec. Admirez la splendeur du spectacle haut en couleur qu’offrent les grandes oies des neiges qui s’y rassemblent par milliers. C’est une période privilégiée pour observer ces grandes voyageuses qui parcourent jusqu’à km chaque année.",[],['http://ow.ly/jGxs304ssZT']
974,460123390028_10157486595625029,Timeline Photos,photo,https://www.facebook.com/EnvironnementetressourcesnaturellesauCanada/photos/a.481746145028.384353.460123390028/10157486595625029/?type=3,2016-09-22 09:20:15,9,0,2,8,1,0,0,0,0,0,"Les stagiaires dans les domaines de sciences, de la technologie, de l’ingénierie et des mathématiques forment la main d’oeuvre verte de demain. Employeurs : faites votre demande dès maintenant!",[],"['http://ow.ly/Sol7304ssGm', 'http://ow.ly/wfi3304ssGJ']"
975,460123390028_10157486093500029,Timeline Photos,photo,https://www.facebook.com/EnvironnementetressourcesnaturellesauCanada/photos/a.481746145028.384353.460123390028/10157486093500029/?type=3,2016-09-22 07:10:21,1,0,0,1,0,0,0,0,0,0,"Déplacez-vous en marchant, en courant ou en utilisant le transport en commun. Nous célébrons aujourd’hui la journée mondiale sans voitures. Renouez avec la nature et profitez de cette première journée de l’automne.",[],['http://ow.ly/8gOl304r4BF']
976,460123390028_10157485825650029,Timeline Photos,photo,https://www.facebook.com/EnvironnementetressourcesnaturellesauCanada/photos/a.481746145028.384353.460123390028/10157485825650029/?type=3,2016-09-22 06:01:14,2,0,0,2,0,0,0,0,0,0,C’est la première journée de l’automne. Les feuilles des arbres afficheront bientôt toutes sortes de couleurs. Quelles sont vos activités de plein air préférées?,[],['http://ow.ly/cZSV304r4qM']
977,460123390028_10157482911150029,Timeline Photos,photo,https://www.facebook.com/EnvironnementetressourcesnaturellesauCanada/photos/a.481746145028.384353.460123390028/10157482911150029/?type=3,2016-09-21 13:45:11,3,0,0,3,0,0,0,0,0,0,"La petite chauve-souris brune, aussi connue sous le nom de vespertilion brun, figure sur la liste des espèces en voie de disparition de la Loi sur les espèces en péril du gouvernement du Canada. Autrefois, les populations de cette espèce étaient nombreuses et leur aire de répartition était vaste. Cependant, au cours des dernières années, les populations ont diminué rapidement en raison de la perte d’habitat, de la perturbation par les activités humaines dans les colonies et du syndrome du museau blanc, une infection fongique sur la peau des chauves-souris qui provoque la mort. Environnement et Changement climatique Canada travaille en collaboration avec Conservation de la nature Canada afin de protéger hectares d’habitat faunique dans le centre de la Saskatchewan. Cette région abrite des petites chauves-souris brunes, ainsi que de nombreuses autres espèces en péril, comme la chauve-souris nordique et la Paruline du Canada. D",[],['http://ow.ly/y5W5304qWK']
978,460123390028_10157482193395029,Timeline Photos,photo,https://www.facebook.com/EnvironnementetressourcesnaturellesauCanada/photos/a.481746145028.384353.460123390028/10157482193395029/?type=3,2016-09-21 10:15:16,0,0,0,0,0,0,0,0,0,0,"Si vous planifiez chasser bientôt, n’oubliez pas d’acheter votre permis de chasse aux oiseaux migrateurs! Vous pouvez l’obtenir et l’imprimer directement de la maison, quand vous le voulez et en quelques minutes seulement.",[],['http://ow.ly/fwNx304qmej']
979,460123390028_10157482036000029,Timeline Photos,photo,https://www.facebook.com/EnvironnementetressourcesnaturellesauCanada/photos/a.481746145028.384353.460123390028/10157482036000029/?type=3,2016-09-21 09:31:49,7,0,4,7,0,0,0,0,0,0,"La Grande Oie des neiges parcourt jusqu’à km chaque année et l’automne est une période privilégiée pour l’observer. La réserve nationale de faune du Cap-Tourmente au Québec est un endroit de prédilection pour admirer la splendeur du spectacle haut en couleur qu’offrent ces grandes voyageuses qui s’y rassemblent par milliers. Du septembre au octobre, vous pourrez participer à l’activité « Gros plan sur les oies » et rencontrer les naturalistes passionnés de la réserve.",[],['http://ow.ly/ZEI5304qlv3']
980,460123390028_10157481437180029,Timeline Photos,photo,https://www.facebook.com/EnvironnementetressourcesnaturellesauCanada/photos/a.481746145028.384353.460123390028/10157481437180029/?type=3,2016-09-21 07:15:27,4,1,1,4,0,0,0,0,0,0,Célébrons la journée nationale de l’arbre. Découvrez les mesures que prend Ressources naturelles Canada pour protéger et préserver les forêts du Canada. C,[],['http://ow.ly/z08Z304oNr']
981,460123390028_10157481281620029,Timeline Photos,photo,https://www.facebook.com/EnvironnementetressourcesnaturellesauCanada/photos/a.481746145028.384353.460123390028/10157481281620029/?type=3,2016-09-21 06:30:53,4,0,3,3,1,0,0,0,0,0,"Bonne Journée mondiale de reconnaissance. Célébrons ce qui ajoute de la couleur à nos vies, comme nos magnifiques espaces naturels. Pourquoi êtes-vous reconnaissant aujourd’hui?",[],['http://ow.ly/T2fa304oNcO']
982,460123390028_10157478540705029,Timeline Photos,photo,https://www.facebook.com/EnvironnementetressourcesnaturellesauCanada/photos/a.481746145028.384353.460123390028/10157478540705029/?type=3,2016-09-20 15:10:13,5,0,2,4,1,0,0,0,0,0,C’est votre tour d’aider à la mise au point d’une politique sur les espèces en péril du Canada. Participez!,[],['http://ow.ly/fE4Z304oMBn']
983,460123390028_10157477957350029,Timeline Photos,photo,https://www.facebook.com/EnvironnementetressourcesnaturellesauCanada/photos/a.481746145028.384353.460123390028/10157477957350029/?type=3,2016-09-20 12:15:36,3,0,1,3,0,0,0,0,0,0,"Comment la grêle se forme-t-elle? La grêle se forme lorsque des courants ascendants présents dans les nuages d’orage transportent des gouttes de pluie vers le haut, dans des zones de l’atmosphère extrêmement froides, où elles gèlent et fusionnent en morceaux de glace. Lorsque ces morceaux deviennent trop lourds pour que le courant ascendant puisse les supporter, ils tombent sur le sol à une vitesse pouvant atteindre km/h ou plus. Intéressant, n’est-ce pas?",[],['http://ow.ly/BU13304mstq']
984,460123390028_10157477656335029,Timeline Photos,photo,https://www.facebook.com/EnvironnementetressourcesnaturellesauCanada/photos/a.481746145028.384353.460123390028/10157477656335029/?type=3,2016-09-20 10:45:13,6,0,3,6,0,0,0,0,0,0,C’est la Semaine nationale de l’arbre et des forêts. Préparez-vous à découvrir la valeur de cette ressource renouvelable extraordinaire de notre pays.,[],[]
985,460123390028_10157477531325029,Timeline Photos,photo,https://www.facebook.com/EnvironnementetressourcesnaturellesauCanada/photos/a.481746145028.384353.460123390028/10157477531325029/?type=3,2016-09-20 10:02:05,0,0,1,0,0,0,0,0,0,0,Certaines personnes sont plus sensibles aux effets de la pollution atmosphérique sur leur santé. Où vous situez-vous sur l’échelle de risque? d,[],['http://ow.ly/v3F4304msf']
986,460123390028_10157477083755029,Timeline Photos,photo,https://www.facebook.com/EnvironnementetressourcesnaturellesauCanada/photos/a.481746145028.384353.460123390028/10157477083755029/?type=3,2016-09-20 08:20:31,1,0,0,1,0,0,0,0,0,0,"Ellika a fait son stage pour les jeunes Horizons Sciences à l’Aquarium de Vancouver, dans le cadre du programme de recherche en matière de pollution des océans, où elle travaille présentement en tant que biologiste. Sur cette photo, elle utilise le spectromètre infrarouge avec transformation de Fourier qui sert à déterminer la composition des microplastiques que l’on retrouve dans l’environnement. Cette analyse aidera à déterminer d’où proviennent ces minuscules morceaux de plastique et leurs répercussions sur la vie océanique. Enrichissez vos compétences et acquerrez de l’eérience de travail. Présenter une demande au programme de stage pour les jeunes Horizons Sciences dès aujourd’hui! 0",[],"['http://ow.ly/RevE304mrWa', 'http://ow.ly/ILXo304mrX']"
987,460123390028_10157472889690029,,video,https://www.facebook.com/EnvironnementetressourcesnaturellesauCanada/videos/10157472889690029/,2016-09-19 10:51:37,7,3,2,7,0,0,0,0,0,0,"Environnement et Changement climatique Canada s’affaire à préparer la prochaine conférence internationale sur les changements climatiques, la COP22, qui aura lieu au Maroc, en novembre. Dans la vidéo, la négociatrice en chef du Canada, Louise Métivier, parle des préparatifs du Canada au moment où nous nous apprêtons à rejoindre nos homologues afin de travailler sur ce dossier de la plus haute importance (la vidéo est en anglais seulement).",[],[]
988,460123390028_10157472198050029,Timeline Photos,photo,https://www.facebook.com/EnvironnementetressourcesnaturellesauCanada/photos/a.481746145028.384353.460123390028/10157472198050029/?type=3,2016-09-19 08:00:28,3,0,0,3,0,0,0,0,0,0,"Saviez-vous qu’Agriculture et Agroalimentaire Canada (AAC) a maintenant sa première parcelle de recherche certifiée biologique? Située au Centre de recherche et de développement d’Harrington, à l’Île-du-Prince-Édouard, il s’agit de la première parcelle d’AAC à obtenir la certification biologique par un vérificateur tiers. Découvrez quels sont nos plans pour cette occasion de recherche unique :",[],['http://ow.ly/tJZY304lhj4']
989,460123390028_10157471926240029,Timeline Photos,photo,https://www.facebook.com/EnvironnementetressourcesnaturellesauCanada/photos/a.481746145028.384353.460123390028/10157471926240029/?type=3,2016-09-19 06:20:30,5,1,3,5,0,0,0,0,0,0,Nous célébrons aujourd’hui la Journée mondiale du contrôle de l’eau. Que faites-vous pour conserver l’eau?,[],['http://ow.ly/MSIM304i0OS']
990,460123390028_10157458984695029,Timeline Photos,photo,https://www.facebook.com/EnvironnementetressourcesnaturellesauCanada/photos/a.481746145028.384353.460123390028/10157458984695029/?type=3,2016-09-16 14:30:45,7,2,5,7,0,0,0,0,0,0,"Le weekend Nettoyons la Terre commence aujourd’hui et ce jusqu'à dimanche. Vous voulez aider l’environnement? N’attendez pas! Le meilleur moment pour faire une différence est maintenant. Nettoyez, restaurez et conservez l’environnement! Clean Up the World - Official",[],['http://ow.ly/eEeT304h6tm']
991,460123390028_10157458235965029,Timeline Photos,photo,https://www.facebook.com/EnvironnementetressourcesnaturellesauCanada/photos/a.481746145028.384353.460123390028/10157458235965029/?type=3,2016-09-16 10:50:23,8,0,2,7,1,0,0,0,0,0,"La forêt pluviale du Grand Ours située le long de la côte centrale de la Colombie Britannique, est l’une des plus grandes forêts pluviales tempérées encore intactes sur la planète. Son écosystème diversifié abrite de nombreuses espèces en péril, notamment des oiseaux dont l’Autour des palombes, des amphibiens dont la grenouille-à-queue côtière et des poissons dont le saumon quinnat. La forêt pluviale abrite également l’ours Kermode, une sous-espèce d’ours très rare dont la fourrure est blanche et que les peuples autochtones de la région appellent Moksgm’ol ou « l’ours Esprit ». Environnement et Changement climatique Canada est fier de s’associer avec Conservation de la nature Canada et des donateurs locaux pour protéger hectares supplémentaires de forêts anciennes côtières situées au cœur de la forêt pluviale du Grand Ours.",[],['http://ow.ly/ofbG304h77z']
992,460123390028_10157458012545029,Timeline Photos,photo,https://www.facebook.com/EnvironnementetressourcesnaturellesauCanada/photos/a.481746145028.384353.460123390028/10157458012545029/?type=3,2016-09-16 09:45:17,2,1,0,2,0,0,0,0,0,0,"Savez-vous que les Prairies subissent en moyenne tempêtes de grêle majeures par année? En Ontario, c’est entre et . d",[],['http://ow.ly/9wVs304h5M']
993,460123390028_10157453889955029,Timeline Photos,photo,https://www.facebook.com/EnvironnementetressourcesnaturellesauCanada/photos/a.481746145028.384353.460123390028/10157453889955029/?type=3,2016-09-15 12:25:15,7,1,1,4,3,0,0,0,0,0,"En famille, participez au Rendez-vous avec la nature à la réserve nationale de faune du Cap-Tourmente dans la belle province de Québec. Amusez-vous en apprenant les gestes que vous pouvez poser au quotidien pour la protection de l’environnement. Joignez vos efforts à ceux des scientifiques et faites une différence. Protéger la planète, ça nous concerne tous!",[],['http://ow.ly/FKqW304f26E']
994,460123390028_10157453332920029,Célébrer #Canada150e pour les oiseaux!,photo,https://www.facebook.com/EnvironnementetressourcesnaturellesauCanada/photos/a.10157453332625029.1073741881.460123390028/10157453332920029/?type=3,2016-09-15 09:30:35,7,0,5,7,0,0,0,0,0,0,"Le compte à rebours de l’anniversaire vise à célébrer ce qui fait la fierté des Canadiens. Pour étudiants en arts plastiques de l’Université Mount Allison de Sackville, au Nouveau Brunswick, la célébration vise la conservation des oiseaux migrateurs. Le centenaire de la Convention concernant les oiseaux migrateurs leur offrait une occasion d’erimer leur appréciation de la nature par l’art. Voici les œuvres qui ont été eées hier soir à Sackville, dans le bureau d’Environnement et Changement climatique Canada. Des habitants de la région de Sackville ont également eu la chance de participer à un atelier d'art à Mount Allison, vous pouvez les voirs en action dans cet album. Comment erimez-vous votre appréciation de la nature et votre fierté en tant que Canadien?",['#Canada150e'],[]
995,460123390028_10157453273365029,Timeline Photos,photo,https://www.facebook.com/EnvironnementetressourcesnaturellesauCanada/photos/a.481746145028.384353.460123390028/10157453273365029/?type=3,2016-09-15 09:05:16,1,0,1,0,0,1,0,0,0,0,"Des grêlons aussi gros que des pamplemousses ont été observés au Canada, mais les petits grêlons peuvent eux aussi être dangereux et causer des dommages importants en quelques minutes. Découvrez des moyens de vous protéger si vous êtes surpris par la grêle.",[],['http://ow.ly/PBWJ304f1L3']
996,460123390028_10157450112270029,,video,https://www.facebook.com/EnvironnementetressourcesnaturellesauCanada/videos/10157450112270029/,2016-09-14 16:10:00,1,0,1,1,0,0,0,0,0,0,Avez-vous des idées et actions écologiques formidables à faire connaître? Relevez le éfiRentrée et partagez vos idées!,['#D'],[]
997,460123390028_10157449512570029,23e session ordinaire du conseil de la CCE,photo,https://www.facebook.com/EnvironnementetressourcesnaturellesauCanada/photos/a.10157425444825029.1073741880.460123390028/10157449512570029/?type=3,2016-09-14 12:34:08,9,1,1,9,0,0,0,0,0,0,"Le Canada, les États-Unis et le Mexique collaborent depuis longtemps dans de nombreux dossiers, notamment celui de l’environnement. Catherine McKenna, ministre de l’Environnement et du Changement climatique, a rencontré ses homologues des États-Unis et du Mexique lors de la session du Conseil de la Commission de coopération environnementale afin de discuter de collaboration, d’économie, de commerce et des jeunes en Amérique du Nord.",[],[]
998,460123390028_10157449136995029,Timeline Photos,photo,https://www.facebook.com/EnvironnementetressourcesnaturellesauCanada/photos/a.481746145028.384353.460123390028/10157449136995029/?type=3,2016-09-14 10:35:15,2,0,2,2,0,0,0,0,0,0,"Voici Garry. Il est eert en oiseaux migrateurs et il aimerait vous parler. Pourquoi les oiseaux migrent-ils? Comment survivent-ils durant leurs longs voyages? Combien de temps voyagent-ils? Est-ce que des oiseaux migrateurs vont passer dans ma collectivité cette année? Demain, de h à h, heure de l’Est, posez vos questions via Twitter à en mentionnant le mot-clic .",['#BirdYearCan'],[]
999,460123390028_10157448765255029,Timeline Photos,photo,https://www.facebook.com/EnvironnementetressourcesnaturellesauCanada/photos/a.481746145028.384353.460123390028/10157448765255029/?type=3,2016-09-14 08:50:14,8,0,3,6,1,1,0,0,0,0,"L’observation des oiseaux est un passe temps et une passion pour des milliers de Canadiens. Pourquoi cette activité est-elle aussi fascinante? Est-ce le défi de découvrir et d’ajouter de nouvelles espèces à votre liste? Est-ce le chant mélodieux des oiseaux ou un comportement de nidification intéressant? Les oiseaux ne sont pas là seulement pour notre plaisir, mais ils jouent également un grand rôle pour la durabilité de nos écosystèmes. Demain, de h à h, heure de l’Est, apprenez-en davantage sur les oiseaux migrateurs, les façons de les apprécier et les endroits où les trouver. Posez vos questions en mentionnant le mot-clic et en suivant .",['#BirdYearCan'],[]
1000,460123390028_10157448593750029,Timeline Photos,photo,https://www.facebook.com/EnvironnementetressourcesnaturellesauCanada/photos/a.481746145028.384353.460123390028/10157448593750029/?type=3,2016-09-14 08:20:09,0,0,1,0,0,0,0,0,0,0,"C’est le grand jour! Afin de marquer le jour du compte à rebours de , le bureau d’Environnement et Changement climatique Canada situé à Sackville, au Nouveau-Brunswick, a collaboré avec Mount Allison University et des artistes locaux reconnus pour présenter une eition d’art et offrir des ateliers de peintures. Toutes ces activités visent à célébrer la fierté des Canadiens à l’égard de la nature, de la faune et de la flore et la passion pour notre pays!",['#Canada150e'],[]
1001,460123390028_10157448283350029,Timeline Photos,photo,https://www.facebook.com/EnvironnementetressourcesnaturellesauCanada/photos/a.481746145028.384353.460123390028/10157448283350029/?type=3,2016-09-14 06:50:20,2,0,2,2,0,0,0,0,0,0,"Les stages en STIM (sciences, technologies, ingénierie et mathématiques) formeront la main d’œuvre verte de demain. Employeurs : inscrivez-vous dès maintenant! 2",[],"['http://ow.ly/aCdO304bknx', 'http://ow.ly/5vtk304bko']"
1002,460123390028_10157444690185029,Timeline Photos,photo,https://www.facebook.com/EnvironnementetressourcesnaturellesauCanada/photos/a.481746145028.384353.460123390028/10157444690185029/?type=3,2016-09-13 12:50:10,8,0,1,6,2,0,0,0,0,0,"Vous vous trouvez à Sackville, dans la région du Nouveau-Brunswick? Rendez-vous au bureau du Service canadien de la faune le septembre, entre h30 et h30, et assistez au vernissage de la collection d’art de œuvres créées par des étudiants de Mount Allison University. On y présente des œuvres allant de la peinture au verre délicat, jusqu’à la riche broderie, et ces pièces uniques ont été conçues afin de célébrer la conservation des oiseaux migrateurs au Canada. Pour avoir un aperçu des œuvres, consultez notre page la semaine prochaine!",[],[]
1003,460123390028_10157444545500029,Timeline Photos,photo,https://www.facebook.com/EnvironnementetressourcesnaturellesauCanada/photos/a.481746145028.384353.460123390028/10157444545500029/?type=3,2016-09-13 12:10:18,5,0,0,5,0,0,0,0,0,0,Avis à tous les chasseurs : la saison de chasse aux oiseaux migrateurs est maintenant ouverte dans de nombreuses régions du Canada. Obtenez votre permis de chasse en ligne dès aujourd’hui!,[],['http://ow.ly/VTxU304aMpJ']
1004,460123390028_10157444326410029,Timeline Photos,photo,https://www.facebook.com/EnvironnementetressourcesnaturellesauCanada/photos/a.481746145028.384353.460123390028/10157444326410029/?type=3,2016-09-13 11:03:54,4,0,0,4,0,0,0,0,0,0,"Au cours de son stage dans le cadre du Programme des jeunes stagiaires d’Horizons Sciences, Félix a préparé, perfectionné puis conçu des tests d’ADN afin d’analyser les toxines dans les espèces qui vivent en eau douce. Vous pouvez, vous aussi, perfectionner vos compétences et acquérir de l’eérience de travail. Présentez dès aujourd’hui votre candidature pour obtenir un stage du Programme des jeunes stagiaires d’Horizons Sciences!",[],"['http://ow.ly/PXqg304aM2J', 'http://ow.ly/AJ5Y304aM3g']"
1005,460123390028_10157444170060029,Timeline Photos,photo,https://www.facebook.com/EnvironnementetressourcesnaturellesauCanada/photos/a.481746145028.384353.460123390028/10157444170060029/?type=3,2016-09-13 10:19:38,1,0,1,1,0,0,0,0,0,0,Le e jour du compte à rebours du est entièrement consacré aux célébrations de notre fierté nationale pour la conservation des oiseaux migrateurs. Obtenez les détails du compte à rebours à 0.,['#Canada150e'],['Canada.ca/15']
1006,460123390028_10157439992550029,Timeline Photos,photo,https://www.facebook.com/EnvironnementetressourcesnaturellesauCanada/photos/a.481746145028.384353.460123390028/10157439992550029/?type=3,2016-09-12 13:10:15,1,0,0,1,0,0,0,0,0,0,"Le août marquait le e anniversaire de l’observatoire du réseau Veille de l’atmosphère du globe de Neil Trivett situé à Alert au Nunavut. L’observatoire est mieux connu sous le nom de laboratoire de recherche d’Alert. Le laboratoire a été construit en . Ses activités sont axées sur le suivi à long terme des concentrations naturelles de gaz à l’état de traces, des aérosols et des polluants organiques. Il s’agit de la station de recherche habitée en permanence la plus au nord au monde; elle se trouve à moins de km du pôle Nord. Bon e anniversaire!",[],['http://ow.ly/5asW3048qeR']
1007,460123390028_10157439009385029,Timeline Photos,photo,https://www.facebook.com/EnvironnementetressourcesnaturellesauCanada/photos/a.481746145028.384353.460123390028/10157439009385029/?type=3,2016-09-12 09:15:11,1,0,0,1,0,0,0,0,0,0,Oui! Nous avons toujours besoin de vos idées d’. Publiez-les avec les autres idées affichées sur notre site Web interactif. Vous voulez faire partie de la solution? Voici votre chance!,['#ActionClimatCAN'],['http://ow.ly/VFQp30481Gl']
1008,460123390028_10157427920040029,Timeline Photos,photo,https://www.facebook.com/EnvironnementetressourcesnaturellesauCanada/photos/a.481746145028.384353.460123390028/10157427920040029/?type=3,2016-09-10 06:50:20,6,1,2,4,2,0,0,0,0,0,"Les aires protégées jouent un rôle essentiel dans les efforts du Canada pour conserver la nature. Elles permettent de protéger des zones importantes des écosystèmes canadiens, d’assurer le maintien des services écosystémiques essentiels, de protéger certains habitats, de créer des débouchées pour l’industrie du tourisme et du loisir en plus de permettre à tous de renouer avec la nature.",[],['http://ow.ly/ctiT3044LCl']
1009,460123390028_10157425445020029,23e session ordinaire du conseil de la CCE,photo,https://www.facebook.com/EnvironnementetressourcesnaturellesauCanada/photos/a.10157425444825029.1073741880.460123390028/10157425445020029/?type=3,2016-09-09 16:35:35,9,1,1,9,0,0,0,0,0,0,"Le Canada, les États-Unis et le Mexique collaborent depuis longtemps dans de nombreux dossiers, notamment celui de l’environnement. Catherine McKenna, ministre de l’Environnement et du Changement climatique, a rencontré ses homologues des États-Unis et du Mexique lors de la session du Conseil de la Commission de coopération environnementale afin de discuter de collaboration, d’économie, de commerce et des jeunes en Amérique du Nord.",[],[]
1010,460123390028_10157425471690029,Timeline Photos,photo,https://www.facebook.com/EnvironnementetressourcesnaturellesauCanada/photos/a.481746145028.384353.460123390028/10157425471690029/?type=3,2016-09-09 16:30:22,2,0,0,2,0,0,0,0,0,0,"À la fin de l’année , ,6 % (1,05 million de km2) de la superficie terrestre du Canada était reconnu comme étant protégé. Cette superficie est plus grande que celle de la Colombie Britannique!",[],['http://ow.ly/j4tA3044uSh']
1011,460123390028_10157424103740029,Timeline Photos,photo,https://www.facebook.com/EnvironnementetressourcesnaturellesauCanada/photos/a.481746145028.384353.460123390028/10157424103740029/?type=3,2016-09-09 09:55:10,2,1,1,2,0,0,0,0,0,0,"Enseigner à vos étudiants et à vos enfants les façons de recycler, c’est une belle occasion de leur apprendre des choses, mais c’est aussi une belle occasion de leur faire adopter une habitude qui durera toute la vie! Informez-vous au sujet du programme de recyclage et de compostage de votre école et demandez à vos enfants de s’engager à recycler et à composter tous les jours.",[],['http://ow.ly/861D3043Etl']
1012,460123390028_10157424009585029,Timeline Photos,photo,https://www.facebook.com/EnvironnementetressourcesnaturellesauCanada/photos/a.481746145028.384353.460123390028/10157424009585029/?type=3,2016-09-09 09:25:10,5,0,1,4,1,0,0,0,0,0,"Les clubs scolaires écolos sont une façon amusante et sociale de faire une différence dans votre école, votre collectivité et votre pays! Enseignants et parents : encouragez les étudiants à se joindre au club écolo de leur école, ou à en créer un! U",[],['http://ow.ly/eF4k3043Do']
