,id,date_published,link,caption_original,caption_cleaned,hashtags,category,Reactions_SUM,average_sentiment_score,language,account_name
66,788039454313291776,2016-10-17 15:30:21,"['https://t.co/fEjHzDW0aR', 'https://t.co/uRba6LWi5I']","The mooring is successfully deployed, marking the start of another year’s worth of data collection #JOIS https://t.co/fEjHzDW0aR https://t.co/uRba6LWi5I",mooring successfully deployed marking start another worth data collection JOIS https co fEjHzDW0aR https co uRba6LWi5I,['#JOIS'],Environmental,3,0.525,en,DFO_Science_tweeter
67,791669768109645824,2016-10-27 15:55:55,['https://t.co/NpQYoElWm'],#ScaryScience  https://t.co/NpQYoElWmc,ScaryScience https co NpQYoElWmc,['#ScaryScience'],Social,2,0.0,en,DFO_Science_tweeter
68,791681825416544256,2016-10-27 16:43:50,"['https://t.co/Irw3VSfpY', 'https://t.co/sHeeMWM0En']","… where they shrink to 80% their original size, but remain incredibly stable. Read more @WHOI here: https://t.co/Irw3VSfpY8 https://t.co/sHeeMWM0En",shrink 80 original size remain incredibly stable Read WHOI https co Irw3VSfpY8 https co sHeeMWM0En,[],Environmental,2,0.5916666666666667,en,DFO_Science_tweeter
69,783010140752674816,2016-10-03 18:25:39,[],RT @DFO_Central: Becky Cudmore confirms no evidence of establishment of #asiancarp in Canadian waters.,RT Becky Cudmore confirms evidence establishment asiancarp Canadian waters,['#asiancarp'],Environmental,2,0.0,en,DFO_Science_tweeter
70,783010196536848384,2016-10-03 18:25:53,['https://t.co/SBKq3q7EIM'],RT @DFO_Central: US agencies have a contingency plan in place for varying risk levels: John Dettmers @LampreyControl https://t.co/SBKq3q7EIM,RT US agencies contingency plan place varying risk levels John Dettmers LampreyControl https co SBKq3q7EIM,[],Environmental,2,0.0,en,DFO_Science_tweeter
71,783010259585630208,2016-10-03 18:26:08,['https://t.co/qRANAwDuxo'],RT @DFO_Central: Astounding research underway in the US on Asian carp control by @USGS Mark Gaikowski https://t.co/qRANAwDuxo,RT Astounding research underway US Asian carp control USGS Mark Gaikowski https co qRANAwDuxo,[],Social,2,0.3,en,DFO_Science_tweeter
72,789444005276819456,2016-10-21 12:31:32,['https://t.co/a3G6ST5eg3'],"Charted @ lower res than the moon, oceans hold many hidden gems like underwater volcanoes in the Atlantic @NASAEarth https://t.co/a3G6ST5eg3",Charted lower res moon oceans hold many hidden gems like underwater volcanoes Atlantic NASAEarth https co a3G6ST5eg3,[],Environmental,2,0.16666666666666669,en,DFO_Science_tweeter
73,783009751714193409,2016-10-03 18:24:07,['https://t.co/NwI4wqX8bE'],RT @DFO_Central: DFO's Dave Burden welcomes all. Noting strong collaboration between Can and US agencies and groups. https://t.co/NwI4wqX8bE,RT DFO Dave Burden welcomes Noting strong collaboration US agencies groups https co NwI4wqX8bE,[],Social,2,0.4333333333333333,en,DFO_Science_tweeter
74,793158379552272384,2016-10-31 18:31:08,['https://t.co/nJyi2ahvSO'],RT @DFO_NL: @DFO_Science @DFO_NL  Martha Robertson taking the plunge for #nlsalmon.                               https://t.co/nJyi2ahvSO,RT Martha Robertson taking plunge nlsalmon https co nJyi2ahvSO,['#nlsalmon'],Environmental,2,0.0,en,DFO_Science_tweeter
75,783010423423561728,2016-10-03 18:26:47,[],RT @DFO_Central: Julia Colm presents outstanding successes of public outreach and education w/ key non-governmental partners @ofah  @InvSp…,RT Julia Colm presents outstanding successes public outreach education key non governmental partners ofah,[],Economical,2,0.16666666666666666,en,DFO_Science_tweeter
76,792079657281654784,2016-10-28 19:04:41,['https://t.co/KSKJXiG0hP'],"This #Halloween, beware of these goosebumps-looking gooseneck barnacles hiding in tidal pools #ScaryScience https://t.co/KSKJXiG0hP",Halloween beware goosebumps looking gooseneck barnacles hiding tidal pools ScaryScience https co KSKJXiG0hP,"['#Halloween', '#ScaryScience']",Social,2,0.0,en,DFO_Science_tweeter
77,783313655123279872,2016-10-04 14:31:43,['https://t.co/b1caPZYE9T'],"This year, the #OceanInnovation conference focuses on adapting to our changing #Arctic waters https://t.co/b1caPZYE9T",year OceanInnovation conference focuses adapting changing Arctic waters https co b1caPZYE9T,"['#OceanInnovation', '#Arctic']",Economical,2,0.0,en,DFO_Science_tweeter
78,792034073652957184,2016-10-28 16:03:33,"['https://t.co/fGOYEzMgYX', 'https://t.co/AMyyDzsWE']","Mike Dempsey of #DFO leads the rosette night crew on #JOIS, who work from midnight to noon dialy. Learn more @WHOI https://t.co/fGOYEzMgYX https://t.co/AMyyDzsWEC",Mike Dempsey DFO leads rosette night crew JOIS work midnight noon dialy Learn WHOI https co fGOYEzMgYX https co AMyyDzsWEC,"['#DFO', '#JOIS']",Environmental,2,0.5,en,DFO_Science_tweeter
79,783029452867600384,2016-10-03 19:42:24,['https://t.co/Dh7aDTOu8k'],DFO scientists are collaborating with international partners to study #Arctic. Read @WHOI daily dispatches: https://t.co/Dh7aDTOu8k,DFO scientists collaborating international partners study Arctic Read WHOI daily dispatches https co Dh7aDTOu8k,['#Arctic'],Economical,2,0.0,en,DFO_Science_tweeter
80,783692257752997888,2016-10-05 15:36:09,['https://t.co/OnZaNwPQj'],RT @marineinstitute: Day two of sessions at #OI2016 are underway https://t.co/OnZaNwPQj2,RT marineinstitute Day two sessions OI2016 underway https co OnZaNwPQj2,['#OI2016'],Environmental,2,0.0,en,DFO_Science_tweeter
81,783738813449461762,2016-10-05 18:41:08,['https://t.co/bG6WkbwA3o'],RT @DFO_Central: Emphasis must be on preventing invasive establishment: DFO's Gavin Christie #GreatLakesForum https://t.co/bG6WkbwA3o,RT Emphasis must preventing invasive establishment DFO Gavin Christie GreatLakesForum https co bG6WkbwA3o,['#GreatLakesForum'],Environmental,2,0.0,en,DFO_Science_tweeter
82,783687143692599296,2016-10-05 15:15:49,['https://t.co/PUc91P3GvS'],RT @DFO_Pacific: #fishery officers on aerial patrol report marine mammal sightings to @DFO_MPO scientists–do you? https://t.co/PUc91P3GvS h…,RT fishery officers aerial patrol report marine mammal sightings https co PUc91P3GvS,['#fishery'],Environmental,2,0.0,en,DFO_Science_tweeter
83,793113043857186816,2016-10-31 15:30:59,['https://t.co/gYzDNx6baR'],We’ve got #creepycrustaceans! This particular Verrill’s spider crab and inshore Tanner crab were spotted off the BC coast https://t.co/gYzDNx6baR,got creepycrustaceans particular spider crab inshore Tanner crab spotted BC coast https co gYzDNx6baR,['#creepycrustaceans'],Environmental,2,0.16666666666666666,en,DFO_Science_tweeter
84,783356414144241665,2016-10-04 17:21:37,['https://t.co/vuxuLCFGTL'],RT @marineinstitute: Ocean Innovation 2016 is well underway at the Frobisher Inn in Iqaluit #OI2016 https://t.co/vuxuLCFGTL,RT marineinstitute Ocean Innovation 2016 well underway Frobisher Inn Iqaluit OI2016 https co vuxuLCFGTL,['#OI2016'],Economical,2,0.0,en,DFO_Science_tweeter
85,783040545648177153,2016-10-03 20:26:28,['https://t.co/FPN7CZxB1A'],RT @DFO_Central: Senior government managers answer questions during panel session. https://t.co/FPN7CZxB1A,RT Senior government managers answer questions panel session https co FPN7CZxB1A,[],Environmental,1,0.0,en,DFO_Science_tweeter
86,784488103146885120,2016-10-07 20:18:33,[],RT @DrPlanktonguy: @DFO_Science @CCG_GCC Limnos returns after a week of fall Mysis survey #lowertrophic #LakeOntario #GLLFAS #greatweather…,RT DrPlanktonguy Limnos returns week fall Mysis survey lowertrophic LakeOntario GLLFAS,"['#lowertrophic', '#LakeOntario', '#GLLFAS', '#greatweather']",Social,1,0.0,en,DFO_Science_tweeter
87,784079643343282176,2016-10-06 17:15:29,[],RT @DFO_Gulf: .@umoncton will also receive $40K to improve knowledge of the potential impacts of hydropower on #AtlanticSalmon,RT umoncton also receive 40K improve knowledge potential impacts hydropower AtlanticSalmon,['#AtlanticSalmon'],Social,1,0.0,en,DFO_Science_tweeter
88,784079630194077696,2016-10-06 17:15:25,[],RT @DFO_Gulf: .@umoncton will receive $74K to develop technology aimed at improving the accuracy of river temperature forecasting,RT umoncton receive 74K develop technology aimed improving accuracy river temperature forecasting,[],Environmental,1,0.0,en,DFO_Science_tweeter
89,783738871951527936,2016-10-05 18:41:22,[],RT @DFO_Central: AIS are nearly impossible to eradicate once established and efforts to control AIS are costly: Christie. #GreatLakesForum…,RT AIS nearly impossible eradicate established efforts control AIS costly Christie,['#GreatLakesForum'],Environmental,1,-0.6666666666666666,en,DFO_Science_tweeter
90,783366257378811904,2016-10-04 18:00:44,"['https://t.co/mDZD77Wld4', 'https://t.co/csf7IxiXCN']",Spongebobs are completely biodegradable drifters. Read how they’re helping out #JOIS here @WHOI: https://t.co/mDZD77Wld4 https://t.co/csf7IxiXCN,Spongebobs completely biodegradable drifters Read helping JOIS WHOI https co mDZD77Wld4 https co csf7IxiXCN,['#JOIS'],Social,1,0.1,en,DFO_Science_tweeter
91,788739270911598592,2016-10-19 13:51:10,"['https://t.co/v5GRr071Gs', 'https://t.co/HXWuaJb40P']",While doing chemical oceanography #DFO’s Tamara Fraser compares nutrients in the water to the fertilizer of life https://t.co/v5GRr071Gs https://t.co/HXWuaJb40P,chemical oceanography Tamara Fraser compares nutrients water fertilizer life https co v5GRr071Gs https co HXWuaJb40P,['#DFO'],Environmental,1,0.0,en,DFO_Science_tweeter
92,783010319811706880,2016-10-03 18:26:22,['https://t.co/CkqTKzsHw4'],RT @DFO_Central: The number of field sites DFO’s #asiancarp crews have visited have quadrupled since 2012. https://t.co/CkqTKzsHw4,RT number field sites asiancarp crews visited quadrupled since 2012 https co CkqTKzsHw4,['#asiancarp'],Social,1,0.0,en,DFO_Science_tweeter
93,783009823856156672,2016-10-03 18:24:24,['https://t.co/4FpgIXKjTA'],RT @DFO_Central: Status update on Asian Carps in the Chicago Area Watersystem from Kevin Irons @IllinoisDNR https://t.co/4FpgIXKjTA,RT Status update Asian Carps Chicago Area Watersystem Kevin Irons IllinoisDNR https co 4FpgIXKjTA,[],Environmental,1,0.0,en,DFO_Science_tweeter
94,791661486959628288,2016-10-27 15:23:01,['https://t.co/LpjSdS2L3I'],Every year the #JOIS crew cast personalized styrofoam cups down over 2.5 miles below sea-level… https://t.co/LpjSdS2L3I,Every year JOIS crew cast personalized styrofoam cups miles sea https co LpjSdS2L3I,['#JOIS'],Social,1,-0.1555555555555556,en,DFO_Science_tweeter
95,790598674153873408,2016-10-24 16:59:47,"['https://t.co/JIlP1ssI', 'https://t.co/sJLlelQy6G']",A full rosette – like this one on #JOIS – can weigh up to 800lbs upon retrieval. Read more about the mission here https://t.co/JIlP1ssIc8 https://t.co/sJLlelQy6G,full rosette like one JOIS weigh 800lbs upon retrieval Read mission https co JIlP1ssIc8 https co sJLlelQy6G,['#JOIS'],Environmental,1,0.425,en,DFO_Science_tweeter
96,788023490330947584,2016-10-17 14:26:55,['https://t.co/AyaJ9XuR3p'],RT @DFO_NL: Read the @DFO_Science advisory report on oceanography and water exchange on the south coast of Nfld.: https://t.co/AyaJ9XuR3p #…,RT Read advisory report oceanography water exchange south coast Nfld https co AyaJ9XuR3p,['#'],Environmental,1,0.0,en,DFO_Science_tweeter
97,791677951993675776,2016-10-27 16:28:27,['https://t.co/EwY6AfFucn'],Would you rather: Sleep on these cionia intestinalis or get bitten by a lamprey this #Halloween? #ScaryScience https://t.co/EwY6AfFucn,Would rather Sleep cionia intestinalis get bitten lamprey Halloween ScaryScience https co EwY6AfFucn,"['#Halloween', '#ScaryScience']",Environmental,1,0.0,en,DFO_Science_tweeter
98,791713450728755200,2016-10-27 18:49:30,['https://t.co/RIiDXuOfqr'],Samples from a RAS-500 (Remote Access Sampler) are compared to – and treated like – precious diamonds on #JOIS https://t.co/RIiDXuOfqr,Samples RAS 500 Remote Access Sampler compared treated like precious diamonds JOIS https co RIiDXuOfqr,['#JOIS'],Social,0,0.2,en,DFO_Science_tweeter
