,id,date_published,link,caption_original,caption_cleaned,hashtags,category,Reactions_SUM,average_sentiment_score,language,account_name
0,790972619394875398,2016-10-25 17:45:42,['https://t.co/CC7gKsEVCI'],"Leading up to #Halloween2016 on Monday, we want to share some of our spookiest Canadian aquatic species like the viperfish #ScaryScience https://t.co/CC7gKsEVCI",Leading Halloween2016 Monday want share spookiest Canadian aquatic species like viperfish ScaryScience https co CC7gKsEVCI,"['#Halloween2016', '#ScaryScience']",Environmental,56,0.0,en,DFO_Science_tweeter
1,789197274152853504,2016-10-20 20:11:07,['https://t.co/sItCht873P'],Over 500 adult fish released in an effort to recover Inner Bay of Fundy #AtlanticSalmon #savingsalmon https://t.co/sItCht873P,500 adult fish released effort recover Inner Bay Fundy AtlanticSalmon savingsalmon https co sItCht873P,"['#AtlanticSalmon', '#savingsalmon']",Environmental,55,0.05,en,DFO_Science_tweeter
2,786915263073714177,2016-10-14 13:03:13,['https://t.co/CQuLbCiPEK'],This #WomensHistoryMonth we honour the extraordinary contributions to oceans research made by our female scientists’ #BecauseOfHer https://t.co/CQuLbCiPEK,WomensHistoryMonth honour extraordinary contributions oceans research made female BecauseOfHer https co CQuLbCiPEK,"['#WomensHistoryMonth', '#BecauseOfHer']",Environmental,44,0.16666666666666666,en,DFO_Science_tweeter
3,793077679247482880,2016-10-31 13:10:28,['https://t.co/hz3jOLVEGn'],DFO wishes you #HappyHalloween! Canadian waters are home to some creepy looking species like Pacific Blackdragon https://t.co/hz3jOLVEGn,DFO wishes HappyHalloween Canadian waters home creepy looking species like Pacific Blackdragon https co hz3jOLVEGn,['#HappyHalloween'],Environmental,41,-0.5,en,DFO_Science_tweeter
4,793162040252792834,2016-10-31 18:45:41,['https://t.co/hbUsQ8mAB6'],RT @ParksCanada: Witch-ing you a spook-tacular #Halloween! Stay safe and have a scary good time!!! https://t.co/hbUsQ8mAB6,RT ParksCanada Witch ing spook tacular Halloween Stay safe scary good time https co hbUsQ8mAB6,['#Halloween'],Social,37,0.3333333333333333,en,DFO_Science_tweeter
5,785892467652562944,2016-10-11 17:19:00,['https://t.co/ExLpv4yqA'],"October is #WomensHistoryMonth, and this year we honour our women scientists’ with #BecauseOfHer https://t.co/ExLpv4yqAd",October WomensHistoryMonth year honour women BecauseOfHer https co ExLpv4yqAd,"['#WomensHistoryMonth', '#BecauseOfHer']",Social,34,0.0,en,DFO_Science_tweeter
6,789196746907750400,2016-10-20 20:09:01,['https://t.co/dWBBn8iJGL'],ICYMI: DFO Science and @CCG_GCC proudly participated in an #AtlanticSalmon release at Fundy Park #savingsalmon https://t.co/dWBBn8iJGL,ICYMI DFO Science proudly participated AtlanticSalmon release Fundy Park savingsalmon https co dWBBn8iJGL,"['#AtlanticSalmon', '#savingsalmon']",Environmental,27,0.8,en,DFO_Science_tweeter
7,784457049543409664,2016-10-07 18:15:09,['https://t.co/BR1DmTozQn'],.@DFO_Central Hydrographers set up a GPS monitoring station against a beautiful horizon in Milne Inlet #Nunavut #CDNScience https://t.co/BR1DmTozQn,Hydrographers set GPS monitoring station beautiful horizon Milne Inlet Nunavut CDNScience https co BR1DmTozQn,"['#Nunavut', '#CDNScience']",Environmental,27,0.85,en,DFO_Science_tweeter
8,786625662463475712,2016-10-13 17:52:27,['https://t.co/V3VnWUQJ9F'],Watch to see how #DFO scientists gather important information on deep-sea water composition #CdnScience https://t.co/V3VnWUQJ9F,Watch see DFO scientists gather important information deep sea water composition CdnScience https co V3VnWUQJ9F,"['#DFO', '#CdnScience']",Environmental,21,0.4,en,DFO_Science_tweeter
9,793067719734259712,2016-10-31 12:30:53,['https://t.co/BQigyCJbzN'],As #WomensHistoryMonth comes to a close we thank all our female scientists – past &amp; present – who have contributed to DFO science https://t.co/BQigyCJbzN,WomensHistoryMonth comes close thank female scientists past amp present contributed DFO science https co BQigyCJbzN,['#WomensHistoryMonth'],Social,20,-0.08333333333333333,en,DFO_Science_tweeter
10,791367968764682240,2016-10-26 19:56:41,"['https://t.co/BslN6q6Dii', 'https://t.co/2T5nc0pz7k']",We’re at @OceanaCAN Science Symposium today to talk about our new Office of Partnership &amp; Collaboration #Oceans4Us https://t.co/BslN6q6Dii https://t.co/2T5nc0pz7k,OceanaCAN Science Symposium today talk new Office Partnership amp Collaboration Oceans4Us https co BslN6q6Dii https co 2T5nc0pz7k,['#Oceans4Us'],Environmental,19,0.13636363636363635,en,DFO_Science_tweeter
11,793161872405127169,2016-10-31 18:45:01,[],"RT @environmentca: #OMG! #Halloween 🎃 is finally here! For a #GreenHalloween, follow these simple tips. #HappyHalloween! Be safe! #TrickOrT…",RT environmentca OMG Halloween finally GreenHalloween follow simple tips HappyHalloween safe,"['#OMG', '#Halloween', '#GreenHalloween', '#HappyHalloween', '#TrickOrT']",Social,19,0.2083333333333333,en,DFO_Science_tweeter
12,789138359486742530,2016-10-20 16:17:01,['https://t.co/CYwqlMBEnt'],Last of the science moorings were recovered by CCGS #SirWilfridLaurier in the Beaufort Sea during an #Arctic gale https://t.co/CYwqlMBEnt,Last science moorings recovered CCGS SirWilfridLaurier Beaufort Sea Arctic gale https co CYwqlMBEnt,"['#SirWilfridLaurier', '#Arctic']",Environmental,17,0.0,en,DFO_Science_tweeter
13,789448253674749952,2016-10-21 12:48:25,"['https://t.co/lDLATzNnTb', 'https://t.co/AXPeJNODCr']",1 of the 5 engines on board the CCGS #LouiSStLaurent that push it through ice #JOIS https://t.co/lDLATzNnTb https://t.co/AXPeJNODCr,engines board CCGS LouiSStLaurent push ice JOIS https co lDLATzNnTb https co AXPeJNODCr,"['#LouiSStLaurent', '#JOIS']",Environmental,16,0.0,en,DFO_Science_tweeter
14,783738754515206144,2016-10-05 18:40:54,[],RT @DFO_Central: DFO works with @environmentca and @EPAGreatLakes in support of the Great Lakes Water Quality Agreement #GreatLakesForum ht…,RT DFO works environmentca EPAGreatLakes support Great Lakes Water Quality Agreement GreatLakesForum,['#GreatLakesForum'],Environmental,15,0.8,en,DFO_Science_tweeter
15,789455263564763136,2016-10-21 13:16:16,[],"RT @DFO_Pacific: #BecauseOfHer research, Marine biologist Edith Berkeley shaped Canada as a world authority on polychaetes in the early 190…",RT BecauseOfHer research Marine biologist Edith Berkeley shaped Canada world authority polychaetes early,['#BecauseOfHer'],Environmental,14,0.1,en,DFO_Science_tweeter
16,791314468898734080,2016-10-26 16:24:05,['https://t.co/ZKouYO3xdA'],.@OceanaCAN #Oceans4Us https://t.co/ZKouYO3xdA,OceanaCAN Oceans4Us https co ZKouYO3xdA,['#Oceans4Us'],Environmental,14,0.0,en,DFO_Science_tweeter
17,788382927566536705,2016-10-18 14:15:12,"['https://t.co/8GQ2Sthp2X', 'https://t.co/6c4bpKKMr']",A “rosette” is the primary instrument for ocean monitoring. Read more about #JOIS w/ @WHOI here: https://t.co/8GQ2Sthp2X https://t.co/6c4bpKKMr1,primary instrument ocean monitoring Read JOIS WHOI https co 8GQ2Sthp2X https co 6c4bpKKMr1,['#JOIS'],Environmental,13,0.45,en,DFO_Science_tweeter
18,793159993008787457,2016-10-31 18:37:33,[],RT @DFO_NL: There are ghosts &amp; goblins. #dfonl has #fishesofhalloween. We asked DFO_Science for their favourites. Biologist @xtinabourne li…,RT ghosts amp goblins dfonl fishesofhalloween asked favourites Biologist xtinabourne,"['#dfonl', '#fishesofhalloween']",Environmental,13,0.0,en,DFO_Science_tweeter
19,788773047314546688,2016-10-19 16:05:23,"['https://t.co/nrwCYvMwhI', 'https://t.co/MbXm1MgyS6']",Read @WHOI to learn about the deployment of this Arctic Ocean Flux Buoy during the #JOIS mission in the #Arctic: https://t.co/nrwCYvMwhI https://t.co/MbXm1MgyS6,Read WHOI learn deployment Arctic Ocean Flux Buoy JOIS mission Arctic https co nrwCYvMwhI https co MbXm1MgyS6,"['#JOIS', '#Arctic']",Economical,12,0.0,en,DFO_Science_tweeter
20,791006462139064322,2016-10-25 20:00:11,['https://t.co/9uBYVvlpzM'],"Science at sea isn’t always smooth sailing, sometimes you get whaled on! #SeaWhatIDidThere #GalwayStatement #CdnOceans #OneHullOfABoat https://t.co/9uBYVvlpzM",Science sea always smooth sailing sometimes get whaled SeaWhatIDidThere GalwayStatement CdnOceans OneHullOfABoat https co 9uBYVvlpzM,"['#SeaWhatIDidThere', '#GalwayStatement', '#CdnOceans', '#OneHullOfABoat']",Environmental,12,0.5,en,DFO_Science_tweeter
21,792065351727124480,2016-10-28 18:07:50,['https://t.co/PjusKxNnA'],RT @ScienceMin: What are Vazella sponges? @DFO_MPO gives the lowdown on its deep sea research in the #AtlanticOcean: https://t.co/PjusKxNnAU,RT ScienceMin Vazella sponges gives lowdown deep sea research AtlanticOcean https co PjusKxNnAU,['#AtlanticOcean'],Social,12,0.0,en,DFO_Science_tweeter
22,782951007617748992,2016-10-03 14:30:41,['https://t.co/lrZeTI\xe2\x80\xa6'],"RT @DFO_MAR: Alien? No, this interesting species is called Cystisoma! Found near the Louisbourg Line aboard #CCGSHudson https://t.co/lrZeTI…",RT Alien interesting species called Cystisoma Found near Louisbourg Line aboard CCGSHudson https co,['#CCGSHudson'],Environmental,12,0.15833333333333333,en,DFO_Science_tweeter
23,791282318153572352,2016-10-26 14:16:20,[],"RT @loctier: Samples retrieved from 2,000m depth in the Atlantic Ocean – we're working onboard the research vessel back from the @eu_atlas…",RT loctier Samples retrieved 000m depth Atlantic Ocean working onboard research vessel back,[],Environmental,12,0.0,en,DFO_Science_tweeter
24,789136789093179397,2016-10-20 16:10:46,"['https://t.co/1VT5pVjhUX', 'https://t.co/0AeS4XTNmk']",A selection of young sea-ice seen on board @CCG_GGC #LouisSStLaurent during the #JOIS mission https://t.co/1VT5pVjhUX https://t.co/0AeS4XTNmk,selection young sea ice seen board LouisSStLaurent JOIS mission https co 1VT5pVjhUX https co 0AeS4XTNmk,"['#LouisSStLaurent', '#JOIS']",Environmental,11,0.1,en,DFO_Science_tweeter
25,784045662828630018,2016-10-06 15:00:27,['https://t.co/tae1PrFOhm'],"Before the @CCG_GCC #LouisSStLaurent headed out to sea for #CanArctic, CHS caught the sunrise in Norway. #ThrowbackThursday https://t.co/tae1PrFOhm",LouisSStLaurent headed sea CanArctic CHS caught sunrise Norway ThrowbackThursday https co tae1PrFOhm,"['#LouisSStLaurent', '#CanArctic', '#ThrowbackThursday']",Economical,11,0.0,en,DFO_Science_tweeter
26,788789749947465728,2016-10-19 17:11:46,['https://t.co/XpRyV\xe2\x80\xa6'],RT @DFO_MAR: The BIO will be celebrating its 55th anniversary next fall and needs a logo for the largest open house yet! https://t.co/XpRyV…,RT BIO celebrating 55th anniversary next fall needs logo largest open house yet https co,[],Environmental,11,0.0,en,DFO_Science_tweeter
27,792380707867852800,2016-10-29 15:00:57,['https://t.co/uteh15rUJ'],"#LouisSStLaurent arrives in Kugluktuk #Nunavut today, marking the successful end to another #JOIS mission https://t.co/uteh15rUJ1",LouisSStLaurent arrives Kugluktuk Nunavut today marking successful end another JOIS mission https co uteh15rUJ1,"['#LouisSStLaurent', '#Nunavut', '#JOIS']",Social,10,0.75,en,DFO_Science_tweeter
28,788401884142964737,2016-10-18 15:30:31,['https://t.\xe2\x80\xa6'],"RT @DFO_MAR: #BecauseOfHer, #DFO scientist Ellen Kenchington, a new species of clam -Acesta cryptadelphe- was discovered in 2007 https://t.…",RT BecauseOfHer DFO scientist Ellen Kenchington new species clam Acesta cryptadelphe discovered 2007 https,"['#BecauseOfHer', '#DFO']",Environmental,10,0.13636363636363635,en,DFO_Science_tweeter
29,789090160877199364,2016-10-20 13:05:29,"['https://t.co/ezhVCLvS9O', 'https://t.co/g1ZdOW1tOV']",Members from the #JOIS mission in the #Arctic take samples of ice cores for study: https://t.co/ezhVCLvS9O https://t.co/g1ZdOW1tOV,Members JOIS mission Arctic take samples ice cores study https co ezhVCLvS9O https co g1ZdOW1tOV,"['#JOIS', '#Arctic']",Environmental,9,0.0,en,DFO_Science_tweeter
30,786206620988674048,2016-10-12 14:07:20,['https://t.co/6XyVUv'],"Read up on the CCGS #LouisSStLaurent, this year’s icebreaker for the annual #JOIS mission w/ @WHOI : https://t.co/6XyVUv810d",Read CCGS LouisSStLaurent icebreaker annual JOIS mission WHOI https co 6XyVUv810d,"['#LouisSStLaurent', '#JOIS']",Environmental,8,0.0,en,DFO_Science_tweeter
31,783356308527407105,2016-10-04 17:21:12,[],"RT @marineinstitute: Students at Inuksuk High School are learning about remotely operated vehicles (ROVs), navigation &amp; ocean maps with @MI…",RT marineinstitute Students Inuksuk High School learning remotely operated vehicles ROVs navigation amp ocean maps,[],Environmental,8,0.03,en,DFO_Science_tweeter
32,784453089982119936,2016-10-07 17:59:25,['https://t.co/7qcs2BmJDv'],"Hydrographer-in-Charge Andrew Leyzack &amp; Dave Bazowsky plan survey operations on CCGS Henry Larsen in Milne Inlet, NU #Arctic #CDNScience https://t.co/7qcs2BmJDv",Hydrographer Charge Andrew Leyzack amp Dave Bazowsky plan survey operations CCGS Henry Larsen Milne Inlet NU Arctic CDNScience https co 7qcs2BmJDv,"['#Arctic', '#CDNScience']",Economical,8,0.0,en,DFO_Science_tweeter
33,783675936558505984,2016-10-05 14:31:17,"['https://t.co/Sd74yTzXJy', 'https://t.co/9cRkE0QFTO']",#DFO scientist Sarah Zimmermann leads the daily morning science meeting on board CCGS #LouisSStLaurent for #JOIS https://t.co/Sd74yTzXJy https://t.co/9cRkE0QFTO,DFO scientist Sarah Zimmermann leads daily morning science meeting board CCGS LouisSStLaurent JOIS https co Sd74yTzXJy https co 9cRkE0QFTO,"['#DFO', '#LouisSStLaurent', '#JOIS']",Environmental,8,0.0,en,DFO_Science_tweeter
34,784101012642664448,2016-10-06 18:40:23,['https://t.co/owzo6qIl'],RT @DFO_MAR: $100K will go to @CRI_News  to study the population &amp; range of Atlantic salmon in the Miramichi River https://t.co/owzo6qIlD1,RT 100K go study population amp range Atlantic salmon Miramichi River https co owzo6qIlD1,[],Social,8,0.0,en,DFO_Science_tweeter
35,793158057077407744,2016-10-31 18:29:51,['https://t.co/N7mjxmT\xe2\x80\xa6'],RT @DFO_NL: #fishesofhalloween? #dfonl @DFO_Science's Kyle Matheson finds #InvasiveSpecies skeleton shrimp very scary. https://t.co/N7mjxmT…,RT fishesofhalloween dfonl Kyle Matheson finds InvasiveSpecies skeleton shrimp scary https co,"['#fishesofhalloween', '#dfonl', '#InvasiveSpecies']",Environmental,7,-0.65,en,DFO_Science_tweeter
36,791308052393758720,2016-10-26 15:58:36,[],RT @OceanTracking: A reminder of the importance to incorporate traditional and indigenous knowledge in scientific research  #oceans4us @Oce…,RT OceanTracking reminder importance incorporate traditional indigenous knowledge scientific research oceans4us,['#oceans4us'],Environmental,7,0.0,en,DFO_Science_tweeter
37,784079535239204865,2016-10-06 17:15:03,['https://t.\xe2\x80\xa6'],RT @DFO_MPO: This funding will support the new Atlantic Salmon Research Joint Venture and scientific research on Atlantic salmon https://t.…,RT funding support new Atlantic Salmon Research Joint Venture scientific research Atlantic salmon https,[],Economical,6,0.13636363636363635,en,DFO_Science_tweeter
38,787699932241207296,2016-10-16 17:01:13,['https://t.co/Wu0Qa7NST'],For the final stage of deployment on #JOIS the syntactic floatation sphere is positioned into place &amp; lowered into the water https://t.co/Wu0Qa7NST1,final stage deployment JOIS syntactic floatation sphere positioned place amp lowered water https co Wu0Qa7NST1,['#JOIS'],Environmental,6,0.0,en,DFO_Science_tweeter
39,787016412011327488,2016-10-14 19:45:09,"['https://t.co/7GPAbH1e7', 'https://t.co/buxV2TIG']","This sediment trap been 3000m below sea-level for the last year, collecting samples &amp; data for #JOIS. Read more here https://t.co/7GPAbH1e7d https://t.co/buxV2TIG90",sediment trap 3000m sea level last year collecting samples amp data JOIS Read https co 7GPAbH1e7d https co buxV2TIG90,['#JOIS'],Environmental,6,0.25,en,DFO_Science_tweeter
40,789131398858899456,2016-10-20 15:49:21,['https://t.co/8XwKmX3b9E'],"RT @CCG_GCC: The last of the science team from the CCGS #SirWilfridLaurier departs in Nome, AK on the CG443 https://t.co/8XwKmX3b9E",RT last science team CCGS SirWilfridLaurier departs Nome AK CG443 https co 8XwKmX3b9E,['#SirWilfridLaurier'],Social,6,0.0,en,DFO_Science_tweeter
41,783404739581075456,2016-10-04 20:33:39,['https://t.co\xe2\x80\xa6'],RT @DFO_Central: Working together to stop Asian Carp. Becky Cudmore gives @USGS staff tour of the #AsianCarp lab in Burlington https://t.co…,RT Working together stop Asian Carp Becky Cudmore gives USGS staff tour AsianCarp lab Burlington https,['#AsianCarp'],Environmental,6,0.0,en,DFO_Science_tweeter
42,789837544133361664,2016-10-22 14:35:19,"['https://t.co/cgA9GVOpPj', 'https://t.co/6pJlUckcGg']",#DFO scientists Kelly Young shows #LouisSStLaurent officers #Arctic zooplankton on a the science tour during #JOIS https://t.co/cgA9GVOpPj https://t.co/6pJlUckcGg,DFO scientists Kelly Young shows LouisSStLaurent officers Arctic zooplankton science tour JOIS https co cgA9GVOpPj https co 6pJlUckcGg,"['#DFO', '#LouisSStLaurent', '#Arctic', '#JOIS']",Economical,5,0.1,en,DFO_Science_tweeter
43,790648804433354753,2016-10-24 20:18:59,[],RT @DFO_NL: Congratulations Dr. Joe Banoub - with Dr. Ben Davis (l) - 2015 @DFO_NL  @DFO_Science Templeman Award winner for work on lignins…,RT Congratulations Dr Joe Banoub Dr Ben Davis 2015 Templeman Award winner work,[],Environmental,5,0.0,en,DFO_Science_tweeter
44,791323985573183488,2016-10-26 17:01:54,"['https://t.co/gpnSMNfZrX', 'https://t.co/0wWJ8ilckP']",Even this deep-sea jellyfish is getting into the holiday spirit and dressing up! #ScaryScience #HappyHalloween https://t.co/gpnSMNfZrX https://t.co/0wWJ8ilckP,Even deep sea jellyfish getting holiday spirit dressing ScaryScience HappyHalloween https co gpnSMNfZrX https co 0wWJ8ilckP,"['#ScaryScience', '#HappyHalloween']",Social,5,0.0,en,DFO_Science_tweeter
45,786631381023617025,2016-10-13 18:15:10,"['https://t.co/5JJeWEECyg', 'https://t.co/GKShTc5VPf']",The rosette is the primary instrument for ocean monitoring. Read more about #JOIS with @WHOI here: https://t.co/5JJeWEECyg https://t.co/GKShTc5VPf,rosette primary instrument ocean monitoring Read JOIS WHOI https co 5JJeWEECyg https co GKShTc5VPf,['#JOIS'],Environmental,5,0.45,en,DFO_Science_tweeter
46,784079674171330560,2016-10-06 17:15:36,['https://t.co/5O\xe2\x80\xa6'],RT @DFO_NL: $119K is going to @NunatsiavutGov to study #nlsalmon migration patterns &amp; habitat preferences in #LakeMelville. https://t.co/5O…,RT 119K going NunatsiavutGov study nlsalmon migration patterns amp habitat preferences LakeMelville https co,"['#nlsalmon', '#LakeMelville']",Social,5,0.0,en,DFO_Science_tweeter
47,784080680238055424,2016-10-06 17:19:36,['https://t.co/BJ8eNDEssh'],These research initiatives will enhance collective knowledge on scientific &amp; conservation efforts to aid in Atlantic salmon recovery #CdnSci https://t.co/BJ8eNDEssh,research initiatives enhance collective knowledge scientific amp conservation efforts aid Atlantic salmon recovery CdnSci https co BJ8eNDEssh,['#CdnSci'],Environmental,5,0.0,en,DFO_Science_tweeter
48,784455784218394624,2016-10-07 18:10:08,['https://t.co/jexeKZUfMB'],A bird’s eye view of the CHS survey boat “Harlequin” heading out for a day’s work in Milne Inlet #Nunavut #CDNScience https://t.co/jexeKZUfMB,eye view CHS survey boat heading work Milne Inlet Nunavut CDNScience https co jexeKZUfMB,"['#Nunavut', '#CDNScience']",Environmental,4,0.0,en,DFO_Science_tweeter
49,782970375915315201,2016-10-03 15:47:39,[],"RT @marineinstitute: Today, @MIOceanNet is in Iqaluit, Nunavut for the kick-off to #OI2016 Youth Forum taking place at Inuksuk High School!…",RT marineinstitute Today MIOceanNet Iqaluit Nunavut kick OI2016 Youth Forum taking place Inuksuk High School,['#OI2016'],Environmental,4,0.16,en,DFO_Science_tweeter
50,784079487956811778,2016-10-06 17:14:52,['https://t.co/owzo6qIl'],RT @DFO_MAR: $250K will go to @SalmonNews to support research on Atlantic salmon migration routes &amp; behaviour https://t.co/owzo6qIlD1,RT 250K go SalmonNews support research Atlantic salmon migration routes amp behaviour https co owzo6qIlD1,[],Environmental,4,0.0,en,DFO_Science_tweeter
51,791726442589646848,2016-10-27 19:41:08,[],RT @DFO_Pacific: #Weareproud Cathryn Abbott receives 2016 Public Service Award of Excellence - Scientific Contribution #BecauseofHer https:…,RT Weareproud Cathryn Abbott receives 2016 Public Service Award Excellence Scientific Contribution BecauseofHer https,"['#Weareproud', '#BecauseofHer']",Environmental,4,0.0,en,DFO_Science_tweeter
52,782923319746101248,2016-10-03 12:40:40,['https://t.co/MjlcO2O7b'],"RT @DFO_Pacific: Congratulations to @DFO_MPO’s Aimee Houde, 2016 #RSC Alice Wilson Award winner https://t.co/MjlcO2O7bD @RSCTheAcademies @a…",RT Congratulations Aimee Houde 2016 RSC Alice Wilson Award winner https co MjlcO2O7bD RSCTheAcademies,['#RSC'],Environmental,4,0.0,en,DFO_Science_tweeter
53,791274603465367552,2016-10-26 13:45:41,['https://t.co/c0fTZ8bIhq'],We are providing more than $500K to @Ocean_Networks to make our West Coast data more accessible to Canadians https://t.co/c0fTZ8bIhq,providing 500K make West Coast data accessible Canadians https co c0fTZ8bIhq,[],Environmental,4,0.4583333333333333,en,DFO_Science_tweeter
54,787307343948181504,2016-10-15 15:01:12,"['https://t.co/GGhmcIX4sR', 'https://t.co/F4aLoZ7XeW']",These 50 small yellow floats act as a safety net – and withstand deep #Arctic depths – on #JOIS with @WHOI https://t.co/GGhmcIX4sR https://t.co/F4aLoZ7XeW,50 small yellow floats act safety net withstand deep Arctic depths JOIS WHOI https co GGhmcIX4sR https co F4aLoZ7XeW,"['#Arctic', '#JOIS']",Social,4,-0.0625,en,DFO_Science_tweeter
55,791307990250979328,2016-10-26 15:58:21,[],"RT @katie_at_sea: .@DFO_MPO setting aside an extra $24M next year for data collection, stock assessment and other fisheries science needs.…",RT setting aside extra 24M next year data collection stock assessment fisheries science needs,[],Environmental,4,-0.041666666666666664,en,DFO_Science_tweeter
56,789474165371920385,2016-10-21 14:31:23,['https://t.co/17Mp2Zh5A'],The #Arctic #JOIS mission collects an Ice-Tethered Profiler (ITP) buoy that’s been stuck in the ice for 2 years @WHOI https://t.co/17Mp2Zh5A1,Arctic JOIS mission collects Ice Tethered Profiler ITP buoy stuck ice years WHOI https co 17Mp2Zh5A1,"['#Arctic', '#JOIS']",Environmental,4,0.0,en,DFO_Science_tweeter
57,791290374421635072,2016-10-26 14:48:21,"['https://t.co/n4dCl8SsV7', 'https://t.co/z6FC1QbAm']",Crew from the #LouisSStLaurent haul in an ITP Mooring float. Read more about #JOIS deployments/retrievals here: https://t.co/n4dCl8SsV7 https://t.co/z6FC1QbAmU,Crew LouisSStLaurent haul ITP Mooring float Read JOIS deployments retrievals https co n4dCl8SsV7 https co z6FC1QbAmU,"['#LouisSStLaurent', '#JOIS']",Environmental,4,0.5,en,DFO_Science_tweeter
58,784101046738190336,2016-10-06 18:40:32,['https://\xe2\x80\xa6'],RT @DFO_MAR: $26.5K will go to @UNB to increase knowledge of sea lice infections in Atlantic salmon &amp; help create recovery methods https://…,RT 26 5K go UNB increase knowledge sea lice infections Atlantic salmon amp help create recovery methods https,[],Environmental,3,0.0,en,DFO_Science_tweeter
59,792033343072329732,2016-10-28 16:00:38,"['https://t.co/QBSXOhorjl', 'https://t.co/VbKOHsgTqZ']","#JOIS’s Mooring Team ready to relaunch the RAS-500, which won’t be retrieved until next year’s expedition https://t.co/QBSXOhorjl https://t.co/VbKOHsgTqZ",Mooring Team ready relaunch RAS 500 retrieved next expedition https co QBSXOhorjl https co VbKOHsgTqZ,['#JOIS'],Environmental,3,0.1,en,DFO_Science_tweeter
60,792063630061821952,2016-10-28 18:00:59,"['https://t.co/UF9EeVNd7', 'https://t.co/0VlXcSvM74']",Canadian scientists on #JOIS collect water sampels from the rossette to filter for microbes in the lab https://t.co/UF9EeVNd70 https://t.co/0VlXcSvM74,Canadian scientists JOIS collect water sampels rossette filter microbes lab https co UF9EeVNd70 https co 0VlXcSvM74,['#JOIS'],Environmental,3,0.0,en,DFO_Science_tweeter
61,793158274774433792,2016-10-31 18:30:43,['https://t.co/\xe2\x80\xa6'],RT @DFO_NL: #Halloween has ghosts. @DFO_Science @PSSargent suggests the very rare 'ghost fish' for #fishesofhalloween.        https://t.co/…,RT Halloween ghosts PSSargent suggests rare ghost fish fishesofhalloween https co,"['#Halloween', '#fishesofhalloween']",Environmental,3,0.39,en,DFO_Science_tweeter
62,793143243810537473,2016-10-31 17:30:59,['https://t.co/kA072TosZ'],"The sun streaming through the water gives these anemones an eerie, spooky feeling. #ScaryScience https://t.co/kA072TosZu",sun streaming water gives anemones eerie spooky feeling ScaryScience https co kA072TosZu,['#ScaryScience'],Social,3,-0.5,en,DFO_Science_tweeter
63,782596366543495168,2016-10-02 15:01:28,['https://t.co/d4gem3XAvx'],"On Tuesday #DFO officials and scientists will attend the annual #OceansInnovation conference in Iqaluit, #Nunavut @marineinstitute https://t.co/d4gem3XAvx",Tuesday DFO officials scientists attend annual OceansInnovation conference Iqaluit Nunavut marineinstitute https co d4gem3XAvx,"['#DFO', '#OceansInnovation', '#Nunavut']",Environmental,3,0.0,en,DFO_Science_tweeter
64,783009664149708800,2016-10-03 18:23:46,['https://t.co/dcoxZPqDTN'],RT @DFO_Central: Bob Lambe from @LampreyControl opens #asiancarp Public Forum! https://t.co/dcoxZPqDTN,RT Bob Lambe LampreyControl opens asiancarp Public Forum https co dcoxZPqDTN,['#asiancarp'],Environmental,3,0.0,en,DFO_Science_tweeter
65,783010365537980417,2016-10-03 18:26:33,['https://t.co/OITM3BGJrM'],RT @DFO_Central: Dr. Nick Mandrak @UTSC presenting research to answer key management questions. https://t.co/OITM3BGJrM,RT Dr Nick Mandrak UTSC presenting research answer key management questions https co OITM3BGJrM,[],Social,3,0.0,en,DFO_Science_tweeter
