,Unnamed: 0,id,date_published,link,caption_original,caption_cleaned,hashtags,num_shares,num_likes,Reactions_SUM,category,language,average_sentiment_score,sentiment,account_name,words_matched_list
1298,1298,710201949954686976,2016-03-16 20:31:54,"['https://t.co/06CPduvuDB', 'https://t.co/6TKRODRd6H']",Don’t let that #steelhead turn into an $800 trophy. Know the BC regs! https://t.co/06CPduvuDB 🎣 https://t.co/6TKRODRd6H,let steelhead turn 800 trophy Know BC regs https co 06CPduvuDB https co 6TKRODRd6H,['#steelhead'],0,1,1,unknown,en,0.0,Neutral,DFO_Pacific_tweeter,
1294,1294,709797753581408256,2016-03-15 17:45:46,['https://t.co/mHJcJNUfyE'],Sport fishers! Keep your 2015-16 licence until March 31 --  you could be selected for the iARC catch record survey https://t.co/mHJcJNUfyE,Sport fishers Keep 2015 16 licence March 31 could selected iARC catch record survey https co mHJcJNUfyE,[],1,0,1,Environmental,en,0.0,Neutral,DFO_Pacific_tweeter,"['or', 'ice']"
1156,1156,705085948690829312,2016-03-02 17:42:44,['https://t.co/0YKiSV0W2R'],"New Sanitary Contamination #shellfish closure: Area 14, Baynes Sound Management Plan Closure 14.22B https://t.co/0YKiSV0W2R",New Sanitary Contamination shellfish closure Area 14 Baynes Sound Management Plan Closure 14 22B https co 0YKiSV0W2R,['#shellfish'],1,0,1,Social,en,0.2681818181818182,Neutral,DFO_Pacific_tweeter,['ami']
1270,1270,705914349811007489,2016-03-05 00:34:30,['https://t.co/fyq1D5FIIJ'],"New Red Tide/PSP bivalve #shellfish closures: Areas 12, 18 &amp; 24. See all closures in effect: https://t.co/fyq1D5FIIJ",New Red Tide PSP bivalve shellfish closures Areas 12 18 amp 24 See closures effect https co fyq1D5FIIJ,['#shellfish'],1,0,1,unknown,en,0.06818181818181818,Neutral,DFO_Pacific_tweeter,
1247,1247,707328902327312384,2016-03-08 22:15:26,['https://t.co/p9PUpFBZmg'],"Women’s Empowerment, in the words of @DFO_MPO ’s Kerra Shaw #InternationalWomansDay #IWD2016 https://t.co/p9PUpFBZmg",Empowerment words Kerra Shaw InternationalWomansDay IWD2016 https co p9PUpFBZmg,"['#InternationalWomansDay', '#IWD2016']",0,1,1,Environmental,en,0.0,Neutral,DFO_Pacific_tweeter,['or']
1194,1194,705124446953193472,2016-03-02 20:15:43,['https://t.co/bfmKaitmOE'],"New Sanitary Contamination #shellfish closure: Area 14, Baynes Sound Management Plan, closure 14.22A https://t.co/bfmKaitmOE",New Sanitary Contamination shellfish closure Area 14 Baynes Sound Management Plan closure 14 22A https co bfmKaitmOE,['#shellfish'],0,1,1,Social,en,0.2681818181818182,Neutral,DFO_Pacific_tweeter,['ami']
1311,1311,710968382959558656,2016-03-18 23:17:26,['https://t.co/VvzUillsJ'],"New Red Tide/PSP bivalve #shellfish closures: Subarea 16-1 - 16-4,16-10,16-17,18-10,19-5,24-6,25-11. https://t.co/VvzUillsJC",New Red Tide PSP bivalve shellfish closures Subarea 16 16 16 10 16 17 18 10 19 24 25 11 https co VvzUillsJC,['#shellfish'],0,0,0,unknown,en,0.06818181818181818,Neutral,DFO_Pacific_tweeter,
1318,1318,706270644577689600,2016-03-06 00:10:18,"['https://t.co/YZhmhM1f8L', 'https://t.co/BEiT4m1PI6']",DYK Endeavour Hydrothermal Vent MPA hosts unique organisms despite being hot/volatile place https://t.co/YZhmhM1f8L https://t.co/BEiT4m1PI6,DYK Endeavour Hydrothermal Vent MPA hosts unique organisms despite being hot volatile place https co YZhmhM1f8L https co BEiT4m1PI6,[],0,0,0,Environmental,en,0.375,Positive,DFO_Pacific_tweeter,['or']
1323,1323,713135723273134083,2016-03-24 22:49:40,['https://t.co/JsSI0a4UsS'],"New Red Tide/PSP bivalve #shellfish closures: Areas 17, 24 &amp; 29. See all closures in effect: https://t.co/JsSI0a4UsS",New Red Tide PSP bivalve shellfish closures Areas 17 24 amp 29 See closures effect https co JsSI0a4UsS,['#shellfish'],0,0,0,unknown,en,0.06818181818181818,Neutral,DFO_Pacific_tweeter,
