,id,date_published,link,caption_original,caption_cleaned,hashtags,category,Reactions_SUM,average_sentiment_score,language,account_name
0,485734081568161_843491915792374,2016-12-12 11:45:37,https://www.facebook.com/QuestionsdargentCanada/photos/a.534106823397553.1073741828.485734081568161/843491915792374/?type=3,"Vous est-il déjà arrivé que le prix d’un article à la caisse d’un magasin soit plus élevé que le prix annoncé ou affiché?

Si le prix de l’article est de 10 $ ou moins, le détaillant vous le remet gratuitement (cela s’applique seulement au premier article si vous en avez plus d’un). Si le prix de l’article est supérieur à 10 $, vous obtenez une remise de 10 $ sur le prix le plus bas annoncé ou affiché.

Si vous constatez une erreur, demandez au détaillant s’il a adopté le Code volontaire sur la lecture optique des prix. Vous verrez peut-être l’avis ci-dessous à l’entrée du magasin ou près des caisses.
http://ow.ly/rmUg306Zdq5","Vous est-il déjà arrivé que le prix d’un article à la caisse d’un magasin soit plus élevé que le prix annoncé ou affiché? Si le prix de l’article est de $ ou moins, le détaillant vous le remet gratuitement (cela s’applique seulement au premier article si vous en avez plus d’un). Si le prix de l’article est supérieur à $, vous obtenez une remise de $ sur le prix le plus bas annoncé ou affiché. Si vous constatez une erreur, demandez au détaillant s’il a adopté le Code volontaire sur la lecture optique des prix. Vous verrez peut-être l’avis ci-dessous à l’entrée du magasin ou près des caisses.",[],Environmental,61,0.05719866071428571,fr,QuestionsdargentCanada_facebook
1,485734081568161_850002851807947,2016-12-23 11:45:39,https://www.facebook.com/QuestionsdargentCanada/photos/a.534106823397553.1073741828.485734081568161/850002851807947/?type=3,"Vous a-t-on déjà demandé de composer un numéro 1-900?
Soyez vigilant avant de donner suite à un courriel ou à un texto vous demandant de téléphoner pour obtenir de l’information sur un service ou une offre quelconque.
Généralement, les numéros débutant par 900 et 976 donnent accès à des services tarifés à l’appel. Vous devrez donc payer les frais des appels qui sont faits à partir de votre téléphone, et ce, peu importe qui a fait l’appel ou qui a accepté de payer les frais demandés. Pour en apprendre plus: http://ow.ly/vmCT307cqjn","Vous a-t-on déjà demandé de composer un numéro -900? Soyez vigilant avant de donner suite à un courriel ou à un texto vous demandant de téléphoner pour obtenir de l’information sur un service ou une offre quelconque. Généralement, les numéros débutant par et donnent accès à des services tarifés à l’appel. Vous devrez donc payer les frais des appels qui sont faits à partir de votre téléphone, et ce, peu importe qui a fait l’appel ou qui a accepté de payer les frais demandés. Pour en apprendre plus:",[],Environmental,27,0.0,fr,QuestionsdargentCanada_facebook
2,485734081568161_840499269424972,2016-12-08 16:00:51,https://www.facebook.com/QuestionsdargentCanada/photos/a.534106823397553.1073741828.485734081568161/840499269424972/?type=3,"Vous êtes à l’emploi du gouvernement fédéral et êtes rémunéré par l’entremise du système de paye Phénix?

Si vous recevez un appel d’une personne cherchant à recouvrer les sommes qui vous auraient été payées en trop, ne fournissez aucun renseignement personnel, comme votre adresse ou vos numéros de carte de crédit ou de compte bancaire, et ne prenez aucune disposition de remboursement avec cette personne. Il s’agit d’une fraude.

Le gouvernement du Canada ne fait affaire avec aucune agence de recouvrement pour percevoir les trop-payés par Phénix. Signalez l’appel en communiquant avec le Centre antifraude du Canada. http://ow.ly/WWOp306WgZo","Vous êtes à l’emploi du gouvernement fédéral et êtes rémunéré par l’entremise du système de paye Phénix? Si vous recevez un appel d’une personne cherchant à recouvrer les sommes qui vous auraient été payées en trop, ne fournissez aucun renseignement personnel, comme votre adresse ou vos numéros de carte de crédit ou de compte bancaire, et ne prenez aucune disposition de remboursement avec cette personne. Il s’agit d’une fraude. Le gouvernement du Canada ne fait affaire avec aucune agence de recouvrement pour percevoir les trop-payés par Phénix. Signalez l’appel en communiquant avec le Centre antifraude du Canada.",[],Environmental,20,0.0,fr,QuestionsdargentCanada_facebook
3,485734081568161_840357592772473,2016-12-08 11:41:28,https://www.facebook.com/QuestionsdargentCanada/videos/840357592772473/,"Vous voulez embaucher un professionnel pour faire quelques travaux dans la maison?

Le travail au noir peut vous sembler une bonne affaire, mais en réalité vous n’aurez aucune protection si le travail n’est pas achevé ou s’il est mal fait. De plus, si un travailleur se blesse sur votre propriété, vous pourriez être tenu responsable et même poursuivi, et vous pourriez ne pas être couvert par votre assurance habitation. Ce n’est donc pas une bonne affaire! 
http://ow.ly/espf306LpuK","Vous voulez embaucher un professionnel pour faire quelques travaux dans la maison? Le travail au noir peut vous sembler une bonne affaire, mais en réalité vous n’aurez aucune protection si le travail n’est pas achevé ou s’il est mal fait. De plus, si un travailleur se blesse sur votre propriété, vous pourriez être tenu responsable et même poursuivi, et vous pourriez ne pas être couvert par votre assurance habitation. Ce n’est donc pas une bonne affaire!",[],Environmental,20,0.0,fr,QuestionsdargentCanada_facebook
4,485734081568161_852257571582475,2016-12-27 11:45:34,https://www.facebook.com/QuestionsdargentCanada/photos/a.534106823397553.1073741828.485734081568161/852257571582475/?type=3,"Vous réservez un voyage en ligne?

#Saviezvous que dans certaines provinces et certains territoires, les agences de voyages en ligne doivent être membres en règle de l’association de protection du consommateur pour que les lois sur la protection du consommateur s’appliquent à elles?

En d’autres mots, si vous réservez un voyage auprès d’une agence non inscrite, votre voyage risque de tomber à l’eau en cas de pépin comme la faillite de l’agence.

Obtenez plus d’info sur l’achat de services de voyage en ligne : http://ow.ly/N6bu306ZfGN","Vous réservez un voyage en ligne? que dans certaines provinces et certains territoires, les agences de voyages en ligne doivent être membres en règle de l’association de protection du consommateur pour que les lois sur la protection du consommateur s’appliquent à elles? En d’autres mots, si vous réservez un voyage auprès d’une agence non inscrite, votre voyage risque de tomber à l’eau en cas de pépin comme la faillite de l’agence. Obtenez plus d’info sur l’achat de services de voyage en ligne :",['#Saviezvous'],Environmental,19,0.0,fr,QuestionsdargentCanada_facebook
5,485734081568161_849433398531559,2016-12-22 11:45:37,https://www.facebook.com/QuestionsdargentCanada/photos/a.534106823397553.1073741828.485734081568161/849433398531559/?type=3,"Assurez-vous de ne pas manquer l’avion dans le temps des Fêtes et évitez ainsi des dépenses inutiles!
Les temps d’attente seront plus longs dans les aéroports cette semaine. Préparez-vous pour éviter d’être en retard.
Cette liste de vérification avant l’embarquement contient de nombreux #conseilsdevoyage: http://ow.ly/CQBF307cq6k",Assurez-vous de ne pas manquer l’avion dans le temps des Fêtes et évitez ainsi des dépenses inutiles! Les temps d’attente seront plus longs dans les aéroports cette semaine. Préparez-vous pour éviter d’être en retard. Cette liste de vérification avant l’embarquement contient de nombreux :,['#conseilsdevoyage'],Environmental,18,0.0,fr,QuestionsdargentCanada_facebook
6,485734081568161_847689578705941,2016-12-19 12:13:12,https://www.facebook.com/QuestionsdargentCanada/photos/a.534106823397553.1073741828.485734081568161/847689578705941/?type=3,"#Saviez-vous que vos droits de cotisation à un compte d’épargne libre d’impôt (CELI) s’accumulent chaque année à partir de la date de votre 18e anniversaire de naissance?
Si vous étiez âgé de 18 ans ou plus en 2009, vos droits de cotisation à un CELI pourraient atteindre jusqu’à 46 500 $. C’est de l’argent que vous pouvez mettre de côté à l’abri de l'impôt et ainsi atteindre vos objectifs en matière d’économie. Apprenez-en plus sur les avantages du CELI: http://ow.ly/AZA3307gFtF","-vous que vos droits de cotisation à un compte d’épargne libre d’impôt (CELI) s’accumulent chaque année à partir de la date de votre e anniversaire de naissance? Si vous étiez âgé de ans ou plus en , vos droits de cotisation à un CELI pourraient atteindre jusqu’à $. C’est de l’argent que vous pouvez mettre de côté à l’abri de l'impôt et ainsi atteindre vos objectifs en matière d’économie. Apprenez-en plus sur les avantages du CELI:",['#Saviez'],Environmental,17,0.0,fr,QuestionsdargentCanada_facebook
7,485734081568161_838989469575952,2016-12-06 11:45:33,https://www.facebook.com/QuestionsdargentCanada/photos/a.534106823397553.1073741828.485734081568161/838989469575952/?type=3,"On vous a demandé de participer à l’échange de cadeaux « secret sister » en ligne?

Réfléchissez-y à deux fois avant de céder à la tentation de vous joindre à un échange de cadeaux sur les médias sociaux! Il s’agit généralement de fraudes. Une seule personne en profite, et ce n’est pas vous. Gardez votre argent et restez dans les bonnes grâces du père Noël.
http://ow.ly/LTa2306LmXW","On vous a demandé de participer à l’échange de cadeaux « secret sister » en ligne? Réfléchissez-y à deux fois avant de céder à la tentation de vous joindre à un échange de cadeaux sur les médias sociaux! Il s’agit généralement de fraudes. Une seule personne en profite, et ce n’est pas vous. Gardez votre argent et restez dans les bonnes grâces du père Noël.",[],Social,16,0.0,fr,QuestionsdargentCanada_facebook
8,485734081568161_835457559929143,2016-12-01 09:32:50,https://www.facebook.com/QuestionsdargentCanada/photos/a.511116095696626.1073741826.485734081568161/660731427401758/?type=3,,,[],Social,15,0.0,tl,QuestionsdargentCanada_facebook
9,485734081568161_852842308190668,2016-12-28 11:45:39,http://ow.ly/qgwH307nSEr,"L’achat de médicaments sur ordonnance en ligne peut sembler une bonne façon d’économiser, mais saviez-vous que vous vous exposez à des risques graves? Cela est particulièrement vrai si vous commandez des médicaments sans vous être soumis à un examen par un professionnel de la santé.

Certaines pharmacies au Canada ont un site Internet légitime, mais d’autres ont un site carrément bidon par l’entremise duquel elles vendent des médicaments contrefaits, frelatés ou faussement étiquetés qui sont dangereux.

Pour en savoir plus sur l’achat de médicaments par l’entremise d’Internet :
http://ow.ly/qgwH307nSEr","L’achat de médicaments sur ordonnance en ligne peut sembler une bonne façon d’économiser, mais saviez-vous que vous vous eez à des risques graves? Cela est particulièrement vrai si vous commandez des médicaments sans vous être soumis à un examen par un professionnel de la santé. Certaines pharmacies au Canada ont un site Internet légitime, mais d’autres ont un site carrément bidon par l’entremise duquel elles vendent des médicaments contrefaits, frelatés ou faussement étiquetés qui sont dangereux. Pour en savoir plus sur l’achat de médicaments par l’entremise d’Internet :",[],Environmental,13,0.0,fr,QuestionsdargentCanada_facebook
10,485734081568161_853457444795821,2016-12-29 11:45:29,https://www.facebook.com/QuestionsdargentCanada/photos/a.534106823397553.1073741828.485734081568161/853457444795821/?type=3,"Le #saviezvous? En plus d’imposer des frais d’intérêts astronomiques, certains prêteurs sur salaire exigent dorénavant que le prêt soit consenti sous forme de carte prépayée.

Cette pratique pourrait rendre le prêt encore plus coûteux en ajoutant des frais pour l’activation et l’utilisation de la carte.

De toutes les formes de crédit, le prêt sur salaire est la plus coûteuse. Mieux vaut l’éviter : http://ow.ly/V7yV307nSZc","Le ? En plus d’imposer des frais d’intérêts astronomiques, certains prêteurs sur salaire exigent dorénavant que le prêt soit consenti sous forme de carte prépayée. Cette pratique pourrait rendre le prêt encore plus coûteux en ajoutant des frais pour l’activation et l’utilisation de la carte. De toutes les formes de crédit, le prêt sur salaire est la plus coûteuse. Mieux vaut l’éviter : c",['#saviezvous'],Environmental,11,0.0,fr,QuestionsdargentCanada_facebook
11,485734081568161_839619239512975,2016-12-07 11:45:37,https://www.facebook.com/QuestionsdargentCanada/photos/a.534106823397553.1073741828.485734081568161/839619239512975/?type=3,"Vous voulez vous débarrasser de votre hypothèque plus rapidement? Eh bien, les versements forfaitaires sont la solution!

Un versement forfaitaire est un montant que vous versez, en plus de vos paiements hypothécaires réguliers, avant l’échéance de votre hypothèque. Le versement forfaitaire fait baisser le solde impayé et vous permet de rembourser votre hypothèque plus rapidement. Vérifiez toujours les conditions rattachées à votre hypothèque pour savoir si vous êtes admissible au remboursement anticipé.
http://ow.ly/74yP306KY07","Vous voulez vous débarrasser de votre hypothèque plus rapidement? Eh bien, les versements forfaitaires sont la solution! Un versement forfaitaire est un montant que vous versez, en plus de vos paiements hypothécaires réguliers, avant l’échéance de votre hypothèque. Le versement forfaitaire fait baisser le solde impayé et vous permet de rembourser votre hypothèque plus rapidement. Vérifiez toujours les conditions rattachées à votre hypothèque pour savoir si vous êtes admissible au remboursement anticipé.",[],Environmental,11,0.0,fr,QuestionsdargentCanada_facebook
12,485734081568161_841111682697064,2016-12-09 11:45:42,https://www.facebook.com/QuestionsdargentCanada/photos/a.534106823397553.1073741828.485734081568161/841111682697064/?type=3,"#Saviezvous que plusieurs commerçants exigent que les ventes de robes de soirée soient finales?

Avant de dépenser pour une tenue de réveillon du Nouvel An ou pour une fête de bureau, informez-vous sur la politique de retour du magasin. Si vos plans tombent à l’eau, vous pourriez ne pas être en mesure de retourner la tenue coûteuse. 
http://ow.ly/1YRk306LpKc","que plusieurs commerçants exigent que les ventes de robes de soirée soient finales? Avant de dépenser pour une tenue de réveillon du Nouvel An ou pour une fête de bureau, informez-vous sur la politique de retour du magasin. Si vos plans tombent à l’eau, vous pourriez ne pas être en mesure de retourner la tenue coûteuse. c",['#Saviezvous'],Environmental,10,0.0,fr,QuestionsdargentCanada_facebook
13,485734081568161_838373259637573,2016-12-05 11:45:38,https://www.facebook.com/QuestionsdargentCanada/photos/a.534106823397553.1073741828.485734081568161/838373259637573/?type=3,"Vous avez trouvé le cadeau parfait en ligne?

Lisez bien tous les détails au moment de faire votre achat. Certains vendeurs en ligne exploitent les magasineurs des fêtes en ajoutant des frais de restockage exorbitants aux frais d’expédition sur les articles populaires: 
http://ow.ly/ISgV306J40w",Vous avez trouvé le cadeau parfait en ligne? Lisez bien tous les détails au moment de faire votre achat. Certains vendeurs en ligne eloitent les magasineurs des fêtes en ajoutant des frais de restockage erbitants aux frais d’eédition sur les articles populaires:,[],Environmental,9,0.0,fr,QuestionsdargentCanada_facebook
14,485734081568161_851087395032826,2016-12-25 10:01:47,https://www.facebook.com/QuestionsdargentCanada/photos/a.534106823397553.1073741828.485734081568161/851087395032826/?type=3,"Joyeuses Fêtes à TOUS les Canadiens — de ceux qui emprunteront les pistes à Bella Bella, à ceux qui célèbreront sous les aurores boréales à Goose Bay. #JoyeusesFêtes!","Joyeuses Fêtes à TOUS les Canadiens — de ceux qui emprunteront les pistes à Bella Bella, à ceux qui célèbreront sous les aurores boréales à Goose Bay. êtes!",['#JoyeusesF'],Environmental,9,0.0,fr,QuestionsdargentCanada_facebook
15,485734081568161_844782452329987,2016-12-14 11:45:37,https://www.facebook.com/QuestionsdargentCanada/photos/a.534106823397553.1073741828.485734081568161/844782452329987/?type=3,"Vous êtes à la recherche d’un cadeau génial pour un enfant?

N’importe qui peut ouvrir un régime enregistré d’épargne-études (REEE) pour un enfant: parents, grands-parents, autres membres de la famille ou amis. Il suffit d’avoir en main le numéro d’assurance sociale de l’enfant.

Renseignez-vous au sujet des divers types de REEE: http://ow.ly/yRXC306ZeAh","Vous êtes à la recherche d’un cadeau génial pour un enfant? N’importe qui peut ouvrir un régime enregistré d’épargne-études (REEE) pour un enfant: parents, grands-parents, autres membres de la famille ou amis. Il suffit d’avoir en main le numéro d’assurance sociale de l’enfant. Renseignez-vous au sujet des divers types de REEE:",[],Social,8,0.0,fr,QuestionsdargentCanada_facebook
16,485734081568161_844139542394278,2016-12-13 11:45:39,https://www.facebook.com/QuestionsdargentCanada/photos/a.534106823397553.1073741828.485734081568161/844139542394278/?type=3,"Le temps des Fêtes, c’est le temps de donner.

#Saviezvous que la plupart des dons en espèces ou en nature à des organismes de bienfaisance ou à des organismes communautaires donnent droit à un crédit d’impôt pour don de bienfaisance? Conservez vos reçus officiels pour réclamer ce crédit dans votre déclaration de revenus. Voilà un cadeau avantageux pour tous!

Renseignez-vous sur les règles fiscales entourant les dons de bienfaisance : http://ow.ly/uzYH306ZdHE","Le temps des Fêtes, c’est le temps de donner. que la plupart des dons en espèces ou en nature à des organismes de bienfaisance ou à des organismes communautaires donnent droit à un crédit d’impôt pour don de bienfaisance? Conservez vos reçus officiels pour réclamer ce crédit dans votre déclaration de revenus. Voilà un cadeau avantageux pour tous! Renseignez-vous sur les règles fiscales entourant les dons de bienfaisance :",['#Saviezvous'],Environmental,7,0.0,fr,QuestionsdargentCanada_facebook
17,485734081568161_835536063254626,2016-12-01 11:45:37,https://www.facebook.com/QuestionsdargentCanada/photos/a.534106823397553.1073741828.485734081568161/835536063254626/?type=3,"Avant de faire votre liste, pensez-y à deux fois. Les cadeaux achetés en magasin coûtent cher!

Prenez le temps de fabriquer vous-même vos cadeaux, comme un album photo ou une couverture de laine. C’est une bonne façon de personnaliser vos surprises pour vos êtres chers, mais cela vous permet aussi d’économiser.

Quels cadeaux #faitsmaison comptez-vous remettre cette année? Ajoutez vos idées ci-dessous. Plus nous en aurons, mieux ce sera!","Avant de faire votre liste, pensez-y à deux fois. Les cadeaux achetés en magasin coûtent cher! Prenez le temps de fabriquer vous-même vos cadeaux, comme un album photo ou une couverture de laine. C’est une bonne façon de personnaliser vos surprises pour vos êtres chers, mais cela vous permet aussi d’économiser. Quels cadeaux comptez-vous remettre cette année? Ajoutez vos idées ci-dessous. Plus nous en aurons, mieux ce sera!",['#faitsmaison'],Environmental,7,0.0,fr,QuestionsdargentCanada_facebook
18,485734081568161_848236038651295,2016-12-20 11:45:31,,"Êtes-vous tenté d’offrir quelques cadeaux de plus à vos proches?
Il est facile de se laisser entraîner par l’esprit des Fêtes. Faites-vous un petit cadeau en respectant votre budget, ce qui vous évitera de jongler avec d’innombrables factures en janvier.
Téléchargez la calculatrice budgétaire pour vous aider à planifier vos dépenses de Noël: http://ow.ly/I5h9307cpJ7","Êtes-vous tenté d’offrir quelques cadeaux de plus à vos proches? Il est facile de se laisser entraîner par l’esprit des Fêtes. Faites-vous un petit cadeau en respectant votre budget, ce qui vous évitera de jongler avec d’innombrables factures en janvier. Téléchargez la calculatrice budgétaire pour vous aider à planifier vos dépenses de Noël:",[],Environmental,7,0.0,fr,QuestionsdargentCanada_facebook
19,485734081568161_845426335598932,2016-12-15 11:45:37,https://www.facebook.com/QuestionsdargentCanada/photos/a.534106823397553.1073741828.485734081568161/845426335598932/?type=3,"Lorsqu’il s’agit des façons de gérer vos dettes, avez-vous envie de donner votre langue au chat?

Si vos dettes sont devenues un fardeau trop lourd, ne perdez plus de temps. Consultez des outils et des ressources qui vous aideront à reprendre le dessus : http://ow.ly/P72f306Zf9u 
#FinancesPersonnelles","Lorsqu’il s’agit des façons de gérer vos dettes, avez-vous envie de donner votre langue au chat? Si vos dettes sont devenues un fardeau trop lourd, ne perdez plus de temps. Consultez des outils et des ressources qui vous aideront à reprendre le dessus : 9u",['#FinancesPersonnelles'],Economical,6,0.0,fr,QuestionsdargentCanada_facebook
20,485734081568161_836336549841244,2016-12-02 11:45:36,https://www.facebook.com/QuestionsdargentCanada/photos/a.534106823397553.1073741828.485734081568161/836336549841244/?type=3,"Vous cherchez à économiser à l’achat de pneus d’hiver?

L’achat de pneus usagés peut être une bonne façon d’économiser, mais évitez de combiner des pneus avec des sculptures, des structures internes et des tailles différentes. Des pneus mal assortis peuvent rendre votre voiture moins stable. 

Pour en savoir plus: http://ow.ly/X5JV306wR8f","Vous cherchez à économiser à l’achat de pneus d’hiver? L’achat de pneus usagés peut être une bonne façon d’économiser, mais évitez de combiner des pneus avec des sculptures, des structures internes et des tailles différentes. Des pneus mal assortis peuvent rendre votre voiture moins stable. Pour en savoir plus:",[],Environmental,4,0.0,fr,QuestionsdargentCanada_facebook
21,485734081568161_840454886096077,2016-12-08 14:25:50,https://www.facebook.com/TransportsetInfrastructureauCanada/photos/a.10151491514147888.1073741825.377625007887/10154810108637888/?type=3,Ce serait dommage de devoir acheter de nouveaux pneus d’été après la fonte des neiges.,Ce serait dommage de devoir acheter de nouveaux pneus d’été après la fonte des neiges.,[],Environmental,4,0.0,fr,QuestionsdargentCanada_facebook
22,485734081568161_854069864734579,2016-12-30 11:45:26,,"Beaucoup de choses peuvent changer en une année.

Au cours de 2016, plusieurs changements ont été apportés aux services, aux avantages et à la réglementation qui ont une incidence sur la vie quotidienne et les finances des Canadiens et de leur famille. Êtes-vous au courant de ces nouveautés? 

Testez vos connaissances au sujet des principaux changements que nous avons signalés ou partagés au cours de 2016. Répondez à notre jeu-questionnaire : http://ow.ly/tIca307x6av","Beaucoup de choses peuvent changer en une année. Au cours de , plusieurs changements ont été apportés aux services, aux avantages et à la réglementation qui ont une incidence sur la vie quotidienne et les finances des Canadiens et de leur famille. Êtes-vous au courant de ces nouveautés? Testez vos connaissances au sujet des principaux changements que nous avons signalés ou partagés au cours de . Répondez à notre jeu-questionnaire :",[],Environmental,4,0.0,fr,QuestionsdargentCanada_facebook
23,485734081568161_848316475309918,2016-12-20 14:50:47,http://bit.ly/1RDMv3k,,,[],Social,4,0.0,tl,QuestionsdargentCanada_facebook
24,485734081568161_843540615787504,2016-12-12 14:00:08,https://www.facebook.com/CANenSante/photos/a.237023919671339.58447.160504807323251/1420490914657961/?type=3,,,[],Social,4,0.0,tl,QuestionsdargentCanada_facebook
25,485734081568161_839697272838505,2016-12-07 14:28:20,https://www.facebook.com/Pensezcybersecurite/photos/a.435485793204761.1073741828.435100263243314/1194901380596528/?type=3,,,[],Social,4,0.0,tl,QuestionsdargentCanada_facebook
26,485734081568161_848866195254946,2016-12-21 11:45:37,,"#Saviez-vous que de nombreuses plaintes en matière de consommation relèvent de la compétence des provinces et des territoires?
Il est important de noter que les lois et le traitement des plaintes peuvent varier selon les provinces et territoires. Assurez-vous de connaître vos droits. Si vous avez une plainte à formuler ou si vous avez besoin d’aide, consultez le bureau d'information aux consommateurs de votre province ou territoire.
http://ow.ly/4a7a307cpT9","-vous que de nombreuses plaintes en matière de consommation relèvent de la compétence des provinces et des territoires? Il est important de noter que les lois et le traitement des plaintes peuvent varier selon les provinces et territoires. Assurez-vous de connaître vos droits. Si vous avez une plainte à formuler ou si vous avez besoin d’aide, consultez le bureau d'information aux consommateurs de votre province ou territoire. 9",['#Saviez'],Economical,3,0.0,fr,QuestionsdargentCanada_facebook
27,485734081568161_835606056580960,2016-12-01 13:46:58,https://media.giphy.com/media/l2JhsyMxTg5jYKiTS/source.gif,,,[],Social,3,0.0,tl,QuestionsdargentCanada_facebook
