,Unnamed: 0,id,date_published,link,caption_original,caption_cleaned,hashtags,num_reactions,num_comments,num_shares,num_likes,num_loves,num_wows,num_hahas,num_sads,num_angrys,num_special,Reactions_SUM,category,language,average_sentiment_score,account_name,words_matched_list,sentiment
22,22,134615279898518_1323595961000438,2016-04-04 18:00:00,https://www.facebook.com/ParcsCanada/photos/a.281154578577920.88091.134615279898518/1323595961000438/?type=3,"C'est le début de la Semaine des ciels étoilés! 
Êtes-vous déjà allé dans l'une de nos réserves de ciel étoilé? C'est le moment ou jamais! http://ow.ly/10hcQ4
Photo prise Parc national Jasper",C'est le début de la Semaine des ciels étoilés! Êtes-vous déjà allé dans l'une de nos réserves de ciel étoilé? C'est le moment ou jamais! Photo prise Parc national Jasper,[],111,7,67,106,4,1,0,0,0,0,185,Economical,fr,0.0,ParcsCanada_facebook,['oil'],neutral
75,75,134615279898518_1320446954648672,2016-04-01 06:05:00,https://www.facebook.com/ParcsCanada/photos/a.281154578577920.88091.134615279898518/1320446954648672/?type=3,"Joyeux poisson d'avril! 
Bien que le castor, on adore... nous préférons notre logo comme il est!
*****
Nous sommes ravis de dévoiler notre NOUVEAU logo Parcs Canada, juste à temps pour le 150e anniversaire du Canada! http://www.pc.gc.ca/fra/voyage-travel/logo.aspx","Joyeux poisson d'avril! Bien que le castor, on adore... nous préférons notre logo comme il est! ***** Nous sommes ravis de dévoiler notre NOUVEAU logo Parcs Canada, juste à temps pour le e anniversaire du Canada!",[],50,10,32,43,1,1,5,0,0,0,92,Environmental,fr,0.0,ParcsCanada_facebook,"['eau', 'parc', 'or', 'air']",neutral
103,103,134615279898518_1340921542601213,2016-04-30 07:30:00,https://www.facebook.com/ParcsCanada/photos/a.281154578577920.88091.134615279898518/1340921542601213/?type=3,"Bon samedi!
Cette photo prise au Parc national Kouchibouguac nous fait rêver à l'été! Et vous?",Bon samedi! Cette photo prise au Parc national Kouchibouguac nous fait rêver à l'été! Et vous?,[],64,6,4,58,6,0,0,0,0,0,74,Environmental,fr,0.0,ParcsCanada_facebook,['parc'],neutral
115,115,134615279898518_1340180506008650,2016-04-28 12:20:00,http://ow.ly/4ncR4t,"D'après Thrillist, voici une liste des parcs nationaux les plus beaux au Canada! (lien en anglais seulement)","D'après Thrillist, voici une liste des parcs nationaux les plus beaux au Canada! (lien en anglais seulement)",[],59,2,10,56,3,0,0,0,0,0,71,Environmental,fr,0.0,ParcsCanada_facebook,"['eau', 'parc']",neutral
138,138,134615279898518_1318775034815864,2016-04-01 16:15:00,https://www.facebook.com/ParcsCanada/photos/a.281154578577920.88091.134615279898518/1318775034815864/?type=3,"Joyeux Vendredi Photo des Abonnés! 
Cette magnifique photo du Cap-Bon-Ami situé dans le Parc national Forillon, Parcs Canada nous vient d'Anna C.-M.

Chaque vendredi, nous choisissons au hasard une photo envoyée par un abonné et pour la mettre en vedette sur notre mur. Si vous aimeriez soumettre une photo; veuillez svp nous envoyer un message.","Joyeux Vendredi Photo des Abonnés! Cette magnifique photo du Cap-Bon-Ami situé dans le Parc national Forillon, Parcs Canada nous vient d'Anna C.-M. Chaque vendredi, nous choisissons au hasard une photo envoyée par un abonné et pour la mettre en vedette sur notre mur. Si vous aimeriez soumettre une photo; veuillez svp nous envoyer un message.",[],30,1,32,29,1,0,0,0,0,0,63,Environmental,fr,0.0,ParcsCanada_facebook,"['parc', 'or', 'mer']",neutral
182,182,134615279898518_1318447118181989,2016-04-02 08:30:00,https://www.facebook.com/ParcsCanada/photos/a.281154578577920.88091.134615279898518/1318447118181989/?type=3,"Il est facile de voir pourquoi le ""Cabot Trail"" au Parc national des Hautes-Terres-du-Cap-Breton est numéro 2 sur la liste de Vacay.ca d’endroits à visiter en 2016! 

Planifiez votre voyage dès maintenant: http://www.pc.gc.ca/fra/pn-np/ns/cbreton/index.aspx","Il est facile de voir pourquoi le ""Cabot Trail"" au Parc national des Hautes-Terres-du-Cap-Breton est numéro sur la liste de Vacay.ca d’endroits à visiter en ! Planifiez votre voyage dès maintenant:",[],48,4,2,43,5,0,0,0,0,0,54,Environmental,fr,0.0,ParcsCanada_facebook,"['parc', 'terres']",neutral
208,208,134615279898518_1325040270856007,2016-04-10 17:45:00,https://www.facebook.com/ParcsCanada/photos/a.281154578577920.88091.134615279898518/1325040270856007/?type=3,"Joyeuse Semaine des ciels étoilés!  

Tu regarderas, la nuit, les étoiles. 
C'est trop petit chez moi pour que je te montre où se trouve la mienne. 
C'est mieux comme ça. Mon étoile, ça sera pour toi une des étoiles. 
Alors, toutes les étoiles, tu aimeras les regarder... 
          - Extrait du Petit Prince d’Antoine de Saint-Exupéry 

Photo prise au Parc national Fundy http://ow.ly/10ktM5 #IDKW16","Joyeuse Semaine des ciels étoilés! Tu regarderas, la nuit, les étoiles. C'est trop petit chez moi pour que je te montre où se trouve la mienne. C'est mieux comme ça. Mon étoile, ça sera pour toi une des étoiles. Alors, toutes les étoiles, tu aimeras les regarder... - Extrait du Petit Prince d’Antoine de Saint-Exupéry Photo prise au Parc national Fundy",['#IDKW16'],44,0,6,40,2,2,0,0,0,0,50,Environmental,fr,0.0,ParcsCanada_facebook,"['parc', 'or', 'mer']",neutral
273,273,134615279898518_1340200366006664,2016-04-29 08:15:00,https://www.facebook.com/ParcsCanada/photos/a.281154578577920.88091.134615279898518/1340200366006664/?type=3,"Joyeux Vendredi Photo des Abonnés! 
Cette photo extraordinaire nous vient de Lisa C. (@creightontario sur Instagram), accompagnée de la légende suivante : « Un coucher de soleil après la pluie à la Grotte au Parc national de la Péninsule-Bruce et Parc marin national Fathom Five»

Chaque vendredi, nous choisissons au hasard une photo envoyée par un abonné et pour la mettre en vedette sur notre mur. Si vous aimeriez soumettre une photo; veuillez svp nous envoyer un message.","Joyeux Vendredi Photo des Abonnés! Cette photo extraordinaire nous vient de Lisa C. ( sur Instagram), accompagnée de la légende suivante : « Un coucher de soleil après la pluie à la Grotte au Parc national de la Péninsule-Bruce et Parc marin national Fathom Five» Chaque vendredi, nous choisissons au hasard une photo envoyée par un abonné et pour la mettre en vedette sur notre mur. Si vous aimeriez soumettre une photo; veuillez svp nous envoyer un message.",[],37,0,3,33,4,0,0,0,0,0,40,Environmental,fr,0.0,ParcsCanada_facebook,"['mer', 'parc', 'or', 'air']",neutral
281,281,134615279898518_1329368703756497,2016-04-18 07:45:00,https://www.facebook.com/ParcsCanada/photos/a.281154578577920.88091.134615279898518/1329368703756497/?type=3,"Vous ne savez pas où camper cet été? Pas de problème! 
The Huffington Post Canada a compiler une liste des meilleurs endroits où camper et devinez quoi? Dix de nos parcs nationaux sont sur la liste! 
Voyez lesquels ici : http://ow.ly/10xLtv (en anglais seulement) 

Photo prise au Parc national des Lacs-Waterton (no 5 sur la liste!)",Vous ne savez pas où camper cet été? Pas de problème! The Huffington Post Canada a compiler une liste des meilleurs endroits où camper et devinez quoi? Dix de nos parcs nationaux sont sur la liste! Voyez lesquels ici : (en anglais seulement) Photo prise au Parc national des Lacs-Waterton (no sur la liste!),[],33,1,5,31,2,0,0,0,0,0,39,Environmental,fr,0.0,ParcsCanada_facebook,"['water', 'lacs', 'parc']",neutral
303,303,134615279898518_1333157916710909,2016-04-19 07:45:53,https://www.facebook.com/ParcsCanada/photos/a.281154578577920.88091.134615279898518/1333156080044426/?type=3,"Défi des chaises rouges accepté!
L'été dernier, la famille Pennell a trouvé plus de 70 chaises rouges en seulement trois mois! Du Lieu historique national du Homestead-Motherwell au Parc national des Hautes-Terres-du-Cap-Breton, ils ont aussi réussi à collectionner un total de 61 médailles de notre programme Xplorateurs! Et vous? Combien de chaises rouges pourrez-vous trouver? Combien de médailles vos enfants pourront-ils collectionner? http://ow.ly/4mOyVp #serapprocher #Xplorateurs","Défi des chaises rouges accepté! L'été dernier, la famille Pennell a trouvé plus de chaises rouges en seulement trois mois! Du Lieu historique national du Homestead-Motherwell au Parc national des Hautes-Terres-du-Cap-Breton, ils ont aussi réussi à collectionner un total de médailles de notre programme lorateurs! Et vous? Combien de chaises rouges pourrez-vous trouver? Combien de médailles vos enfants pourront-ils collectionner?","['#serapprocher', '#Xplorateurs']",33,0,3,33,0,0,0,0,0,0,36,Social,fr,0.0,ParcsCanada_facebook,"['ami', 'enfants', 'famille', 'historique']",neutral
313,313,134615279898518_1326467427379958,2016-04-09 09:00:00,http://www.narcity.com/montreal/11-endroits-surreels-au-quebec-que-tu-dois-absolument-voir-au-moins-une-fois-dans-ta-vie/#,Vous devriez ajouter la Réserve de parc national du Canada de l'Archipel-de-Mingan à votre liste d’expériences à vivre!,Vous devriez ajouter la Réserve de parc national du Canada de l'Archipel-de-Mingan à votre liste d’eériences à vivre!,[],35,1,0,35,0,0,0,0,0,0,36,Environmental,fr,0.0,ParcsCanada_facebook,['parc'],neutral
342,342,134615279898518_1324854290874605,2016-04-08 08:15:01,https://www.facebook.com/ParcsCanada/photos/a.281154578577920.88091.134615279898518/1324854290874605/?type=3,"Joyeux Vendredi Photo des Abonnés! 
Cette superbe photo prise à la Réserve de parc national Pacific Rim nous vient de Iain Robert Reid Photography, accompagnée de la légende suivante : « Un matin à pagayer paisiblement dans l'archipel Broken Group ».

Chaque vendredi, nous choisissons au hasard une photo envoyée par un abonné et pour la mettre en vedette sur notre mur. Si vous aimeriez soumettre une photo; veuillez svp nous envoyer un message.","Joyeux Vendredi Photo des Abonnés! Cette superbe photo prise à la Réserve de parc national Pacific Rim nous vient de Iain Robert Reid Photography, accompagnée de la légende suivante : « Un matin à pagayer paisiblement dans l'archipel Broken Group ». Chaque vendredi, nous choisissons au hasard une photo envoyée par un abonné et pour la mettre en vedette sur notre mur. Si vous aimeriez soumettre une photo; veuillez svp nous envoyer un message.",[],29,0,5,29,0,0,0,0,0,0,34,Environmental,fr,0.0,ParcsCanada_facebook,"['parc', 'mer']",neutral
356,356,134615279898518_1335169323176435,2016-04-22 08:15:00,https://www.facebook.com/ParcsCanada/photos/a.281154578577920.88091.134615279898518/1335169323176435/?type=3,"Joyeux Vendredi Photo des Abonnés! 
Cette superbe photo prise aux chutes Takakkaw, dans le Parc national Yoho, nous vient de Nathaniel M. (@nathanmenezes sur Instagram), accompagnée de la légende suivante : « Il existe une certaine sérénité lorsque l'on campe près des eaux glacées. » 

Chaque vendredi, nous choisissons au hasard une photo envoyée par un abonné et pour la mettre en vedette sur notre mur. Si vous aimeriez soumettre une photo; veuillez svp nous envoyer un message.","Joyeux Vendredi Photo des Abonnés! Cette superbe photo prise aux chutes Takakkaw, dans le Parc national Yoho, nous vient de Nathaniel M. ( sur Instagram), accompagnée de la légende suivante : « Il existe une certaine sérénité lorsque l'on campe près des eaux glacées. » Chaque vendredi, nous choisissons au hasard une photo envoyée par un abonné et pour la mettre en vedette sur notre mur. Si vous aimeriez soumettre une photo; veuillez svp nous envoyer un message.",[],32,1,1,29,3,0,0,0,0,0,34,Environmental,fr,0.0,ParcsCanada_facebook,"['eau', 'parc', 'or', 'mer']",neutral
418,418,134615279898518_1329321270427907,2016-04-12 14:30:00,https://www.facebook.com/ParcsCanada/photos/a.281154578577920.88091.134615279898518/1329321120427922/?type=3,"Saviez-vous que le tétras des armoises est l’espèce d’oiseau menacée la plus rare au Canada? Aujourd’hui, il n’en reste que 60 dans le pays.
C’est pourquoi le Parc national des Prairies et l’Université d’Alberta entreprennent un projet pour restaurer leur habitat. #semainedelafaune","Saviez-vous que le tétras des armoises est l’espèce d’oiseau menacée la plus rare au Canada? Aujourd’hui, il n’en reste que dans le pays. C’est pourquoi le Parc national des Prairies et l’Université d’Alberta entreprennent un projet pour restaurer leur habitat.",['#semainedelafaune'],26,1,3,26,0,0,0,0,0,0,30,Environmental,fr,0.0,ParcsCanada_facebook,"['oiseau', 'eau', 'parc', 'air']",neutral
458,458,134615279898518_1329266677100033,2016-04-14 07:45:00,https://www.youtube.com/watch?v=izhx8uP7yYE,"Chaque année, les bécasseaux maubèches rufa migrent entre l’Argentine et l’Arctique. Il s’agit d’un trajet de 10 000 km! Ils s’arrêtent à la Réserve de parc national du Canada de l'Archipel-de-Mingan lors de leur incroyable migration continentale. #Semainedelafaune

Découvrez les obstacles qu’ils doivent surmonter et comment nous l’aidons : https://www.youtube.com/watch?v=izhx8uP7yYE","Chaque année, les bécasseaux maubèches rufa migrent entre l’Argentine et l’Arctique. Il s’agit d’un trajet de km! Ils s’arrêtent à la Réserve de parc national du Canada de l'Archipel-de-Mingan lors de leur incroyable migration continentale. Découvrez les obstacles qu’ils doivent surmonter et comment nous l’aidons :",['#Semainedelafaune'],12,0,15,11,1,0,0,0,0,0,27,Environmental,fr,0.0,ParcsCanada_facebook,"['eau', 'parc', 'or']",neutral
460,460,134615279898518_1335278863165481,2016-04-23 08:30:00,https://www.facebook.com/ParcsCanada/photos/a.281154578577920.88091.134615279898518/1335278863165481/?type=3,Vous avez sorti votre VR du garage et vous êtes prêts pour de nouvelles aventures? Voici quelques suggestions : http://www.pc.gc.ca/fra/voyage-travel/suggestions-suggest/top-vr-rv-destinations.aspx #Camping,Vous avez sorti votre VR du garage et vous êtes prêts pour de nouvelles aventures? Voici quelques suggestions :,['#Camping'],20,1,6,20,0,0,0,0,0,0,27,Environmental,fr,0.0,ParcsCanada_facebook,['or'],neutral
528,528,134615279898518_1330471560312878,2016-04-15 08:15:00,https://www.facebook.com/ParcsCanada/photos/a.281154578577920.88091.134615279898518/1330471560312878/?type=3,"Joyeux Vendredi Photo des Abonnés! 
En honneur de la #semainedelafaune, voici une magnifique photo qui nous vient de Zuperhero Photography, accompagnée de la légende suivante : « Un wapiti regarde vers le lac Annette, au parc national Jasper ».

Chaque vendredi, nous choisissons au hasard une photo envoyée par un abonné et pour la mettre en vedette sur notre mur. Si vous aimeriez soumettre une photo; veuillez svp nous envoyer un message.","Joyeux Vendredi Photo des Abonnés! En honneur de la , voici une magnifique photo qui nous vient de Zuperhero Photography, accompagnée de la légende suivante : « Un wapiti regarde vers le lac Annette, au parc national Jasper ». Chaque vendredi, nous choisissons au hasard une photo envoyée par un abonné et pour la mettre en vedette sur notre mur. Si vous aimeriez soumettre une photo; veuillez svp nous envoyer un message.",['#semainedelafaune'],18,2,3,17,1,0,0,0,0,0,23,Environmental,fr,0.0,ParcsCanada_facebook,"['parc', 'mer']",neutral
527,527,134615279898518_1324365717590129,2016-04-05 14:19:05,https://www.facebook.com/ParcsCanada/photos/a.1324365457590155.1073741914.134615279898518/1324365717590129/?type=3,"Lundi, 87 jeunes bisons des plaines ont été transférés du parc national Elk Island à la réserve de la Nation Blackfeet au Montana, leur territoire ancestral. Le partenariat avec l’Iinnii Initiative a été un projet de conservation unique et un succès international. 
Bon retour à la maison, les bisons!
 Wildlife Conservation Society WCS Canada Oakland Zoo","Lundi, jeunes bisons des plaines ont été transférés du parc national Elk Island à la réserve de la Nation Blackfeet au Montana, leur territoire ancestral. Le partenariat avec l’Iinnii Initiative a été un projet de conservation unique et un succès international. Bon retour à la maison, les bisons! Wildlife Conservation Society WCS Canada Oakland Zoo",[],20,1,2,20,0,0,0,0,0,0,23,Environmental,fr,0.0,ParcsCanada_facebook,"['wildlife', 'conservation', 'parc']",neutral
559,559,134615279898518_1325808637445837,2016-04-07 14:58:18,https://www.facebook.com/ParcsCanada/photos/a.281154578577920.88091.134615279898518/1325808637445837/?type=3,"Voici Poca et Terra! 
Les nouveaux chevaux Percherons du lieu historique national du Ranch-Bar U ont été nommés! 

Les noms choisis rendent hommage au travail de pionnier de George Pocaterra, un immigrant italien qui adorait les contreforts et les montagnes du sud de l'Alberta. Pour en savoir plus : http://ow.ly/10pP28","Voici Poca et Terra! Les nouveaux chevaux Percherons du lieu historique national du Ranch-Bar U ont été nommés! Les noms choisis rendent hommage au travail de pionnier de George Pocaterra, un immigrant italien qui adorait les contreforts et les montagnes du sud de l'Alberta. Pour en savoir plus : 28",[],20,0,2,18,2,0,0,0,0,0,22,Environmental,fr,0.0,ParcsCanada_facebook,"['eau', 'or']",neutral
627,627,134615279898518_1319959828030718,2016-04-03 08:15:01,https://www.facebook.com/ParcsCanada/photos/a.281154578577920.88091.134615279898518/1319959828030718/?type=3,"C'est la journée pour trouver un arc-en-ciel! 
Cette photo a été prise au parc national #Vuntut et est un excellent rappel que la saison des #randonnées est de retour!

Avant de partir à la recherche de votre propre arc-en-ciel, assurez-vous de consulter notre rapport sur l'état des sentiers: http://www.pc.gc.ca/apps/tcond/index_f.asp
Parcs Canada Yukon","C'est la journée pour trouver un arc-en-ciel! Cette photo a été prise au parc national et est un excellent rappel que la saison des ées est de retour! Avant de partir à la recherche de votre propre arc-en-ciel, assurez-vous de consulter notre rapport sur l'état des sentiers: Parcs Canada Yukon","['#Vuntut', '#randonn']",16,1,3,15,1,0,0,0,0,0,20,Environmental,fr,0.0,ParcsCanada_facebook,"['propre', 'parc', 'or']",neutral
683,683,134615279898518_1330532293640138,2016-04-16 07:30:00,https://www.facebook.com/ParcsCanada/photos/a.281154578577920.88091.134615279898518/1330531930306841/?type=3,"C’est aujourd'hui que se termine la #semainedelafaune!
Apprenez au sujet du retour des faucons pèlerins au Parc national Pukaskwa : http://www.pc.gc.ca/fra/nature/eep-sar/itm11.aspx 
#faune #oiseaux",C’est aujourd'hui que se termine la ! Apprenez au sujet du retour des faucons pèlerins au Parc national Pukaskwa :,"['#semainedelafaune', '#faune', '#oiseaux']",16,0,1,15,0,1,0,0,0,0,17,Environmental,fr,0.0,ParcsCanada_facebook,['parc'],neutral
811,811,134615279898518_1335269413166426,2016-04-21 11:30:01,https://www.facebook.com/ParcsCanada/photos/a.281154578577920.88091.134615279898518/1335269413166426/?type=3,"Nous sommes curieux! Vous faites quoi ce week-end?
Photo prise à la Réserve de parc national des Îles-Gulf",Nous sommes curieux! Vous faites quoi ce week-end? Photo prise à la Réserve de parc national des Îles-Gulf,[],9,2,2,9,0,0,0,0,0,0,13,Environmental,fr,0.0,ParcsCanada_facebook,['parc'],neutral
823,823,134615279898518_1324258954267472,2016-04-07 08:20:00,https://www.facebook.com/ParcsCanada/photos/a.281154578577920.88091.134615279898518/1324258954267472/?type=3,"En cette journée internationale du castor, on célèbre notre castor préférée... Parka! 
Parka est toujours prête à faire découvrir à vous et vos enfants toutes les merveilles qui se trouvent dans les parcs nationaux, les lieux historiques nationaux et les aires marines nationales de conservation du Canada. 
Préparez-vous à explorer ici : http://www.pc.gc.ca/fra/apprend-learn/parka/adult.aspx","En cette journée internationale du castor, on célèbre notre castor préférée... Parka! Parka est toujours prête à faire découvrir à vous et vos enfants toutes les merveilles qui se trouvent dans les parcs nationaux, les lieux historiques nationaux et les aires marines nationales de conservation du Canada. Préparez-vous à elorer ici :",[],10,0,3,10,0,0,0,0,0,0,13,Environmental,fr,0.0,ParcsCanada_facebook,"['parc', 'park', 'air', 'conservation', 'mer', 'marine', 'or']",neutral
826,826,134615279898518_1335899293103438,2016-04-22 09:19:19,http://parcmarin.qc.ca/beluga/,,,[],12,1,0,11,1,0,0,0,0,0,13,unknown,tl,0.0,ParcsCanada_facebook,,neutral
847,847,134615279898518_1338758896150811,2016-04-26 13:00:00,https://www.facebook.com/ParcsCanada/photos/a.281154578577920.88091.134615279898518/1338758896150811/?type=3,#MardiQuiz: Pouvez-vous nous dire à quel endroit cette photo a été prise?,: Pouvez-vous nous dire à quel endroit cette photo a été prise?,['#MardiQuiz'],10,1,1,9,1,0,0,0,0,0,12,unknown,fr,0.0,ParcsCanada_facebook,,neutral
894,894,134615279898518_1319715531388481,2016-04-06 14:15:00,https://www.facebook.com/ParcsCanada/photos/a.281154578577920.88091.134615279898518/1319715531388481/?type=3,"Quel bonheur! Sautez de joie sous le soleil de minuit dans le parc national #Ivvavik du 20 au 24 juin. Réservez dès maintenant! 

http://www.pc.gc.ca/fra/pn-np/yt/ivvavik/ne/camp1.aspx",Quel bonheur! Sautez de joie sous le soleil de minuit dans le parc national du au juin. Réservez dès maintenant!,['#Ivvavik'],9,0,2,8,0,0,1,0,0,0,11,Social,fr,0.0,ParcsCanada_facebook,['inuit'],neutral
885,885,134615279898518_1319987274694640,2016-04-24 14:45:00,https://www.facebook.com/ParcsCanada/photos/a.281154578577920.88091.134615279898518/1319987274694640/?type=3,"Vous planifiez un voyage vers #Tofino cet #été?
Ne faites pas qu’admirer le paysage à partir de l’auto, faites une #randonnées ou sautez à l’eau à la Réserve de parc national Pacific Rim!

http://www.pc.gc.ca/fra/pn-np/bc/pacificrim/index.aspx","Vous planifiez un voyage vers cet été? Ne faites pas qu’admirer le paysage à partir de l’auto, faites une ées ou sautez à l’eau à la Réserve de parc national Pacific Rim!","['#Tofino', '#', '#randonn']",11,0,0,11,0,0,0,0,0,0,11,Environmental,fr,0.0,ParcsCanada_facebook,"['eau', 'parc']",neutral
936,936,134615279898518_1327862080573826,2016-04-11 07:20:00,https://www.facebook.com/ParcsCanada/photos/a.281154578577920.88091.134615279898518/1327862080573826/?type=3,"C’est la semaine de la faune! 
Saviez-vous qu’il y a 73 espèces d’oiseaux en péril au Canada? Le guillemot à cou blanc en fait partie. Découvrez comment nous rétablissons son habitat sur les îles du parc national Gwaii Haanas - îles de beauté.
http://www.pc.gc.ca/fra/pn-np/bc/gwaiihaanas/plan/Plan5/Plan5A.aspx",C’est la semaine de la faune! Saviez-vous qu’il y a espèces d’oiseaux en péril au Canada? Le guillemot à cou blanc en fait partie. Découvrez comment nous rétablissons son habitat sur les îles du parc national Gwaii Haanas - îles de beauté.,[],7,1,2,7,0,0,0,0,0,0,10,Environmental,fr,0.0,ParcsCanada_facebook,"['oiseau', 'eau', 'parc', 'oiseaux', 'faune']",neutral
969,969,134615279898518_1337911449568889,2016-04-25 09:52:28,https://youtu.be/0DR5fVWkwLU,"Il n’aura jamais été aussi simple de s’initier au #camping! 
Voici un aperçu de notre programme d'initiation au camping. Les réservations débuteront la semaine prochaine: http://ow.ly/4n4cqr",Il n’aura jamais été aussi simple de s’initier au ! Voici un aperçu de notre programme d'initiation au camping. Les réservations débuteront la semaine prochaine:,['#camping'],6,0,3,6,0,0,0,0,0,0,9,unknown,fr,0.0,ParcsCanada_facebook,,neutral
970,970,134615279898518_1339475392745828,2016-04-27 12:20:03,https://www.facebook.com/ParcsCanada/photos/a.281154578577920.88091.134615279898518/1339475392745828/?type=3,"Avez-vous visité le Parc urbain national de la Rouge?
C'est l’endroit parfait pour des aventures en plein air lors de votre visite à Toronto! http://www.pc.gc.ca/fra/progs/np-pn/cnpn-cnnp/rouge/index.aspx",Avez-vous visité le Parc urbain national de la Rouge? C'est l’endroit parfait pour des aventures en plein air lors de votre visite à Toronto!,[],8,1,0,8,0,0,0,0,0,0,9,Environmental,fr,0.0,ParcsCanada_facebook,"['parc', 'or', 'air']",neutral
1046,1046,134615279898518_1319999154693452,2016-04-19 08:17:28,https://www.facebook.com/ParcsCanada/photos/a.281154578577920.88091.134615279898518/1319999154693452/?type=3,"Assurez-vous de faire un détour cet #été afin de découvrir l’histoire militaire de St. John au Lieu historique national de Signal Hill!

http://www.pc.gc.ca/fra/lhn-nhs/nl/signalhill/index.aspx",Assurez-vous de faire un détour cet été afin de découvrir l’histoire militaire de St. John au Lieu historique national de Signal Hill!,['#'],6,1,1,5,0,1,0,0,0,0,8,Environmental,fr,0.0,ParcsCanada_facebook,"['or', 'air']",neutral
