,id,date_published,link,caption_original,caption_cleaned,hashtags,category,Reactions_SUM,average_sentiment_score,language,account_name
139,726018689712148480,2016-04-29 12:01:59,"['https://t.co/tFA3vqxLhR', 'https://t.co/cjRjhLXCgP']",#ViveVendredi #FF #LeSaviezVous? Nous sommes aussi sur Facebook. https://t.co/tFA3vqxLhR https://t.co/cjRjhLXCgP,ViveVendredi FF LeSaviezVous aussi Facebook https co tFA3vqxLhR https co cjRjhLXCgP,"['#ViveVendredi', '#FF', '#LeSaviezVous']",Social,0,0.0,en,Transports_gc_tweeter
140,725732508323700737,2016-04-28 17:04:48,['https://t.co/LyczOeCcqJ'],Mise à jour: évaluation des risques pour l’environnement au port de #PortStanley https://t.co/LyczOeCcqJ @MunCentralElgin #Ontario,Mise jour valuation des risques pour environnement au port de PortStanley https co LyczOeCcqJ MunCentralElgin Ontario,"['#PortStanley', '#Ontario']",Environmental,0,0.0,fr,Transports_gc_tweeter
141,725048118635597824,2016-04-26 19:45:16,['https://t.co/1Baog7sAaO'],Réponse à la question d ’ajd (https://t.co/1Baog7sAaO): A. Un train peut prendre jusqu’à 2 km pour arriver à un arrêt complet.,ponse la question ajd https co 1Baog7sAaO Un train peut prendre km pour arriver un complet,[],Social,0,0.0,fr,Transports_gc_tweeter
142,725018347616755719,2016-04-26 17:46:58,['https://t.co/mPrVRzkeJm'],Examen de la Loi sur les transports au Canada : Ministre Garneau parle de la suite @ECofCanada demain. #Toronto https://t.co/mPrVRzkeJm,Examen Loi les transports Canada Ministre Garneau parle suite ECofCanada demain Toronto https co mPrVRzkeJm,['#Toronto'],Economical,0,0.0,pt,Transports_gc_tweeter
143,724983992978685956,2016-04-26 15:30:28,"['https://t.co/LVFhk7onUQ', 'https://t.co/09FxKG3F7y']",Rappel: #coussingonflable #Takata avant pour plusieurs années de #voitures @MercedesBenzCDN https://t.co/LVFhk7onUQ https://t.co/09FxKG3F7y,Rappel coussingonflable Takata avant pour plusieurs es de voitures MercedesBenzCDN https co LVFhk7onUQ https co 09FxKG3F7y,"['#coussingonflable', '#Takata', '#voitures']",Social,0,0.0,fr,Transports_gc_tweeter
144,725112373699338241,2016-04-27 00:00:36,['https://t.co/zu0YZMCLjK'],Alimentation à quai: branchement des navires au réseau électr. terrestre #ActionClimatCAN https://t.co/zu0YZMCLjK,Alimentation quai branchement des navires au seau lectr terrestre ActionClimatCAN https co zu0YZMCLjK,['#ActionClimatCAN'],Environmental,0,0.0,fr,Transports_gc_tweeter
145,725701827249971200,2016-04-28 15:02:53,['https://t.co/rDG87NVnp5'],Ministre Garneau a rencontré les résidents de #Toronto. #SSF2016 https://t.co/rDG87NVnp5,Ministre Garneau les sidents de Toronto SSF2016 https co rDG87NVnp5,"['#Toronto', '#SSF2016']",Environmental,0,0.0,fr,Transports_gc_tweeter
146,725408925202432000,2016-04-27 19:38:59,['https://t.co/N4f8akrpKy'],Le min Garneau a rencontré le maire de #Toronto ajd pour parler #SSF2016 #VoiesFerréesGareautrain https://t.co/N4f8akrpKy,Le min Garneau le maire de Toronto ajd pour parler SSF2016 esGareautrain https co N4f8akrpKy,"['#Toronto', '#SSF2016', '#VoiesFerr']",Environmental,0,0.0,fr,Transports_gc_tweeter
147,721360160879484929,2016-04-16 15:30:39,[],Au défilé #Vaisakhi à #Vancouver ajd. avec le service de police de @ShipCN pour promouvoir la #SécuritéFerroviaire #JoyeuxVaisakhi,Au Vaisakhi Vancouver ajd avec le service de police de ShipCN pour promouvoir la Ferroviaire JoyeuxVaisakhi,"['#Vaisakhi', '#Vancouver', '#S', '#JoyeuxVaisakhi']",Environmental,0,0.0,fr,Transports_gc_tweeter
