,Unnamed: 0,id,date_published,link,caption_original,caption_cleaned,hashtags,num_reactions,num_comments,num_shares,num_likes,num_loves,num_wows,num_hahas,num_sads,num_angrys,num_special,Reactions_SUM,category,language,average_sentiment_score,account_name,words_matched_list,sentiment
1173,1173,134615279898518_1329376037089097,2016-04-17 08:45:00,https://www.youtube.com/watch?v=kmg4CZHL2OE,"La quatrième expédition de peinture de Cory Trépanier (Artist / filmmaker / explorer Cory Trepanier) pour son projet « Into the Arctic » commence avec deux semaines en canot sur la rivière Thomsen, dans le parc national Aulavik, à l'extrémité nord de l'île Banks. 
Dans cette première partie, Cory et son équipage atterrissent dans le parc à la station Green Cabin et partent en canot. Durant ces premiers jours à descendre la rivière, ils rencontrent des bœufs musqués et des faucons pèlerins et découvrent la vaste toundra arctique. 
https://www.youtube.com/watch?v=kmg4CZHL2OE","La quatrième eédition de peinture de Cory Trépanier (Artist / filmmaker / elorer Cory Trepanier) pour son projet « Into the Arctic » commence avec deux semaines en canot sur la rivière Thomsen, dans le parc national Aulavik, à l'extrémité nord de l'île Banks. Dans cette première partie, Cory et son équipage atterrissent dans le parc à la station Green Cabin et partent en canot. Durant ces premiers jours à descendre la rivière, ils rencontrent des bœufs musqués et des faucons pèlerins et découvrent la vaste toundra arctique.",[],2,1,1,2,0,0,0,0,0,0,4,Environmental,fr,0.0,ParcsCanada_facebook,"['parc', 'green ', 'or']",neutral
1186,1186,134615279898518_1329959817030719,2016-04-13 12:03:27,https://www.facebook.com/MonPasseportParcs/videos/989394587781073/,"Félicitations à la classe de 8e de la Duke of Connaught Junior and Senior Public School! Bon voyage au Parc national Jasper!
https://www.facebook.com/MonPasseportParcs/videos/vb.160948263959047/989394587781073/?type=2&theater Air Canada",Félicitations à la classe de e de la Duke of Connaught Junior and Senior Public School! Bon voyage au Parc national Jasper! Air Canada,[],3,0,0,3,0,0,0,0,0,0,3,Environmental,en,0.0,ParcsCanada_facebook,"['parc', 'or', 'air']",neutral
1239,1239,134615279898518_1340798605946840,2016-04-30 08:00:00,,"Veuillez noter que le site de Parcs Canada ne sera pas disponible de 6 h à 10 h (heure normale de l’Est) demain, le dimanche 1er mai.","Veuillez noter que le site de Parcs Canada ne sera pas disponible de h à h (heure normale de l’Est) demain, le dimanche er mai.",[],0,0,0,0,0,0,0,0,0,0,0,Environmental,fr,0.0,ParcsCanada_facebook,"['parc', 'or']",neutral
1240,1240,134615279898518_1330050163688351,2016-04-13 14:53:10,https://www.facebook.com/MonPasseportParcs/videos/989413937779138/,"Ils ont l'air très contents! 
https://www.facebook.com/MonPasseportParcs/videos/vb.160948263959047/989413937779138/?type=2&theater",Ils ont l'air très contents!,[],0,0,0,0,0,0,0,0,0,0,0,Environmental,en,0.0,ParcsCanada_facebook,['air'],neutral
