,Unnamed: 0,id,date_published,link,caption_original,caption_cleaned,hashtags,num_reactions,num_comments,num_shares,num_likes,num_loves,num_wows,num_hahas,num_sads,num_angrys,num_special,Reactions_SUM,category,language,average_sentiment_score,account_name,words_matched_list,sentiment
1110,1110,134615279898518_1353653504661350,2016-05-18 07:53:38,https://www.facebook.com/pcparcsavie/photos/a.486300491385415.126348.485556504793147/1334325693249553/?type=3,,,[],6,0,0,6,0,0,0,0,0,0,6,unknown,tl,0.0,ParcsCanada_facebook,,neutral
1133,1133,134615279898518_1354486141244753,2016-05-22 07:30:00,http://ow.ly/gxEL300kqLf,"Bonne #JournéedelaBiodiversité!
Saviez-vous que les #BioBlitz nous aident à apprendre davantage au sujet de la flore et la faune dans nos parcs ET des espèces en péril? Vous êtes invités au #BioBlitz du Parc national Fundy en juin. Aidez-nous à enregistrer le plus d'espèces différentes possible! Pour plus d'information : http://ow.ly/gxEL300kqLf",Bonne éedelaBiodiversité! Saviez-vous que les nous aident à apprendre davantage au sujet de la flore et la faune dans nos parcs ET des espèces en péril? Vous êtes invités au du Parc national Fundy en juin. Aidez-nous à enregistrer le plus d'espèces différentes possible! Pour plus d'information :,"['#Journ', '#BioBlitz', '#BioBlitz']",5,0,0,5,0,0,0,0,0,0,5,Environmental,fr,0.0,ParcsCanada_facebook,"['parc', 'or', 'faune', 'flore']",neutral
1170,1170,134615279898518_1343605165666184,2016-05-03 13:00:00,http://ow.ly/4nkM1w,"Des randonnées, de la faune, des visites guidées... Ça promet!
Pour vous aider à planifier votre week-end, voici le guide de Northwest Territories Tourism pour le parc nation de Wood Buffalo! (en anglais)","Des randonnées, de la faune, des visites guidées... Ça promet! Pour vous aider à planifier votre week-end, voici le guide de Northwest Territories Tourism pour le parc nation de Wood Buffalo! (en anglais)",[],2,0,2,2,0,0,0,0,0,0,4,Environmental,fr,0.0,ParcsCanada_facebook,"['parc', 'or', 'faune']",neutral
1235,1235,134615279898518_1354479117912122,2016-05-21 08:00:05,https://www.facebook.com/ParcsCanada/photos/a.281154578577920.88091.134615279898518/1354558444570856/?type=3,"En ce jour mondial du #PoissonMigrateur, nous soulignons l'anguille d'Amérique! Celle-ci est confrontée à un certain nombre de menaces, comme : les obstacles en eau douce qui empêchent la remontée; la mortalité due aux turbines des centrales hydroélectriques; les pêches; les contaminants; les parasites de la vessie natatoire; les changements climatiques et les changements des conditions océaniques. Recueillir des données sur l'anguille d'Amérique est donc nécessaire afin d'évaluer la situation de l'espèce: http://ow.ly/YL3A300ia18 
World Fish Migration Day #EspèceEnPéril #WFMD2016","En ce jour mondial du , nous soulignons l'anguille d'Amérique! Celle-ci est confrontée à un certain nombre de menaces, comme : les obstacles en eau douce qui empêchent la remontée; la mortalité due aux turbines des centrales hydroélectriques; les pêches; les contaminants; les parasites de la vessie natatoire; les changements climatiques et les changements des conditions océaniques. Recueillir des données sur l'anguille d'Amérique est donc nécessaire afin d'évaluer la situation de l'espèce: 18 World Fish Migration Day èceEnPéril","['#PoissonMigrateur', '#Esp', '#WFMD2016']",1,0,0,1,0,0,0,0,0,0,1,Environmental,fr,0.0,ParcsCanada_facebook,"['climat', 'eau', 'or', 'climatique', 'air']",neutral
1242,1242,134615279898518_1353205068039527,2016-05-17 14:07:02,https://www.facebook.com/LHNSignalHill/photos/a.466682400087523.1073741842.438332619589168/1022438174511940/?type=3,"Cet été, venez tirer vous-même le canon de midi! http://ow.ly/dZuM300iA6g","Cet été, venez tirer vous-même le canon de midi!",[],0,0,0,0,0,0,0,0,0,0,0,unknown,nl,0.0,ParcsCanada_facebook,,neutral
