,id,date_published,link,caption_original,caption_cleaned,hashtags,category,Reactions_SUM,average_sentiment_score,language,account_name
0,719506674457976832,2016-04-11 12:45:33,['https://t.co/weGzPmqww7'],#SemaineDeLaFaune: Soyez conscient de votre environnement. Protégez les animaux. #SNCF https://t.co/weGzPmqww7,SemaineDeLaFaune Soyez conscient de votre environnement gez les animaux SNCF https co weGzPmqww7,"['#SemaineDeLaFaune', '#SNCF']",Environmental,19,0.0,fr,Transports_gc_tweeter
1,717412490628481024,2016-04-05 18:04:01,['https://t.co/18iJ4KtKBI'],Le ministre Garneau constate comment le centre de comm. de la @GCC_CCG suit les navires dans les eaux can. #BC https://t.co/18iJ4KtKBI,ministre Garneau constate comment centre comm suit les navires les eaux can BC https co 18iJ4KtKBI,['#BC'],Economical,10,0.0,fr,Transports_gc_tweeter
2,725785216275648513,2016-04-28 20:34:14,['https://t.co/gqbjEn6RiY'],Table ronde productive avec le min Garneau et le groupe de travail sur la sécurité ferroviaire @FCM_online #SSF2016 https://t.co/gqbjEn6RiY,Table ronde productive avec le min Garneau et le groupe de travail sur la ferroviaire SSF2016 https co gqbjEn6RiY,['#SSF2016'],Environmental,9,0.0,fr,Transports_gc_tweeter
3,725362845051965440,2016-04-27 16:35:53,['https://t.co/VoOpYLf0gN'],Recommandations de l’Examen de la Loi sur les transports au Canada: le min Garneau parle priorités #Transports https://t.co/VoOpYLf0gN,Recommandations de Examen de la Loi sur les transports au Canada le min Garneau parle Transports https co VoOpYLf0gN,['#Transports'],Environmental,9,0.0,fr,Transports_gc_tweeter
4,717020374903468032,2016-04-04 16:05:53,"['https://t.co/t4fVZe9jAY', 'https://t.co/LsyYZE5Cz6']","Pour la sécurité de tous, ne pointez pas vos lasers vers le ciel. https://t.co/t4fVZe9jAY #avion #PasBrillant https://t.co/LsyYZE5Cz6",Pour la de tous ne pointez pas vos lasers vers le ciel https co t4fVZe9jAY avion PasBrillant https co LsyYZE5Cz6,"['#avion', '#PasBrillant']",Social,8,0.0,fr,Transports_gc_tweeter
5,717771122813624320,2016-04-06 17:49:05,['https://t.co/PlbTfDLRFO'],"Utiliser un #drone près d’un aéroport, c’est dangereux et illégal. @VHFCTerminal @VancouverPD #VanCity https://t.co/PlbTfDLRFO",Utiliser un drone un roport est dangereux et gal VHFCTerminal VancouverPD VanCity https co PlbTfDLRFO,"['#drone', '#VanCity']",Environmental,8,0.0,fr,Transports_gc_tweeter
6,725339323139239941,2016-04-27 15:02:25,[],"Joyeux 35e anniversaire  @Gareautrain, qui a commencé ses activités au Canada en 1981! @RailCanada #SSF2016",Joyeux 35e anniversaire Gareautrain qui ses au Canada en 1981 RailCanada SSF2016,['#SSF2016'],Environmental,7,0.0,fr,Transports_gc_tweeter
7,725323735465603073,2016-04-27 14:00:29,[],RT @salledepresseGC: .@transports_gc: Semaine #SécuritéFerroviaire! Ns améliorons les passages à niveau au #Canada #SSF2016 @Gareautrain ht…,RT salledepresseGC Semaine Ferroviaire Ns liorons les passages niveau au Canada SSF2016 Gareautrain,"['#S', '#Canada', '#SSF2016']",Environmental,7,0.0,fr,Transports_gc_tweeter
8,724659793168859137,2016-04-25 18:02:12,"['https://t.co/ck2vctIrh', 'https://t.co/tL7lw2a1vK']",Ns investissons ds l’alimentation à quai pr réduire les émissions aux ports #ActionClimatCAN https://t.co/ck2vctIrhD https://t.co/tL7lw2a1vK,Ns investissons ds alimentation quai pr duire les missions aux ports ActionClimatCAN https co ck2vctIrhD https co tL7lw2a1vK,['#ActionClimatCAN'],Economical,7,0.0,fr,Transports_gc_tweeter
9,720643024309612544,2016-04-14 16:01:00,"['https://t.co/cAbSK0wiEf', 'https://t.co/DIxVTKV5Uh']","Au sol et dans les airs, nous collaborons pour assurer la sécurité de notre espace aérien : https://t.co/cAbSK0wiEf https://t.co/DIxVTKV5Uh",Au sol et dans les airs nous collaborons pour assurer la de notre espace rien https co cAbSK0wiEf https co DIxVTKV5Uh,[],Environmental,7,0.0,fr,Transports_gc_tweeter
10,724569087465164800,2016-04-25 12:01:46,['https://t.co/W0m9FRjHAT'],Première Semaine de la #SécuritéFerroviaire au Canada de @Gareautrain en avril 2003 #SSF2016 https://t.co/W0m9FRjHAT,Semaine de la Ferroviaire au Canada de Gareautrain en avril 2003 SSF2016 https co W0m9FRjHAT,"['#S', '#SSF2016']",Environmental,6,0.0,fr,Transports_gc_tweeter
11,725112381458796545,2016-04-27 00:00:38,"['https://t.co/OOXdjVJ4jn', 'https://t.co/ErKuPjVlvo']","#AvisConsommateurs: remplacement possible de vis, certains sièges d’auto Evenflo 2013-2015. https://t.co/OOXdjVJ4jn https://t.co/ErKuPjVlvo",AvisConsommateurs remplacement possible de vis certains ges auto Evenflo 2013 2015 https co OOXdjVJ4jn https co ErKuPjVlvo,['#AvisConsommateurs'],Social,6,0.0,fr,Transports_gc_tweeter
12,724613391181029376,2016-04-25 14:57:49,"['https://t.co/fkwHaOhCUI', 'https://t.co/\xe2\x80\xa6']","RT @CN_CommFR: Prenez et partagez l'Engagement pour la Sécurité dès maintenant! https://t.co/fkwHaOhCUI

#SecuriteFerroviaire https://t.co/…",RT Prenez et partagez Engagement pour la maintenant https co fkwHaOhCUI SecuriteFerroviaire https co,['#SecuriteFerroviaire'],Social,6,0.0,fr,Transports_gc_tweeter
13,726116399115059200,2016-04-29 18:30:14,['https://t.co/ElpujnLRcQ'],Drones près des aéroports: illégal et dangereux @FlyYOW @AirCanada. Distance d’au moins 9km requise #Ottawa #ottnews https://t.co/ElpujnLRcQ,Drones des roports gal et dangereux FlyYOW AirCanada Distance au moins 9km requise Ottawa ottnews https co ElpujnLRcQ,"['#Ottawa', '#ottnews']",Environmental,6,0.0,fr,Transports_gc_tweeter
14,722068697964285952,2016-04-18 14:26:07,"['https://t.co/GmZc47B8HP', 'https://t.co/t7CPGDWc4s']",Allez voir nos initiatives en transport écologique : https://t.co/GmZc47B8HP https://t.co/t7CPGDWc4s,Allez voir nos initiatives en transport cologique https co GmZc47B8HP https co t7CPGDWc4s,[],Economical,6,0.0,fr,Transports_gc_tweeter
15,718770883029049344,2016-04-09 12:01:47,"['https://t.co/8GRfkyAIJs', 'https://t.co/Zdbcql9d43']",Nous réglementons les #drones pour votre sécurité et celle de l’espace aérien. https://t.co/8GRfkyAIJs https://t.co/Zdbcql9d43,Nous glementons les drones pour votre et celle de espace rien https co 8GRfkyAIJs https co Zdbcql9d43,['#drones'],Social,6,0.0,fr,Transports_gc_tweeter
16,719615958986420224,2016-04-11 19:59:49,"['https://t.co/U7aLvr4T2x', 'https://t.co/P2oKPK5qbZ']",#Rappel: Hyundai Elantra 2008-2010. Déploiement imprévu possible #CoussinsGonflables avant. https://t.co/U7aLvr4T2x https://t.co/P2oKPK5qbZ,Rappel Hyundai Elantra 2008 2010 ploiement vu possible CoussinsGonflables avant https co U7aLvr4T2x https co P2oKPK5qbZ,"['#Rappel', '#CoussinsGonflables']",Social,6,0.0,fr,Transports_gc_tweeter
17,717767098148208641,2016-04-06 17:33:06,['https://t.co/enUCzXJPZ'],RT @acsta_gc: Vous transportez des articles alimentés par des piles? Voici nos conseils : https://t.co/enUCzXJPZD,RT Vous transportez des articles par des piles Voici nos conseils https co enUCzXJPZD,[],Economical,5,0.0,fr,Transports_gc_tweeter
18,717744490769997824,2016-04-06 16:03:16,[],"Avec @GCC_CCG et @environnementca, nous protégeons les voies navigables de l’#Arctique cdn de la pollution par les navires. #CanArctique",Avec et environnementca nous geons les voies navigables de Arctique cdn de la pollution par les navires CanArctique,"['#Arctique', '#CanArctique']",Environmental,5,0.0,fr,Transports_gc_tweeter
19,717383872548323328,2016-04-05 16:10:18,"['https://t.co/FLdqzGznVX', 'https://t.co/0PqamCphO']","#Rappel: #VUS Ford et Lincoln 2015-2016 GTDI de 2,3 L. Chauffe-moteur pourrait surchauffer. https://t.co/FLdqzGznVX https://t.co/0PqamCphOu",Rappel VUS Ford Lincoln 2015 2016 GTDI Chauffe moteur pourrait surchauffer https co FLdqzGznVX https co 0PqamCphOu,"['#Rappel', '#VUS']",Environmental,5,0.0,fr,Transports_gc_tweeter
20,717809420248432641,2016-04-06 20:21:16,['https://t.co/uVpduBvrB6'],"RT @GCC_CCG: Le printemps est arrivé! À tous les navigateurs, assurez-vous que votre équipement soit #Sécuritaire https://t.co/uVpduBvrB6",RT Le printemps est tous les navigateurs assurez vous que votre quipement soit curitaire https co uVpduBvrB6,['#S'],Environmental,5,0.0,fr,Transports_gc_tweeter
21,720283799242715139,2016-04-13 16:13:34,['https://t.co/0bYeluxitq'],"Voyez ce que l’avion du PNSA a repéré sur Prince of
Wales Island @GOVofNUNAVUT! #SemaineDeLaFaune #OursPolaire https://t.co/0bYeluxitq",Voyez ce que avion du PNSA sur Prince Wales Island GOVofNUNAVUT SemaineDeLaFaune OursPolaire https co 0bYeluxitq,"['#SemaineDeLaFaune', '#OursPolaire']",Environmental,5,0.0,fr,Transports_gc_tweeter
22,725686578522296321,2016-04-28 14:02:17,['https://t.co/NxGyBsTIzk'],Ajd le ministre Garneau fera une annonce sur la #SécuritéFerroviaire avec @FCM_online au @DeltaOttawCtyCt. #SSF2016 https://t.co/NxGyBsTIzk,Ajd le ministre Garneau fera une annonce sur la Ferroviaire avec au DeltaOttawCtyCt SSF2016 https co NxGyBsTIzk,"['#S', '#SSF2016']",Environmental,5,0.0,fr,Transports_gc_tweeter
23,716747339663327232,2016-04-03 22:00:56,['https://t.co/XTjQXrJpVN'],"Vous contemplez les étoiles? Pointez-les du doigt, pas avec un #laser. #PasBrillant
https://t.co/XTjQXrJpVN",Vous contemplez les toiles Pointez les du doigt pas avec un laser PasBrillant https co XTjQXrJpVN,"['#laser', '#PasBrillant']",Economical,4,0.0,fr,Transports_gc_tweeter
24,718182120355733504,2016-04-07 21:02:15,"['https://t.co/icvnx94M9a', 'https://t.co/Gx3dS885ib']","Avec notre Guide de #SécuritéNautique, restez à flot cet été. https://t.co/icvnx94M9a https://t.co/Gx3dS885ib",Avec notre Guide de Nautique restez flot cet https co icvnx94M9a https co Gx3dS885ib,['#S'],Social,4,0.0,fr,Transports_gc_tweeter
25,717724840879394816,2016-04-06 14:45:11,['https://t.co/ehBEh2rvg'],".@GCC_CCG, le min Garneau est allé #VersLInfiniEtPlusLoinEncore en signant la #NavetteSpatiale d’un employé @asc_csa https://t.co/ehBEh2rvgd",le min Garneau est VersLInfiniEtPlusLoinEncore en signant la NavetteSpatiale un https co ehBEh2rvgd,"['#VersLInfiniEtPlusLoinEncore', '#NavetteSpatiale']",Environmental,4,0.0,fr,Transports_gc_tweeter
26,726380938444328960,2016-04-30 12:01:25,"['https://t.co/Vndm2bbTrz', 'https://t.co/sIjJV9N']",Ns travaillons avec @USDOT pour ns préparer aux véhicules intelligents. #ActionClimatCAN https://t.co/Vndm2bbTrz https://t.co/sIjJV9ND2C,Ns travaillons avec USDOT pour ns parer aux hicules intelligents ActionClimatCAN https co Vndm2bbTrz https co sIjJV9ND2C,['#ActionClimatCAN'],Environmental,4,0.0,fr,Transports_gc_tweeter
27,725717388457553920,2016-04-28 16:04:43,['https://t.co/UqPm97WrEH'],Campagne-éclair à #Brampton ce matin pour la #SSF2016: un franc succès! @CN_CommFR @GOtransitFR @VIA_Rail https://t.co/UqPm97WrEH,Campagne clair Brampton ce matin pour la SSF2016 un franc GOtransitFR https co UqPm97WrEH,"['#Brampton', '#SSF2016']",Environmental,4,0.0,fr,Transports_gc_tweeter
28,726036599411236864,2016-04-29 13:13:09,['https://t.co/x5hGxPBjQE'],Fin de la #SSF2016 à la gare GO de Pickering avec @GOtransitFR @VIA_Rail @Gareautrain #VoiesFerréesGareautrain https://t.co/x5hGxPBjQE,Fin de la SSF2016 la gare GO de Pickering avec GOtransitFR Gareautrain esGareautrain https co x5hGxPBjQE,"['#SSF2016', '#VoiesFerr']",Environmental,4,0.0,fr,Transports_gc_tweeter
29,726108941277626368,2016-04-29 18:00:36,['https://t.co/zWsQq6Ly'],#EnRappel: Min Garneau a annoncé de nouvelles mesures pour mieux renseigner les collectivités. @ReseauFCM #SFF2016 https://t.co/zWsQq6Ly99,EnRappel Min Garneau de nouvelles mesures pour mieux renseigner les ReseauFCM SFF2016 https co zWsQq6Ly99,"['#EnRappel', '#SFF2016']",Environmental,4,0.0,fr,Transports_gc_tweeter
30,726124030118486017,2016-04-29 19:00:34,['https://t.co/EJPk4QTI8w'],Avis aux utilisateurs de #drones imprudents: amende ou emprisonnement possible @QuebecYQB @AirCanada #VilleQuébec https://t.co/EJPk4QTI8w,Avis aux utilisateurs de drones imprudents amende ou emprisonnement possible QuebecYQB AirCanada bec https co EJPk4QTI8w,"['#drones', '#VilleQu']",Environmental,4,0.0,fr,Transports_gc_tweeter
31,717502501168226304,2016-04-06 00:01:41,[],"Vos enfants savent-ils ce qu’on faisait avant les GPS? #DansMonTemps, il fallait utiliser une carte pour retrouver notre chemin au pays.",Vos enfants savent ils ce faisait avant les GPS DansMonTemps il fallait utiliser une carte pour retrouver notre chemin au pays,['#DansMonTemps'],Social,4,0.0,fr,Transports_gc_tweeter
32,724750298175180801,2016-04-26 00:01:50,"['https://t.co/7t4bzpCFMr', 'https://t.co/Pl2x8l64dm']",Le réseau ferroviaire @AuCanada est le 5e au monde en étendue #SSF2016 @RailCanada https://t.co/7t4bzpCFMr https://t.co/Pl2x8l64dm,Le seau ferroviaire AuCanada est le 5e au monde en tendue SSF2016 RailCanada https co 7t4bzpCFMr https co Pl2x8l64dm,['#SSF2016'],Environmental,4,0.0,fr,Transports_gc_tweeter
33,723144817505492992,2016-04-21 13:42:14,"['https://t.co/wz9zbo9g5n', 'https://t.co/UQqfgr\xe2\x80\xa6']",RT @environnementca: .@ministre_ec sera sur #FacebookLive de 10h à 11h (HAE). https://t.co/wz9zbo9g5n  #ActionClimatCAN https://t.co/UQqfgr…,RT environnementca sera sur FacebookLive de 10h 11h HAE https co wz9zbo9g5n ActionClimatCAN https co,"['#FacebookLive', '#ActionClimatCAN']",Environmental,4,0.0,en,Transports_gc_tweeter
34,722401013458710528,2016-04-19 12:26:37,['https://t.co/Lt3i3iPeXW'],Inscription pour le Conseil consultatif maritime can. @SHAW_CENTRE #Ottawa. Séance d’ouverture à 9h30. #CMAC2016 https://t.co/Lt3i3iPeXW,Inscription pour le Conseil consultatif maritime Ottawa ance ouverture 9h30 CMAC2016 https co Lt3i3iPeXW,"['#Ottawa', '#CMAC2016']",Environmental,4,0.0,fr,Transports_gc_tweeter
35,724703534051135488,2016-04-25 20:56:01,['https://t.co/XpMEeAHZj'],Vous avez vu le panneau #SSF2016 à #Coquitlam? https://t.co/XpMEeAHZjC,Vous avez vu le panneau SSF2016 Coquitlam https co XpMEeAHZjC,"['#SSF2016', '#Coquitlam']",Environmental,4,0.0,fr,Transports_gc_tweeter
36,723602407217881089,2016-04-22 20:00:32,['https://t.co/yWSMs5dJue'],#CheminDeFer : pas la place pour un #égoportrait. Restez loin! #SSF2016 @Gareautrain @RailCanada https://t.co/yWSMs5dJue,CheminDeFer pas la place pour un goportrait Restez loin SSF2016 Gareautrain RailCanada https co yWSMs5dJue,"['#CheminDeFer', '#', '#SSF2016']",Environmental,4,0.0,fr,Transports_gc_tweeter
37,720318485436375041,2016-04-13 18:31:24,['https://t.co/55ucPQs\xe2\x80\xa6'],"RT @SAAQ: Si tous les occupants d'un véhicule bouclaient leur ceinture, on pourrait éviter environ 40 décès par année. https://t.co/55ucPQs…",RT SAAQ Si tous les occupants un hicule bouclaient leur ceinture pourrait viter environ 40 par https co,[],Social,4,0.0,fr,Transports_gc_tweeter
38,722878114712391680,2016-04-20 20:02:27,"['https://t.co/9k2CW1v25j', 'https://t.co/OSfn6XCqMi']","Un drone près d’un aéroport, c’est dangereux et illégal. Restez au moins 9km. https://t.co/9k2CW1v25j https://t.co/OSfn6XCqMi",Un drone un roport est dangereux et gal Restez au moins 9km https co 9k2CW1v25j https co OSfn6XCqMi,[],Environmental,4,0.0,fr,Transports_gc_tweeter
39,720401589157105664,2016-04-14 00:01:37,['https://t.co/iQLdM94qrJ'],"Le dégel printanier attire les animaux près de la route. Soyez vigilant, redoublez de prudence. https://t.co/iQLdM94qrJ",Le gel printanier attire les animaux de la route Soyez vigilant redoublez de prudence https co iQLdM94qrJ,[],Social,4,0.0,fr,Transports_gc_tweeter
40,722452666564145152,2016-04-19 15:51:52,"['https://t.co/do3TDp1ddF', 'https://t.co/0UtU3ta0dq']",Réunion du Conseil consultatif maritime can. au sujet de l’industrie maritime #CMAC2016 https://t.co/do3TDp1ddF https://t.co/0UtU3ta0dq,union du Conseil consultatif maritime au sujet de industrie maritime CMAC2016 https co do3TDp1ddF https co 0UtU3ta0dq,['#CMAC2016'],Economical,4,0.0,fr,Transports_gc_tweeter
41,719867738076889088,2016-04-12 12:40:17,[],#MardiDevinette : Quel animal représente le danger le plus courant aux aéroports canadiens? #SemaineDeLaFaune,MardiDevinette Quel animal sente le danger le plus courant aux roports canadiens SemaineDeLaFaune,"['#MardiDevinette', '#SemaineDeLaFaune']",Environmental,3,0.0,fr,Transports_gc_tweeter
42,726045838326304768,2016-04-29 13:49:51,[],RT @environnementca: Vous lisez ceci en chemin? Nos amis @BSTCanada et @Transports_gc et nous vous souhaitons BONNE ROUTE! #FF,RT environnementca lisez ceci chemin amis BSTCanada souhaitons BONNE ROUTE FF,['#FF'],Environmental,3,0.0,fr,Transports_gc_tweeter
43,720706980449529856,2016-04-14 20:15:08,"['https://t.co/IxxiWldPel', 'https://t.co/z1NFhesxLi']","#Rappel: RAM Promaster 2015-2016 avec moteurs 2,4L. Le véhicule pourrait passer au neutre. https://t.co/IxxiWldPel https://t.co/z1NFhesxLi",Rappel RAM Promaster 2015 2016 avec moteurs 4L Le hicule pourrait passer au neutre https co IxxiWldPel https co z1NFhesxLi,['#Rappel'],Social,3,0.0,fr,Transports_gc_tweeter
44,722824720287014917,2016-04-20 16:30:17,['https://t.co/p\xe2\x80\xa6'],RT @salledepresseGC: .@Transports_gc a identifié des problèmes de sécurité sur quatre modèles de #véhicules de Fiat Chrysler https://t.co/p…,RT salledepresseGC des mes de sur quatre les de hicules de Fiat Chrysler https co,['#v'],Economical,3,0.0,fr,Transports_gc_tweeter
45,722938258339012608,2016-04-21 00:01:26,"['https://t.co/dZZGF2qpaJ', 'https://t.co/oW5xTBRJmZ']",Vs voulez suivre un cours sur la #SécuritéNautique? Trouvez un prestataire de cours : https://t.co/dZZGF2qpaJ https://t.co/oW5xTBRJmZ,Vs voulez suivre un cours sur la Nautique Trouvez un prestataire de cours https co dZZGF2qpaJ https co oW5xTBRJmZ,['#S'],Environmental,3,0.0,fr,Transports_gc_tweeter
46,722827698708590592,2016-04-20 16:42:07,"['https://t.co/MkcCTODaiY', 'https://t.co/dL6SIZq1Ns']",Des problèmes de servodirection avec un de ces modèles? Dites-le-nous: mvs-sa@tc.gc.ca Info: https://t.co/MkcCTODaiY https://t.co/dL6SIZq1Ns,Des mes de servodirection avec un de ces les Dites le nous mvs sa tc gc ca Info https co MkcCTODaiY https co dL6SIZq1Ns,[],Social,3,0.0,fr,Transports_gc_tweeter
47,723512072307388416,2016-04-22 14:01:34,"['https://t.co/dck8pAh43Q', 'https://t.co/HYHm2Djgrx']",Fiers de travailler avec #ÉtatsUnis à la protection de l’enviro en aviation #ActionClimatCAN https://t.co/dck8pAh43Q https://t.co/HYHm2Djgrx,Fiers de travailler avec tatsUnis la protection de enviro en aviation ActionClimatCAN https co dck8pAh43Q https co HYHm2Djgrx,"['#', '#ActionClimatCAN']",Environmental,3,0.0,fr,Transports_gc_tweeter
48,721066103355662336,2016-04-15 20:02:10,"['https://t.co/1Nf7C1qv6a', 'https://t.co/tTnQZx7ERx']",#Éphéméride Le #Titanic a sombré le 15 avr. 1912. La #SécuritéMaritime a bien évolué depuis: https://t.co/1Nf7C1qv6a https://t.co/tTnQZx7ERx,ride Le Titanic le 15 avr 1912 La Maritime bien depuis https co 1Nf7C1qv6a https co tTnQZx7ERx,"['#', '#Titanic', '#S']",Social,3,0.0,fr,Transports_gc_tweeter
49,723574063088721920,2016-04-22 18:07:54,[],RT @salledepresseGC: .@Transports_gc Min Garneau souligne la Semaine de la sécurité ferroviaire qui commence lundi #SSF2016 @Gareautrain ht…,RT salledepresseGC Min Garneau souligne la Semaine de la ferroviaire qui commence lundi SSF2016 Gareautrain,['#SSF2016'],Environmental,3,0.0,fr,Transports_gc_tweeter
50,725712788002361344,2016-04-28 15:46:26,['https://\xe2\x80\xa6'],RT @salledepresseGC: .@Transports_gc: Découvrez la nouvelle exposition d'@Exporail pour en savoir plus sur la #SécuritéFerroviaire https://…,RT salledepresseGC couvrez la nouvelle exposition Exporail pour en savoir plus sur la Ferroviaire https,['#S'],Environmental,3,0.0,fr,Transports_gc_tweeter
51,725029333253951492,2016-04-26 18:30:38,"['https://t.co/6Wk6oEMZxN', 'https://t.co/9SieSdfV9X']",Rappel: #coussingonflable #Takata du conducteur pour Sprinter @MercedesBenzCDN 2010-2014 https://t.co/6Wk6oEMZxN https://t.co/9SieSdfV9X,Rappel coussingonflable Takata conducteur Sprinter MercedesBenzCDN 2010 2014 https co 6Wk6oEMZxN https co 9SieSdfV9X,"['#coussingonflable', '#Takata']",Social,3,0.0,en,Transports_gc_tweeter
52,715992413173649408,2016-04-01 20:01:08,"['https://t.co/p4i8q7L7IN', 'https://t.co/7gUdaEuhMO']",#Rappel : #VUS VW Touareg 2011-2016. La pédale de frein pourrait avoir été mal assemblée. https://t.co/p4i8q7L7IN https://t.co/7gUdaEuhMO,Rappel VUS VW Touareg 2011 2016 La dale de frein pourrait avoir mal https co p4i8q7L7IN https co 7gUdaEuhMO,"['#Rappel', '#VUS']",Social,3,0.0,ca,Transports_gc_tweeter
53,725765011604443140,2016-04-28 19:13:57,[],RT @salledepresseGC: .@Transports_gc: Ns transmettons + d'info sur les marchandises dangereuses et la #SécuritéFerroviaire #SSF2016 https:/…,RT salledepresseGC Ns transmettons info sur les marchandises dangereuses et la Ferroviaire SSF2016 https,"['#S', '#SSF2016']",Environmental,3,0.0,fr,Transports_gc_tweeter
54,723482044584611840,2016-04-22 12:02:15,[],C’est le #JourDeLaTerre2016! Suivez @environnementca pour savoir comment nous protégeons l’environnement au Canada.,est le JourDeLaTerre2016 Suivez environnementca pour savoir comment nous geons environnement au Canada,['#JourDeLaTerre2016'],Environmental,3,0.0,fr,Transports_gc_tweeter
55,725474764391878657,2016-04-28 00:00:37,['https://t.co/IXTIJiHtF'],Alimentation à quai: réduction des #GES et de la pollution atmosphérique #ActionClimatCAN https://t.co/IXTIJiHtF9,Alimentation quai duction des GES et de la pollution rique ActionClimatCAN https co IXTIJiHtF9,"['#GES', '#ActionClimatCAN']",Environmental,3,0.0,fr,Transports_gc_tweeter
56,725384161876287488,2016-04-27 18:00:35,['https://t.co/jT3xzBOiVE'],"Examen de la Loi sur les transports au Canada: le min Garneau parle prochaines étapes, stratégies de mobilisation https://t.co/jT3xzBOiVE",Examen de la Loi sur les transports au Canada le min Garneau parle prochaines tapes gies de mobilisation https co jT3xzBOiVE,[],Environmental,3,0.0,fr,Transports_gc_tweeter
57,725648444593938432,2016-04-28 11:30:45,[],Campagne-éclair à #Brampton ce matin pour la #SSF2016: un franc succès! @CN_CommFR @GOtransitFR @VIA_Rail,Campagne clair Brampton ce matin pour la SSF2016 un franc GOtransitFR,"['#Brampton', '#SSF2016']",Environmental,3,0.0,fr,Transports_gc_tweeter
58,722047138528698368,2016-04-18 13:00:27,"['https://t.co/Azi8HF15Gb', 'https://t.co/P6dLcndKsX']","#Rappel: Toyota Camry, Avalon 2016. #Coussinsgonflables et #passagers: problème possible.  https://t.co/Azi8HF15Gb https://t.co/P6dLcndKsX",Rappel Toyota Camry Avalon 2016 Coussinsgonflables et passagers possible https co Azi8HF15Gb https co P6dLcndKsX,"['#Rappel', '#Coussinsgonflables', '#passagers']",Social,2,0.0,fr,Transports_gc_tweeter
59,724976433072869376,2016-04-26 15:00:25,['https://t.co/96cWkPag4J'],Rappel: Le min Garneau au centre sportif de #LacMégantic ce soir à 18h30 #SSF2016 https://t.co/96cWkPag4J,Rappel Le min Garneau au centre sportif de gantic ce soir 18h30 SSF2016 https co 96cWkPag4J,"['#LacM', '#SSF2016']",Environmental,2,0.0,fr,Transports_gc_tweeter
60,725680976022609921,2016-04-28 13:40:01,['https://t.co/LFDRKZ08ey'],#EnRappel : Regardez le ministre Garneau parler @ECofCanada de l’avenir des #transports au #Canada @CPAC_TV https://t.co/LFDRKZ08ey,EnRappel Regardez le ministre Garneau parler ECofCanada de avenir des transports au Canada https co LFDRKZ08ey,"['#EnRappel', '#transports', '#Canada']",Economical,2,0.0,ca,Transports_gc_tweeter
61,725674342546284544,2016-04-28 13:13:40,[],RT @salledepresseGC: Demain min Garneau fera une annonce sur la #SécuritéFerroviaire avec @FCM_online au @DeltaOttawCtyCt. #SSF2016 https:/…,RT salledepresseGC Demain min Garneau fera une annonce sur la Ferroviaire avec au DeltaOttawCtyCt SSF2016 https,"['#S', '#SSF2016']",Environmental,2,0.0,fr,Transports_gc_tweeter
62,725656282380800001,2016-04-28 12:01:54,['https://t.co/nbpIoKRbXW'],Progr. éTV: évaluer sécurité et rendement écoénergétique des véhicules verts #ActionClimatCAN https://t.co/nbpIoKRbXW,Progr TV valuer et rendement tique des hicules verts ActionClimatCAN https co nbpIoKRbXW,['#ActionClimatCAN'],Environmental,2,0.0,fr,Transports_gc_tweeter
63,725319123371200516,2016-04-27 13:42:09,"['https://t.co/IQXKV2jgvp', 'https://t.co/4RGHEzaF25']","Hier soir, le min Garneau a rencontré les citoyens de #LacMégantic. #SSF2016 https://t.co/IQXKV2jgvp https://t.co/4RGHEzaF25",Hier soir le min Garneau les citoyens de gantic SSF2016 https co IQXKV2jgvp https co 4RGHEzaF25,"['#LacM', '#SSF2016']",Environmental,2,0.0,fr,Transports_gc_tweeter
64,725008535843667969,2016-04-26 17:07:59,[],RT @salledepresseGC: .@Transports_gc: Le min Garneau soulignera la Semaine de la #SécuritéFerroviaire à #Toronto #SSF2016 @Gareautrain http…,RT salledepresseGC Le min Garneau soulignera la Semaine de la Ferroviaire Toronto SSF2016 Gareautrain,"['#S', '#Toronto', '#SSF2016']",Environmental,2,0.0,fr,Transports_gc_tweeter
65,724658426589134848,2016-04-25 17:56:47,"['https://t.co/dd9lrNzmrj', 'https://t.co/27fEg4YhJ']",RT @Gareautrain: #voiesferréesgareautrain #ssf2016 https://t.co/dd9lrNzmrj https://t.co/27fEg4YhJ2,RT Gareautrain esgareautrain ssf2016 https co dd9lrNzmrj https co 27fEg4YhJ2,"['#voiesferr', '#ssf2016']",Environmental,2,0.0,fr,Transports_gc_tweeter
66,724677702310084608,2016-04-25 19:13:22,"['https://t.co/eZsk1waWEo', 'https://t.co/oFBKB3LKYm']",#Rappel: #VUS Nissan Rogue. Les parties du hayon arrière pourraient devoir être réparées. https://t.co/eZsk1waWEo https://t.co/oFBKB3LKYm,Rappel VUS Nissan Rogue Les parties du hayon pourraient devoir es https co eZsk1waWEo https co oFBKB3LKYm,"['#Rappel', '#VUS']",Social,2,0.0,fr,Transports_gc_tweeter
67,724646078897860609,2016-04-25 17:07:43,['https://t.co/cwpgTljKSb'],RT @salledepresseGC: .@Transports_gc: Le min Garneau au centre sportif de #LacMégantic demain à 18h30 #SSF2016 https://t.co/cwpgTljKSb,RT salledepresseGC Le min Garneau au centre sportif de gantic demain 18h30 SSF2016 https co cwpgTljKSb,"['#LacM', '#SSF2016']",Environmental,2,0.0,fr,Transports_gc_tweeter
