,id,date_published,link,caption_original,caption_cleaned,hashtags,category,Reactions_SUM,average_sentiment_score,language,account_name
0,758018249065914370,2016-07-26 19:16:48,"['https://t.co/bIFm3wXM2r', 'https://t.co/D7Idw5Y0ys']",RT @NOAACoral: YOU can help protect #corals from #climatechange. Tips in this infographic https://t.co/bIFm3wXM2r https://t.co/D7Idw5Y0ys,RT NOAACoral help protect corals climatechange Tips infographic https co bIFm3wXM2r https co D7Idw5Y0ys,"['#corals', '#climatechange']",Environmental,63,0.0,en,DFO_Gulf_tweeter
1,758000082339893248,2016-07-26 18:04:37,['https://t.co/oLCZNMjH\xe2\x80\xa6'],RT @NewsroomGC: #GC announces new funding for CDN researchers to study effects of contaminants in oceans &amp; freshwater https://t.co/oLCZNMjH…,RT NewsroomGC GC announces new funding CDN researchers study effects contaminants oceans amp freshwater https co,['#GC'],Environmental,33,0.13636363636363635,en,DFO_Gulf_tweeter
2,750369495324254208,2016-07-05 16:43:23,[],RT @CanadianPM: What do you think are the most important moments in Canadian history? Share them using #HistoryWeek2016.,RT CanadianPM think important moments Canadian history Share using HistoryWeek2016,['#HistoryWeek2016'],Economical,30,0.45,en,DFO_Gulf_tweeter
3,753660942500687872,2016-07-14 18:42:25,['https://t.co/0PUKF0ZvtQ'],"The @CCG_GCC crew and science staff pleased to meet Min. LeBlanc on the Perley, in #Shediac NB https://t.co/0PUKF0ZvtQ",crew science staff pleased meet Min LeBlanc Perley Shediac NB https co 0PUKF0ZvtQ,['#Shediac'],Social,18,0.5,en,DFO_Gulf_tweeter
4,756488732488892417,2016-07-22 13:59:03,['https://t.co/JSiXChBUwO'],RT @INFC_eng: 5 minutes is all it takes to help shape Canada’s #infra future. Fill out an e-workbook here: https://t.co/JSiXChBUwO  #INFRAc…,RT minutes takes help shape infra future Fill workbook https co JSiXChBUwO,"['#infra', '#INFRAc']",Social,16,0.0,en,DFO_Gulf_tweeter
5,756572304935686145,2016-07-22 19:31:08,['https://t.co/yNppP\xe2\x80\xa6'],RT @DFO_MPO: Good luck to our international science team on their #GalwayStatement expedition mapping the Atlantic Ocean https://t.co/yNppP…,RT Good luck international science team GalwayStatement expedition mapping Atlantic Ocean https co,['#GalwayStatement'],Social,16,0.35,en,DFO_Gulf_tweeter
6,753648838414626816,2016-07-14 17:54:19,['https://t.co/mUkPLO\xe2\x80\xa6'],RT @NewsroomGC: .@transport_gc announces new safety regulations for small fishing vessels to come into force next year. https://t.co/mUkPLO…,RT NewsroomGC announces new safety regulations small fishing vessels come force next year https co,[],Social,15,-0.03787878787878788,en,DFO_Gulf_tweeter
7,756195080470401024,2016-07-21 18:32:11,['https://t.co/K\xe2\x80\xa6'],"RT @NewsroomGC: DFO funds @DalScience's #OceanSchool  a new, innovative, education program for youth developed with @thenfb https://t.co/K…",RT NewsroomGC DFO funds DalScience OceanSchool new innovative education program youth developed thenfb https co,['#OceanSchool'],Environmental,12,0.24545454545454545,en,DFO_Gulf_tweeter
8,751452572725248001,2016-07-08 16:27:09,['https://t.\xe2\x80\xa6'],RT @CCG_GCC: Love the sea? Want to join the Coast Guard? Check out the careers we offer – or maybe the College is right for you! https://t.…,RT Love sea Want join Coast Guard Check careers offer maybe College right https,[],Environmental,11,0.42857142857142855,en,DFO_Gulf_tweeter
9,752821982006304768,2016-07-12 11:08:41,['https://t.co/Lh2cF\xe2\x80\xa6'],RT @DFO_MAR: Search and Rescue exercise happening today in the Northumberland Strait from 1:00 p.m. until 5:00 p.m. #CCG https://t.co/Lh2cF…,RT Search Rescue exercise happening today Northumberland Strait 00 00 CCG https co,['#CCG'],Environmental,9,0.0,en,DFO_Gulf_tweeter
10,751406900445605888,2016-07-08 13:25:40,['https://t.co/ESe1WU8AYR'],"Our boating season is short, but aquatic invasive species' impacts are long-lasting. Help prevent their spread: https://t.co/ESe1WU8AYR",boating season short aquatic invasive species impacts long lasting Help prevent spread https co ESe1WU8AYR,[],Environmental,8,0.0,en,DFO_Gulf_tweeter
11,750004423653486592,2016-07-04 16:32:43,"['https://t.co/AogHbAwfq', 'https://t.co/eGkg2l3jXq']",RT @ACOACanada: What is the Atlantic Growth Strategy? Infographic: https://t.co/AogHbAwfqu #AtlanticGrowth https://t.co/eGkg2l3jXq,RT ACOACanada Atlantic Growth Strategy Infographic https co AogHbAwfqu AtlanticGrowth https co eGkg2l3jXq,['#AtlanticGrowth'],Economical,8,0.0,en,DFO_Gulf_tweeter
12,757583824402481153,2016-07-25 14:30:33,['https://t.co/v\xe2\x80\xa6'],RT @DFO_MPO: Check out what’s ahead for the scientists and crew of the CCGS #LouisSStLaurent in their Arctic mission! video: https://t.co/v…,RT Check ahead scientists crew CCGS LouisSStLaurent Arctic mission video https co,['#LouisSStLaurent'],Economical,5,0.0,en,DFO_Gulf_tweeter
13,755738319502340096,2016-07-20 12:17:10,['https://t.co/tl7FgWO3ys'],Never had the chance to see the boats take to sea on the #firstday of a fishery opening? Watch this: https://t.co/tl7FgWO3ys,Never chance see boats take sea firstday fishery opening Watch https co tl7FgWO3ys,['#firstday'],Social,5,0.0,en,DFO_Gulf_tweeter
14,755382045002661889,2016-07-19 12:41:28,['https://t.co/pqfhWHnhIN'],#DYK? Our aquatic animal disease lab is now accredited to an international standard https://t.co/pqfhWHnhIN,DYK aquatic animal disease lab accredited international standard https co pqfhWHnhIN,['#DYK'],Social,5,0.0,en,DFO_Gulf_tweeter
15,755064436646375424,2016-07-18 15:39:24,['https://t.co/wDIIY1rcq'],"Rigour, reliability &amp; accuracy: our fish and seafood deserve no less. #WeAreProud to house one of these labs https://t.co/wDIIY1rcq1",Rigour reliability amp accuracy fish seafood deserve less WeAreProud house one labs https co wDIIY1rcq1,['#WeAreProud'],Social,5,0.08333333333333333,en,DFO_Gulf_tweeter
16,758760846952628224,2016-07-28 20:27:37,['https://t.co/0ubaqecT5X'],"Our biologists dived this morning for #lobster research. Watch 
Radio-Canada’s Téléjournal @iciacadie at 6 tonight https://t.co/0ubaqecT5X",biologists dived morning lobster research Watch Radio journal iciacadie tonight https co 0ubaqecT5X,['#lobster'],Environmental,3,0.0,en,DFO_Gulf_tweeter
17,748962095451009024,2016-07-01 19:30:53,['https://t.co/cEEja10A6l'],"At sea or on the land, have a great #CanadaDay! https://t.co/cEEja10A6l",sea land great CanadaDay https co cEEja10A6l,['#CanadaDay'],Environmental,3,1.0,en,DFO_Gulf_tweeter
18,750768861402767360,2016-07-06 19:10:19,['https://t.co/MuKojLAdRT'],Staff at the new  @CCG_GCC Integrated Service Centre in #Charlottetown were pleased to meet min. LeBlanc this a.m. https://t.co/MuKojLAdRT,Staff new Integrated Service Centre Charlottetown pleased meet min LeBlanc https co MuKojLAdRT,['#Charlottetown'],Social,3,0.3181818181818182,en,DFO_Gulf_tweeter
19,751045795152031746,2016-07-07 13:30:45,['https://t.co/18x4wVQZ7q'],#TBT Wharves are part of our history. Photos of Caraquet from 1936-1938 #Gulf35 #Canada150 https://t.co/18x4wVQZ7q,TBT Wharves part history Photos Caraquet 1936 1938 Gulf35 Canada150 https co 18x4wVQZ7q,"['#TBT', '#Gulf35', '#Canada150']",Environmental,3,0.0,en,DFO_Gulf_tweeter
20,756492911978700800,2016-07-22 14:15:39,['https://t.co/FF9d3uxzcV'],Wondering how is life on a Royal Canadian Navy mission? Read this fascinating travel story! https://t.co/FF9d3uxzcV,Wondering life Royal Canadian Navy mission Read fascinating travel story https co FF9d3uxzcV,[],Environmental,2,0.875,en,DFO_Gulf_tweeter
21,758714927355928577,2016-07-28 17:25:09,['https://t.co/BBvwrcJ6bF'],"For info on #StripedBass retention fishery July 30-Aug.21 in Southern Gulf of St. Lawrence, go to https://t.co/BBvwrcJ6bF",info StripedBass retention fishery July 30 Aug 21 Southern Gulf St Lawrence go https co BBvwrcJ6bF,['#StripedBass'],Environmental,1,0.0,en,DFO_Gulf_tweeter
22,758682235553865729,2016-07-28 15:15:15,['https://t.co/bMFIYHUe'],#TBT Wharves are part of our history. Photos of Anse-Bleue in 1928 #Gulf35 #Canada150 https://t.co/bMFIYHUe92,TBT Wharves part history Photos Anse Bleue 1928 Gulf35 Canada150 https co bMFIYHUe92,"['#TBT', '#Gulf35', '#Canada150']",Environmental,1,0.0,en,DFO_Gulf_tweeter
23,758674704202919936,2016-07-28 14:45:19,['https://t.co/NNzd08TxHS'],"MT @NSteinbach_RC Biologist Amélie Rondeau says because of lobster abundance, diving takes much longer https://t.co/NNzd08TxHS",MT Biologist lie Rondeau says lobster abundance diving takes much longer https co NNzd08TxHS,[],Environmental,1,0.2,en,DFO_Gulf_tweeter
24,757654885450059776,2016-07-25 19:12:55,['https://t.co/QJffSfVJNn'],#Salmon angling closed in 25 #Miramichi-area fishing pools due to warm water temperature. https://t.co/QJffSfVJNn,Salmon angling closed 25 Miramichi area fishing pools due warm water temperature https co QJffSfVJNn,"['#Salmon', '#Miramichi']",Social,1,0.125,en,DFO_Gulf_tweeter
25,756116322497495040,2016-07-21 13:19:13,['https://t.co/j2WVptWWOS'],"#TBT Wharves are part of our history. Photos of Grand Étang, circa 1920 #Gulf35 #Canada150 https://t.co/j2WVptWWOS",TBT Wharves part history Photos Grand tang circa 1920 Gulf35 Canada150 https co j2WVptWWOS,"['#TBT', '#Gulf35', '#Canada150']",Environmental,1,0.5,en,DFO_Gulf_tweeter
26,753613794413346817,2016-07-14 15:35:04,['https://t.co/J4il45I'],#TBT Wharves are part of our history. Photos of Chéticamp from 1914 to 1954 #Gulf35 #Canada150 https://t.co/J4il45I90D,TBT Wharves part history Photos ticamp 1914 1954 Gulf35 Canada150 https co J4il45I90D,"['#TBT', '#Gulf35', '#Canada150']",Environmental,0,0.0,en,DFO_Gulf_tweeter
27,750777624612507648,2016-07-06 19:45:09,[],Answer : cleaning shellfish where they were collected helps prevent the spread of #AquaticInvasiveSpecies!,Answer cleaning shellfish collected helps prevent spread AquaticInvasiveSpecies,['#AquaticInvasiveSpecies'],Environmental,0,0.0,en,DFO_Gulf_tweeter
28,750778876419244032,2016-07-06 19:50:07,['https://t.co/D3FQ9VQuhz'],Why are #AquaticInvasiveSpecies a cause for concern? To better understand: https://t.co/D3FQ9VQuhz,AquaticInvasiveSpecies cause concern better understand https co D3FQ9VQuhz,['#AquaticInvasiveSpecies'],Environmental,0,0.5,en,DFO_Gulf_tweeter
29,751140071789789188,2016-07-07 19:45:23,['https://t.co/zB1AzXzt1x'],Going on a boat ride? Careful with bothersome passengers! (hint: we’re not talking about the loud neighbour) https://t.co/zB1AzXzt1x,Going boat ride Careful bothersome passengers hint talking loud neighbour https co zB1AzXzt1x,[],Social,0,-0.012499999999999995,en,DFO_Gulf_tweeter
30,758665737221337088,2016-07-28 14:09:41,['https://t.co/jrZV6vlV2R'],MT @NSteinbach_RC DFO biologists and technicians are diving in the Cogagne Bay in #NB to survey lobsters https://t.co/jrZV6vlV2R,MT DFO biologists technicians diving Cogagne Bay NB survey lobsters https co jrZV6vlV2R,['#NB'],Social,0,0.0,en,DFO_Gulf_tweeter
31,753931833759436800,2016-07-15 12:38:51,['https://t.co/ySgYfXRbi'],"With the snow crab fishery in zone 12 now close for the year, watch this video of the #FirstDay https://t.co/ySgYfXRbi2",snow crab fishery zone 12 close year watch video FirstDay https co ySgYfXRbi2,['#FirstDay'],Environmental,0,0.0,en,DFO_Gulf_tweeter
32,755813973891710976,2016-07-20 17:17:48,['https://t.co/iYGdWtU35e'],#GottaCatchEmAll in these labs stands for identify all reportable diseases. #PokemonGO https://t.co/iYGdWtU35e,GottaCatchEmAll labs stands identify reportable diseases PokemonGO https co iYGdWtU35e,"['#GottaCatchEmAll', '#PokemonGO']",Environmental,0,0.0,en,DFO_Gulf_tweeter
33,756128056285270016,2016-07-21 14:05:51,['https://t.co/CUuxduZZc6'],"Navigating on a salmon river in NB? Take extra care to avoid nets, fences and traps. #Science https://t.co/CUuxduZZc6",Navigating salmon river NB Take extra care avoid nets fences traps Science https co CUuxduZZc6,['#Science'],Social,0,0.0,en,DFO_Gulf_tweeter
34,750761434519375872,2016-07-06 18:40:49,['https://t.co/sRVWoo8Jnk'],Which environmental threat can you prevent by cleaning shellfish on-site? The answer in a few hours https://t.co/sRVWoo8Jnk,environmental threat prevent cleaning shellfish site answer hours https co sRVWoo8Jnk,[],Environmental,0,-0.2,en,DFO_Gulf_tweeter
35,748864089322029057,2016-07-01 13:01:26,"['https://t.co/ngBxe69jyh', 'https://t.co/1SvkeBOh87']",Don’t miss #CanadaDay celebrations in your area! https://t.co/ngBxe69jyh https://t.co/1SvkeBOh87,miss CanadaDay celebrations area https co ngBxe69jyh https co 1SvkeBOh87,['#CanadaDay'],Social,0,0.0,en,DFO_Gulf_tweeter
