,id,date_published,link,caption_original,caption_cleaned,hashtags,category,Reactions_SUM,average_sentiment_score,language,account_name
0,318424514044_10155091637089045,2016-08-29 10:35:10,https://www.facebook.com/EnvironmentandNaturalResourcesinCanada/photos/a.338211969044.199983.318424514044/10155091637089045/?type=3,"Environment and Climate Change Canada is pleased to announce the 500th Ecological Gift in Ontario. Sandra Nelles generously donated a conservation easement over 38 hectares of her rural residential property to the Oak Ridges Moraine Land Trust that was certified through the Ecological Gifts Program. The conservation easement was specifically designed for her property and included protection zones to preserve forested areas that contain Butternut—a species of tree endangered in Canada—and zones for continued farming. Ms. Nelles retains ownership of the property, while restricting future development and protecting the ecological features of the land. http://ow.ly/Ej4d303GrZa http://ow.ly/H6se303Gs3l","Environment and Climate Change Canada is pleased to announce the th Ecological Gift in Ontario. Sandra Nelles generously donated a conservation easement over hectares of her rural residential property to the Oak Ridges Moraine Land Trust that was certified through the Ecological Gifts Program. The conservation easement was specifically designed for her property and included protection zones to preserve forested areas that contain Butternut—a species of tree endangered in Canada—and zones for continued farming. Ms. Nelles retains ownership of the property, while restricting future development and protecting the ecological features of the land.",[],Environmental,113,0.53125,en,EnvironmentandNaturalResourcesinCanada_facebook
1,318424514044_10155091807274045,2016-08-29 11:30:29,https://www.facebook.com/EnvironmentandNaturalResourcesinCanada/photos/a.338211969044.199983.318424514044/10155091807274045/?type=3,"Outdoor enthusiasts have long been drawn to the Montagnes Vertes region of southern Quebec. Its hiking trails and ski slopes offer unmatched views of the old-growth forest wilderness. The area is also home to wide-ranging mammals, including moose, bobcats, black bears and fishers, as well as a number of species at risk such as the Bicknell’s Thrush and Canada Warbler.
Environment and Climate Change Canada is working with the Nature Conservancy of Canada and local donors to greatly expand the Montagnes Vertes nature reserve around Mont Sutton to protect important wildlife habitat while continuing public access to the area’s natural beauty. http://ow.ly/GIfM303GsYE","Outdoor enthusiasts have long been drawn to the Montagnes Vertes region of southern Quebec. Its hiking trails and ski slopes offer unmatched views of the old-growth forest wilderness. The area is also home to wide-ranging mammals, including moose, bobcats, black bears and fishers, as well as a number of species at risk such as the Bicknell’s Thrush and Canada Warbler. Environment and Climate Change Canada is working with the Nature Conservancy of Canada and local donors to greatly eand the Montagnes Vertes nature reserve around Mont Sutton to protect important wildlife habitat while continuing public access to the area’s natural beauty.",[],Environmental,92,0.0,en,EnvironmentandNaturalResourcesinCanada_facebook
2,318424514044_10155048222734045,2016-08-16 08:15:11,https://www.facebook.com/EnvironmentandNaturalResourcesinCanada/photos/a.338211969044.199983.318424514044/10155048222734045/?type=3,"Birds connect our continent and our communities. One hundred years ago today, Canada and the U.S. signed the Migratory Bird Convention to protect birds. Let’s celebrate together and take a pledge to help the birds this year. 
Fill out your pledge today! http://ow.ly/y8QQ303huIF","Birds connect our continent and our communities. One hundred years ago today, Canada and the U.S. signed the Migratory Bird Convention to protect birds. Let’s celebrate together and take a pledge to help the birds this year. Fill out your pledge today!",[],Environmental,91,0.11857142857142858,en,EnvironmentandNaturalResourcesinCanada_facebook
3,318424514044_10155012510074045,2016-08-05 06:50:15,https://www.facebook.com/EnvironmentandNaturalResourcesinCanada/photos/a.338211969044.199983.318424514044/10155012510074045/?type=3,"They are maybe beautiful but did you know that Mute Swans are very large and powerful birds, and can be capable of aggression? They can cause serious injury to people and pets. Attacks can occur on land and water when attempting to feed them, or after entering their territories. Be careful! Do not approach them during the breeding or brood-rearing seasons. http://ow.ly/wDml302WHA5","They are maybe beautiful but did you know that Mute Swans are very large and powerful birds, and can be capable of aggression? They can cause serious injury to people and pets. Attacks can occur on land and water when attempting to feed them, or after entering their territories. Be careful! Do not approach them during the breeding or brood-rearing seasons.",[],Environmental,76,0.0,en,EnvironmentandNaturalResourcesinCanada_facebook
4,318424514044_10155029788089045,2016-08-10 14:55:20,https://www.facebook.com/EnvironmentandNaturalResourcesinCanada/photos/a.338211969044.199983.318424514044/10155029788089045/?type=3,"Did you know that in Canada, the Blue Racer is a snake that is only found on Pelee Island, in southern Ontario?  #SpeciesatRisk
http://ow.ly/gShq30357Cl","Did you know that in Canada, the Blue Racer is a snake that is only found on Pelee Island, in southern Ontario?",['#SpeciesatRisk'],Social,74,0.3875,en,EnvironmentandNaturalResourcesinCanada_facebook
5,318424514044_10155058425024045,2016-08-19 09:40:20,https://www.facebook.com/EnvironmentandNaturalResourcesinCanada/photos/a.338211969044.199983.318424514044/10155058425024045/?type=3,"Have you already seen these signs during your trips in Quebec or Canada? It’s the symbol used to identify National Wildlife Areas. When you see this sign, it means that you are in a protected area. The Cap-Tourmente National Wildlife Area is one of the 54 National Wildlife Areas in Canada. http://ow.ly/Q5S9303oobS","Have you already seen these signs during your trips in Quebec or Canada? It’s the symbol used to identify National Wildlife Areas. When you see this sign, it means that you are in a protected area. The Cap-Tourmente National Wildlife Area is one of the National Wildlife Areas in Canada.",[],Environmental,67,0.0,en,EnvironmentandNaturalResourcesinCanada_facebook
6,318424514044_10155032709139045,2016-08-11 13:40:38,https://www.facebook.com/EnvironmentandNaturalResourcesinCanada/photos/a.338211969044.199983.318424514044/10155032709139045/?type=3,"Did you know that there are over 70,000 species of plants and animals in Canada? Find out more about biodiversity and what you can do to make a difference! http://ow.ly/6pp83038KRO","Did you know that there are over ,000 species of plants and animals in Canada? Find out more about biodiversity and what you can do to make a difference!",[],Environmental,66,0.0,en,EnvironmentandNaturalResourcesinCanada_facebook
7,318424514044_10155100169519045,2016-08-31 14:25:14,https://www.facebook.com/EnvironmentandNaturalResourcesinCanada/photos/a.338211969044.199983.318424514044/10155100169519045/?type=3,Do you ever wonder about the quality of water or soil on farmland? About pollution or biodiversity? Environment and Climate Change Canada develops indicators that can answer your questions about the state of the environment. Check out the latest #CdnEnv #Indicators http://ow.ly/Gz3P303KWzy,Do you ever wonder about the quality of water or soil on farmland? About pollution or biodiversity? Environment and Climate Change Canada develops indicators that can answer your questions about the state of the environment. Check out the latest,"['#CdnEnv', '#Indicators']",Environmental,57,0.0,en,EnvironmentandNaturalResourcesinCanada_facebook
8,318424514044_10155000044979045,2016-08-01 10:10:31,https://www.facebook.com/EnvironmentandNaturalResourcesinCanada/photos/a.338211969044.199983.318424514044/10155000044979045/?type=3,"Did you know that when the Eastern Hog-nosed Snake is threatened, it flattens its head to mimic a venomous cobra? It might also roll on its back and pretend to be dead. http://ow.ly/6hkz302NBdB","Did you know that when the Eastern Hog-nosed Snake is threatened, it flattens its head to mimic a venomous cobra? It might also roll on its back and pretend to be dead.",[],Social,49,0.0,en,EnvironmentandNaturalResourcesinCanada_facebook
9,318424514044_10155099177629045,2016-08-31 08:15:14,https://www.facebook.com/EnvironmentandNaturalResourcesinCanada/photos/a.338211969044.199983.318424514044/10155099177629045/?type=3,"If you are caught outdoors with no shelter during a tornado, lie flat in a ditch, ravine or other low lying area and shield your head with your arms. Read more tips here: http://ow.ly/pXSR303KVhu #tornadoes #TornadoSafety","If you are caught outdoors with no shelter during a tornado, lie flat in a ditch, ravine or other low lying area and shield your head with your arms. Read more tips here: u","['#tornadoes', '#TornadoSafety']",Social,44,0.06324869791666665,en,EnvironmentandNaturalResourcesinCanada_facebook
10,318424514044_10155052442864045,2016-08-17 13:00:34,https://www.facebook.com/EnvironmentandNaturalResourcesinCanada/videos/10155052442864045/,"With the help of Ally, Aiden, Cohen and Bird Studies Canada, Environment and Climate Change Canada supports projects that help migratory birds—like this inspiring Piping Plover one! What are YOU doing to help? Take a pledge today—it’s fun and saves bird lives! #BirdYear http://ow.ly/DqG6303ktCZ","With the help of Ally, Aiden, Cohen and Bird Studies Canada, Environment and Climate Change Canada supports projects that help migratory birds—like this inspiring Piping Plover one! What are YOU doing to help? Take a pledge today—it’s fun and saves bird lives!",['#BirdYear'],Environmental,41,0.0,en,EnvironmentandNaturalResourcesinCanada_facebook
11,318424514044_10155055933874045,2016-08-18 13:52:34,https://www.facebook.com/EnvironmentandNaturalResourcesinCanada/photos/a.10155055932909045.1073741871.318424514044/10155055933874045/?type=3,Environment and Climate Change Canada employees pledge to take birds under their wing.  Will you be joining? http://ow.ly/pok9303mKIM,Environment and Climate Change Canada employees pledge to take birds under their wing. Will you be joining?,[],Environmental,40,0.0,en,EnvironmentandNaturalResourcesinCanada_facebook
12,318424514044_10155097384294045,2016-08-30 20:52:51,https://www.facebook.com/EnvironmentandNaturalResourcesinCanada/photos/a.10155096336764045.1073741873.318424514044/10155096430469045/?type=3,Alberta is a resource-rich province and an important  part of Canada’s energy sector. Minister Catherine McKenna met with labour and municipal officials in Calgary to discuss enhanced collaboration on climate action and Canada’s future green economy.,Alberta is a resource-rich province and an important part of Canada’s energy sector. Minister Catherine McKenna met with labour and municipal officials in Calgary to discuss enhanced collaboration on climate action and Canada’s future green economy.,[],Economical,37,0.4375,en,EnvironmentandNaturalResourcesinCanada_facebook
13,318424514044_10155095796564045,2016-08-30 12:15:35,https://www.facebook.com/EnvironmentandNaturalResourcesinCanada/photos/a.338211969044.199983.318424514044/10155095796564045/?type=3,"Did you know that over the past 20 years, Environment and Climate Change Canadas Ecological Gifts Program has protected almost 19,000 hectares of land across Ontario and over 175,000 hectares across Canada? Ontario region is now celebrating its 500th gift, generously donated by Sandra Nelles of the Peel Region. Thank you very much for your contribution to preserving Canada’s ecological treasures! http://ow.ly/okkf303IFIN","Did you know that over the past years, Environment and Climate Change Canadas Ecological Gifts Program has protected almost ,000 hectares of land across Ontario and over ,000 hectares across Canada? Ontario region is now celebrating its th gift, generously donated by Sandra Nelles of the Peel Region. Thank you very much for your contribution to preserving Canada’s ecological treasures!",[],Environmental,37,0.0,en,EnvironmentandNaturalResourcesinCanada_facebook
14,318424514044_10155012448729045,2016-08-05 06:10:15,https://www.facebook.com/EnvironmentandNaturalResourcesinCanada/photos/a.338211969044.199983.318424514044/10155012448729045/?type=3,You have geese or swans on your property and you don’t know what to do? Learn how you can use preventive and deterrent techniques to discourage those birds from coming to your property. Don’t capture or relocate them! You need a permit first! http://ow.ly/9xu7302WGBl,You have geese or swans on your property and you don’t know what to do? Learn how you can use preventive and deterrent techniques to discourage those birds from coming to your property. Don’t capture or relocate them! You need a permit first!,[],Environmental,36,0.0,en,EnvironmentandNaturalResourcesinCanada_facebook
15,318424514044_10155081046274045,2016-08-26 09:40:16,https://www.facebook.com/EnvironmentandNaturalResourcesinCanada/photos/a.338211969044.199983.318424514044/10155081046274045/?type=3,"STEM (Science, Technology, Engineering and Mathematics) interns make up the green workforce of tomorrow! Employers: apply now! http://ow.ly/MQRm303jLmf http://ow.ly/DePM303jLnc","STEM (Science, Technology, Engineering and Mathematics) interns make up the green workforce of tomorrow! Employers: apply now! c",[],Economical,36,0.0,en,EnvironmentandNaturalResourcesinCanada_facebook
16,318424514044_10155003609084045,2016-08-02 12:20:21,https://www.facebook.com/EnvironmentandNaturalResourcesinCanada/photos/a.338211969044.199983.318424514044/10155003609084045/?type=3,"Did you know that many snakes will mimic venomous ones as a form of defence? The Gray Ratsnake for example, shakes its tail in dry leaves, like a rattlesnake. http://ow.ly/eUfr302QcbJ","Did you know that many snakes will mimic venomous ones as a form of defence? The Gray Ratsnake for example, shakes its tail in dry leaves, like a rattlesnake.",[],Environmental,36,0.2785714285714286,en,EnvironmentandNaturalResourcesinCanada_facebook
17,318424514044_10155052053809045,2016-08-17 10:30:27,https://www.facebook.com/EnvironmentandNaturalResourcesinCanada/photos/a.338211969044.199983.318424514044/10155052053809045/?type=3,"Discover the impact of our consumption choices, how to become an environmentally responsible citizen and green technologies through the exhibits Renewable Energy: Time to Decide, Spaceship Earth and Finding Balance at the Biosphere. http://ow.ly/fQKG303k1D8","Discover the impact of our consumption choices, how to become an environmentally responsible citizen and green technologies through the exhibits Renewable Energy: Time to Decide, Spaceship Earth and Finding Balance at the Biosphere. 1D8",[],Economical,35,0.0,en,EnvironmentandNaturalResourcesinCanada_facebook
18,318424514044_10155029597334045,2016-08-10 13:39:45,https://www.facebook.com/EnvironmentandNaturalResourcesinCanada/photos/a.10155029595264045.1073741870.318424514044/10155029597334045/?type=3,"Check out Minister McKenna’s recent trip to Atlantic Canada! She had a busy three days meeting with the four Atlantic Canada Environment Ministers, stakeholders, checking out a few of our national parks, and meeting with staff.","Check out Minister McKenna’s recent trip to Atlantic Canada! She had a busy three days meeting with the four Atlantic Canada Environment Ministers, stakeholders, checking out a few of our national parks, and meeting with staff.",[],Economical,34,0.0,en,EnvironmentandNaturalResourcesinCanada_facebook
19,318424514044_10155077810829045,2016-08-25 09:35:16,https://www.facebook.com/EnvironmentandNaturalResourcesinCanada/photos/a.338211969044.199983.318424514044/10155077810829045/?type=3,Conserving Canadian species is a top priority. Did you know that swabbing for DNA is a first step in wildlife genomics research? Researchers use genomics to learn more about the incidence of snake fungal disease to protect species like this Dekay's Brownsnake. http://ow.ly/YdqU303zCZ0,Conserving Canadian species is a top priority. Did you know that swabbing for DNA is a first step in wildlife genomics research? Researchers use genomics to learn more about the incidence of snake fungal disease to protect species like this Dekay's Brownsnake. 0,[],Environmental,32,0.5,en,EnvironmentandNaturalResourcesinCanada_facebook
20,318424514044_10155026393269045,2016-08-09 14:00:51,https://www.facebook.com/EnvironmentandNaturalResourcesinCanada/photos/a.338211969044.199983.318424514044/10155026393269045/?type=3,"Did you know that the Cap Tourmente and Lac Saint Francois National Wildlife Areas in Quebec are designated as wetlands of international importance under the RAMSAR Convention? 
The Cap Tourmente wildlife area was the first site to receive this prestigious designation in North America in 1981. The benefits of wetlands are numerous: they filter our water and limit floods and erosion. They also provide feeding, breeding and nursery habitat for many species. It’s one of the most productive natural habitats on the planet. Let’s protect them!
http://ow.ly/1DMo3034yov","Did you know that the Cap Tourmente and Lac Saint Francois National Wildlife Areas in Quebec are designated as wetlands of international importance under the RAMSAR Convention? The Cap Tourmente wildlife area was the first site to receive this prestigious designation in North America in . The benefits of wetlands are numerous: they filter our water and limit floods and erosion. They also provide feeding, breeding and nursery habitat for many species. It’s one of the most productive natural habitats on the planet. Let’s protect them!",[],Environmental,32,0.0,en,EnvironmentandNaturalResourcesinCanada_facebook
21,318424514044_10155074910279045,2016-08-24 11:52:00,https://www.facebook.com/EnvironmentandNaturalResourcesinCanada/photos/a.10155074907384045.1073741872.318424514044/10155074910279045/?type=3,"During her visit to Québec on August 23 and 24, Minister McKenna discussed with Minister David Heurtel, and engaged with enthusiastic youth from the Quebec region and business leaders about the challenges and opportunities related to the fight against climate change. Together we will find sustainable solutions for the future of our country and our world.
http://letstalkclimateaction.ca/ideas","During her visit to Québec on August and , Minister McKenna discussed with Minister David Heurtel, and engaged with enthusiastic youth from the Quebec region and business leaders about the challenges and opportunities related to the fight against climate change. Together we will find sustainable solutions for the future of our country and our world.",[],Environmental,30,0.0,en,EnvironmentandNaturalResourcesinCanada_facebook
22,318424514044_10155055380124045,2016-08-18 10:40:09,https://www.facebook.com/EnvironmentandNaturalResourcesinCanada/photos/a.338211969044.199983.318424514044/10155055380124045/?type=3,"Electricity as an alternative fuel for transportation is already a reality in Canada. The availability of vehicles and charging stations continues to increase. With Budget 2016, the Government of Canada will invest $16.4 million to support the installation of up to 70 fast-charging units for electric vehicles. 

Post a photo of your electric vehicle if you are already driving one!","Electricity as an alternative fuel for transportation is already a reality in Canada. The availability of vehicles and charging stations continues to increase. With Budget , the Government of Canada will invest $16.4 million to support the installation of up to fast-charging units for electric vehicles. Post a photo of your electric vehicle if you are already driving one!",[],Economical,26,0.35612689393939395,en,EnvironmentandNaturalResourcesinCanada_facebook
23,318424514044_10155035493629045,2016-08-12 10:35:50,https://www.facebook.com/EnvironmentandNaturalResourcesinCanada/photos/a.338211969044.199983.318424514044/10155035493629045/?type=3,Did you know that snakes cannot crawl backwards? They turn their whole body to move in opposite direction. #SpeciesatRisk http://ow.ly/4qkS3039gOB,Did you know that snakes cannot crawl backwards? They turn their whole body to move in opposite direction.,['#SpeciesatRisk'],Environmental,25,0.0,en,EnvironmentandNaturalResourcesinCanada_facebook
24,318424514044_10155002984319045,2016-08-02 08:35:10,https://www.facebook.com/EnvironmentandNaturalResourcesinCanada/photos/a.338211969044.199983.318424514044/10155002984319045/?type=3,"Excessive heat can be dangerous! Know how to protect yourself during a heatwave! 
http://ow.ly/8Xds302Q7RG Healthy Canadians",Excessive heat can be dangerous! Know how to protect yourself during a heatwave! Healthy Canadians,[],Social,23,0.0,en,EnvironmentandNaturalResourcesinCanada_facebook
25,318424514044_10155032917904045,2016-08-11 15:01:06,https://www.facebook.com/EnvironmentandNaturalResourcesinCanada/photos/a.338211969044.199983.318424514044/10155032917904045/?type=3,"To reduce the environmental footprint of oil extraction, researchers from Natural Resources Canada are piloting a technique called Direct Contact Steam Generation, or DCSG. It has the potential to decrease greenhouse gases from extracting oil by 30-70% and reduce water used by 50-100%! http://ow.ly/IzWX3038LhT","To reduce the environmental footprint of oil extraction, researchers from Natural Resources Canada are piloting a technique called Direct Contact Steam Generation, or DCSG. It has the potential to decrease greenhouse gases from extracting oil by -70% and reduce water used by -100%!",[],Environmental,20,0.0,en,EnvironmentandNaturalResourcesinCanada_facebook
26,318424514044_10155074634789045,2016-08-24 09:40:17,https://www.facebook.com/EnvironmentandNaturalResourcesinCanada/photos/a.338211969044.199983.318424514044/10155074634789045/?type=3,We can fight climate change together! Share your #CANClimateAction ideas with the Government of Canada today on our interactive website. http://ow.ly/Dzmw303xztF,We can fight climate change together! Share your ideas with the Government of Canada today on our interactive website.,['#CANClimateAction'],Environmental,19,0.0,en,EnvironmentandNaturalResourcesinCanada_facebook
27,318424514044_10155078256884045,2016-08-25 13:01:06,https://www.facebook.com/EnvironmentandNaturalResourcesinCanada/photos/a.338211969044.199983.318424514044/10155078256884045/?type=3,"The Canada-U.S. Great Lakes Public Forum is a unique opportunity for people on both sides of the border—Indigenous people, scientists, academics, government, community leaders and youth—to come together to share ideas on the most important issues facing the Great Lakes today. It is also a time to celebrate everything that makes our Great Lakes so great.
Check out the full event program, including a list of who you can expect to see from October 4 to 6 in Toronto. http://ow.ly/CNr6303zDi1","The Canada-U.S. Great Lakes Public Forum is a unique opportunity for people on both sides of the border—Indigenous people, scientists, academics, government, community leaders and youth—to come together to share ideas on the most important issues facing the Great Lakes today. It is also a time to celebrate everything that makes our Great Lakes so great. Check out the full event program, including a list of who you can eect to see from October to in Toronto. 1",[],Environmental,19,0.25,en,EnvironmentandNaturalResourcesinCanada_facebook
28,318424514044_10155045947859045,2016-08-15 14:00:54,https://www.facebook.com/EnvironmentandNaturalResourcesinCanada/photos/a.338211969044.199983.318424514044/10155045947859045/?type=3,"Young people and climate change solutions go hand in hand! Check out our Kids and Climate Change webpage, talk to your family about climate change and participate in Summer Challenge activities! You can share your results and ideas with us on Twitter using the hashtag #CANClimateAction. Have fun! http://ow.ly/bKLh303fuwL","Young people and climate change solutions go hand in hand! Check out our Kids and Climate Change webpage, talk to your family about climate change and participate in Summer Challenge activities! You can share your results and ideas with us on Twitter using the hashtag . Have fun!",['#CANClimateAction'],Social,17,0.2,en,EnvironmentandNaturalResourcesinCanada_facebook
29,318424514044_10155058874514045,2016-08-19 13:00:53,https://www.facebook.com/EnvironmentandNaturalResourcesinCanada/photos/a.338211969044.199983.318424514044/10155058874514045/?type=3,"During heavy rains, avoid driving across flooded roads. You can’t tell the condition of the road under the water. http://ow.ly/nKSh303ooP3","During heavy rains, avoid driving across flooded roads. You can’t tell the condition of the road under the water.",[],Environmental,16,0.0,en,EnvironmentandNaturalResourcesinCanada_facebook
30,318424514044_10155035125159045,2016-08-12 08:01:40,https://www.facebook.com/EnvironmentandNaturalResourcesinCanada/photos/a.338211969044.199983.318424514044/10155035125159045/?type=3,Happy International #YouthDay! Tell us about your sustainable actions and how you are making your community more sustainable. http://ow.ly/7ZZC3039gyl,Happy International ! Tell us about your sustainable actions and how you are making your community more sustainable.,['#YouthDay'],Environmental,14,0.0,en,EnvironmentandNaturalResourcesinCanada_facebook
