,id,date_published,link,caption_original,caption_cleaned,hashtags,category,Reactions_SUM,average_sentiment_score,language,account_name
30,137563459593611_1538413586175251,2016-12-06 10:10:00,https://www.facebook.com/ParksCanada/photos/a.179253688757921.51944.137563459593611/1538413586175251/?type=3,"Has the snow got you dreaming of hot days by the lake? Beat the winter blues and start thinking about your ultimate summer vacation now! Tag someone you want to go camping with this summer. 

Don’t forget, #2017camping reservations start in January! http://ow.ly/UEXWU Canada Keep Exploring

Photo taken in Gulf Islands National Park Reserve.","Has the snow got you dreaming of hot days by the lake? Beat the winter blues and start thinking about your ultimate summer vacation now! Tag someone you want to go camping with this summer. Don’t forget, reservations start in January! U Canada Keep Eloring Photo taken in Gulf Islands National Park Reserve.",['#2017camping'],Environmental,417,0.09633525970319634,en,ParksCanada_facebook
31,137563459593611_1539649919384951,2016-12-29 11:35:00,https://www.facebook.com/ParksCanada/photos/a.179253688757921.51944.137563459593611/1539649919384951/?type=3,"Are you planning on making any New Year Resolutions? Cut your stress? Travel? Become more active? Spend more time with loved ones? Go outside more?

If you said “all of the above”, we have the perfect solution: CAMPING! See all the great options we offer around the country: http://ow.ly/UEXWU #2017Camping","Are you planning on making any New Year Resolutions? Cut your stress? Travel? Become more active? Spend more time with loved ones? Go outside more? If you said “all of the above”, we have the perfect solution: CAMPING! See all the great options we offer around the country: U",['#2017Camping'],Environmental,405,0.15843434343434346,en,ParksCanada_facebook
32,137563459593611_1533327990017144,2016-12-02 09:15:00,https://www.facebook.com/ParksCanada/photos/a.179253688757921.51944.137563459593611/1533327990017144/?type=3,"Happy Friday Follower Photo!!!

This stunning shot of Pacific Rim National Park Reserve comes to us from Aidan H., @aidanholla_ on Instagram. Did you know WE'RE now on Instagram? Follow us @Parks.Canada and find out more about the new #ParksContest!  

Every Friday, we randomly pick a photo sent to us by a follower and feature it on our wall. If you would like to submit a photo for consideration, simply send us a message with your photo and caption.","Happy Friday Follower Photo!!! This stunning shot of Pacific Rim National Park Reserve comes to us from Aidan H., on Instagram. Did you know WE'RE now on Instagram? Follow us .Canada and find out more about the new ! Every Friday, we randomly pick a photo sent to us by a follower and feature it on our wall. If you would like to submit a photo for consideration, simply send us a message with your photo and caption.",['#ParksContest'],Environmental,389,0.425,en,ParksCanada_facebook
33,137563459593611_1545130558836887,2016-12-11 18:02:00,https://www.facebook.com/ParksCanada/photos/a.179253688757921.51944.137563459593611/1545130558836887/?type=3,"Wander the trails and dirt roads to discover the history of ranching in Canada at the Bar U Ranch National Historic Site! This is your chance to live like a #cowboy! For more information and hidden gems, click here: http://ow.ly/UCSB306YZDL #BarURanchNHS #ranching #dirtroads","Wander the trails and dirt roads to discover the history of ranching in Canada at the Bar U Ranch National Historic Site! This is your chance to live like a ! For more information and hidden gems, click here:","['#cowboy', '#BarURanchNHS', '#ranching', '#dirtroads']",Environmental,346,0.2885714285714286,en,ParksCanada_facebook
34,137563459593611_1550831644933445,2016-12-30 18:20:00,http://ow.ly/94nv3075Yio,"Over 100 years ago, shortbread cookies surely would have been made and served during special gatherings at Woodside, the boyhood home of William Lyon Mackenzie King, Canada's tenth, and longest-serving Prime Minister.

Here is the recipe that has been used at Woodside National Historic Site for a very long time. #ClubParka #cookies","Over years ago, shortbread cookies surely would have been made and served during special gatherings at Woodside, the boyhood home of William Lyon Mackenzie King, Canada's tenth, and longest-serving Prime Minister. Here is the recipe that has been used at Woodside National Historic Site for a very long time.","['#ClubParka', '#cookies']",Environmental,246,0.2714285714285714,en,ParksCanada_facebook
35,137563459593611_1541455172537759,2016-12-07 16:30:01,http://www.letstalkparkscanada.ca/,"Canadians are invited to join the “Let’s Talk Parks, Canada” conversation from January 9 to 27, 2017. Come back on January 9 to share your views and ideas through our e-workbooks and interactive comment page. In the meantime, learn more here: http://www.letstalkparkscanada.ca/","Canadians are invited to join the “Let’s Talk Parks, Canada” conversation from January to , . Come back on January to share your views and ideas through our e-workbooks and interactive comment page. In the meantime, learn more here:",[],Environmental,207,0.285,en,ParksCanada_facebook
36,137563459593611_1574172975932645,2016-12-29 15:25:04,https://www.facebook.com/ParksCanada/photos/a.1574172582599351.1073741918.137563459593611/1574172975932645/?type=3,"Hey #history buffs! 
Here's something we're sure you'll enjoy!
We've unveiled 6 commemorative #HSMBC (Historic Sites and Monuments Board of Canada) plaques in #Quebec. 
Check under each photo for more information. 
#Canada150",Hey buffs! Here's something we're sure you'll enjoy! We've unveiled commemorative (Historic Sites and Monuments Board of Canada) plaques in . Check under each photo for more information.,"['#history', '#HSMBC', '#Quebec', '#Canada150']",Environmental,204,0.31875,en,ParksCanada_facebook
37,137563459593611_1531339850215958,2016-12-01 01:00:00,https://www.facebook.com/ParksCanada/photos/a.179253688757921.51944.137563459593611/1531339850215958/?type=3,"TODAY is the day! You can now follow @parks.canada on #Instagram! There's already a little surprise for all you #Canada150 fans out there... and later today we'll reveal something very exciting! 
Hint: #ParksContest",TODAY is the day! You can now follow .canada on ! There's already a little surprise for all you fans out there... and later today we'll reveal something very exciting! Hint:,"['#Instagram', '#Canada150', '#ParksContest']",Environmental,157,0.4,en,ParksCanada_facebook
38,137563459593611_1558691807480762,2016-12-20 06:50:02,https://www.facebook.com/ParksCanada/photos/a.179253688757921.51944.137563459593611/1558691807480762/?type=3,Learn something new next year and have fun while you're at it! See our list of the top 10 ways to experience hands-on Canadian history for #Canada150: http://ow.ly/Wkpa307gaZv #CDNHisory #history,Learn something new next year and have fun while you're at it! See our list of the top ways to eerience hands-on Canadian history for :,"['#Canada150', '#CDNHisory', '#history']",Environmental,148,0.3066666666666667,en,ParksCanada_facebook
39,137563459593611_1531266580223285,2016-12-01 12:21:33,https://www.facebook.com/ParksCanada/photos/a.179253688757921.51944.137563459593611/1531266580223285/?type=3,IT'S OFFICIAL: We're on #Instagram! Follow us @Parks.Canada and check out our first photo to learn about our NEW AND EXCITING #ParksContest! #DiscoveryPass #Canada150,IT'S OFFICIAL: We're on ! Follow us .Canada and check out our first photo to learn about our NEW AND EXCITING !,"['#Instagram', '#ParksContest', '#DiscoveryPass', '#Canada150']",Environmental,132,0.04695746527777778,en,ParksCanada_facebook
40,137563459593611_1550832748266668,2016-12-18 08:35:00,http://ow.ly/aVEX3075YEN,"Winter Bird Count, an activity that helps collect data on bird populations, has been taking place in Rouge National Urban Park for more than 10 years!

This tradition inspired the creation of this #ClubParka easy origami activity! Your #kids will have fun folding their own holiday birds!","Winter Bird Count, an activity that helps collect data on bird populations, has been taking place in Rouge National Urban Park for more than years! This tradition inspired the creation of this easy origami activity! Your will have fun folding their own holiday birds!","['#ClubParka', '#kids']",Social,132,0.0,en,ParksCanada_facebook
41,137563459593611_1550829744933635,2016-12-21 18:50:03,http://ow.ly/T6Ia3075Ybw,"Ever wondered what the #Holidays were like for soldiers and their families living at Fort Wellington 200 years ago?

Create these old time holiday crafts with your #kids to have your house looking (and smelling) festive! #ClubParka",Ever wondered what the were like for soldiers and their families living at Fort Wellington years ago? Create these old time holiday crafts with your to have your house looking (and smelling) festive!,"['#Holidays', '#kids', '#ClubParka']",Social,130,0.0,en,ParksCanada_facebook
42,137563459593611_1559888660694410,2016-12-20 15:25:00,https://www.facebook.com/ParksCanada/photos/a.179253688757921.51944.137563459593611/1559888660694410/?type=3,"Our consultation on national parks, national historic sites, and national marine conservation areas opens on January 9. Are you ready to participate? Learn more here: 
http://www.letstalkparkscanada.ca/participate","Our consultation on national parks, national historic sites, and national marine conservation areas opens on January . Are you ready to participate? Learn more here:",[],Environmental,100,0.1811111111111111,en,ParksCanada_facebook
43,137563459593611_1542889829060960,2016-12-09 14:50:00,https://youtu.be/M68nMy0FSfs,#Parka is eager to celebrate #Canada150 and she wondered if #kids were excited too. So she went out and asked them! Watch their cute answers in this #video! #parkscanada #Canada150 #CBC2017,is eager to celebrate and she wondered if were excited too. So she went out and asked them! Watch their cute answers in this !,"['#Parka', '#Canada150', '#kids', '#video', '#parkscanada', '#Canada150', '#CBC2017']",Social,96,0.05860119047619047,en,ParksCanada_facebook
44,137563459593611_1529445887072021,2016-12-03 18:05:00,,"Please note that we will be performing maintenance on Parks Canada’s website tomorrow, Sunday December 4th, from 6:00 a.m. until 2:00 p.m. (EST). Our website will be unavailable during this time. We are sorry for the inconvenience and thank you for your patience.","Please note that we will be performing maintenance on Parks Canada’s website tomorrow, Sunday December th, from :00 a.m. until :00 p.m. (EST). Our website will be unavailable during this time. We are sorry for the inconvenience and thank you for your patience.",[],Environmental,85,0.1708333333333333,en,ParksCanada_facebook
45,137563459593611_1545261912157085,2016-12-11 10:33:04,https://youtu.be/cIggmubPrYI,"It's #SubscriberSunday! Did you know we have a YouTube channel? You don't want to miss any of our awesome videos, so subscribe today!","It's ! Did you know we have a YouTube channel? You don't want to miss any of our awesome videos, so subscribe today!",['#SubscriberSunday'],Social,45,0.0,en,ParksCanada_facebook
