,id,date_published,link,caption_original,caption_cleaned,hashtags,category,Reactions_SUM,average_sentiment_score,language,account_name
28,485734081568161_851716738303225,2016-12-26 11:45:21,https://www.facebook.com/QuestionsdargentCanada/photos/a.534106823397553.1073741828.485734081568161/851716738303225/?type=3,"Vous voulez profiter des aubaines du lendemain de Noël en vous procurant un nouveau téléphone mobile?

Saviez-vous que les fournisseurs ont l’obligation de vous fournir un contrat rédigé en langage clair décrivant les services que vous recevrez et les coûts qui s’y rattachent? Ils doivent également vous aviser de tout changement apporté aux principales modalités de votre contrat, à moins que le changement soit à votre avantage, par exemple dans le cas de l’augmentation de votre limite d’utilisation.

Avant d’acheter, sachez quels sont vos droits en tant que consommateur de services sans fil: http://crtc.gc.ca/fra/phone/mobile/prepay.htm","Vous voulez profiter des aubaines du lendemain de Noël en vous procurant un nouveau téléphone mobile? Saviez-vous que les fournisseurs ont l’obligation de vous fournir un contrat rédigé en langage clair décrivant les services que vous recevrez et les coûts qui s’y rattachent? Ils doivent également vous aviser de tout changement apporté aux principales modalités de votre contrat, à moins que le changement soit à votre avantage, par exemple dans le cas de l’augmentation de votre limite d’utilisation. Avant d’acheter, sachez quels sont vos droits en tant que consommateur de services sans fil:",[],Environmental,3,0.0,fr,QuestionsdargentCanada_facebook
29,485734081568161_846145595527006,2016-12-16 15:00:54,https://www.facebook.com/QuestionsdargentCanada/photos/a.534106823397553.1073741828.485734081568161/846145595527006/?type=3,"Le processus de consultation à propos du #Budget2017 tirant à sa fin, nous voulons tout de même continuer d’avoir vos avis.
Bien que nous ayons reçu un nombre record de commentaires et d’idées en ligne de la part de particuliers et de groupes, plus il y a de Canadiennes et de Canadiens qui nous font part de leurs points de vue, plus nous pouvons ajuster les mesures du budget de 2017 pour faire en sorte qu’elles correspondent aux opinions des Canadiens et à leurs espoirs pour l’avenir.
Les Canadiens sont invités à soumettre leurs commentaires et leurs idées jusqu’à la conclusion des consultations en ligne, à 11 h 59 (HNP) le 19 décembre. http://ow.ly/C3eS307ccY0","Le processus de consultation à propos du tirant à sa fin, nous voulons tout de même continuer d’avoir vos avis. Bien que nous ayons reçu un nombre record de commentaires et d’idées en ligne de la part de particuliers et de groupes, plus il y a de Canadiennes et de Canadiens qui nous font part de leurs points de vue, plus nous pouvons ajuster les mesures du budget de pour faire en sorte qu’elles correspondent aux opinions des Canadiens et à leurs espoirs pour l’avenir. Les Canadiens sont invités à soumettre leurs commentaires et leurs idées jusqu’à la conclusion des consultations en ligne, à h (HNP) le décembre. 0",['#Budget2017'],Environmental,2,0.0,fr,QuestionsdargentCanada_facebook
30,485734081568161_844944155647150,2016-12-14 17:20:10,https://www.otc-cta.gc.ca/fra/questions-et-reponses-publicite-des-prix,,,[],Social,2,0.0,tl,QuestionsdargentCanada_facebook
