,id,date_published,link,caption_original,caption_cleaned,hashtags,category,Reactions_SUM,average_sentiment_score,language,account_name
0,137563459593611_1543271082356168,2016-12-09 09:15:03,https://www.facebook.com/ParksCanada/photos/a.179253688757921.51944.137563459593611/1543271082356168/?type=3,"Happy Friday Follower Photo!!!

This stunning shot of Jasper National Park comes to us from @danielericmadrigal via Instagram. Don't forget to tag us (@parks.canada) and use #ParksCanada on IG so we can see your gorgeous parks pics! http://ow.ly/4eN9306WIbJ

Every Friday, we randomly pick a photo sent to us by a follower and feature it on our wall. If you would like to submit a photo for consideration, simply send us a message with your photo and caption.","Happy Friday Follower Photo!!! This stunning shot of Jasper National Park comes to us from via Instagram. Don't forget to tag us (.canada) and use on IG so we can see your gorgeous parks pics! Every Friday, we randomly pick a photo sent to us by a follower and feature it on our wall. If you would like to submit a photo for consideration, simply send us a message with your photo and caption.",['#ParksCanada'],Environmental,2813,0.17854314735844587,en,ParksCanada_facebook
1,137563459593611_1555062454510364,2016-12-16 15:35:00,https://www.facebook.com/parkscanadawpg/photos/a.532371003541987.1073741828.527844677327953/1025265394252543/?type=3,How cute is this picture? Have yourselves a great weekend everyone! Daisy Gilardini Photography Parks Canada WPG,How cute is this picture? Have yourselves a great weekend everyone! Daisy Gilardini Photography Parks Canada WPG,[],Environmental,2383,0.1995729813664596,en,ParksCanada_facebook
2,137563459593611_1533550833328193,2016-12-02 12:19:16,,"We are thrilled that so many of you are excited for Canada150 and the free souvenir 2017 Parks Canada Discovery Pass. Due to the exceptionally high volume of Discovery Pass online orders, you may experience delays in accessing the site. 

We wish to remind those who are trying to order their pass online that this is not a limited time offer and encourage you to come back and try again later. If you are planning to visit soon, passes are also available at Parks Canada locations across the country starting January 1, 2017. 

We look forward to welcoming all visitors to experience the best of Canada’s natural and cultural heritage in 2017.","We are thrilled that so many of you are excited for Canada150 and the free souvenir Parks Canada Discovery Pass. Due to the exceptionally high volume of Discovery Pass online orders, you may eerience delays in accessing the site. We wish to remind those who are trying to order their pass online that this is not a limited time offer and encourage you to come back and try again later. If you are planning to visit soon, passes are also available at Parks Canada locations across the country starting January , . We look forward to welcoming all visitors to eerience the best of Canada’s natural and cultural heritage in .",[],Environmental,2256,0.04991477272727272,en,ParksCanada_facebook
3,137563459593611_1552227361460540,2016-12-14 15:23:51,https://www.facebook.com/ParksCanada/photos/a.179253688757921.51944.137563459593611/1552227361460540/?type=3,"Haven't ordered your FREE #DiscoveryPass yet? No worries, there is NO DEADLINE! It'll be available throughout 2017! 
There are 2 ways to get your Discovery Pass: order online or get it in person at our entry gates and visitor centres... ALL THROUGH 2017!","Haven't ordered your FREE yet? No worries, there is NO DEADLINE! It'll be available throughout ! There are ways to get your Discovery Pass: order online or get it in person at our entry gates and visitor centres... ALL THROUGH !",['#DiscoveryPass'],Environmental,1948,0.050323275862068965,en,ParksCanada_facebook
4,137563459593611_1563728806977062,2016-12-27 10:15:01,https://www.facebook.com/ParksCanada/photos/a.179253688757921.51944.137563459593611/1563728806977062/?type=3,"Order your 2017 FREE #DiscoveryPass today and enter our #ParksContest for your chance to win an unforgettable 7-day trip for 4 to Western Newfoundland, 1 of 3 weekend getaways in one of our #oTENTiks, #ParksCanada merchandise and much more thanks to our partners MEC and CIBC. What are you waiting for?","Order your FREE today and enter our for your chance to win an unforgettable -day trip for to Western Newfoundland, of weekend getaways in one of our , merchandise and much more thanks to our partners MEC and CIBC. What are you waiting for?","['#DiscoveryPass', '#ParksContest', '#oTENTiks', '#ParksCanada']",Environmental,1618,0.06454951298701299,en,ParksCanada_facebook
5,137563459593611_1550547334961876,2016-12-13 10:39:25,https://www.facebook.com/ParksCanada/photos/a.179253688757921.51944.137563459593611/1550547334961876/?type=3,"Did you know Vuntut National Park is one of the least visited national parks in Canada? Remote and unspoiled Arctic wilderness, a First Nation’s history dating back millennia and the setting for one of the planet’s great animal migrations await the few visitors each year who make the trek! 

Find out what the other least visited parks are with MUCH #FarandWide: http://ow.ly/jGoa3075ltY Parks Canada Yukon Canada Keep Exploring","Did you know Vuntut National Park is one of the least visited national parks in Canada? Remote and unspoiled Arctic wilderness, a First Nation’s history dating back millennia and the setting for one of the planet’s great animal migrations await the few visitors each year who make the trek! Find out what the other least visited parks are with MUCH : Parks Canada Yukon Canada Keep Eloring",['#FarandWide'],Environmental,1298,0.09990234375,en,ParksCanada_facebook
6,137563459593611_1563816513634958,2016-12-26 13:05:01,https://www.facebook.com/ParksCanada/photos/a.179253688757921.51944.137563459593611/1563816513634958/?type=3,"In Canada, we are fortunate to have the most extensive network of protected areas in the world. So this year, as we celebrate #Canada150, we encourage YOU to help the environment while on vacation! Here are our top ten ways to do just that: http://ow.ly/eXwk307pnkb

Photo taken in Pukaskwa National Park.","In Canada, we are fortunate to have the most extensive network of protected areas in the world. So this year, as we celebrate , we encourage YOU to help the environment while on vacation! Here are our top ten ways to do just that: Photo taken in Pukaskwa National Park.",['#Canada150'],Environmental,1230,0.2706385281385281,en,ParksCanada_facebook
7,137563459593611_1574140529269223,2016-12-30 09:15:00,https://www.facebook.com/ParksCanada/photos/a.179253688757921.51944.137563459593611/1574140529269223/?type=3,"Happy Friday Follower Photo!!!

This amazing shot comes to us from Linda Unwin, who captioned it: ""We are from the UK and we can't get enough of Canada. This photo was taken in Jasper National Park.  It is our heaven on earth.""

Every Friday, we randomly pick a photo sent to us by a follower and feature it on our wall. If you would like to submit a photo for consideration, simply send us a message with your photo and caption.","Happy Friday Follower Photo!!! This amazing shot comes to us from Linda Unwin, who captioned it: ""We are from the UK and we can't get enough of Canada. This photo was taken in Jasper National Park. It is our heaven on earth."" Every Friday, we randomly pick a photo sent to us by a follower and feature it on our wall. If you would like to submit a photo for consideration, simply send us a message with your photo and caption.",[],Environmental,1211,0.16675084175084173,en,ParksCanada_facebook
8,137563459593611_1530949550254988,2016-12-19 12:10:32,https://www.facebook.com/ParksCanada/photos/a.179253688757921.51944.137563459593611/1530949550254988/?type=3,Olympian Clara Hughes and Minister Catherine McKenna already have their FREE 2017 #DiscoveryPass! Make sure to order yours and #ShowUsYourPass! #Canada150,Olympian Clara Hughes and Minister Catherine McKenna already have their FREE ! Make sure to order yours and !,"['#DiscoveryPass', '#ShowUsYourPass', '#Canada150']",Economical,1118,0.08372519841269843,en,ParksCanada_facebook
9,137563459593611_1530724480277495,2016-12-10 09:15:06,https://www.facebook.com/ParksCanada/photos/a.179253688757921.51944.137563459593611/1530724480277495/?type=3,Last week we kicked off our exciting #ParksContest on our new #Instagram account: @parks.canada! Order your FREE #DiscoveryPass and enter our #contest today! http://ow.ly/eHO3306YHDT,Last week we kicked off our exciting on our new account: .canada! Order your FREE and enter our today!,"['#ParksContest', '#Instagram', '#DiscoveryPass', '#contest']",Environmental,1114,0.166605466130114,en,ParksCanada_facebook
10,137563459593611_1529524350397508,2016-12-04 09:15:01,https://www.facebook.com/ParksCanada/photos/a.179253688757921.51944.137563459593611/1529524350397508/?type=3,"Happy #NationalCookieDay!!!
Try this classic and easy to make recipe for Scottish shortbread, dating back to the 19th century: http://ow.ly/VunNf 
 
Some have even declared these cookies the best they ever tasted!","Happy !!! Try this classic and easy to make recipe for Scottish shortbread, dating back to the th century: Some have even declared these cookies the best they ever tasted!",['#NationalCookieDay'],Environmental,1046,0.08547548731870766,en,ParksCanada_facebook
11,137563459593611_1554851127864830,2016-12-24 13:10:01,https://www.facebook.com/ParksCanada/photos/a.179253688757921.51944.137563459593611/1554851127864830/?type=3,"Quttinirpaaq National Park is the northernmost park in Canada, and one of the least visited national parks! Find out what makes it unique with MUCH #FarandWide: http://ow.ly/2NCg307c7sm Parks Canada Nunavut Canada Keep Exploring","Quttinirpaaq National Park is the northernmost park in Canada, and one of the least visited national parks! Find out what makes it unique with MUCH : Parks Canada Nunavut Canada Keep Eloring",['#FarandWide'],Environmental,944,0.110609243697479,en,ParksCanada_facebook
12,137563459593611_1533806826635927,2016-12-05 12:10:02,https://www.facebook.com/ParksCanada/photos/a.179253688757921.51944.137563459593611/1533806826635927/?type=3,"Who's planning to #ExploreCanada in 2017?  Don't miss out on your chance to see some of our #HiddenGems and celebrate #Canada150 with us. http://ow.ly/pwAn306LgDi

Remember, our parks and sites are #FREE for everyone next year! What will you cross off of your bucket list? 

Photo taken in Mount Revelstoke and Glacier national parks.","Who's planning to in ? Don't miss out on your chance to see some of our and celebrate with us. Remember, our parks and sites are for everyone next year! What will you cross off of your bucket list? Photo taken in Mount Revelstoke and Glacier national parks.","['#ExploreCanada', '#HiddenGems', '#Canada150', '#FREE']",Environmental,943,0.17498290043290046,en,ParksCanada_facebook
13,137563459593611_1563774080305868,2016-12-31 10:35:03,https://www.facebook.com/ParksCanada/photos/a.179253688757921.51944.137563459593611/1563774080305868/?type=3,"It's difficult to take a bad picture at these gorgeous locations! Check out MUCH #FarandWide's list of most Instagrammable places in Canada. What's your favourite national park to Instagram? http://ow.ly/Z8Vq307pj3r

Don't forget to follow us on IG (parks.canada) and use #ParksCanada!

Photo taken in Kluane National Park and Reserve. Parks Canada Yukon",It's difficult to take a bad picture at these gorgeous locations! Check out MUCH 's list of most Instagrammable places in Canada. What's your favourite national park to Instagram? Don't forget to follow us on IG (parks.canada) and use ! Photo taken in Kluane National Park and Reserve. Parks Canada Yukon,"['#FarandWide', '#ParksCanada']",Environmental,855,0.2509469696969697,en,ParksCanada_facebook
14,137563459593611_1560202650663011,2016-12-25 19:35:00,https://www.facebook.com/ParksCanada/photos/a.179253688757921.51944.137563459593611/1560202650663011/?type=3,"See what we’re doing for the restoration of Plains #bison to its native range in this new #video. Featuring: Banff National Park, Elk Island National Park, Prince Albert National Park, Grasslands National Park and Montana's Blackfeet Nation. https://youtu.be/OtF9QBQGMt4

It's #SubscriberSunday! Did you know we have a YouTube channel? You don't want to miss any of our awesome videos, so subscribe today!","See what we’re doing for the restoration of Plains to its native range in this new . Featuring: Banff National Park, Elk Island National Park, Prince Albert National Park, Grasslands National Park and Montana's Blackfeet Nation. It's ! Did you know we have a YouTube channel? You don't want to miss any of our awesome videos, so subscribe today!","['#bison', '#video', '#SubscriberSunday']",Environmental,822,0.07105394605394605,en,ParksCanada_facebook
15,137563459593611_1563747066975236,2016-12-28 09:25:00,https://www.facebook.com/ParksCanada/photos/a.179253688757921.51944.137563459593611/1563747066975236/?type=3,"These interesting beings are called nudibranchs. They’re pleasing to the eye but venomous to the touch! Interesting fact: some species of nudibranchs recycle their prey’s defences! For example, they might eat anemones that possess stinging cells and then reuse those same cells for their own defence! #recycling #NatureforAll #SpeciesAtRisk #FantasticBeasts","These interesting beings are called nudibranchs. They’re pleasing to the eye but venomous to the touch! Interesting fact: some species of nudibranchs recycle their prey’s defences! For example, they might eat anemones that possess stinging cells and then reuse those same cells for their own defence!","['#recycling', '#NatureforAll', '#SpeciesAtRisk', '#FantasticBeasts']",Environmental,818,0.13505709147754602,en,ParksCanada_facebook
16,137563459593611_1563591786990764,2016-12-23 09:15:00,https://www.facebook.com/ParksCanada/photos/a.179253688757921.51944.137563459593611/1563591786990764/?type=3,"Happy Friday Follower Photo! For a twist, we want YOU to caption the photo this week! 

This impressive wildlife shot comes to us from Jason Harasimo, who snapped it in Quttinirpaaq National Park. Parks Canada Nunavut

Every Friday, we randomly pick a photo sent to us by a follower and feature it on our wall. If you would like to submit a photo for consideration, simply send us a message with your photo and caption.","Happy Friday Follower Photo! For a twist, we want YOU to caption the photo this week! This impressive wildlife shot comes to us from Jason Harasimo, who snapped it in Quttinirpaaq National Park. Parks Canada Nunavut Every Friday, we randomly pick a photo sent to us by a follower and feature it on our wall. If you would like to submit a photo for consideration, simply send us a message with your photo and caption.",[],Environmental,771,0.03395053116732804,en,ParksCanada_facebook
17,137563459593611_1538436539506289,2016-12-07 12:05:00,https://www.facebook.com/ParksCanada/photos/a.179253688757921.51944.137563459593611/1538436539506289/?type=3,"#WildlifeWednesday: Arctic hare (pictured) live in the arctic-alpine highlands of Gros Morne National Park, and snowshoe hare are found throughout the park's forests!",": Arctic hare (pictured) live in the arctic-alpine highlands of Gros Morne National Park, and snowshoe hare are found throughout the park's forests!",['#WildlifeWednesday'],Environmental,764,0.1986842105263158,en,ParksCanada_facebook
18,137563459593611_1561331210550155,2016-12-21 11:58:58,https://www.facebook.com/ParksCanada/photos/a.424247457591875.123704.137563459593611/1561330683883541/?type=3,"Happy first day of #Winter! 

We hope you get to enjoy as many of our parks and sites as possible this season! Have you ordered your FREE #DiscoveryPass yet? http://ow.ly/eHO3306YHDT

Photo taken in Mount Revelstoke and Glacier national parks",Happy first day of ! We hope you get to enjoy as many of our parks and sites as possible this season! Have you ordered your FREE yet? Photo taken in Mount Revelstoke and Glacier national parks,"['#Winter', '#DiscoveryPass']",Environmental,750,0.19067752100840327,en,ParksCanada_facebook
19,137563459593611_1563680993648510,2016-12-25 08:10:00,https://www.facebook.com/ParksCanada/photos/a.179253688757921.51944.137563459593611/1563680993648510/?type=3,"Merry Christmas!!! This holiday season, spend time with your family and friends by exploring nature and the outdoors together. With #Canada150 around the corner, we hope you make countless memories in this country's treasured places with loved ones all year round!

Photo taken in Banff National Park.","Merry Christmas!!! This holiday season, spend time with your family and friends by eloring nature and the outdoors together. With around the corner, we hope you make countless memories in this country's treasured places with loved ones all year round! Photo taken in Banff National Park.",['#Canada150'],Social,748,0.065,en,ParksCanada_facebook
20,137563459593611_1528237427192867,2016-12-03 13:37:00,https://www.facebook.com/ParksCanada/photos/a.179253688757921.51944.137563459593611/1528237427192867/?type=3,Ever biked on the snow? Give it a try! You can rent a fat bike at Kouchibouguac National Park and go for a ride in the park's 16 km of dedicated snow-biking trails: http://ow.ly/JKjd306ADkO,Ever biked on the snow? Give it a try! You can rent a fat bike at Kouchibouguac National Park and go for a ride in the park's km of dedicated snow-biking trails:,[],Environmental,718,0.08767583057133839,en,ParksCanada_facebook
21,137563459593611_1553433411339935,2016-12-16 09:15:04,https://www.facebook.com/ParksCanada/photos/a.179253688757921.51944.137563459593611/1553433411339935/?type=3,"Happy Friday Follower Photo!!!

This amazing shot ABOVE Sirmilik National Park comes to us from Natalie Gillis Photography, who captioned it: ""Hitching a helicopter ride over Eclipse Sound on the most beautiful day to be up in the air."" At this remote park, paddle among seals and floating ice, listening for the breaths of narwhal and beluga whales. Visiting Sirmilik is the ultimate Arctic adventure under the Midnight Sun! http://ow.ly/ClSa307a2Az Parks Canada Nunavut

Every Friday, we randomly pick a photo sent to us by a follower and feature it on our wall. If you would like to submit a photo for consideration, simply send us a message with your photo and caption.","Happy Friday Follower Photo!!! This amazing shot ABOVE Sirmilik National Park comes to us from Natalie Gillis Photography, who captioned it: ""Hitching a helicopter ride over Eclipse Sound on the most beautiful day to be up in the air."" At this remote park, paddle among seals and floating ice, listening for the breaths of narwhal and beluga whales. Visiting Sirmilik is the ultimate Arctic adventure under the Midnight Sun! Parks Canada Nunavut Every Friday, we randomly pick a photo sent to us by a follower and feature it on our wall. If you would like to submit a photo for consideration, simply send us a message with your photo and caption.",[],Environmental,703,0.25,en,ParksCanada_facebook
22,137563459593611_1553328541350422,2016-12-15 10:10:04,https://www.facebook.com/ParksCanada/photos/a.179253688757921.51944.137563459593611/1553328541350422/?type=3,"Caption this #ThrowbackThursday photo of visitors at Fundy National Park, 1950. Credit: Library and Archives Canada.","Caption this photo of visitors at Fundy National Park, . Credit: Library and Archives Canada.",['#ThrowbackThursday'],Social,703,0.1876120670995671,en,ParksCanada_facebook
23,137563459593611_1555162784500331,2016-12-17 07:25:00,https://www.facebook.com/ParksCanada/photos/a.179253688757921.51944.137563459593611/1555162784500331/?type=3,"Let’s Talk Parks, Canada! As part of the consultation on national protected places, we’ll be hosting public events in Montreal, Toronto, Halifax, and Vancouver. More details coming soon here: http://www.letstalkparkscanada.ca/participate","Let’s Talk Parks, Canada! As part of the consultation on national protected places, we’ll be hosting public events in Montreal, Toronto, Halifax, and Vancouver. More details coming soon here:",[],Environmental,698,0.15479662698412694,en,ParksCanada_facebook
24,137563459593611_1542940955722514,2016-12-08 11:19:39,https://www.facebook.com/ParksCanada/photos/a.179253688757921.51944.137563459593611/1542940955722514/?type=3,"Celebrate #Canada150 in Grasslands National Park, one of our hidden gems! 

Discover some of Canada’s rarest wildlife, darkest skies, astonishing dinosaur fossils, over 12,000 teepee rings, and varied landscapes, from buttes and valleys to breathtaking badlands. You can sleep in an oTENTik, teepee, or campsite. Your surprise awaits! http://ow.ly/JlN5306WdvX #ExploreSask Tourism Saskatchewan","Celebrate in Grasslands National Park, one of our hidden gems! Discover some of Canada’s rarest wildlife, darkest skies, astonishing dinosaur fossils, over ,000 teepee rings, and varied landscapes, from buttes and valleys to breathtaking badlands. You can sleep in an oTENTik, teepee, or campsite. Your surprise awaits! Tourism Saskatchewan","['#Canada150', '#ExploreSask']",Environmental,673,0.25698302469135803,en,ParksCanada_facebook
25,137563459593611_1539639576052652,2016-12-22 08:15:05,https://www.facebook.com/ParksCanada/photos/a.179253688757921.51944.137563459593611/1539639576052652/?type=3,"How would you like to take your family on an exciting adventure and immerse them overnight in Canadian history? 

In January, jump on the opportunity to book an oTENTik in one of our national historic sites. http://ow.ly/UEXWU Fort Rodd Hill and Fisgard Lighthouse National Historic Sites Fort Langley National Historic Site Rideau Canal Trent-Severn Waterway #2017camping","How would you like to take your family on an exciting adventure and immerse them overnight in Canadian history? In January, jump on the opportunity to book an oTENTik in one of our national historic sites. U Fort Rodd Hill and Fisgard Lighthouse National Historic Sites Fort Langley National Historic Site Rideau Canal Trent-Severn Waterway",['#2017camping'],Environmental,526,0.13560606060606062,en,ParksCanada_facebook
26,137563459593611_1562269940456282,2016-12-22 12:05:05,https://www.facebook.com/ParksCanada/photos/a.179253688757921.51944.137563459593611/1562269940456282/?type=3,"Forget about #gingerbread houses, what about a gingerbread Cabot Tower??? We're so impressed with this homage to St. John’s most visible landmark! 

Thank you Michelle A. L. for sharing this adorable picture with us! Bravo to the artist Colleen S. for this great replica! Signal Hill National Historic Site","Forget about houses, what about a gingerbread Cabot Tower??? We're so impressed with this homage to St. John’s most visible landmark! Thank you Michelle A. L. for sharing this adorable picture with us! Bravo to the artist Colleen S. for this great replica! Signal Hill National Historic Site",['#gingerbread'],Environmental,496,0.27968750000000003,en,ParksCanada_facebook
27,137563459593611_1539626139387329,2016-12-14 09:10:01,https://www.facebook.com/ParksCanada/photos/a.179253688757921.51944.137563459593611/1539626139387329/?type=3,"Winter camping??? Of course, we're Canadian! 
Winter is a great #TimeToConnect with the great outdoors and find your inner adventurer.

Check our website to find out which parks offer winter camping, and book your #2017Camping experience as early as January: http://ow.ly/UEXWU Canada's 150th Anniversary of Confederation #Canada150

Photo taken in La Mauricie National Park, Parks Canada.","Winter camping??? Of course, we're Canadian! Winter is a great with the great outdoors and find your inner adventurer. Check our website to find out which parks offer winter camping, and book your eerience as early as January: U Canada's th Anniversary of Confederation Photo taken in La Mauricie National Park, Parks Canada.","['#TimeToConnect', '#2017Camping', '#Canada150']",Environmental,491,0.04602272727272727,en,ParksCanada_facebook
28,137563459593611_1549040705112539,2016-12-12 14:30:02,https://www.facebook.com/ParksCanada/photos/a.179253688757921.51944.137563459593611/1549040705112539/?type=3,"Here in Canada, we're not afraid of a little snow! That's why we put together these ten #winter wonderland activities that can be yours to discover in 2017! Start making your wish list now and don't forget to order your 2017 FREE #DiscoveryPass for #Canada150! http://ow.ly/ev8h3072Vyf

Photo taken in La Mauricie National Park, Parks Canada","Here in Canada, we're not afraid of a little snow! That's why we put together these ten wonderland activities that can be yours to discover in ! Start making your wish list now and don't forget to order your FREE for ! Photo taken in La Mauricie National Park, Parks Canada","['#winter', '#DiscoveryPass', '#Canada150']",Environmental,486,0.16111111111111112,en,ParksCanada_facebook
29,137563459593611_1553572474659362,2016-12-17 11:55:03,https://www.facebook.com/ParksCanada/photos/a.179253688757921.51944.137563459593611/1553572474659362/?type=3,"MUCH #FarAndWide has some suggestions for awesome alternatives to popular tourist spots! See which of our places are featured, and keep this list for when you're planning your FREE visits in 2017: http://ow.ly/e6Pc307amUw Canada Keep Exploring

Photo taken in Pukaskwa National Park.","MUCH has some suggestions for awesome alternatives to popular tourist spots! See which of our places are featured, and keep this list for when you're planning your FREE visits in : Canada Keep Eloring Photo taken in Pukaskwa National Park.",['#FarAndWide'],Environmental,470,0.3445707070707071,en,ParksCanada_facebook
