,id,date_published,link,caption_original,caption_cleaned,hashtags,category,Reactions_SUM,average_sentiment_score,language,account_name
0,802240030899052544,2016-11-25 19:58:22,"['https://t.co/k5c9yyYgkG', 'https://t.co/9UlyGDPpjs']",Return of striped bass to the St. Lawrence: a success for #biodiversity! https://t.co/k5c9yyYgkG https://t.co/9UlyGDPpjs,Return striped bass St Lawrence success biodiversity https co k5c9yyYgkG https co 9UlyGDPpjs,['#biodiversity'],Environmental,30,0.1125,en,DFO_CCG_Quebec_tweeter
1,802249106483658752,2016-11-25 20:34:26,"['https://t.co/cEfrqHRmev', 'https://t.co/7kYYFgGUq']",Watercourse crossings: allowing free passage for fish is essential for protecting the #fisheries https://t.co/cEfrqHRmev https://t.co/7kYYFgGUq1,Watercourse crossings allowing free passage fish essential protecting fisheries https co cEfrqHRmev https co 7kYYFgGUq1,['#fisheries'],Environmental,21,0.2,en,DFO_CCG_Quebec_tweeter
2,796793018045054976,2016-11-10 19:13:53,"['https://t.co/yvgmOSu3dh', 'https://t.co/koifIJNwFV']",Construction of embankment starting in December to isolate #KathrynSpirit from river #CCG https://t.co/yvgmOSu3dh https://t.co/koifIJNwFV,Construction embankment starting December isolate KathrynSpirit river CCG https co yvgmOSu3dh https co koifIJNwFV,"['#KathrynSpirit', '#CCG']",Social,18,0.0,en,DFO_CCG_Quebec_tweeter
3,798996282312273920,2016-11-16 21:08:52,['https://t.co/gT9HxfXwRi'],RT @NewsroomGC: Have your say on the #FisheriesAct from now until Nov 25. letstalkfishhabitat.ca https://t.co/gT9HxfXwRi,RT NewsroomGC say FisheriesAct Nov 25 letstalkfishhabitat ca https co gT9HxfXwRi,['#FisheriesAct'],Social,13,0.0,en,DFO_CCG_Quebec_tweeter
4,798272134183260160,2016-11-14 21:11:22,['https://t.co/zOKOfBY9kX'],"#CCG marks #RemembranceDay with ND at HMCS Donnacona – AC Gascon, CCGS Des Groseilliers CO Dufresne and Chief Engineer Duchesne https://t.co/zOKOfBY9kX",CCG marks RemembranceDay ND HMCS Donnacona AC Gascon CCGS Des Groseilliers CO Dufresne Chief Engineer Duchesne https co zOKOfBY9kX,"['#CCG', '#RemembranceDay']",Environmental,12,0.0,en,DFO_CCG_Quebec_tweeter
5,796779891115065344,2016-11-10 18:21:44,[],RT @Transport_gc: Min. Garneau: We’re taking measures to isolate the #KathrynSpirit to dismantle and remove it from the shores of #Beauharn…,RT Min Garneau taking measures isolate KathrynSpirit dismantle remove shores,"['#KathrynSpirit', '#Beauharn']",Environmental,10,0.0,en,DFO_CCG_Quebec_tweeter
6,796779532216844288,2016-11-10 18:20:18,"['https://t.co/yvgmOSu3dh', 'https://t.co/9BxAPGWuRm']",Min.Garneau &amp; A-C Gascon announce first phase to remove #KathrynSpirit from #Beauharnois https://t.co/yvgmOSu3dh https://t.co/9BxAPGWuRm,Min Garneau amp Gascon announce first phase remove KathrynSpirit Beauharnois https co yvgmOSu3dh https co 9BxAPGWuRm,"['#KathrynSpirit', '#Beauharnois']",Environmental,7,0.25,en,DFO_CCG_Quebec_tweeter
7,802248814396637185,2016-11-25 20:33:17,['https://t.co/zYp1JhRoX5'],RT @NewsroomGC: Annual Closure of Canadian Coast Guard Seasonal Search and Rescue Bases in Quebec #CCG https://t.co/zYp1JhRoX5,RT NewsroomGC Annual Closure Canadian Coast Guard Seasonal Search Rescue Bases Quebec CCG https co zYp1JhRoX5,['#CCG'],Environmental,6,0.0,en,DFO_CCG_Quebec_tweeter
8,796791985105412096,2016-11-10 19:09:47,['https://t.c\xe2\x80\xa6'],"RT @CCG_GCC: CCGS #Kaeble named for Cpl Joseph Kaeble, V.C., who died in 1918 single-handedly repelling an attack #RememberThem https://t.c…",RT CCGS Kaeble named Cpl Joseph Kaeble died 1918 single handedly repelling attack RememberThem https,"['#Kaeble', '#RememberThem']",Environmental,5,0.0,en,DFO_CCG_Quebec_tweeter
9,802193743520628737,2016-11-25 16:54:27,"['https://t.co/mR45GzphBY', 'https://t.co/fXlKdn7BFM']",Hydrography playing a key role in underwater #archaeology: looking for #shipwrecks... https://t.co/mR45GzphBY #CHS https://t.co/fXlKdn7BFM,Hydrography playing key role underwater archaeology looking shipwrecks https co mR45GzphBY CHS https co fXlKdn7BFM,"['#archaeology', '#shipwrecks', '#CHS']",Environmental,5,0.0,en,DFO_CCG_Quebec_tweeter
10,796736630186971141,2016-11-10 15:29:49,['https://t.co/mksj4XJNTY'],RT @NewsroomGC: #CCG #Transport_GC and #GoC commit to securing and removing the #KathrynSpirit from #Beauharnois https://t.co/mksj4XJNTY,RT NewsroomGC CCG GoC commit securing removing KathrynSpirit Beauharnois https co mksj4XJNTY,"['#CCG', '#Transport_GC', '#GoC', '#KathrynSpirit', '#Beauharnois']",Environmental,3,0.0,en,DFO_CCG_Quebec_tweeter
11,796785015925436420,2016-11-10 18:42:06,['https://t.co/kTB9gtTKb'],#CCG Assistant Commissioner Julie Gascon explaining the details of next steps for the #KathrynSpirit vessel https://t.co/kTB9gtTKbd,CCG Assistant Commissioner Julie Gascon explaining details next steps KathrynSpirit vessel https co kTB9gtTKbd,"['#CCG', '#KathrynSpirit']",Environmental,3,0.0,en,DFO_CCG_Quebec_tweeter
12,801110150266454020,2016-11-22 17:08:38,['https://t.co/wuytCzP63I'],RT @NewsroomGC: New #ChamplainBridge: Spawning &amp; feeding area for fishes in @ville_vd rapids #Environmentalhealth https://t.co/wuytCzP63I,RT NewsroomGC New ChamplainBridge Spawning amp feeding area fishes rapids Environmentalhealth https co wuytCzP63I,"['#ChamplainBridge', '#Environmentalhealth']",Social,2,0.13636363636363635,en,DFO_CCG_Quebec_tweeter
13,802214209291485184,2016-11-25 18:15:46,"['https://t.co/0O0CAddFE6', 'https://t.co/9bdCnPFw9g']",New bridge over the St. Lawrence: acting to protect our #fisheries https://t.co/0O0CAddFE6 #Champlainbridge https://t.co/9bdCnPFw9g,New bridge St Lawrence acting protect fisheries https co 0O0CAddFE6 Champlainbridge https co 9bdCnPFw9g,"['#fisheries', '#Champlainbridge']",Environmental,2,0.06818181818181818,en,DFO_CCG_Quebec_tweeter
14,798994935777083394,2016-11-16 21:03:31,['https://t.co/wIN3eVLOcb'],Work as a Licensing Officer in Quebec Area Offices at #DFO https://t.co/wIN3eVLOcb #Jobs #IlesdelaMadeleine,Work Licensing Officer Quebec Area Offices DFO https co wIN3eVLOcb Jobs IlesdelaMadeleine,"['#DFO', '#Jobs', '#IlesdelaMadeleine']",Economical,1,0.0,en,DFO_CCG_Quebec_tweeter
15,796805687611428864,2016-11-10 20:04:14,['https://t.co/6KY5OWt8gn'],#WorldScienceDay https://t.co/6KY5OWt8gn,WorldScienceDay https co 6KY5OWt8gn,['#WorldScienceDay'],Environmental,1,0.0,en,DFO_CCG_Quebec_tweeter
16,804053364065660928,2016-11-30 20:03:55,"['https://t.co/6tCmc8rCZA', 'https://t.co/GFFOfYw09w']",Work as an Engineering Project Supervisor with the Canadian Hydrographic Service in Mont-Joli! #DFO #CHS #GOC https://t.co/6tCmc8rCZA https://t.co/GFFOfYw09w,Work Engineering Project Supervisor Canadian Hydrographic Service Mont Joli DFO CHS GOC https co 6tCmc8rCZA https co GFFOfYw09w,"['#DFO', '#CHS', '#GOC']",Environmental,1,0.0,en,DFO_CCG_Quebec_tweeter
17,801433387068260352,2016-11-23 14:33:04,"['https://t.co/ZR6sPOl4Jg', 'https://t.co/kvbY1AW6tA']",Infoceans: the October-November 2016 issue of our bulletin is now online. Check it out! https://t.co/ZR6sPOl4Jg #DFO #GCC https://t.co/kvbY1AW6tA,Infoceans October November 2016 issue bulletin online Check https co ZR6sPOl4Jg DFO GCC https co kvbY1AW6tA,"['#DFO', '#GCC']",Environmental,0,0.0,en,DFO_CCG_Quebec_tweeter
18,802255175616339968,2016-11-25 20:58:33,['https://t.co/BNezRhBMKI'],Work as a real property project officer at Fisheries and Oceans Canada #DFO #job https://t.co/BNezRhBMKI,Work real property project officer Fisheries Oceans Canada DFO job https co BNezRhBMKI,"['#DFO', '#job']",Environmental,0,0.2,en,DFO_CCG_Quebec_tweeter
