,id,date_published,link,caption_original,caption_cleaned,hashtags,category,Reactions_SUM,average_sentiment_score,language,account_name
0,697798604308795393,2016-02-11 15:05:26,"['https://t.co/5rYw7nnklv', 'https://t.co/oNiFXXWgZi']","RT @CdnHeritage: Wherever you are, take part in the #CanadianFlag Challenge https://t.co/5rYw7nnklv https://t.co/oNiFXXWgZi",RT CdnHeritage Wherever take part CanadianFlag Challenge https co 5rYw7nnklv https co oNiFXXWgZi,['#CanadianFlag'],Social,82,0.0,en,DFO_MAR_tweeter
1,695731093547413508,2016-02-05 22:09:53,['https://t.co/CnsyTtCaOM'],RT @DFO_Gulf: What a contrast! Check out these ice cover images from #NasaWorldView of today vs Feb. 2015. https://t.co/CnsyTtCaOM,RT contrast Check ice cover images NasaWorldView today vs Feb 2015 https co CnsyTtCaOM,['#NasaWorldView'],Environmental,46,0.0,en,DFO_MAR_tweeter
2,697798499946098688,2016-02-11 15:05:01,[],"RT @DFO_MPO: #WeAreProud of our female scientists and their work to understand, manage &amp; protect our oceans &amp; marine resources #dayofwomeni…",RT WeAreProud female scientists work understand manage amp protect oceans amp marine resources,"['#WeAreProud', '#dayofwomeni']",Environmental,43,0.0,en,DFO_MAR_tweeter
3,699237402188115968,2016-02-15 14:22:42,['https://t.co/1X8LyPkh9n'],RT @CCG_GCC: All @CCG_GCC ships proud to fly the Canadian Flag #FlagDay https://t.co/1X8LyPkh9n,RT ships proud fly Canadian Flag FlagDay https co 1X8LyPkh9n,['#FlagDay'],Social,25,0.8,en,DFO_MAR_tweeter
4,697852645826912256,2016-02-11 18:40:10,"['https://t.co/4J2NDI5JGL', 'https://t.co\xe2\x80\xa6']",RT @DFO_MPO: #DFOScientist Nellie Gagné researches aquatic animal diseases #dayofwomeninscience video: https://t.co/4J2NDI5JGL https://t.co…,RT DFOScientist Nellie researches aquatic animal diseases dayofwomeninscience video https co 4J2NDI5JGL https,"['#DFOScientist', '#dayofwomeninscience']",Social,22,0.0,en,DFO_MAR_tweeter
5,694182701910364160,2016-02-01 15:37:08,"['https://t.co/DIs9ljTJ4I', 'https://t.co/YSPvBQ72jv']",See what BIO biologist Mike James has discovered about how Leatherback #Turtles live https://t.co/DIs9ljTJ4I https://t.co/YSPvBQ72jv,See BIO biologist Mike James discovered Leatherback Turtles live https co DIs9ljTJ4I https co YSPvBQ72jv,['#Turtles'],Social,20,0.13636363636363635,en,DFO_MAR_tweeter
6,701803414783655936,2016-02-22 16:19:07,[],RT @JTFAtlantic: #JRCCHalifax #JRCCGreenland have coordinated delivery of 4 pumps to F/V in distress &amp; crew have confirmed that pumps are w…,RT JTFAtlantic JRCCHalifax JRCCGreenland coordinated delivery pumps distress amp crew confirmed pumps,"['#JRCCHalifax', '#JRCCGreenland']",Economical,19,0.4,en,DFO_MAR_tweeter
7,701803385549365249,2016-02-22 16:19:00,[],RT @JTFAtlantic: #JRCCHalifax is working in close collaboration with #JRCCGreenland to coordinate  ongoing #SAR involving a F/V 220NM of Nu…,RT JTFAtlantic JRCCHalifax working close collaboration JRCCGreenland coordinate ongoing SAR involving 220NM,"['#JRCCHalifax', '#JRCCGreenland', '#SAR']",Social,19,0.0,en,DFO_MAR_tweeter
8,697045180487225344,2016-02-09 13:11:36,"['https://t.co/TTgQbJeYlA', 'https://t.co\xe2\x80\xa6']",RT @DFO_MPO: #DFO is funding 11 more research projects on contaminants. See complete list of projects: https://t.co/TTgQbJeYlA https://t.co…,RT DFO funding 11 research projects contaminants See complete list projects https co TTgQbJeYlA https,['#DFO'],Social,18,0.3,en,DFO_MAR_tweeter
9,694180238348132352,2016-02-01 15:27:20,"['https://t.co/0NG0VrenvB', 'https://t.co/09Nh\xe2\x80\xa6']",RT @DFO_Science: The secret lives of Leatherback #Turtles: What #DFO scientists have discovered - https://t.co/0NG0VrenvB https://t.co/09Nh…,RT secret lives Leatherback Turtles DFO scientists discovered https co 0NG0VrenvB https co,"['#Turtles', '#DFO']",Social,17,-0.4,en,DFO_MAR_tweeter
10,701799609346166785,2016-02-22 16:04:00,"['https://t.co/kOsAIqIDDw', 'https://t.co/JMmgDZo1ir']",RT @DFO_Science: #DFO is leading a study on small craft harbours’ environmental impacts https://t.co/kOsAIqIDDw https://t.co/JMmgDZo1ir,RT DFO leading study small craft environmental impacts https co kOsAIqIDDw https co JMmgDZo1ir,['#DFO'],Social,15,-0.25,en,DFO_MAR_tweeter
11,701768833208610821,2016-02-22 14:01:42,[],RT @JTFAtlantic: #JRCCHalifax confirms F/V taking on water 280 nm east of Iqaluit. C130 Hercules out of #413 Sqn. &amp; Louis St. Laurent @CCG_…,RT JTFAtlantic JRCCHalifax confirms taking water 280 nm east Iqaluit C130 Hercules 413 Sqn amp Louis St Laurent,"['#JRCCHalifax', '#413']",Environmental,15,0.0,en,DFO_MAR_tweeter
12,699237442663116800,2016-02-15 14:22:52,['https://t.co/Y7mHV43FES'],RT @DFO_NL: Officers and crew of #CCGS Terry Fox on a chilly morning in St. John’s #CanadianFlag #FlagDay https://t.co/Y7mHV43FES,RT Officers crew CCGS Terry Fox chilly morning St CanadianFlag FlagDay https co Y7mHV43FES,"['#CCGS', '#CanadianFlag', '#FlagDay']",Environmental,13,-0.6,en,DFO_MAR_tweeter
13,694195603010654209,2016-02-01 16:28:23,['https://t.co/doH6D75omk'],No one was injured at the Bedford Institute of Oceanography and fire damage was restricted to a single building https://t.co/doH6D75omk,one injured Bedford Institute Oceanography fire damage restricted single building https co doH6D75omk,[],Environmental,12,-0.07142857142857142,en,DFO_MAR_tweeter
14,702651517845815296,2016-02-25 00:29:11,['https://t.co/6O2Ew9jRwo'],RT @NewsroomGC: Statement from Minister Hunter Tootoo on F/V Saputi https://t.co/6O2Ew9jRwo,RT NewsroomGC Statement Minister Hunter Tootoo Saputi https co 6O2Ew9jRwo,[],Economical,10,0.0,en,DFO_MAR_tweeter
15,694195674418712580,2016-02-01 16:28:40,['https://t.co/OjBfdkbqKW'],Clean up began overnight at the BIO. Impacts to #DFO &amp; #CCG operations are minimal https://t.co/OjBfdkbqKW,Clean began overnight BIO Impacts DFO amp CCG operations minimal https co OjBfdkbqKW,"['#DFO', '#CCG']",Environmental,9,0.13333333333333336,en,DFO_MAR_tweeter
16,699237520454901761,2016-02-15 14:23:10,['https://t.co/3gv2Z\xe2\x80\xa6'],RT @DFO_NL: Northwesterly winds at Northwest Atlantic Fisheries Centre in St. John’s this morning #CanadianFlag #FlagDay https://t.co/3gv2Z…,RT Northwesterly winds Northwest Atlantic Fisheries Centre St morning CanadianFlag FlagDay https co,"['#CanadianFlag', '#FlagDay']",Environmental,8,0.0,en,DFO_MAR_tweeter
17,694950895172374529,2016-02-03 18:29:39,['https://t.co/fvwBkTzAlY'],"RT @DFO_Science: Science at DFO video! Featuring scientists in labs, on boats, CCG ships and even in the air! https://t.co/fvwBkTzAlY https…",RT Science DFO video Featuring scientists labs boats CCG ships even air https co fvwBkTzAlY,[],Environmental,7,0.0,en,DFO_MAR_tweeter
18,699230044972048385,2016-02-15 13:53:28,['https://t.co/lMtq82U\xe2\x80\xa6'],"RT @carolynraycbc: It's not a holiday for DFO scientists, who are hearing a series of presentations on climate change. https://t.co/lMtq82U…",RT carolynraycbc holiday DFO scientists hearing series presentations climate change https co,[],Environmental,7,0.0,en,DFO_MAR_tweeter
19,702947221155811329,2016-02-25 20:04:12,['https://t.co/weYbtujWKq'],RT @DFO_MPO: Your first step to a new career as a DFO #Fishery Officer Trainee starts here.  Apply now. https://t.co/weYbtujWKq,RT first step new career DFO Fishery Officer Trainee starts Apply https co weYbtujWKq,['#Fishery'],Environmental,7,0.19318181818181807,en,DFO_MAR_tweeter
20,694195493623218177,2016-02-01 16:27:57,[],"The Bedford Institute of Oceanography (BIO) is open today and has been deemed safe, after a fire yesterday #Dartmouth",Bedford Institute Oceanography BIO open today deemed safe fire yesterday Dartmouth,['#Dartmouth'],Social,6,0.25,en,DFO_MAR_tweeter
21,704373245491937283,2016-02-29 18:30:43,"['https://t.co/2HTQxGGHGp', 'https://t.co/YqKVsRCiS5']",We want to hear from you. Consultation on Cusk until March 18th  #SpeciesAtRisk https://t.co/2HTQxGGHGp https://t.co/YqKVsRCiS5,want hear Consultation Cusk March 18th SpeciesAtRisk https co 2HTQxGGHGp https co YqKVsRCiS5,['#SpeciesAtRisk'],Environmental,6,0.0,en,DFO_MAR_tweeter
22,699304432119500800,2016-02-15 18:49:03,['https://t.co/mlcjsynxHn'],"RT @JackieFosterCTV: 10 Scientists, 1 Topic: Climate Change @ Bedford Institute of Oceanography. @CTVAtlantic https://t.co/mlcjsynxHn",RT JackieFosterCTV 10 Scientists Topic Climate Change Bedford Institute Oceanography CTVAtlantic https co mlcjsynxHn,[],Environmental,6,0.0,en,DFO_MAR_tweeter
23,699236805519024129,2016-02-15 14:20:20,['https://t.co/NtwdDiWUBl'],"DFO identifies potential #ClimateChange impacts on ecosystem, infrastructure and fisheries https://t.co/NtwdDiWUBl",DFO identifies potential ClimateChange impacts ecosystem infrastructure fisheries https co NtwdDiWUBl,['#ClimateChange'],Environmental,5,0.0,en,DFO_MAR_tweeter
24,699270349163257856,2016-02-15 16:33:37,['https://t.co/m0vtybn\xe2\x80\xa6'],"RT @DFO_Gulf: Wherever you are, join in the #CanadianFlag Challenge, just like our scientists at the Fisheries Centre! https://t.co/m0vtybn…",RT Wherever join CanadianFlag Challenge like scientists Fisheries Centre https co,['#CanadianFlag'],Environmental,5,0.0,en,DFO_MAR_tweeter
25,699304448636620800,2016-02-15 18:49:07,['https://t.co/OMjsVl\xe2\x80\xa6'],RT @JackieFosterCTV: DFO Scientist Jim Hamilton speaks about changing ice conditions in Northwest Passage. @CTVAtlantic https://t.co/OMjsVl…,RT JackieFosterCTV DFO Scientist Jim Hamilton speaks changing ice conditions Northwest Passage CTVAtlantic https co,[],Environmental,5,0.0,en,DFO_MAR_tweeter
26,699304485764644864,2016-02-15 18:49:16,[],RT @JackieFosterCTV: The 10 DFO scientists @ BIO are presenting results of extensive research on Climate Change. @CTVAtlantic,RT JackieFosterCTV 10 DFO scientists BIO presenting results extensive research Climate Change CTVAtlantic,[],Environmental,5,0.0,en,DFO_MAR_tweeter
27,699304511517675520,2016-02-15 18:49:22,['https://t.co/\xe2\x80\xa6'],RT @JackieFosterCTV: Christine Stortini: what species do we have to worry about when it comes to climate change? @CTVAtlantic https://t.co/…,RT JackieFosterCTV Christine Stortini species worry comes climate change CTVAtlantic https co,[],Environmental,5,0.0,en,DFO_MAR_tweeter
28,696761746002939904,2016-02-08 18:25:20,[],DFO offices in Halifax will close at 3:00 p.m. today,DFO offices Halifax close 00 today,[],Environmental,5,0.0,en,DFO_MAR_tweeter
29,699235332303224834,2016-02-15 14:14:29,"['https://t.co/otwhMCzX', 'https://t.co/DQP0gU9dg']",Dr. John Loder discusses ocean climate trends &amp; projections for #AtlanticCanada https://t.co/otwhMCzXdc https://t.co/DQP0gU9dgD,Dr John Loder discusses ocean climate trends amp projections AtlanticCanada https co otwhMCzXdc https co DQP0gU9dgD,['#AtlanticCanada'],Environmental,4,0.0,en,DFO_MAR_tweeter
30,694686543282335744,2016-02-03 00:59:13,['https://t.co/LSI9Ib5IHe'],RT @YarVanguardnews: Coast Guard captain describes rescue of crew from sinking vessel https://t.co/LSI9Ib5IHe,RT YarVanguardnews Coast Guard captain describes rescue crew sinking vessel https co LSI9Ib5IHe,[],Environmental,4,0.0,en,DFO_MAR_tweeter
31,699220066882215936,2016-02-15 13:13:49,['https://t.co/ady2GAodUs'],DFO Scientists present findings from Aquatic Climate Change Adaptation Services Program (ACCASP) today at BIO https://t.co/ady2GAodUs,DFO Scientists present findings Aquatic Climate Change Adaptation Services Program ACCASP today BIO https co ady2GAodUs,[],Environmental,4,0.0,en,DFO_MAR_tweeter
32,699304464486899712,2016-02-15 18:49:11,['https://t.co/KZiakz3u\xe2\x80\xa6'],RT @JackieFosterCTV: Dave Brickman up next - his topic is Modeling Ocean Climate Change in the Atlantic. @CTVAtlantic https://t.co/KZiakz3u…,RT JackieFosterCTV Dave Brickman next topic Modeling Ocean Climate Change Atlantic CTVAtlantic https co,[],Environmental,4,0.0,en,DFO_MAR_tweeter
33,699304495285665792,2016-02-15 18:49:18,[],"RT @JackieFosterCTV: Scientist Will Perrie speaks about waves &amp; storms in Atlantic Canada.References ""Perfect Storm""in 1991 @CTVAtlantic ht…",RT JackieFosterCTV Scientist Perrie speaks waves amp storms Atlantic Canada References Perfect Storm 1991 CTVAtlantic,[],Environmental,4,1.0,en,DFO_MAR_tweeter
34,699314035293085698,2016-02-15 19:27:13,['https://t.co/z9A7CuL1OX'],"#CandianFlag flies at oldest DFO-owned building, the Esther Lord at St. Andrews Biological Station. Opened in 1909. https://t.co/z9A7CuL1OX",CandianFlag flies oldest DFO owned building Esther Lord St Andrews Biological Station Opened 1909 https co z9A7CuL1OX,['#CandianFlag'],Environmental,4,0.0,en,DFO_MAR_tweeter
35,699253756794433537,2016-02-15 15:27:41,['https://t.co/snecu2YSDN'],Dr. Kumiko Azetsu-Scott discusses ocean acidification in the Atlantic Zone https://t.co/snecu2YSDN,Dr Kumiko Azetsu Scott discusses ocean acidification Atlantic Zone https co snecu2YSDN,[],Social,3,0.0,en,DFO_MAR_tweeter
36,694951494227988480,2016-02-03 18:32:02,['https://t.co/PKhWICT6Mj'],RT @DFO_Gulf: #DFO delegation in Senegal to discuss fisheries management https://t.co/PKhWICT6Mj,RT DFO delegation Senegal discuss fisheries management https co PKhWICT6Mj,['#DFO'],Environmental,3,0.0,en,DFO_MAR_tweeter
37,699258037563998208,2016-02-15 15:44:42,['https://t.co/OgFOJscaqY'],DFO Research Scientist Dr. David Brickman models ocean #ClimateChange in the Atlantic https://t.co/OgFOJscaqY,DFO Research Scientist Dr David Brickman models ocean ClimateChange Atlantic https co OgFOJscaqY,['#ClimateChange'],Environmental,2,0.0,en,DFO_MAR_tweeter
38,697011274169851904,2016-02-09 10:56:52,[],DFO offices in Halifax are closed until 10:00 a.m. today #NSStorm,DFO offices Halifax closed 10 00 today NSStorm,['#NSStorm'],Environmental,2,-0.1,en,DFO_MAR_tweeter
39,699220311443636224,2016-02-15 13:14:47,['https://t.co/UCgpiq51n3'],ACCASP looks at how to incorporate #ClimateChange adaptation science into decision making at DFO https://t.co/UCgpiq51n3,ACCASP looks incorporate ClimateChange adaptation science decision making DFO https co UCgpiq51n3,['#ClimateChange'],Environmental,2,0.0,en,DFO_MAR_tweeter
40,699254202376257536,2016-02-15 15:29:28,['https://t.co/PwJWvvl76Y'],New tool provides mariners with real time information on currents &amp; ice conditions in the Eastern Northwest passage https://t.co/PwJWvvl76Y,New tool provides mariners real time information currents amp ice conditions Eastern Northwest passage https co PwJWvvl76Y,[],Environmental,1,0.16818181818181818,en,DFO_MAR_tweeter
41,699259342583943170,2016-02-15 15:49:53,['https://t.co/FabihI5s'],Dr. William Perrie investigates the potential impact of #ClimateChange on waves and storms in #AtlanticCanada https://t.co/FabihI5sUD,Dr William Perrie investigates potential impact ClimateChange waves storms AtlanticCanada https co FabihI5sUD,"['#ClimateChange', '#AtlanticCanada']",Environmental,1,0.0,en,DFO_MAR_tweeter
42,699260557145305088,2016-02-15 15:54:43,['https://t.co/HUByDgLZZ'],Scientists at BIO examine how to incorporate #ClimateChange science into fisheries &amp; ecosystem management https://t.co/HUByDgLZZd,Scientists BIO examine incorporate ClimateChange science fisheries amp ecosystem management https co HUByDgLZZd,['#ClimateChange'],Environmental,1,0.0,en,DFO_MAR_tweeter
43,699299664655421445,2016-02-15 18:30:07,['https://t.co/sDl8S\xe2\x80\xa6'],"RT @NateTWN: Ten scientists, one topic-Climate Change. Fascinating work being done at BIO. Great to hear about it today. https://t.co/sDl8S…",RT NateTWN Ten scientists one topic Climate Change Fascinating work done BIO Great hear today https co,[],Environmental,1,0.5,en,DFO_MAR_tweeter
44,701858832545398785,2016-02-22 19:59:20,['https://t.\xe2\x80\xa6'],"RT @DigbyNews: Fisheries convictions around SW NS from Aug. to Nov.: Pubnico lobsterman fined $20,000 for fishing untagged traps https://t.…",RT DigbyNews Fisheries convictions around SW NS Aug Nov Pubnico lobsterman fined 20 000 fishing untagged traps https,[],Environmental,1,0.0,en,DFO_MAR_tweeter
