,id,date_published,link,caption_original,caption_cleaned,hashtags,category,Reactions_SUM,average_sentiment_score,language,account_name
60,944240229409525760,2017-12-22 16:16:28,['https://t.co/HKYrLiBGzf'],"#ICYMI Last week, we released our #railway investigation report into the 2016 crossing collision in Sainte-Ursule, Quebec https://t.co/HKYrLiBGzf",ICYMI Last week released railway investigation report 2016 crossing collision Sainte Ursule Quebec https co HKYrLiBGzf,"['#ICYMI', '#railway']",Economical,1,0.0,en,TSBCanada_tweeter
61,942802393728782337,2017-12-18 17:03:01,['https://t.co/hQZuwMiRB6'],"Our investigation is progressing into the October 2017 collision with terrain of a small Piper aircraft near Calgary Springbank Airport, Alberta. See investigation page #A17W0172 https://t.co/hQZuwMiRB6",investigation progressing October 2017 collision terrain small Piper aircraft near Calgary Springbank Airport Alberta See investigation page A17W0172 https co hQZuwMiRB6,['#A17W0172'],Environmental,1,-0.075,en,TSBCanada_tweeter
62,938091831715344385,2017-12-05 17:04:56,['https://t.co/eOmsN11IRk'],"Just released: investigation report into June 2016 train collision near Carvel, AB https://t.co/eOmsN11IRk",released investigation report June 2016 train collision near Carvel AB https co eOmsN11IRk,[],Economical,1,0.1,en,TSBCanada_tweeter
63,938090961426665473,2017-12-05 17:01:28,['https://t.co/RiFWK1xsRr'],"2016 train collision near Carvel, AB, highlights TSB’s calls for physical defences to ensure railway signals are followed https://t.co/RiFWK1xsRr",2016 train collision near Carvel AB highlights calls physical defences ensure railway signals followed https co RiFWK1xsRr,[],Environmental,1,0.05,en,TSBCanada_tweeter
64,937773874166599680,2017-12-04 20:01:29,['https://t.co/dXYLY3TDJn'],Our Strategic Plan enables us to adapt to emerging realities and more effectively advance transportation safety. See how we plan to build a safer transportation system for Canadians https://t.co/dXYLY3TDJn,Strategic Plan enables us adapt emerging realities effectively advance transportation safety See plan build safer transportation system Canadians https co dXYLY3TDJn,[],Social,1,0.55,en,TSBCanada_tweeter
65,944246040760389632,2017-12-22 16:39:34,['https://t.co/bf3aPzaAes'],Job opportunity for public service employees and students: Human Resources Assistant. Join a dynamic team! Apply before January 5 https://t.co/bf3aPzaAes,Job opportunity public service employees students Human Resources Assistant Join dynamic team Apply January https co bf3aPzaAes,[],Environmental,0,0.0,en,TSBCanada_tweeter
66,946107390730096640,2017-12-27 19:55:54,['https://t.co/sc5MkJL2r'],#DYK that TSB Board member Joseph Hincke was RCMP's first Professional Integrity Officer? Learn about the Board members’ background and experience by reading their biographies https://t.co/sc5MkJL2r1,DYK TSB Board member Joseph Hincke RCMP first Professional Integrity Officer Learn Board background experience reading biographies https co sc5MkJL2r1,['#DYK'],Environmental,0,0.175,en,TSBCanada_tweeter
