,id,date_published,link,caption_original,caption_cleaned,hashtags,category,Reactions_SUM,average_sentiment_score,language,account_name
0,401846167974_10154982432302975,2017-01-06 10:00:28,https://www.facebook.com/TransportandInfrastructureinCanada/photos/a.10153859321727975.1073741827.401846167974/10154982432302975/?type=3,Recall: Honda Odyssey. The second row seats may stay in the unlocked position after accessing the third row seats. http://www.tc.gc.ca/tz61n,Recall: Honda Odyssey. The second row seats may stay in the unlocked position after accessing the third row seats.,[],Social,633,0.0,en,TransportandInfrastructureinCanada_facebook
1,401846167974_10155054536787975,2017-01-27 14:50:43,https://www.facebook.com/TransportandInfrastructureinCanada/photos/a.10151569797817975.1073741825.401846167974/10155054536787975/?type=3,A Public Notice has been issued for Orbit Baby G3 Infant Car Seats. http://www.tc.gc.ca/w4ors,A Public Notice has been issued for Orbit Baby G3 Infant Car Seats.,[],Environmental,251,0.0,en,TransportandInfrastructureinCanada_facebook
2,401846167974_10155023099207975,2017-01-19 08:20:09,https://www.facebook.com/TransportandInfrastructureinCanada/photos/a.10151569797817975.1073741825.401846167974/10155023099207975/?type=3,Takata airbag recalls are expanding in Canada. Is your vehicle affected? Find out here: http://www.tc.gc.ca/3f1xz,Takata airbag recalls are eanding in Canada. Is your vehicle affected? Find out here:,[],Environmental,27,0.0,en,TransportandInfrastructureinCanada_facebook
3,401846167974_10154970962292975,2017-01-02 08:01:13,https://www.facebook.com/TransportandInfrastructureinCanada/photos/a.10151569797817975.1073741825.401846167974/10154970962292975/?type=3,It’s a New Year. Make 2017 your safest yet!,It’s a New Year. Make your safest yet!,[],Social,19,0.0,en,TransportandInfrastructureinCanada_facebook
4,401846167974_10155015848477975,2017-01-16 20:01:05,https://www.facebook.com/TransportandInfrastructureinCanada/photos/a.10151569797817975.1073741825.401846167974/10155015848477975/?type=3,"Have you seen our list of Drone Do’s and Don’ts? Visit: 
http://ow.ly/QIAr306VWGB",Have you seen our list of Drone Do’s and Don’ts? Visit:,[],Social,19,0.0,en,TransportandInfrastructureinCanada_facebook
5,401846167974_10155005088017975,2017-01-13 11:00:34,https://www.facebook.com/TransportandInfrastructureinCanada/photos/a.10153859321727975.1073741827.401846167974/10155005088017975/?type=3,Recall: Audi Q5 SUVs. The canister that operates the side head curtain airbag inflator could become corroded. http://www.tc.gc.ca/2ri6o,Recall: Audi Q5 SUVs. The canister that operates the side head curtain airbag inflator could become corroded.,[],Environmental,17,0.0,en,TransportandInfrastructureinCanada_facebook
6,401846167974_10155002708052975,2017-01-12 18:00:33,https://www.facebook.com/TransportandInfrastructureinCanada/photos/a.10153859321727975.1073741827.401846167974/10155002708052975/?type=3,Recall: Audi vehicles. The coolant pump could become blocked and may overheat. http://www.tc.gc.ca/4eg3m,Recall: Audi vehicles. The coolant pump could become blocked and may overheat.,[],Social,17,0.0,en,TransportandInfrastructureinCanada_facebook
7,401846167974_10155052002122975,2017-01-26 16:00:45,https://www.facebook.com/TransportandInfrastructureinCanada/photos/a.10153859321727975.1073741827.401846167974/10155052002122975/?type=3,Recall: Nissan Altima cars. The rear passenger door could unlatch and open when the window is lowered. http://www.tc.gc.ca/mk7y3,Recall: Nissan Altima cars. The rear passenger door could unlatch and open when the window is lowered.,[],Environmental,16,0.0,en,TransportandInfrastructureinCanada_facebook
8,401846167974_10155054089012975,2017-01-27 12:01:33,https://www.facebook.com/TransportandInfrastructureinCanada/photos/a.10151569797817975.1073741825.401846167974/10155054089012975/?type=3,"Pilots: Are you interested in learning more about using repaired parts, flying with skis and more? Check out our new Aviation Safety Letter (ASL): http://ow.ly/Zov0308nHtO","Pilots: Are you interested in learning more about using repaired parts, flying with skis and more? Check out our new Aviation Safety Letter (ASL):",[],Environmental,15,0.0,en,TransportandInfrastructureinCanada_facebook
9,401846167974_10155048676132975,2017-01-25 16:38:55,https://www.facebook.com/TransportandInfrastructureinCanada/videos/10155048676132975/,Our coastlines & marine environment are a part of our national identity! The #OceansProtectionPlan will safeguard them for our future.,Our coastlines & marine environment are a part of our national identity! The will safeguard them for our future.,['#OceansProtectionPlan'],Environmental,15,0.0,en,TransportandInfrastructureinCanada_facebook
10,401846167974_10154985769387975,2017-01-07 11:20:22,https://www.facebook.com/TransportandInfrastructureinCanada/photos/a.10151569797817975.1073741825.401846167974/10154985769387975/?type=3,"Size doesn’t matter, safety is the priority for all aircraft and airports: http://ow.ly/vGoJ306UHyt","Size doesn’t matter, safety is the priority for all aircraft and airports:",[],Environmental,14,0.0,en,TransportandInfrastructureinCanada_facebook
11,401846167974_10154973879512975,2017-01-03 08:01:22,https://www.facebook.com/TransportandInfrastructureinCanada/photos/a.10151569797817975.1073741825.401846167974/10154973879512975/?type=3,"Trivia Tuesday: What does the first ship to port at the Port de Montréal every year receive?
A. Stanley cup replica
B. The Gold-Headed cane
C. Poutine for life",Trivia Tuesday: What does the first ship to port at the Port de Montréal every year receive? A. Stanley cup replica B. The Gold-Headed cane C. Poutine for life,[],Environmental,13,0.0,en,TransportandInfrastructureinCanada_facebook
12,401846167974_10154995222252975,2017-01-10 20:01:10,https://www.facebook.com/TransportandInfrastructureinCanada/photos/a.10151569797817975.1073741825.401846167974/10154995222252975/?type=3,"Snow on the tracks, doesn’t mean they aren’t used. It’s not wise to use train tracks for your photoshoot. Anytime is train time!","Snow on the tracks, doesn’t mean they aren’t used. It’s not wise to use train tracks for your photoshoot. Anytime is train time!",[],Environmental,13,0.0,en,TransportandInfrastructureinCanada_facebook
13,401846167974_10155037383127975,2017-01-23 08:01:33,https://www.facebook.com/TransportandInfrastructureinCanada/photos/a.10151569797817975.1073741825.401846167974/10155037383127975/?type=3,"Did you know, we have people in 80 regional offices and service centres across the country http://www.tc.gc.ca/0urrd","Did you know, we have people in regional offices and service centres across the country d",[],Environmental,12,0.0,en,TransportandInfrastructureinCanada_facebook
14,401846167974_10155057044387975,2017-01-28 13:15:45,https://www.facebook.com/TransportandInfrastructureinCanada/photos/a.10151569797817975.1073741825.401846167974/10155057044387975/?type=3,Did you know: On average a plane leaves Toronto Pearson International Airport  every 80 seconds!,Did you know: On average a plane leaves Toronto Pearson International Airport every seconds!,[],Environmental,11,0.0,en,TransportandInfrastructureinCanada_facebook
15,401846167974_10155018796582975,2017-01-17 20:01:38,https://www.facebook.com/TransportandInfrastructureinCanada/photos/a.10151569797817975.1073741825.401846167974/10155018796582975/?type=3,We work with our partners to protect Canada’s coasts. http://ow.ly/X4Sc306VWUs,We work with our partners to protect Canada’s coasts.,[],Environmental,11,0.0,en,TransportandInfrastructureinCanada_facebook
16,401846167974_10154972720537975,2017-01-02 20:00:53,https://www.facebook.com/TransportandInfrastructureinCanada/photos/a.10151569797817975.1073741825.401846167974/10154972720537975/?type=3,Oceans Protection Plan: Creating a stronger evidence base to improve marine safety on our coasts http:// ow.ly/WapM3072IG3,Oceans Protection Plan: Creating a stronger evidence base to improve marine safety on our coasts http://,[],Environmental,10,0.0,en,TransportandInfrastructureinCanada_facebook
17,401846167974_10155038123682975,2017-01-23 12:33:58,https://www.facebook.com/TransportandInfrastructureinCanada/photos/a.10151569797817975.1073741825.401846167974/10155038123682975/?type=3,"Transport Canada and its federal partners are visiting communities and meeting with stakeholders to talk about the Canada’s #OceansProtectionsPlan and what it means for communities, marine safety, the environment, industry and local economies.","Transport Canada and its federal partners are visiting communities and meeting with stakeholders to talk about the Canada’s and what it means for communities, marine safety, the environment, industry and local economies.",['#OceansProtectionsPlan'],Environmental,10,0.0,en,TransportandInfrastructureinCanada_facebook
18,401846167974_10154993693787975,2017-01-10 08:01:44,https://www.facebook.com/TransportandInfrastructureinCanada/photos/a.10151569797817975.1073741825.401846167974/10154993693787975/?type=3,"Trivia Tuesday: What is the maximum number of carry-on bags allowed?
A. 1
B. 4
C. 2
D. 3",Trivia Tuesday: What is the maximum number of carry-on bags allowed? A. B. C. D.,[],Social,9,0.0,en,TransportandInfrastructureinCanada_facebook
19,401846167974_10155011469212975,2017-01-15 11:40:21,https://www.facebook.com/TransportandInfrastructureinCanada/photos/a.10151569797817975.1073741825.401846167974/10155011469212975/?type=3,Make sure your car seat is installed properly. Visit a car seat clinic near you: http://ow.ly/wvcy306KYKP,Make sure your car seat is installed properly. Visit a car seat clinic near you:,[],Social,9,0.0,en,TransportandInfrastructureinCanada_facebook
20,401846167974_10154979331302975,2017-01-05 07:00:56,https://www.facebook.com/TransportandInfrastructureinCanada/photos/a.10153859321727975.1073741827.401846167974/10154979331302975/?type=3,Recall: Jaguar F-Type and XE cars. The front seat belt assembly may not meet specification.  http://www.tc.gc.ca/mcsmw,Recall: Jaguar F-Type and XE cars. The front seat belt assembly may not meet specification.,[],Social,8,0.0,en,TransportandInfrastructureinCanada_facebook
21,401846167974_10154977667987975,2017-01-04 16:00:25,https://www.facebook.com/TransportandInfrastructureinCanada/photos/a.10153859321727975.1073741827.401846167974/10154977667987975/?type=3,Recall: Land Rover & Range Rover SUVs. The front seat belt assembly may not meet specification.  http://www.tc.gc.ca/u5eje,Recall: Land Rover & Range Rover SUVs. The front seat belt assembly may not meet specification.,[],Social,8,0.0,en,TransportandInfrastructureinCanada_facebook
22,401846167974_10155059980222975,2017-01-29 14:30:34,https://www.facebook.com/TransportandInfrastructureinCanada/photos/a.10151569797817975.1073741825.401846167974/10155059980222975/?type=3,"Our #Canada150 moment. Elsie MacGill, oversaw the production of Canadian Hawker Hurricanes during WWII Canada Aviation and Space Museum has one on display!","Our moment. Elsie MacGill, oversaw the production of Canadian Hawker Hurricanes during WWII Canada Aviation and Space Museum has one on display!",['#Canada150'],Social,8,0.0,en,TransportandInfrastructureinCanada_facebook
23,401846167974_10155034393552975,2017-01-22 15:01:13,https://www.facebook.com/TransportandInfrastructureinCanada/photos/a.10151569797817975.1073741825.401846167974/10155034393552975/?type=3,This symbol means your winter tires were designed for snowy conditions and meet our performance requirements.,This symbol means your winter tires were designed for snowy conditions and meet our performance requirements.,[],Environmental,7,0.0,en,TransportandInfrastructureinCanada_facebook
24,401846167974_10155066856017975,2017-01-31 14:30:35,https://www.facebook.com/TransportandInfrastructureinCanada/photos/a.10153859321727975.1073741827.401846167974/10155066856017975/?type=3,Recall: Toyota Tundra trucks with a rear plastic step bumper. The reinforcement brackets could become damaged in a rear impact crash. http://www.tc.gc.ca/v16nv,Recall: Toyota Tundra trucks with a rear plastic step bumper. The reinforcement brackets could become damaged in a rear impact crash.,[],Environmental,6,0.0,en,TransportandInfrastructureinCanada_facebook
25,401846167974_10154975440222975,2017-01-03 20:01:06,https://www.facebook.com/TransportandInfrastructureinCanada/photos/a.10151569797817975.1073741825.401846167974/10154975440222975/?type=3,Did you know: winter tires use a rubber compound as well as different tread patterns than All-Season tires to provide better traction,Did you know: winter tires use a rubber compound as well as different tread patterns than All-Season tires to provide better traction,[],Social,6,0.0,en,TransportandInfrastructureinCanada_facebook
26,401846167974_10155057394177975,2017-01-28 16:00:57,https://www.facebook.com/TransportandInfrastructureinCanada/photos/a.10151569797817975.1073741825.401846167974/10155057394177975/?type=3,Canada’s #OceansProtectionPlan will make vessel owners responsible and liable for derelict and wrecked vessels. http://ow.ly/9RHK308nNjd,Canada’s will make vessel owners responsible and liable for derelict and wrecked vessels. d,['#OceansProtectionPlan'],Environmental,5,0.0,en,TransportandInfrastructureinCanada_facebook
27,401846167974_10155050862187975,2017-01-26 08:01:40,https://www.facebook.com/TransportandInfrastructureinCanada/photos/a.10151569797817975.1073741825.401846167974/10155050862187975/?type=3,Carnaval de Québec begins today! Enjoy its amazing activities. Leave the drone at home. The Carnaval is a No Drone Zone.,Carnaval de Québec begins today! Enjoy its amazing activities. Leave the drone at home. The Carnaval is a No Drone Zone.,[],Social,5,0.0,en,TransportandInfrastructureinCanada_facebook
28,401846167974_10155021725892975,2017-01-18 20:01:33,https://www.facebook.com/TransportandInfrastructureinCanada/photos/a.10151569797817975.1073741825.401846167974/10155021725892975/?type=3,What do you do if you think your vehicle has a safety defect? Find out here: http://ow.ly/dutA307Z2nW,What do you do if you think your vehicle has a safety defect? Find out here:,[],Social,5,0.0,en,TransportandInfrastructureinCanada_facebook
29,401846167974_10155017100737975,2017-01-17 08:01:40,https://www.facebook.com/TransportandInfrastructureinCanada/photos/a.10151569797817975.1073741825.401846167974/10155017100737975/?type=3,"Trivia Tuesday: True or False, Your car battery is just as reliable in winter as it is in summer.","Trivia Tuesday: True or False, Your car battery is just as reliable in winter as it is in summer.",[],Environmental,4,0.0,en,TransportandInfrastructureinCanada_facebook
30,401846167974_10155026365677975,2017-01-20 11:29:18,https://www.facebook.com/TransportandInfrastructureinCanada/photos/a.10151569797817975.1073741825.401846167974/10155026365677975/?type=3,"The tide is turning for one of the East Coast’s most vibrant natural wonders! 

Over the past decades the beautiful Petitcodiac River has been polluted by wastewater runoff and a weakened tidal bore. 

Infrastructure Canada is supporting New Brunswick's ongoing efforts to restore the river to its former glory by constructing a new bridge to realign the causeway, improving the direction and intensity of the water flow underneath. In the neighboring Riverview, Infrastructure Canada is funding upgrades to the TransAqua wastewater facility, adding a secondary level of treatment to ensure cleaner water flows into the Petitcodiac River. 

Learn more about INFC’s investments in the restoration of the Petitcodiac River:
http://ow.ly/2iZL308caOo
http://ow.ly/EdAz308caSv","The tide is turning for one of the East Coast’s most vibrant natural wonders! Over the past decades the beautiful Petitcodiac River has been polluted by wastewater runoff and a weakened tidal bore. Infrastructure Canada is supporting New Brunswick's ongoing efforts to restore the river to its former glory by constructing a new bridge to realign the causeway, improving the direction and intensity of the water flow underneath. In the neighboring Riverview, Infrastructure Canada is funding upgrades to the TransAqua wastewater facility, adding a secondary level of treatment to ensure cleaner water flows into the Petitcodiac River. Learn more about INFC’s investments in the restoration of the Petitcodiac River:",[],Environmental,4,0.0,en,TransportandInfrastructureinCanada_facebook
31,401846167974_10155038728002975,2017-01-23 15:01:00,https://www.facebook.com/TransportandInfrastructureinCanada/photos/a.10151569797817975.1073741825.401846167974/10155038728002975/?type=3,We’re seeking assistance finding the owner of this unregistered 18 foot and 9’ fibreglass boat with an inboard motor. The boat was found near the Longueuil shore in Quebec. Email us: PPNQUE-NNPQUE@tc.gc.ca,We’re seeking assistance finding the owner of this unregistered foot and ’ fibreglass boat with an inboard motor. The boat was found near the Longueuil shore in Quebec. Email us: PPNQUE-NNPQUE.gc.ca,[],Environmental,4,0.0,en,TransportandInfrastructureinCanada_facebook
32,401846167974_10155047763557975,2017-01-25 11:42:37,https://www.facebook.com/TransportandInfrastructureinCanada/photos/a.10151569797817975.1073741825.401846167974/10155047763557975/?type=3,"Today, officials are in Vancouver, B.C. talking to environmental NGOs, industry, Indigenous groups and government about Canada’s #OceansProtectionPlan. 

Among many other initiatives, the Government of Canada is working to address key threats to marine wildlife and killer whales in particular including a real-time whale detection system to alert mariners to the presence of whales and other marine mammals. 

Learn more about the what the Ocean’s Protection Plan means for Vancouver and Southern B.C.: http://ow.ly/tSZ8307RSd4","Today, officials are in Vancouver, B.C. talking to environmental NGOs, industry, Indigenous groups and government about Canada’s . Among many other initiatives, the Government of Canada is working to address key threats to marine wildlife and killer whales in particular including a real-time whale detection system to alert mariners to the presence of whales and other marine mammals. Learn more about the what the Ocean’s Protection Plan means for Vancouver and Southern B.C.:",['#OceansProtectionPlan'],Environmental,4,0.0,en,TransportandInfrastructureinCanada_facebook
33,401846167974_10155049120572975,2017-01-25 19:00:32,https://www.facebook.com/TransportandInfrastructureinCanada/photos/a.10151569797817975.1073741825.401846167974/10155049120572975/?type=3,#OceansProtectionPlan: Working to understand the impacts of underwater noise on marine life #OurCoasts http://ow.ly/H4pK308lTsf,: Working to understand the impacts of underwater noise on marine life,"['#OceansProtectionPlan', '#OurCoasts']",Environmental,4,0.0,en,TransportandInfrastructureinCanada_facebook
34,401846167974_10155052574942975,2017-01-26 20:01:08,https://www.facebook.com/TransportandInfrastructureinCanada/photos/a.10151569797817975.1073741825.401846167974/10155052574942975/?type=3,"On this day in 1906, the RMS Empress of Ireland set out on her maiden voyage from Liverpool to Quebec.","On this day in , the RMS Empress of Ireland set out on her maiden voyage from Liverpool to Quebec.",[],Social,4,0.0,en,TransportandInfrastructureinCanada_facebook
35,401846167974_10155051726442975,2017-01-26 13:58:24,https://www.facebook.com/TransportandInfrastructureinCanada/photos/a.10151569797817975.1073741825.401846167974/10155051726442975/?type=3,"Canada’s #OceansProtectionPlan will prohibit the abandonment of vessels.
http://ow.ly/9RHK308nNjd",Canada’s will prohibit the abandonment of vessels. d,['#OceansProtectionPlan'],Environmental,2,0.0,en,TransportandInfrastructureinCanada_facebook
