,id,date_published,link,caption_original,caption_cleaned,hashtags,category,Reactions_SUM,average_sentiment_score,language,account_name
0,817461242390581249,2017-01-06 20:02:02,['https://t.co/mj3JJXq7Jk\xe2\x80\xa6'],RT @ONU_fr: Quel est l’impact des #changementsclimatiques sur la santé? L’OMS vous l’explique en une #infographie : https://t.co/mj3JJXq7Jk…,RT Quel est impact des changementsclimatiques sur la OMS vous explique en une infographie https co,"['#changementsclimatiques', '#infographie']",Social,88,0.0,fr,ministre_ec_tweeter
1,816346578726387712,2017-01-03 18:12:46,"['https://t.co/jWQs1MrNpy', 'https://t.co/uQbxE2A4Js']",RT @PMcanadien: Ne ratez pas les célébrations de #Canada150 à l’échelle du Canada en 2017: https://t.co/jWQs1MrNpy https://t.co/uQbxE2A4Js,RT PMcanadien Ne ratez pas les brations de Canada150 chelle du Canada en 2017 https co jWQs1MrNpy https co uQbxE2A4Js,['#Canada150'],Social,31,0.0,es,ministre_ec_tweeter
2,817111708238049285,2017-01-05 20:53:07,['https://t.co/M7tvU562Ry'],"RT @PMcanadien: Cette année, découvrez notre grand pays avec la carte d’entrée gratuite de @ParcsCanada: https://t.co/M7tvU562Ry #Canada150…",RT PMcanadien Cette couvrez notre grand pays avec la carte gratuite de ParcsCanada https co M7tvU562Ry,['#Canada150'],Social,29,0.5,fr,ministre_ec_tweeter
3,816341970708742144,2017-01-03 17:54:27,['https://t.co/42BEDdCuCP'],RT @CCNUCC: La France présente son plan climat national à long terme auprès de la @CCNUCC https://t.co/42BEDdCuCP #AccordDeParis @ecologiEn…,RT CCNUCC La France sente son plan climat national long terme de la CCNUCC https co 42BEDdCuCP AccordDeParis,['#AccordDeParis'],Environmental,25,-0.05,fr,ministre_ec_tweeter
4,817048540698607617,2017-01-05 16:42:06,['https://t.co/zM0\xe2\x80\xa6'],"RT @canada150e: Cette année, des projets d'envergure marqueront notre histoire. Participez-y! #Canada150 #Ensemble #Canada https://t.co/zM0…",RT canada150e Cette des projets envergure marqueront notre histoire Participez Canada150 Ensemble Canada https co,"['#Canada150', '#Ensemble', '#Canada']",Social,25,0.0,pt,ministre_ec_tweeter
5,822523115762831362,2017-01-20 19:16:07,['https://t.co\xe2\x80\xa6'],"RT @UNEPfr: ""Connectons-nous à la Nature"" est le thème de la #JournéeMondialeDelEnvironnement2017. Quel slogan préférez-vous ? https://t.co…",RT UNEPfr Connectons nous la Nature est le de la eMondialeDelEnvironnement2017 Quel slogan rez vous https,['#Journ'],Environmental,23,0.0,fr,ministre_ec_tweeter
6,824319188336517124,2017-01-25 18:13:04,"['https://t.co/yebeYdWlhw', 'https://t.co/dZw\xe2\x80\xa6']",RT @PMcanadien: Le premier ministre Trudeau annonce les 11 nouveaux membres du #ConseilJeunessePM: https://t.co/yebeYdWlhw https://t.co/dZw…,RT PMcanadien Le premier ministre Trudeau annonce les 11 nouveaux membres du ConseilJeunessePM https co yebeYdWlhw https co,['#ConseilJeunessePM'],Social,20,0.0,fr,ministre_ec_tweeter
7,818495924313980928,2017-01-09 16:33:29,['https://\xe2\x80\xa6'],RT @PMcanadien: Participez au concours #VoicimonCanada en exprimant ce que le Canada signifie pour vous dans une vidéo de 30 sec.: https://…,RT PMcanadien Participez au concours VoicimonCanada en exprimant ce que le Canada signifie pour vous dans une de 30 sec https,['#VoicimonCanada'],Social,20,-0.1,fr,ministre_ec_tweeter
8,818880138083532801,2017-01-10 18:00:13,"['https://t.co/gNojcArir5', 'https://t.co/jAIufIGEdB']",Comment pouvons-nous jouir des lieux protégés du Canada et les préserver pour les générations futures? https://t.co/gNojcArir5 #ParlonsParcs https://t.co/jAIufIGEdB,Comment pouvons nous jouir des lieux du Canada et les server pour les rations futures https co gNojcArir5 ParlonsParcs https co jAIufIGEdB,['#ParlonsParcs'],Social,17,0.0,fr,ministre_ec_tweeter
9,821838483606085634,2017-01-18 21:55:38,[],"RT @CommerceCanada: Le Canada veut faire avancer un programme commercial progressiste pour rendre la mondialisation plus efficace, équitabl…",RT CommerceCanada Le Canada veut faire avancer un programme commercial progressiste pour rendre la mondialisation plus efficace,[],Economical,15,0.0,fr,ministre_ec_tweeter
10,816353189914091520,2017-01-03 18:39:02,['https://t.co/\xe2\x80\xa6'],RT @COP22: Visitez la page d'information @CCNUCC pour en savoir plus sur la #COP23 qui se tiendra du 6 au 17 nov. 2017 à Bonn https://t.co/…,RT COP22 Visitez la page information CCNUCC pour en savoir plus sur la COP23 qui se tiendra du au 17 nov 2017 Bonn https co,['#COP23'],Environmental,15,0.0,fr,ministre_ec_tweeter
11,817102427543453696,2017-01-05 20:16:14,[],"RT @AuCanada: Modifiez votre 🗓, 2017 est l’année idéale pour visiter le Canada! Ne ratez pas les festivités #Canada150  prévues partout au…",RT AuCanada Modifiez votre 2017 est ale pour visiter le Canada Ne ratez pas les Canada150 vues partout,['#Canada150'],Social,14,0.0,fr,ministre_ec_tweeter
12,823643106075668480,2017-01-23 21:26:33,['https://\xe2\x80\xa6'],"RT @Transports_gc: #DunOcéanÀLautre Le #PlanDeProtectionDesOcéans, un système de #sécurité parmi les meilleurs au monde. #NosCôtes https://…",RT Lautre Le ans un de parmi les meilleurs au monde tes https,"['#DunOc', '#PlanDeProtectionDesOc', '#s', '#NosC']",Economical,13,0.0,fr,ministre_ec_tweeter
13,821450088249704448,2017-01-17 20:12:17,['https://t.co/6hK1VjYWJi'],RT @canada150e: Découvrez le contenu à venir pour #Canada150 https://t.co/6hK1VjYWJi,RT canada150e couvrez le contenu venir pour Canada150 https co 6hK1VjYWJi,['#Canada150'],Social,12,0.0,fr,ministre_ec_tweeter
14,821838404484820992,2017-01-18 21:55:19,[],RT @CommerceCanada: Qu’est-ce que le Forum économique mondial (FEM)? Apprenez-en plus sur cette rencontre annuelle et pourquoi le Canada y…,RT CommerceCanada est ce que le Forum conomique mondial FEM Apprenez en plus sur cette rencontre annuelle et pourquoi le Canada,[],Economical,12,0.0,fr,ministre_ec_tweeter
15,824370034579505152,2017-01-25 21:35:06,['https://t.co/D6zpqfXSCP'],L’accord d’auj. est une étape importante de notre engagement en faveur de la réconciliation avec les peuples autochtones. https://t.co/D6zpqfXSCP,accord auj est une tape importante de notre engagement en faveur de la conciliation avec les peuples autochtones https co D6zpqfXSCP,[],Social,11,0.0,fr,ministre_ec_tweeter
16,820329335219490818,2017-01-14 17:58:49,"['https://t.co/JYgBaopRai', 'https://t.co/8z23LvnB9x']",#Montréal #ParlonsParcs. Venez rejoindre Parka et Boule de Neige  @ParcJeanDrapeau pour Fête des Neiges aujourd’hui. https://t.co/JYgBaopRai https://t.co/8z23LvnB9x,al ParlonsParcs Venez rejoindre Parka et Boule de Neige ParcJeanDrapeau pour des Neiges hui https co JYgBaopRai https co 8z23LvnB9x,"['#Montr', '#ParlonsParcs']",Environmental,11,0.0,fr,ministre_ec_tweeter
17,818488955343605761,2017-01-09 16:05:48,[],"RT @Transports_gc: Il fait froid? Rappel: 30 secondes suffisent pour réchauffer le moteur, même par froid extrême #ConduiteHivernale https:…",RT Il fait froid Rappel 30 secondes suffisent pour chauffer le moteur par froid ConduiteHivernale https,['#ConduiteHivernale'],Economical,11,0.0,fr,ministre_ec_tweeter
18,819212479624572929,2017-01-11 16:00:50,"['https://t.co/7gQ08fo6Y', 'https://t.co/tGkXKHWJep']",Comment @parcscanada peut faire connaître les endroits qui racontent l’histoire du Canada? Votre avis https://t.co/7gQ08fo6Y1  #ParlonsParcs https://t.co/tGkXKHWJep,Comment parcscanada peut faire tre les endroits qui racontent histoire du Canada Votre avis https co 7gQ08fo6Y1 ParlonsParcs https co tGkXKHWJep,['#ParlonsParcs'],Environmental,10,0.0,fr,ministre_ec_tweeter
19,817470998823976964,2017-01-06 20:40:48,[],RT @canada150e: Être VIP durant la fête du Canada en 2017 ça vous dit? Participez dès maintenant au #défidelafêteducanada #Canada150 https:…,RT canada150e tre VIP durant la du Canada en 2017 vous dit Participez maintenant au Canada150 https,"['#d', '#Canada150']",Social,10,0.0,ca,ministre_ec_tweeter
20,816999448756658177,2017-01-05 13:27:02,['https://t.co/FWt1OlGVx'],Le gouvernement du Canada s’est engagé à assurer un avenir plus vert pour les Canadiens. #ActionClimatCAN. https://t.co/FWt1OlGVxu,Le gouvernement du Canada est assurer un avenir plus vert pour les Canadiens ActionClimatCAN https co FWt1OlGVxu,['#ActionClimatCAN'],Environmental,10,0.0,fr,ministre_ec_tweeter
21,824363144378204162,2017-01-25 21:07:44,['https://t.co/Gzm2fwByIg'],.@ParcsCanada accueille favorablement les occasions de continuer à renforcer les relations avec les peuples autochtones du Canada. https://t.co/Gzm2fwByIg,ParcsCanada accueille favorablement les occasions de continuer renforcer les relations avec les peuples autochtones du Canada https co Gzm2fwByIg,[],Social,9,0.0,fr,ministre_ec_tweeter
22,822521170821951489,2017-01-20 19:08:23,['https://t.co/rU3EEKoDvg'],Castle en Alberta est une zone d'importance biologique protégée #AichiTarget11 (en anglais) https://t.co/rU3EEKoDvg,Castle en Alberta est une zone importance biologique AichiTarget11 en anglais https co rU3EEKoDvg,['#AichiTarget11'],Economical,8,0.0,fr,ministre_ec_tweeter
23,817414211303329792,2017-01-06 16:55:09,['https://t.co/4zpmfgFl3B'],RT @MindesSciences: Les scientifiques @environnementca étudient l’eau douce dans l’intérêt de tous les Canadiens. https://t.co/4zpmfgFl3B #…,RT MindesSciences Les scientifiques environnementca tudient eau douce dans de tous les Canadiens https co 4zpmfgFl3B,['#'],Environmental,8,0.0,fr,ministre_ec_tweeter
24,817476304962457600,2017-01-06 21:01:53,[],RT @environnementca: #SVQ les arbres naturels sont recyclables? Ils se transforment en #compost et paillis. N’oubliez pas de les recycler!…,RT environnementca SVQ les arbres naturels sont recyclables Ils se transforment en compost et paillis oubliez pas de les recycler,"['#SVQ', '#compost']",Environmental,8,0.0,fr,ministre_ec_tweeter
25,817087136503595011,2017-01-05 19:15:28,['https://t.co/t9Ea6IvM8n'],Parlons de Parcs Canada! https://t.co/t9Ea6IvM8n,Parlons de Parcs Canada https co t9Ea6IvM8n,[],Social,8,0.0,ca,ministre_ec_tweeter
26,824361315472961538,2017-01-25 21:00:28,"['https://t.co/7gQ08fo6Y', 'https://t.co/Q0tASB4j2F']","Merci à Darren Fisher, député de Darthmouth–Cole Harbour, qui a animé #ParlonsParcs ajdh à Halifax. https://t.co/7gQ08fo6Y1 #BellCause https://t.co/Q0tASB4j2F",Merci Darren Fisher de Cole Harbour qui ParlonsParcs ajdh Halifax https co 7gQ08fo6Y1 BellCause https co Q0tASB4j2F,"['#ParlonsParcs', '#BellCause']",Social,8,0.0,en,ministre_ec_tweeter
27,823977462396833793,2017-01-24 19:35:10,['https://t.co/iRz7gx9xez'],RT @canada150e: Visitez le plus grand terrain de jeux de neige du continent du 3 au 20 février! #Canada150 https://t.co/iRz7gx9xez,RT canada150e Visitez le plus grand terrain de jeux de neige du continent du au 20 vrier Canada150 https co iRz7gx9xez,['#Canada150'],Social,8,0.625,fr,ministre_ec_tweeter
28,825076880898408454,2017-01-27 20:23:52,"['https://t.co/zqsPKX9QjL', 'https://t.co/qFPo4jcTi4']",RT @canada150e: Nous avons hâte de voir vos superbes photos! #Drapeaucanadien #Canada150 https://t.co/zqsPKX9QjL https://t.co/qFPo4jcTi4,RT canada150e Nous avons te de voir vos superbes photos Drapeaucanadien Canada150 https co zqsPKX9QjL https co qFPo4jcTi4,"['#Drapeaucanadien', '#Canada150']",Environmental,7,0.0,pt,ministre_ec_tweeter
29,824689633405521920,2017-01-26 18:45:05,['https://t.co/KwPcfjv5Hz'],#ActionClimatCAN signifie plus de bornes de recharge pour les véhicules électriques. Renseignez-vous : https://t.co/KwPcfjv5Hz,ActionClimatCAN signifie plus de bornes de recharge pour les hicules lectriques Renseignez vous https co KwPcfjv5Hz,['#ActionClimatCAN'],Environmental,7,0.0,fr,ministre_ec_tweeter
30,825052017718554625,2017-01-27 18:45:04,['https://t.co/4u2F3sdYzX'],L’avenir de nos enfants passe par la protection de la planète. Découvrez la contribution du Can : #ActionClimatCAN https://t.co/4u2F3sdYzX,avenir de nos enfants passe par la protection de la te couvrez la contribution du ActionClimatCAN https co 4u2F3sdYzX,['#ActionClimatCAN'],Social,7,0.0,fr,ministre_ec_tweeter
31,815591842129608705,2017-01-01 16:13:42,['https://t.co/dJU7xB4tc7'],Je suis si fière du travail accompli en 2016 et j'ai très hâte de voir ce qui nous attend en 2017! #Canada150 https://t.co/dJU7xB4tc7,Je suis si du travail accompli en 2016 et ai te de voir ce qui nous attend en 2017 Canada150 https co dJU7xB4tc7,['#Canada150'],Social,7,0.0,fr,ministre_ec_tweeter
32,816316891845234689,2017-01-03 16:14:48,['https://t.co/yWkGMr5xoR'],"Le Canada a joué un rôle important à la #COP22 à Marrakech, au Maroc, en novembre dernier. https://t.co/yWkGMr5xoR",Le Canada un le important la COP22 Marrakech au Maroc en novembre dernier https co yWkGMr5xoR,['#COP22'],Economical,7,0.4,fr,ministre_ec_tweeter
33,816665586877009920,2017-01-04 15:20:23,['https://t.co/oRKBHYDepV'],"Automne dern., j’ai visité usine autobus New Flyer, à #Winnipeg. Ces autobus élect. aideront eff. transition vers écon. sobre en carb. https://t.co/oRKBHYDepV",Automne dern ai usine autobus New Flyer Winnipeg Ces autobus lect aideront eff transition vers con sobre en carb https co oRKBHYDepV,['#Winnipeg'],Environmental,7,0.13636363636363635,fr,ministre_ec_tweeter
34,824343489064423428,2017-01-25 19:49:38,[],"RT @RNCan: De la restauration des forêts au contrôle de la qualité de l’air, voici quelques #SVQ sur l’#Adaptation au #ChangementClimatique…",RT RNCan De la restauration des au le de la de air voici quelques SVQ sur Adaptation au,"['#SVQ', '#Adaptation', '#ChangementClimatique']",Environmental,7,0.0,fr,ministre_ec_tweeter
35,824378853527265280,2017-01-25 22:10:09,['https://t.co/mygFz1JBiF'],"Aujourd’hui, le #ConseilJeunessePM et moi avons discuté d’établissement de relation de nation à nation avec les peuples autochtones. https://t.co/mygFz1JBiF",hui le ConseilJeunessePM et moi avons tablissement de relation de nation nation avec les peuples autochtones https co mygFz1JBiF,['#ConseilJeunessePM'],Social,7,0.0,fr,ministre_ec_tweeter
36,819652921709252609,2017-01-12 21:10:59,[],RT @Transports_gc: #PlanDeProtectionDesOcéans: Essai et application de techno d’intervention en cas de déversement le long de #NosCôtes htt…,RT ans Essai et application de techno intervention en cas de versement le long de tes,"['#PlanDeProtectionDesOc', '#NosC']",Economical,6,-0.05,fr,ministre_ec_tweeter
37,822144209536827392,2017-01-19 18:10:28,[],Demande mondiale de technologies propres augmente. #SVQ plus de 87 % des entreprises tech. propres du CAN exportent déjà leurs produits?,Demande mondiale de technologies propres augmente SVQ plus de 87 des entreprises tech propres du exportent leurs produits,['#SVQ'],Economical,6,0.0,fr,ministre_ec_tweeter
38,821047602120683524,2017-01-16 17:32:57,['https://t.co\xe2\x80\xa6'],RT @CommerceCanada: Des ministres participeront à la réunion annuelle du Forum économique mondial du 17 au 20 janvier #FÉM2017 https://t.co…,RT CommerceCanada Des ministres participeront la union annuelle du Forum conomique mondial du 17 au 20 janvier M2017 https,['#F'],Economical,6,0.0,fr,ministre_ec_tweeter
39,822803287208497153,2017-01-21 13:49:25,['https://t.co/i31kV5dF0W'],https://t.co/i31kV5dF0W,https co i31kV5dF0W,[],Social,6,0.0,it,ministre_ec_tweeter
40,818170661638144000,2017-01-08 19:01:01,"['https://t.co/JYgBaopRai', 'https://t.co/gnBTqb3']","Consultations Parlons Parcs Canada! s’ouvrent demain. Vous voulez organiser une discussion ouverte? Guide pratique: 
https://t.co/JYgBaopRai https://t.co/gnBTqb30U2",Consultations Parlons Parcs Canada ouvrent demain Vous voulez organiser une discussion ouverte Guide pratique https co JYgBaopRai https co gnBTqb30U2,[],Environmental,6,0.0,fr,ministre_ec_tweeter
41,819949221424099332,2017-01-13 16:48:22,['https://t.co/Wt5j\xe2\x80\xa6'],RT @Transports_gc: #LSV: Les voitures électriques produisent jusqu’à 60% moins de #CO2 que celles à essence ou au diésel. https://t.co/Wt5j…,RT LSV Les voitures lectriques produisent 60 moins de CO2 que celles essence ou au sel https co,"['#LSV', '#CO2']",Economical,6,0.0,fr,ministre_ec_tweeter
42,816642919650263041,2017-01-04 13:50:19,['https://t.co/r6MEFbVF8m'],Bcp de choses se produisent au Can. en #2017. Ns organiserons entre autres la Journée mond. de l’enviro. #JME2017 https://t.co/r6MEFbVF8m,Bcp de choses se produisent au en 2017 Ns organiserons entre autres la mond de enviro JME2017 https co r6MEFbVF8m,"['#2017', '#JME2017']",Environmental,6,0.0,fr,ministre_ec_tweeter
43,823911151411068928,2017-01-24 15:11:40,"['https://t.co/BnZHRnzKFm', 'https://t.\xe2\x80\xa6']",RT @RNCan: Voyez les centrales hydroélectriques du Canada sur notre carte #ÉnergiePropre #CartesOuvertes https://t.co/BnZHRnzKFm https://t.…,RT RNCan Voyez les centrales lectriques du Canada sur notre carte nergiePropre CartesOuvertes https co BnZHRnzKFm https,"['#', '#CartesOuvertes']",Environmental,6,0.0,fr,ministre_ec_tweeter
44,817121043634671619,2017-01-05 21:30:12,['https://t.co/XIYOXvGipJ'],RT @MPO_MAR: Pour toute info sur les poissons et autres espèces retrouvés sur les côtes de Nouvelle-Écosse : https://t.co/XIYOXvGipJ,RT Pour toute info sur les poissons et autres ces sur les tes de Nouvelle cosse https co XIYOXvGipJ,[],Social,6,0.0,fr,ministre_ec_tweeter
45,817377913129598976,2017-01-06 14:30:55,"['https://t.co/ohY1czJJ9B', 'https://t.co/I9v5Og2g8T']","Apprenez-en plus sur les investissements que fait le Canada dans l’infrastructure verte :
https://t.co/ohY1czJJ9B https://t.co/I9v5Og2g8T",Apprenez en plus sur les investissements que fait le Canada dans infrastructure verte https co ohY1czJJ9B https co I9v5Og2g8T,[],Economical,6,0.0,fr,ministre_ec_tweeter
46,823627637197275139,2017-01-23 20:25:05,[],Ravie de poursuivre le travail avec Stephen Lucas dans son nouveau rôle de sous-ministre d’@environnementca.,Ravie de poursuivre le travail avec Stephen Lucas dans son nouveau le de sous ministre environnementca,[],Environmental,5,0.0,fr,ministre_ec_tweeter
47,821032777286057985,2017-01-16 16:34:02,['https://t.co/M1ckjfkSOV'],EN DIRECT! Passionnés par nos parcs et lieux hist. nationaux? Joignez-vous à moi : https://t.co/M1ckjfkSOV #ParlonsParcs  @ParcsCanada,EN DIRECT par nos parcs et lieux hist nationaux Joignez vous moi https co M1ckjfkSOV ParlonsParcs ParcsCanada,['#ParlonsParcs'],Social,5,0.125,fr,ministre_ec_tweeter
48,824319547926790145,2017-01-25 18:14:29,[],RT @PMcanadien: Le gouvernement tient compte des jeunes dans l’élaboration de ses politiques et programmes. Suivez #ConseilJeunessePM pour…,RT PMcanadien Le gouvernement tient compte des jeunes dans laboration de ses politiques et programmes Suivez ConseilJeunessePM,['#ConseilJeunessePM'],Social,5,0.0,fr,ministre_ec_tweeter
49,816352640930086912,2017-01-03 18:36:51,['https://t.co/\xe2\x80\xa6'],RT @RNCan: Écoutez le 1er épisode du balado #DemandezÀRNCan : études fondées sur le savoir traditionnel et la science moderne https://t.co/…,RT RNCan coutez le 1er pisode du balado RNCan tudes es sur le savoir traditionnel et la science moderne https co,['#Demandez'],Social,5,0.0,fr,ministre_ec_tweeter
50,816737370368331776,2017-01-04 20:05:37,['https://t.co\xe2\x80\xa6'],RT @RNCan: Le min Carr annonce un Règlement sur l'#EfficacitéÉnergétique révisé pour moins d'émissions de GES et coûts réduits https://t.co…,RT RNCan Le min Carr annonce un glement sur tique pour moins missions de GES et ts duits https,['#Efficacit'],Social,5,0.0,fr,ministre_ec_tweeter
51,819292054333386752,2017-01-11 21:17:02,['https://t.co/\xe2\x80\xa6'],"RT @RNCan: Cherchons projets pour accroître l’#EfficacitéÉnergétique et réduire la demande en énergie, vers objectifs de 2030 https://t.co/…",RT RNCan Cherchons projets pour tre tique et duire la demande en nergie vers objectifs de 2030 https co,['#Efficacit'],Social,5,0.0,fr,ministre_ec_tweeter
52,819968683162353665,2017-01-13 18:05:43,['https://t.co/jB\xe2\x80\xa6'],RT @MinistreISDE: Découvrez comment les #satellites contribuent à protéger notre #santé en surveillant notre environnement: https://t.co/jB…,RT MinistreISDE couvrez comment les satellites contribuent ger notre en surveillant notre environnement https co,"['#satellites', '#sant']",Economical,5,0.0,fr,ministre_ec_tweeter
53,823886853455708161,2017-01-24 13:35:07,"['https://t.co/oBU641hGB', 'https://t.co/2uvYRueT5']",Le Can est le + efficace lorsque ns travaillons tous ens. sur buts/object. communs. Bravo Canada! #ActionClimatCAN https://t.co/oBU641hGBU https://t.co/2uvYRueT5C,Can efficace lorsque ns travaillons tous ens buts object communs Bravo Canada ActionClimatCAN https co oBU641hGBU https co 2uvYRueT5C,['#ActionClimatCAN'],Environmental,5,0.0,fr,ministre_ec_tweeter
54,825061748906610689,2017-01-27 19:23:44,['https://t.co\xe2\x80\xa6'],RT @MPO_DFO: La zone proposée Banc Sainte-Anne protègerait les espèces marines comme la morue de l'Atlantique &amp; la tortue luth https://t.co…,RT La zone Banc Sainte Anne gerait les ces marines comme la morue de Atlantique amp la tortue luth https,[],Environmental,5,0.0,fr,ministre_ec_tweeter
55,818912820100235267,2017-01-10 20:10:05,['https://t.co/lzxvEKapDE'],"RT @Transports_gc: Savez-vous à qui signaler un incident de pollution en milieu marin? @GCC_CCG 
https://t.co/lzxvEKapDE",RT Savez vous qui signaler un incident de pollution en milieu marin https co lzxvEKapDE,[],Environmental,5,0.0,fr,ministre_ec_tweeter
56,823628940195545088,2017-01-23 20:30:16,[],"Bienvenue à Martine Dubuc, sous-ministre déléguée d’Environnement et Changement climatique Canada nouvellement nommée @environnementca.",Bienvenue Martine Dubuc sous ministre Environnement et Changement climatique Canada nouvellement environnementca,[],Environmental,5,0.0,fr,ministre_ec_tweeter
57,821761621089513472,2017-01-18 16:50:12,"['https://t.co/HR5G3NVz7x', 'https://t.co/KGqQbiwm6M']","CAN effectue transition vers économie #ÉnergiePropre. Découvrez impacts sur foyers, milieux travail et comm. : https://t.co/HR5G3NVz7x https://t.co/KGqQbiwm6M",effectue transition vers conomie nergiePropre couvrez impacts sur foyers milieux travail et comm https co HR5G3NVz7x https co KGqQbiwm6M,['#'],Environmental,5,0.0,fr,ministre_ec_tweeter
58,824666875346948096,2017-01-26 17:14:39,['https://t.co/ML3bO\xe2\x80\xa6'],RT @examen_EE: Le Comité de l'#examenEE a entendu ce qui fonctionne bien et moins bien avec les processus d'EE actuels : https://t.co/ML3bO…,RT Le de examenEE entendu ce qui fonctionne bien et moins bien avec les processus EE actuels https co,['#examenEE'],Social,5,0.0,fr,ministre_ec_tweeter
59,822451556373200896,2017-01-20 14:31:46,[],RT @salledepresseGC: #GdC annonce un programme créé avec des #Autochtones pour atténuer les répercussions des #changementsclimatiques https…,RT salledepresseGC GdC annonce un programme avec des Autochtones pour nuer les percussions des changementsclimatiques,"['#GdC', '#Autochtones', '#changementsclimatiques']",Social,5,0.0,fr,ministre_ec_tweeter
60,824376884582617088,2017-01-25 22:02:20,['https://t.co/ueHoDkSjSs'],"Disc : compétences, éduc. + expertise dont jeunes ont besoin pr nouv. ère #ActionClimat. Idées #ConseilJeunessePM = très appréciées. https://t.co/ueHoDkSjSs",Disc tences duc expertise dont jeunes ont besoin pr nouv ActionClimat es ConseilJeunessePM es https co ueHoDkSjSs,"['#ActionClimat', '#ConseilJeunessePM']",Social,5,0.0,fr,ministre_ec_tweeter
61,818925491210125313,2017-01-10 21:00:26,"['https://t.co/JYgBaopRai', 'https://t.co/TnAUcQblDl']",Vous voulez tenir votre propre rencontre de discussion ouverte #ParlonsParcs? Téléchargez notre guide pratique : https://t.co/JYgBaopRai https://t.co/TnAUcQblDl,Vous voulez tenir votre propre rencontre de discussion ouverte ParlonsParcs chargez notre guide pratique https co JYgBaopRai https co TnAUcQblDl,['#ParlonsParcs'],Environmental,5,0.0,fr,ministre_ec_tweeter
62,826509894459260928,2017-01-31 19:18:09,['https://t.co/kvM5pDJkY'],RT @ParcsCanada: Une des façons d'aider l'#environnement pendant vos vacances : observez le saumon au @PNFundy. https://t.co/kvM5pDJkYD #es…,RT ParcsCanada Une des ons aider environnement pendant vos vacances observez le saumon au PNFundy https co kvM5pDJkYD,"['#environnement', '#es']",Environmental,4,0.0,fr,ministre_ec_tweeter
63,825066873830141954,2017-01-27 19:44:06,[],"RT @salledepresseGC: +41,4 M$ du #GC pour les #infra liées à l'#eau et à l'#eauusée en Mauricie = #muniCAN fortes #fedinvestit #polqc https…",RT salledepresseGC 41 du GC pour les infra es eau et en Mauricie muniCAN fortes fedinvestit polqc,"['#GC', '#infra', '#eau', '#eauus', '#muniCAN', '#fedinvestit', '#polqc']",Economical,4,0.0,fr,ministre_ec_tweeter
64,823642738516168708,2017-01-23 21:25:06,[],RT @environnementca: Conditions neigeuses = conduite dangereuse. Soyez prudent! Consultez #météo + planif. journée. Soyez #météologique! ht…,RT environnementca Conditions neigeuses conduite dangereuse Soyez prudent Consultez planif Soyez ologique,"['#m', '#m']",Environmental,4,0.0,fr,ministre_ec_tweeter
65,823917982472667138,2017-01-24 15:38:49,[],"RT @Transports_gc: Nous visitons les collectivités et rencontrons les intervenants pour parler du #PlanDeProtectionDesOcéans. En janvier, n…",RT Nous visitons les et rencontrons les intervenants pour parler du ans En janvier,['#PlanDeProtectionDesOc'],Economical,4,0.0,fr,ministre_ec_tweeter
66,822484545530449920,2017-01-20 16:42:51,[],RT @Transports_gc: #LeSaviezVous? Notre #ÉquipeDuPNSA établie à #Moncton effectue la reconnaissance des glaces pour la @GCC_CCG en #hiver @…,RT LeSaviezVous Notre quipeDuPNSA tablie Moncton effectue la reconnaissance des glaces pour la en hiver,"['#LeSaviezVous', '#', '#Moncton', '#hiver']",Economical,4,0.0,fr,ministre_ec_tweeter
