,id,date_published,link,caption_original,caption_cleaned,hashtags,category,Reactions_SUM,average_sentiment_score,language,account_name
0,943905384338731008,2017-12-21 18:05:55,[],"Due to the seriousness of helicopter accident near Tweed, ON, the TSB would like to bring the following to the immediate attention of all helicopter operators:  Cargo must be adequately secured at all times, to prevent it from shifting or departing the helicopter during flight.",Due seriousness helicopter accident near Tweed TSB would like bring following immediate attention helicopter operators Cargo must adequately secured times prevent shifting departing helicopter flight,[],Environmental,52,0.07708333333333334,en,TSBCanada_tweeter
1,941405375936548865,2017-12-14 20:31:46,[],"Helicopter accident near Tweed, ON: The helicopter is a 1999 Aerospatiale AS 350 B-2, registered to Hydro One Networks Inc. Investigators are on their way.",Helicopter accident near Tweed helicopter 1999 Aerospatiale 350 registered Hydro One Networks Inc Investigators way,[],Economical,27,0.1,en,TSBCanada_tweeter
2,941705684202278912,2017-12-15 16:25:05,"['https://t.co/A0ugsy78Ti', 'https://t.co/UZTw5NNtCh']","Aircraft accident near Fond-du-Lac, SK: Photos of wreckage and accident site have been uploaded to our Flickr page https://t.co/A0ugsy78Ti https://t.co/UZTw5NNtCh",Aircraft accident near Fond du Lac SK Photos wreckage accident site uploaded Flickr page https co A0ugsy78Ti https co UZTw5NNtCh,[],Environmental,27,0.1,en,TSBCanada_tweeter
3,937789175042138114,2017-12-04 21:02:17,"['https://t.co/ghbfwaxY77', 'https://t.co/f0HF\xe2\x80\xa6']",RT @Transport_gc: Do you need permission to fly your new #drone? Check out this page to find out: https://t.co/ghbfwaxY77 https://t.co/f0HF…,RT need permission fly new drone Check page find https co ghbfwaxY77 https co,['#drone'],Economical,22,0.4681818181818182,en,TSBCanada_tweeter
4,943905232358133760,2017-12-21 18:05:18,['https://t.co/ZFAiZsJqcI'],"Update –  Helicopter accident near Tweed, ON: While nearing the staging area, one of the supply bags that was being carried externally blew off the platform and, along with its attached carabiner, struck the tail rotor https://t.co/ZFAiZsJqcI",Update Helicopter accident near Tweed nearing staging area one supply bags carried externally blew platform along attached carabiner struck tail rotor https co ZFAiZsJqcI,[],Environmental,22,0.05,en,TSBCanada_tweeter
5,941142585673965568,2017-12-14 03:07:32,['https://t.co/RcaaeqqjUq'],"Deploys a team of investigators to an aircraft accident near Fond-du-Lac, SK https://t.co/RcaaeqqjUq",Deploys team investigators aircraft accident near Fond du Lac SK https co RcaaeqqjUq,[],Environmental,19,0.1,en,TSBCanada_tweeter
6,945996670843711488,2017-12-27 12:35:56,"['https://t.co/BQYrMPERlb', 'https://t.co/VJydHS\xe2\x80\xa6']",RT @Transport_gc: Buying a drone? Fly it below 90 metres and 5.5 km from airports. It’s the law https://t.co/BQYrMPERlb https://t.co/VJydHS…,RT Buying drone Fly 90 metres km airports law https co BQYrMPERlb https co,[],Environmental,17,0.8,en,TSBCanada_tweeter
7,943571729921789953,2017-12-20 20:00:05,['https://t.co/4EV8GoFapi'],"Latest update on our investigation into the accident in Fond-du-Lac, SK https://t.co/4EV8GoFapi",Latest update investigation accident Fond du Lac SK https co 4EV8GoFapi,[],Economical,17,0.5,fr,TSBCanada_tweeter
8,943906446000914432,2017-12-21 18:10:08,[],"Update – Helicopter accident near Tweed, ON: Passengers who do not wear seat belts risk serious injury or death in the event of an emergency.",Update Helicopter accident near Tweed Passengers wear seat belts risk serious injury death event emergency,[],Environmental,16,-0.11666666666666665,en,TSBCanada_tweeter
9,943574933824835584,2017-12-20 20:12:49,"['https://t.co/QhAbyZqgWK', 'https://t.co/khlT26A8Wm']","Flight Data Recorder (FDR) and Cockpit Voice Recorder (CVR) from aircraft involved in collision with terrain in Fond-du-Lac, SK https://t.co/QhAbyZqgWK https://t.co/khlT26A8Wm",Flight Data Recorder FDR Cockpit Voice Recorder CVR aircraft involved collision terrain Fond du Lac SK https co QhAbyZqgWK https co khlT26A8Wm,[],Environmental,16,0.0,en,TSBCanada_tweeter
10,941754359821619200,2017-12-15 19:38:30,[],"Aircraft accident near Fond-du-Lac, SK: Flight Data Recorder, Cockpit Voice Recorder, and Emergency Locator Transmitter were recovered and secured.",Aircraft accident near Fond du Lac SK Flight Data Recorder Cockpit Voice Recorder Emergency Locator Transmitter recovered secured,[],Environmental,15,0.1,en,TSBCanada_tweeter
11,946848547919495169,2017-12-29 21:01:00,[],"After releasing 56 investigation reports since last January, we will soon be saying goodbye to 2017. Wishing everyone safe travels in the new year.",releasing 56 investigation reports since last January soon saying goodbye 2017 Wishing everyone safe travels new year,[],Economical,14,0.21212121212121213,en,TSBCanada_tweeter
12,941378953784242177,2017-12-14 18:46:47,['https://t.co/Wwf204YZJ'],"Deploys team of investigators to a helicopter accident near Tweed, ON https://t.co/Wwf204YZJU",Deploys team investigators helicopter accident near Tweed https co Wwf204YZJU,[],Economical,14,0.1,en,TSBCanada_tweeter
13,941782267965341696,2017-12-15 21:29:24,['https://t.co/8KcUdG5AXm'],"Update on our investigation into the accident near Fond-du-Lac, SK: The aircraft descended into trees and terrain. See latest information here: https://t.co/8KcUdG5AXm",Update investigation accident near Fond du Lac SK aircraft descended trees terrain See latest information https co 8KcUdG5AXm,[],Environmental,12,0.3,en,TSBCanada_tweeter
14,946082391260565505,2017-12-27 18:16:34,"['https://t.co/MDc7uxyIDh', 'https://t.co/27TY7GqLDN']",So much happens between the deployment of TSB investigators to an accident site and the release of the investigation report. Find out more about our investigative journey in this video: https://t.co/MDc7uxyIDh https://t.co/27TY7GqLDN,much happens deployment TSB investigators accident site release investigation report Find investigative journey video https co MDc7uxyIDh https co 27TY7GqLDN,[],Economical,12,0.35,en,TSBCanada_tweeter
15,944289870779908096,2017-12-22 19:33:43,['https://t.co/jW6VwVjjAs'],"Are you flying over the holidays? If so, here’s some important safety advice: pay attention to pre-flight safety briefings, review safety features card &amp; wear clothing that is appropriate to the season. https://t.co/jW6VwVjjAs",flying holidays important safety advice pay attention pre flight safety briefings review safety features card amp wear clothing appropriate season https co jW6VwVjjAs,[],Environmental,11,0.45,en,TSBCanada_tweeter
16,943516201988317184,2017-12-20 16:19:26,['https://t.co/UiogwyOYoP'],"Tomorrow: TSB will provide a news briefing on its investigation into the helicopter accident near Tweed, Ontario https://t.co/UiogwyOYoP",Tomorrow TSB provide news briefing investigation helicopter accident near Tweed Ontario https co UiogwyOYoP,[],Economical,11,0.1,en,TSBCanada_tweeter
17,943528845210210304,2017-12-20 17:09:41,"['https://t.co/EL46bHxxAZ', 'https://t.co/xrDkf64gWm']","The wreckage of the helicopter involved in the accident near Tweed, ON, has arrived at the TSB engineering lab. Photos:  https://t.co/EL46bHxxAZ https://t.co/xrDkf64gWm",wreckage helicopter involved accident near Tweed arrived TSB engineering lab Photos https co EL46bHxxAZ https co xrDkf64gWm,[],Economical,11,0.1,en,TSBCanada_tweeter
18,942229981308088328,2017-12-17 03:08:27,['https://t.co/2fkH2uTNSJ'],"Deploys a team of investigators to an aircraft accident near Baldur, Manitoba https://t.co/2fkH2uTNSJ",Deploys team investigators aircraft accident near Baldur Manitoba https co 2fkH2uTNSJ,[],Environmental,9,0.1,en,TSBCanada_tweeter
19,941769736123310080,2017-12-15 20:39:36,['https://t.co/1AQMkpyB6'],"Update on our investigation into the helicopter crash that occurred near Tweed, ON: What we know, progress to date and next steps https://t.co/1AQMkpyB60",Update investigation helicopter crash occurred near Tweed know progress date next steps https co 1AQMkpyB60,[],Economical,9,0.05,en,TSBCanada_tweeter
20,943907764757258241,2017-12-21 18:15:22,['https://t.co/eCzHCdEP1b'],"Update –  Helicopter accident near Tweed, ON: Map depicting overall accident distribution https://t.co/eCzHCdEP1b",Update Helicopter accident near Tweed Map depicting overall accident distribution https co eCzHCdEP1b,[],Social,9,0.05,en,TSBCanada_tweeter
21,943904177524224000,2017-12-21 18:01:07,['https://t.co/ZFAiZsJqcI'],"Latest investigation update on the fatal helicopter accident near Tweed, ON: https://t.co/ZFAiZsJqcI",Latest investigation update fatal helicopter accident near Tweed https co ZFAiZsJqcI,[],Economical,9,0.3,en,TSBCanada_tweeter
22,941741846283333632,2017-12-15 18:48:47,['https://t.co/McGxQxcqwy'],"TSB will provide a news briefing at 2:30 p.m. EST on its investigation into the helicopter crash that occurred near Tweed, Ontario https://t.co/McGxQxcqwy",TSB provide news briefing 30 EST investigation helicopter crash occurred near Tweed Ontario https co McGxQxcqwy,[],Economical,9,0.1,en,TSBCanada_tweeter
23,940972122851217408,2017-12-13 15:50:11,['https://t.co/q3Y73Au9Vr'],"When a transportation accident or incident within federal jurisdiction occurs, the TSB may send a team of investigators to the site. Here are the actions expected from first responders in support of a TSB investigation: https://t.co/q3Y73Au9Vr",transportation accident incident within federal jurisdiction occurs TSB may send team investigators site actions expected first responders support TSB investigation https co q3Y73Au9Vr,[],Economical,8,0.075,en,TSBCanada_tweeter
24,941362148273475584,2017-12-14 17:40:00,[],"Aircraft accident near Fond-du-Lac, SK: The aircraft was equipped with two data recorders, a Flight Data Recorder (FDR) and a Cockpit Voice Recorder (CVR). They will be sent to our Lab in Ottawa for analysis.",Aircraft accident near Fond du Lac SK aircraft equipped two data recorders Flight Data Recorder FDR Cockpit Voice Recorder CVR sent Lab Ottawa analysis,[],Environmental,8,0.1,en,TSBCanada_tweeter
25,938122116108636160,2017-12-05 19:05:16,['https://t.co/3V2mL98kNN'],"When air accidents occur during the landing phase of flight, or if a takeoff is rejected, the consequences can be even more serious when there is no adequate safety area at the end of the runway. Runway overruns is a safety issue on our #Watchlist https://t.co/3V2mL98kNN",air accidents occur landing phase flight takeoff rejected consequences even serious adequate safety area end runway Runway overruns safety issue Watchlist https co 3V2mL98kNN,['#Watchlist'],Environmental,7,9.251858538542968e-18,en,TSBCanada_tweeter
26,943906584786358272,2017-12-21 18:10:41,"['https://t.co/GG07N4IYEm', 'https://t.co/9E3CdDBCbL']","Update – Photos taken at the helicopter accident site near Tweed, ON https://t.co/GG07N4IYEm https://t.co/9E3CdDBCbL",Update Photos taken helicopter accident site near Tweed https co GG07N4IYEm https co 9E3CdDBCbL,[],Social,7,0.1,en,TSBCanada_tweeter
27,943574307489353728,2017-12-20 20:10:20,['https://t.co/4EV8GoFapi'],"Collision with terrain in Fond-du-Lac, SK: 6 passengers and 1 crew member sustained serious injuries. 18 other aircraft occupants also sustained injuries https://t.co/4EV8GoFapi",Collision terrain Fond du Lac SK passengers crew member sustained serious injuries 18 aircraft occupants also sustained injuries https co 4EV8GoFapi,[],Environmental,7,-0.22916666666666666,en,TSBCanada_tweeter
28,943480197294288896,2017-12-20 13:56:22,['https://t.co/TtD4ecW5GI'],"Today: TSB will provide a news briefing on its investigation into the airplane accident in Fond-du-Lac, Saskatchewan https://t.co/TtD4ecW5GI",Today TSB provide news briefing investigation airplane accident Fond du Lac Saskatchewan https co TtD4ecW5GI,[],Economical,7,0.0,en,TSBCanada_tweeter
29,942803985202925570,2017-12-18 17:09:21,['https://t.co/91OuGwZcIE'],"#Photos: investigation into the October 2017 collision with terrain of a small Piper aircraft near Calgary Springbank Airport, Alberta https://t.co/91OuGwZcIE",Photos investigation October 2017 collision terrain small Piper aircraft near Calgary Springbank Airport Alberta https co 91OuGwZcIE,['#Photos'],Environmental,7,-0.075,en,TSBCanada_tweeter
30,942768366275702790,2017-12-18 14:47:48,"['https://t.co/AUcSoPt9b', 'https://t.co/8HCG3nRHJ']","Helicopter accident near Tweed, ON - Photo of wreckage at crash site https://t.co/AUcSoPt9bC https://t.co/8HCG3nRHJ1",Helicopter accident near Tweed Photo wreckage crash site https co AUcSoPt9bC https co 8HCG3nRHJ1,[],Social,7,0.1,en,TSBCanada_tweeter
31,939163090544885762,2017-12-08 16:01:44,['https://t.co/WWEnYDZz6'],"We are continuously striving to get our safety messages out. In addition to investigation reports, there are other ways we communicate safety deficiencies: https://t.co/WWEnYDZz68",continuously striving get safety messages addition investigation reports ways communicate safety deficiencies https co WWEnYDZz68,[],Economical,7,-0.125,en,TSBCanada_tweeter
32,946386911861661697,2017-12-28 14:26:37,['https://t.co/wWX1KtmXOK'],"See why  railway transportation of flammable liquids like crude oil across North America poses safety risks, and how these can be addressed more effectively #Watchlist  https://t.co/wWX1KtmXOK",See railway transportation flammable liquids like crude oil across North America poses safety risks addressed effectively Watchlist https co wWX1KtmXOK,['#Watchlist'],Social,6,0.13333333333333333,en,TSBCanada_tweeter
33,937700593140891649,2017-12-04 15:10:17,['https://t.co/STfDi5LCQn'],"#ICYMI Last week, we released our investigation report into the 2016 fatal sinking of fishing vessel Pop’s Pride off the coast of Newfoundland and Labrador https://t.co/STfDi5LCQn",ICYMI Last week released investigation report 2016 fatal sinking fishing vessel Pride coast Newfoundland Labrador https co STfDi5LCQn,['#ICYMI'],Economical,6,0.0,en,TSBCanada_tweeter
34,943542002448297984,2017-12-20 18:01:58,['https://t.co/jz9EGeXygX'],"Just released: our investigation report into 2015 near-collision with terrain of a Helijet helicopter in Tofino, BC https://t.co/jz9EGeXygX",released investigation report 2015 near collision terrain Helijet helicopter Tofino BC https co jz9EGeXygX,[],Economical,6,0.0,en,TSBCanada_tweeter
35,942117346201792513,2017-12-16 19:40:53,[],"Investigation into the accident near Fond-du-Lac, SK: The Flight Data Recorder and Cockpit Voice Recorder were dispatched to the TSB lab in Ottawa.",Investigation accident near Fond du Lac SK Flight Data Recorder Cockpit Voice Recorder dispatched TSB lab Ottawa,[],Economical,5,0.1,en,TSBCanada_tweeter
36,941364428586528768,2017-12-14 17:49:04,['https://t.co/PuDl1lz7iI'],"Deploys a team of investigators to Montreal, Quebec to assess a man overboard incident https://t.co/PuDl1lz7iI",Deploys team investigators Montreal Quebec assess man overboard incident https co PuDl1lz7iI,[],Economical,4,-0.25,en,TSBCanada_tweeter
37,936610549852508163,2017-12-01 14:58:51,['https://t.co/oOF8k20wrV'],"December is here! For those planning to travel by air during the holiday season, this video is a reminder to fasten your seatbelt at all times. Because turbulence can make the ride more than a little bumpy: https://t.co/oOF8k20wrV",December planning travel air holiday season video reminder fasten seatbelt times turbulence make ride little bumpy https co oOF8k20wrV,[],Environmental,4,0.15625,en,TSBCanada_tweeter
38,940605970786541568,2017-12-12 15:35:13,"['https://t.co/1LztAueaiQ', 'https://t.co/5W30HblRs3']",We investigate transportation accidents/incidents across the country. See our map of active investigations https://t.co/1LztAueaiQ https://t.co/5W30HblRs3,investigate transportation accidents incidents across country See map active investigations https co 1LztAueaiQ https co 5W30HblRs3,[],Economical,4,-0.13333333333333333,en,TSBCanada_tweeter
39,938189136384622592,2017-12-05 23:31:35,['https://t.co/IoW63kbojE'],"Deploys a team following a collision between a dredger and a barge in the Fraser River, BC https://t.co/IoW63kbojE",Deploys team following collision dredger barge Fraser River BC https co IoW63kbojE,[],Social,4,0.0,en,TSBCanada_tweeter
40,939216802978172929,2017-12-08 19:35:10,"['https://t.co/Stv5oZz4mJ', 'https://t.co/sgPYYZ3VbQ']",#SECURITAS enables you to report-in confidence-concerns you may have about safety. Everyone can keep an eye out for potentially unsafe acts or conditions when travelling or working. Can you spot the safety issues in this video? https://t.co/Stv5oZz4mJ https://t.co/sgPYYZ3VbQ,SECURITAS enables report confidence concerns may safety Everyone keep eye potentially unsafe acts conditions travelling working spot safety issues video https co Stv5oZz4mJ https co sgPYYZ3VbQ,['#SECURITAS'],Social,4,0.0,en,TSBCanada_tweeter
41,943573033159184386,2017-12-20 20:05:16,['https://t.co/4EV8GoFapi'],"Collision with terrain in Fond-du-Lac, SK: Shortly after takeoff, the aircraft collided with trees and terrain less than a mile west of the end of Runway 28. The aircraft was destroyed https://t.co/4EV8GoFapi",Collision terrain Fond du Lac SK Shortly takeoff aircraft collided trees terrain less mile west end Runway 28 aircraft destroyed https co 4EV8GoFapi,[],Environmental,4,-0.08333333333333333,en,TSBCanada_tweeter
42,941355735820185601,2017-12-14 17:14:31,[],"Aircraft accident near Fond-du-Lac, SK: The aircraft crashed shortly after take-off from Fond-du-Lac, SK (ZFD). The flight was on its way to Stony Rapids, SK (YSF)",Aircraft accident near Fond du Lac SK aircraft crashed shortly take Fond du Lac SK ZFD flight way Stony Rapids SK YSF,[],Environmental,4,0.05,en,TSBCanada_tweeter
43,946812893244338177,2017-12-29 18:39:19,['https://t.co/aphdeTcrhg'],"#InterestingFact : hot air balloons are considered aircraft under the Aeronautics Act. In 2008, the TSB issued two recommendations for #hotairballoon safety. Nine years later, the risk remains https://t.co/aphdeTcrhg",InterestingFact hot air balloons considered aircraft Aeronautics Act 2008 TSB issued two recommendations hotairballoon safety Nine years later risk remains https co aphdeTcrhg,"['#InterestingFact', '#hotairballoon']",Environmental,4,0.125,en,TSBCanada_tweeter
44,938432895869509632,2017-12-06 15:40:12,['https://t.co/3sBiTOijMa'],"Throughout the years, we have conducted many major investigations and have been involved in important changes in the transportation industry. Check out this photo gallery of the TSB's first 25 years #soontobe28 https://t.co/3sBiTOijMa",Throughout years conducted many major investigations involved important changes transportation industry Check photo gallery TSB first 25 years soontobe28 https co 3sBiTOijMa,['#soontobe28'],Economical,3,0.303125,en,TSBCanada_tweeter
45,938850664301629441,2017-12-07 19:20:16,"['https://t.co/FwUsGtAMgV', 'https://t.co/md4hSiFh']",#TBT TSB investigator observing new hull plating and framing on fishing vessel SAPUTI following flooding in 2016. Read the final report to find out more about this investigation: https://t.co/FwUsGtAMgV https://t.co/md4hSiFhCC,TBT TSB investigator observing new hull plating framing fishing vessel SAPUTI following flooding 2016 Read final report find investigation https co FwUsGtAMgV https co md4hSiFhCC,['#TBT'],Economical,3,0.1590909090909091,en,TSBCanada_tweeter
46,943135811658309632,2017-12-19 15:07:54,['https://t.co/KiulyCFjh'],"Just released: our investigation report into the a March 2017 crude oil leak at Enbridge Terminal in Sherwood Park, AB #pipeline https://t.co/KiulyCFjh0",released investigation report March 2017 crude oil leak Enbridge Terminal Sherwood Park AB pipeline https co KiulyCFjh0,['#pipeline'],Economical,3,-0.7,en,TSBCanada_tweeter
47,941669179601707009,2017-12-15 14:00:02,['https://t.co/xzkeo6krtA'],"Fatal helicopter accident near Tweed, ON: Our investigation page will be updated with the latest information throughout the day https://t.co/xzkeo6krtA",Fatal helicopter accident near Tweed investigation page updated latest information throughout day https co xzkeo6krtA,[],Economical,3,0.3,en,TSBCanada_tweeter
48,941667500055519232,2017-12-15 13:53:22,['https://t.co/gnYdxDpYq'],Interested in marine safety? Read our latest blog post on the importance of draining water periodically from fuel oil service tanks https://t.co/gnYdxDpYq8 @CHIRP_Maritime @IHS4Maritime @ProMarinerMag,Interested marine safety Read latest blog post importance draining water periodically fuel oil service tanks https co gnYdxDpYq8 IHS4Maritime ProMarinerMag,[],Environmental,3,0.375,en,TSBCanada_tweeter
49,946463342998294528,2017-12-28 19:30:20,['https://t.co/GswG8h4Dri'],"Watch our very first animation, which was released as part of the investigation into a runway overrun that occurred in 2005 at @TorontoPearson https://t.co/GswG8h4Dri #TBT",Watch first animation released part investigation runway overrun occurred 2005 TorontoPearson https co GswG8h4Dri TBT,['#TBT'],Economical,2,0.325,en,TSBCanada_tweeter
50,938810101565198339,2017-12-07 16:39:05,['https://t.co/xBf0Bl55qr'],"Today the UN marks International Civil Aviation Day under the theme Working together to ensure no country is left behind, and all states have access to the significant socio-economic benefits of safe and reliable air transport https://t.co/xBf0Bl55qr @UN @ICAO",Today UN marks International Civil Aviation Day theme Working together ensure country left behind states access significant socio economic benefits safe reliable air transport https co xBf0Bl55qr UN ICAO,[],Environmental,2,0.095,en,TSBCanada_tweeter
51,936671525763256320,2017-12-01 19:01:08,['https://t.co/W0YuBLnjXx'],SECURITAS is primarily concerned with unsafe acts and conditions in transportation systems. What should you include in your message when reporting a safety concern? https://t.co/W0YuBLnjXx,SECURITAS primarily concerned unsafe acts conditions transportation systems include message reporting safety concern https co W0YuBLnjXx,[],Social,2,0.4,en,TSBCanada_tweeter
52,940235119419412480,2017-12-11 15:01:35,['https://t.co/yIJmijGect'],"Obstructed view of crossing warning system among factors that led to 2016 crossing collision in Sainte-Ursule, Quebec https://t.co/yIJmijGect",Obstructed view crossing warning system among factors led 2016 crossing collision Sainte Ursule Quebec https co yIJmijGect,[],Environmental,2,0.0,en,TSBCanada_tweeter
53,940684016289746944,2017-12-12 20:45:21,['https://t.co/E6tfEu7ZiX'],"#ICYMI Last week, we released our investigation report into a 2016 train collision near Carvel, Alberta. The findings highlight the need for physical defences to ensure railway signals are followed https://t.co/E6tfEu7ZiX",ICYMI Last week released investigation report 2016 train collision near Carvel Alberta findings highlight need physical defences ensure railway signals followed https co E6tfEu7ZiX,['#ICYMI'],Economical,2,0.03333333333333333,en,TSBCanada_tweeter
54,943136487016730624,2017-12-19 15:10:35,['https://t.co/YBCViwOtSf'],"Lack of detailed inspection procedures contributed to a March 2017 crude oil leak at Enbridge Terminal in Sherwood Park, AB #pipeline https://t.co/YBCViwOtSf",Lack detailed inspection procedures contributed March 2017 crude oil leak Enbridge Terminal Sherwood Park AB pipeline https co YBCViwOtSf,['#pipeline'],Economical,2,-0.14999999999999994,en,TSBCanada_tweeter
55,943541610708635648,2017-12-20 18:00:24,['https://t.co/RvBL025lXP'],"Night flight without adequate visual references led to 2015 near-collision with terrain of a Helijet helicopter in Tofino, BC https://t.co/RvBL025lXP",Night flight without adequate visual references led 2015 near collision terrain Helijet helicopter Tofino BC https co RvBL025lXP,[],Social,2,0.16666666666666666,en,TSBCanada_tweeter
56,941036331479764994,2017-12-13 20:05:19,['https://t.co/fUxI62F0zL'],What's the TSB #Watchlist?  It identifies the key safety issues that need to be addressed to make Canada’s transportation system even safer. Have a look: https://t.co/fUxI62F0zL,TSB Watchlist identifies key safety issues need addressed make transportation system even safer look https co fUxI62F0zL,['#Watchlist'],Social,2,0.0,en,TSBCanada_tweeter
57,940235135508799488,2017-12-11 15:01:39,['https://t.co/D6ZQ6OKijF'],"Just released: Our investigation report into a September 2016 crossing collision in Sainte-Ursule, Quebec https://t.co/D6ZQ6OKijF",released investigation report September 2016 crossing collision Sainte Ursule Quebec https co D6ZQ6OKijF,[],Economical,2,0.0,en,TSBCanada_tweeter
58,938502128401879041,2017-12-06 20:15:18,['https://t.co/R1ZkSuLaiF'],Tomorrow is the last day to apply for a Senior Engineer Specialist - Materials #job at the TSB. Open to persons residing in Canada and Canadian citizens residing abroad. Don't miss your chance to make a difference! https://t.co/R1ZkSuLaiF,Tomorrow last day apply Senior Engineer Specialist Materials job TSB Open persons residing Canada Canadian citizens residing abroad miss chance make difference https co R1ZkSuLaiF,['#job'],Economical,1,0.0,en,TSBCanada_tweeter
59,940285724502478850,2017-12-11 18:22:41,['https://t.co/iURVzsdFW4'],Don’t want to be the last one to know? Subscribe to our RSS feeds to receive timely notifications of new TSB content #stayconnected https://t.co/iURVzsdFW4,want last one know Subscribe RSS feeds receive timely notifications new TSB content stayconnected https co iURVzsdFW4,['#stayconnected'],Social,1,0.06818181818181818,en,TSBCanada_tweeter
