,Unnamed: 0,id,date_published,link,caption_original,caption_cleaned,hashtags,num_shares,num_likes,Reactions_SUM,category,language,average_sentiment_score,sentiment,account_name,words_matched_list
2694,2694,895766987217014786,2017-08-10 22:01:06,['https://t.co/aRnQIrHbf3'],L’#ÉquipeDuPNSA utilise le Dash 7 puisqu’il peut se rendre dans les régions éloignées. Photo prise à Clyde River au #Nunavut https://t.co/aRnQIrHbf3,quipeDuPNSA utilise le Dash il peut se rendre dans les gions es Photo prise Clyde River au Nunavut https co aRnQIrHbf3,"['#', '#Nunavut']",0,0,0,unknown,fr,0.0,Neutral,Transports_gc_tweeter,
2679,2679,901825437273292801,2017-08-27 15:15:14,"['https://t.co/Ehq9KW3vWB', 'https://t.co/znZ2MCPB8G']",#PlanDeProtectionDesOcéans: Nous prenons des mesures avec nos partenaires pour protéger la côte arctique #NosCôtes https://t.co/Ehq9KW3vWB https://t.co/znZ2MCPB8G,ans Nous prenons des mesures avec nos partenaires pour ger la te arctique tes https co Ehq9KW3vWB https co znZ2MCPB8G,"['#PlanDeProtectionDesOc', '#NosC']",0,0,0,Environmental,fr,0.0,Neutral,Transports_gc_tweeter,['air']
2675,2675,901878276792229893,2017-08-27 18:45:11,[],"#PlanDeProtectionDesOcéans : 21M$ pour la formation et les possibilités en transport maritime pour les femmes, gens du Nord et Autochtones",ans 21M pour la formation et les en transport maritime pour les femmes gens du Nord et Autochtones,['#PlanDeProtectionDesOc'],0,0,0,Social,fr,0.0,Neutral,Transports_gc_tweeter,"['femmes', 'autochtones']"
2671,2671,901885822936416256,2017-08-27 19:15:11,[],#PlanDeProtectionDesOcéans Développer le chapitre de la #GCC auxiliaire pour l’Arctique : capacité accrue d’intervention d’urgence #NosCôtes,ans velopper le chapitre de la GCC auxiliaire pour Arctique accrue intervention urgence tes,"['#PlanDeProtectionDesOc', '#GCC', '#NosC']",0,0,0,Environmental,fr,0.0,Neutral,Transports_gc_tweeter,['air']
2667,2667,901889644572409858,2017-08-27 19:30:22,[],"#PlanDeProtectionDesOcéans : 16,9M$ pour la mise en œuvre d’un système servant à améliorer la coordination des mesures d’urgence #NosCôtes",ans 16 9M pour la mise en uvre un servant liorer la coordination des mesures urgence tes,"['#PlanDeProtectionDesOc', '#NosC']",0,0,0,Environmental,fr,0.0,Neutral,Transports_gc_tweeter,['or']
2666,2666,902179247854407680,2017-08-28 14:41:09,['https://t.co/3L3Tnkh6I'],Ajd le min. Garneau parlera financement pour commerce+corridors de transport dans le Nord #FedInvestit #Yellowknife https://t.co/3L3Tnkh6Ic,Ajd min Garneau parlera financement commerce corridors transport Nord FedInvestit Yellowknife https co 3L3Tnkh6Ic,"['#FedInvestit', '#Yellowknife']",0,0,0,Economical,en,0.0,Neutral,Transports_gc_tweeter,"['commerce', 'finance', 'invest', 'nord', 'financement', 'transport']"
2661,2661,902275023909605380,2017-08-28 21:01:43,"['https://t.co/k77d8rHb6T', 'https://t.co/nouXhzTBzf']",#FondsCorridorsCommerciaux: répondre aux besoins en transports et faciliter le commerce aux #TNO #FedInvestit https://t.co/k77d8rHb6T https://t.co/nouXhzTBzf,FondsCorridorsCommerciaux pondre aux besoins en transports et faciliter le commerce aux TNO FedInvestit https co k77d8rHb6T https co nouXhzTBzf,"['#FondsCorridorsCommerciaux', '#TNO', '#FedInvestit']",0,0,0,Economical,fr,0.0,Neutral,Transports_gc_tweeter,"['invest', 'transport', 'commerce']"
2647,2647,899966379872399360,2017-08-22 12:08:00,[],#MardiDevinette : Comment appelle-t-on un créateur de cartes?,MardiDevinette Comment appelle un ateur de cartes,['#MardiDevinette'],0,0,0,unknown,fr,0.0,Neutral,Transports_gc_tweeter,
2641,2641,901051925583593474,2017-08-25 12:01:34,[],Les voies de covoiturage @AuCanada sont d’abord utilisées dans les années 90 @cityoftoronto et @CityofVancouver,Les voies de covoiturage AuCanada sont abord es dans les es 90 cityoftoronto et CityofVancouver,[],0,0,0,Environmental,fr,0.0,Neutral,Transports_gc_tweeter,['or']
3010,3010,892445158377230336,2017-08-01 18:01:21,"['https://t.co/TcsfkAQLow', 'https://t.co/skfFj8xXPT']",#Rappel: #Voitures Infiniti. Défaut possible lié au module de commande de la pompe à carburant. https://t.co/TcsfkAQLow https://t.co/skfFj8xXPT,Rappel Voitures Infiniti faut possible au module de commande de la pompe carburant https co TcsfkAQLow https co skfFj8xXPT,"['#Rappel', '#Voitures']",0,0,0,unknown,fr,0.0,Neutral,Transports_gc_tweeter,
