,Unnamed: 0,id,date_published,link,caption_original,caption_cleaned,hashtags,num_reactions,num_comments,num_shares,num_likes,num_loves,num_wows,num_hahas,num_sads,num_angrys,num_special,Reactions_SUM,category,language,average_sentiment_score,account_name,words_matched_list,sentiment
154,154,242079006274865_298606380622127,2017-10-29 09:00:00,https://www.facebook.com/CanadianCoastGuard/photos/a.258864731262959.1073741828.242079006274865/298605827288849/?type=3,"We spoke with 300 First Nations students during an annual Aboriginal Youth Career Awareness. 

This year, the Chippewas of Kettle and Stony Point hosted the two-day event on the powwow grounds along the shores of Lake Huron at Kettle Point. 

We look forward to participating again next year!","We spoke with First Nations students during an annual Aboriginal Youth Career Awareness. This year, the Chippewas of Kettle and Stony Point hosted the two-day event on the powwow grounds along the shores of Lake Huron at Kettle Point. We look forward to participating again next year!",[],33,0,4,33,0,0,0,0,0,0,37,Social,en,0.0,CanadianCoastGuard_facebook,"['students', 'first nations']",neutral
156,156,242079006274865_291305641352201,2017-10-07 10:00:00,https://www.facebook.com/CanadianCoastGuard/photos/a.258864731262959.1073741828.242079006274865/291305498018882/?type=3,"During a search and rescue exercise in Hamilton, Ontario @CanadianForces SAR technicians successfully dropped a pack to the CCGS Cape Lambton from over 300 metres! For more info about search and rescue visit: http://ow.ly/oXYZ30fsWVk","During a search and rescue exercise in Hamilton, Ontario SAR technicians successfully dropped a pack to the CCGS Cape Lambton from over metres! For more info about search and rescue visit:",[],31,0,5,31,0,0,0,0,0,0,36,Social,en,0.0,CanadianCoastGuard_facebook,['ami'],neutral
160,160,242079006274865_292378391244926,2017-10-02 11:02:20,https://www.facebook.com/CanadianCoastGuard/videos/292378144578284/,"CCGS GC-03 returns to Quebec harbour after its day of operations on the St. Lawrence River. This small vessel, designed for hydrographic surveys and channel surveys, is used to monitor the depth of water in the St. Lawrence Seaway between Sault-au-Cochon and Montreal. Its work contributes to the safety of navigation. Like the Morillon and the CCGS F.C.G. Smith, CCGS GC-03 is in operation annually during the spring thaw to the end of November. http://ow.ly/XZze30flRoH","CCGS GC-03 returns to Quebec harbour after its day of operations on the St. Lawrence River. This small vessel, designed for hydrographic surveys and channel surveys, is used to monitor the depth of water in the St. Lawrence Seaway between Sault-au-Cochon and Montreal. Its work contributes to the safety of navigation. Like the Morillon and the CCGS F.C.G. Smith, CCGS GC-03 is in operation annually during the spring thaw to the end of November.",[],29,0,4,29,0,0,0,0,0,0,33,Environmental,en,0.0,CanadianCoastGuard_facebook,"['water', 'or']",neutral
165,165,242079006274865_295085360974229,2017-10-10 15:00:00,http://www.marinfo.gc.ca/en/Flotte/Amundsen.asp,"The the CCGS Amundsen is returning home (Quebec City) on October 12, after having supported the 2nd edition of the Inuit Health Survey, in Nunavik, conducted by the Institut national de santé publique du Québec. It also enabled the BriGHT (Bridging Global Change, Inuit Health and Transforming Arctic Ocean) project of the Northern Sentinel Strategy, developed at Université Laval. It was its 13th scientific expendition in the Arctic.

To find out more: http://www.marinfo.gc.ca/en/Flotte/Amundsen.asp","The the CCGS Amundsen is returning home (Quebec City) on October , after having supported the nd edition of the Inuit Health Survey, in Nunavik, conducted by the Institut national de santé publique du Québec. It also enabled the BriGHT (Bridging Global Change, Inuit Health and Transforming Arctic Ocean) project of the Northern Sentinel Strategy, developed at Université Laval. It was its th scientific eendition in the Arctic. To find out more:",[],29,1,2,28,1,0,0,0,0,0,32,Social,en,1.0,CanadianCoastGuard_facebook,"['inuit', 'health', 'change']",positive
168,168,242079006274865_295066937642738,2017-10-10 13:00:00,https://www.facebook.com/CanadianCoastGuard/photos/a.258864731262959.1073741828.242079006274865/295067354309363/?type=3,"On September 14, 2017, a delegation of 43 distinguished visitors from 19 countries toured CCGS Henry Larsen in Resolute Bay, Nunavut, while the icebreaker stopped there for a scheduled crew change. Most of the international visitors represented the NATO Parliamentary Assembly. Led by the Department of National Defence, this northern tour provided delegates with an opportunity to study and discuss Arctic issues related to climate change, international relations, security and cooperation.","On September , , a delegation of distinguished visitors from countries toured CCGS Henry Larsen in Resolute Bay, Nunavut, while the icebreaker stopped there for a scheduled crew change. Most of the international visitors represented the NATO Parliamentary Assembly. Led by the Department of National Defence, this northern tour provided delegates with an opportunity to study and discuss Arctic issues related to climate change, international relations, security and cooperation.",[],25,0,5,24,0,1,0,0,0,0,30,Environmental,en,0.0,CanadianCoastGuard_facebook,"['climate change', 'climate', 'or', 'ice', 'climat']",neutral
179,179,242079006274865_295385674277531,2017-10-11 08:15:14,http://ow.ly/DWHP30fMguY,,,[],27,0,0,26,0,1,0,0,0,0,27,unknown,tl,0.0,CanadianCoastGuard_facebook,,neutral
188,188,242079006274865_296077334208365,2017-10-13 09:23:02,https://www.facebook.com/CanadianCoastGuard/photos/a.258864731262959.1073741828.242079006274865/296077207541711/?type=3,"FBF. On September 21, 2017, our Assistant Commissioner for the Central and Arctic Region, Julie Gascon, participated in the launch of the new, progressive Canada-EU Trade Agreement held at the Port of Montreal. Part of Coast Guard’s mandate is to ensure safe and efficient navigation of international merchant ships in Canada. As the new agreement is expected to result in increased ship traffic in the coming years, demand for Canadian Coast Guard services is also expected to increase.  Canada’s International Trade - Global Affairs Canada Find out about the Agreement here: http://ow.ly/vUMG30fR4A1","FBF. On September , , our Assistant Commissioner for the Central and Arctic Region, Julie Gascon, participated in the launch of the new, progressive Canada-EU Trade Agreement held at the Port of Montreal. Part of Coast Guard’s mandate is to ensure safe and efficient navigation of international merchant ships in Canada. As the new agreement is eected to result in increased ship traffic in the coming years, demand for Canadian Coast Guard services is also eected to increase. Canada’s International Trade - Global Affairs Canada Find out about the Agreement here: 1",[],23,0,0,22,1,0,0,0,0,0,23,Environmental,en,0.0,CanadianCoastGuard_facebook,"['gas', 'ice', 'coast', 'guard', 'mer', 'air', 'or']",neutral
193,193,242079006274865_296078744208224,2017-10-14 10:00:00,https://www.facebook.com/CanadianCoastGuard/photos/a.258864731262959.1073741828.242079006274865/296078407541591/?type=3,"Dr. Viola Davidson conducted the research for her M.Sc. and Ph.D. degrees on marine phytoplankton at the St. Andrews Biological Station from 1924-1932 as a volunteer investigator. At this time it was unusual for a woman to do graduate studies in marine science. Her later volunteer work (1947-48) was on salmon and eel movement at the Grand Lake rearing ponds at Wellington Station, Nova Scotia. Dr. Davidson was also a teacher at Central High School of Commerce in Toronto through the 1920s-1940s. She was a passionate and dedicated marine scientist. http://ow.ly/NVQt30fAgHI","Dr. Viola Davidson conducted the research for her M.Sc. and Ph.D. degrees on marine phytoplankton at the St. Andrews Biological Station from -1932 as a volunteer investigator. At this time it was unusual for a woman to do graduate studies in marine science. Her later volunteer work (1947-48) was on salmon and eel movement at the Grand Lake rearing ponds at Wellington Station, Nova Scotia. Dr. Davidson was also a teacher at Central High School of Commerce in Toronto through the s-1940s. She was a passionate and dedicated marine scientist.",[],20,0,2,18,2,0,0,0,0,0,22,Environmental,en,0.0,CanadianCoastGuard_facebook,"['marine', 'or', 'lake ', 'mer']",neutral
199,199,242079006274865_288776568271775,2017-10-01 08:00:00,https://www.facebook.com/CanadianCoastGuard/photos/a.258864731262959.1073741828.242079006274865/288776644938434/?type=3,October is Women’s History Month! Stay tuned all month as we celebrate the achievements of women in the Canadian Coast Guard. Women in Canada,October is Women’s History Month! Stay tuned all month as we celebrate the achievements of women in the Canadian Coast Guard. Women in Canada,[],15,1,4,14,1,0,0,0,0,0,20,Environmental,en,0.4166666666666667,CanadianCoastGuard_facebook,"['guard', 'or', 'coast']",positive
203,203,242079006274865_295125464303552,2017-10-10 15:00:00,https://www.facebook.com/CanadianCoastGuard/photos/a.258864731262959.1073741828.242079006274865/295125234303575/?type=3,"We’re holding information sessions in multiple Arctic communities to ask college students how we can best spread the word about our recruitment efforts for the new Inshore Rescue Boat stations! Interested student can attend information sessions
Come find out more about the hiring process and requirements, and to provide your feedback. See photos for more information.  Please note: dates and times are subject to change.

ᑐᓴᐅᒪᑎᑦᑎᓂᐊᕋᑦᑕ ᓄᓇᓕᓂ ᐅᑭᐅᕐᑕᕐᑐᒥ ᐊᐱᕆᓂᐊᕐᕋᑎᒍ ᓯᓚᑐᓴᕐᕕᒃᒥᑐ ᐃᓕᓂᐊᕐᑐᑦ ᖃᓄᕐ ᖃᐅᔨᒪᑎᑎᒐᔭᕐᒪᖔᑦᑕ ᐃᖃᓇᐃᔭᕈᒪᔪᓂ ᕿᓂᕐᑎᓪᓗᑕ ᓄᑖᖑᔪᒧ ᓯᒃᔭᖓᓂ ᐸᕐᓴᐃᓂᕐᒧᑦ ᐅᒥᐊᑯᑦ ᓴᕿᑦᑐᖃᕐᓂᐊᕐᒪᑦ ᐃᓂᖃᕐᑎᑕᐅᓗᓂ! ᐃᓕᓂᐊᕐᑐᑦ ᐱᔪᒪᓂ ᐅᐸᖃᑕᐅᔪᓐᓇᕐᑐᑦ ᐅᑯᓇᓂ ᓄᓇᓕᒃᓂ. ᑕᑯᔭᕐᑐᕐᓂᐊᕐᐳᑎᑦ ᖃᐅᔨᔭᕐᑐᕐᓗᑎ ᐃᖃᓇᐃᔭᕈᒪᔪᑦ ᖃᓄᐃᓕᐅᕆᐊᖃᕐᒪᖔᑕ, ᐊᒻᒪᓗ ᐅᖃᐅᓯᓴᖃᕈᕕᑦ ᑐᓴᕈᒪᔪᒍ. ᐊᔾᔨᖑᓪᓗ ᑕᑯᓗᑦ ᑐᑭᓯᓂᐊᕐᕋᕕᑦᑦ. ᖃᐅᔨᒪᓗᑎ ᐅᓪᓗᖏᑦ ᐃᑲᕋᓪᓗ ᐊᓯᓪᓕᑐᐃᓐᓇᕆᐊᓖᑦ","We’re holding information sessions in multiple Arctic communities to ask college students how we can best spread the word about our recruitment efforts for the new Inshore Rescue Boat stations! Interested student can attend information sessions Come find out more about the hiring process and requirements, and to provide your feedback. See photos for more information. Please note: dates and times are subject to change. ᑐᓴᐅᒪᑎᑦᑎᓂᐊᕋᑦᑕ ᓄᓇᓕᓂ ᐅᑭᐅᕐᑕᕐᑐᒥ ᐊᐱᕆᓂᐊᕐᕋᑎᒍ ᓯᓚᑐᓴᕐᕕᒃᒥᑐ ᐃᓕᓂᐊᕐᑐᑦ ᖃᓄᕐ ᖃᐅᔨᒪᑎᑎᒐᔭᕐᒪᖔᑦᑕ ᐃᖃᓇᐃᔭᕈᒪᔪᓂ ᕿᓂᕐᑎᓪᓗᑕ ᓄᑖᖑᔪᒧ ᓯᒃᔭᖓᓂ ᐸᕐᓴᐃᓂᕐᒧᑦ ᐅᒥᐊᑯᑦ ᓴᕿᑦᑐᖃᕐᓂᐊᕐᒪᑦ ᐃᓂᖃᕐᑎᑕᐅᓗᓂ! ᐃᓕᓂᐊᕐᑐᑦ ᐱᔪᒪᓂ ᐅᐸᖃᑕᐅᔪᓐᓇᕐᑐᑦ ᐅᑯᓇᓂ ᓄᓇᓕᒃᓂ. ᑕᑯᔭᕐᑐᕐᓂᐊᕐᐳᑎᑦ ᖃᐅᔨᔭᕐᑐᕐᓗᑎ ᐃᖃᓇᐃᔭᕈᒪᔪᑦ ᖃᓄᐃᓕᐅᕆᐊᖃᕐᒪᖔᑕ, ᐊᒻᒪᓗ ᐅᖃᐅᓯᓴᖃᕈᕕᑦ ᑐᓴᕈᒪᔪᒍ. ᐊᔾᔨᖑᓪᓗ ᑕᑯᓗᑦ ᑐᑭᓯᓂᐊᕐᕋᕕᑦᑦ. ᖃᐅᔨᒪᓗᑎ ᐅᓪᓗᖏᑦ ᐃᑲᕋᓪᓗ ᐊᓯᓪᓕᑐᐃᓐᓇᕆᐊᓖᑦ",[],14,0,5,14,0,0,0,0,0,0,19,Social,en,0.0,CanadianCoastGuard_facebook,"['students', 'change']",neutral
228,228,242079006274865_300930673723031,2017-10-27 12:48:59,https://www.facebook.com/CanadaC3/videos/438360289895477/,,,[],10,0,0,9,1,0,0,0,0,0,10,unknown,tl,0.0,CanadianCoastGuard_facebook,,neutral
