,Unnamed: 0,id,date_published,link,caption_original,caption_cleaned,hashtags,num_reactions,num_comments,num_shares,num_likes,num_loves,num_wows,num_hahas,num_sads,num_angrys,num_special,Reactions_SUM,category,language,average_sentiment_score,account_name,words_matched_list,sentiment
9,9,242079006274865_299946113821487,2017-10-24 13:25:29,https://www.facebook.com/CanadianCoastGuard/photos/a.258864731262959.1073741828.242079006274865/299945950488170/?type=3,"The Canadian Coast Guard, together with the Canadian Armed Forces – Joint Task Force Pacific, Emergency Management BC, British Columbia Emergency Health Services, Public Safety Canada and BC Ferries, among other partners, will be leading a major maritime disaster exercise called “Exercise Salish Sea” east of Salt Spring Island, British Columbia on October 25 & 26. Tomorrow we will share highlights from Day 1, which will focus on the rescue of over 100 “survivors” from a BC Ferries’ vessel M/V Coastal Renaissance. A total of 15 vessels and four aircraft are being employed. BC Ferries Royal Canadian Marine Search & Rescue • Station 1 - West Vancouver Maritime Forces Pacific / Forces maritimes du Pacifique","The Canadian Coast Guard, together with the Canadian Armed Forces – Joint Task Force Pacific, Emergency Management BC, British Columbia Emergency Health Services, Public Safety Canada and BC Ferries, among other partners, will be leading a major maritime disaster exercise called “Exercise Salish Sea” east of Salt Spring Island, British Columbia on October & . Tomorrow we will share highlights from Day , which will focus on the rescue of over “survivors” from a BC Ferries’ vessel M/V Coastal Renaissance. A total of vessels and four aircraft are being employed. BC Ferries Royal Canadian Marine Search & Rescue • Station - West Vancouver Maritime Forces Pacific / Forces maritimes du Pacifique",[],137,8,73,129,4,4,0,0,0,0,218,Environmental,en,0.38782442480359147,CanadianCoastGuard_facebook,"['ice', 'coast', 'guard', 'coastal', 'mer', 'air', 'marine', 'or']",positive
12,12,242079006274865_300322253783873,2017-10-25 18:25:37,https://www.facebook.com/CanadianCoastGuard/photos/a.261340221015410.1073741829.242079006274865/300322143783884/?type=3,"Today we were on the water east of Salt Spring Island, British Columbia, with partners, participating in day one of a two-day major maritime incident training exercise called “Exercise Salish Sea”. This training exercise is the largest major exercise in Canadian Coast Guard history. Today’s scenario involved the evacuation of 100 ‘survivors’ from a participating BC Ferries’ vessel. Some were evacuated into vessels in the water, and some hoists of evacuees were simulated by our colleagues in the Canadian Armed Forces and US Coast Guard. 

Environmental Response will be the focus of tomorrow’s activities. Partners participating in Exercise Salish Sea include: Canadian Armed Forces, Canadian Coast Guard, Transport and Infrastructure in Canada, BC Ferries, BC Emergency Health Services, Emergency Management BC, BC Ministry of Environment, Royal Canadian Marine Search and Rescue, the U.S. Coast Guard and Western Canada Marine Response Organization, among a great many others. Special thanks today to the community on Salt Spring Island, where our ‘casualties’ were brought ashore.","Today we were on the water east of Salt Spring Island, British Columbia, with partners, participating in day one of a two-day major maritime incident training exercise called “Exercise Salish Sea”. This training exercise is the largest major exercise in Canadian Coast Guard history. Today’s scenario involved the evacuation of ‘survivors’ from a participating BC Ferries’ vessel. Some were evacuated into vessels in the water, and some hoists of evacuees were simulated by our colleagues in the Canadian Armed Forces and US Coast Guard. Environmental Response will be the focus of tomorrow’s activities. Partners participating in Exercise Salish Sea include: Canadian Armed Forces, Canadian Coast Guard, Transport and Infrastructure in Canada, BC Ferries, BC Emergency Health Services, Emergency Management BC, BC Ministry of Environment, Royal Canadian Marine Search and Rescue, the U.S. Coast Guard and Western Canada Marine Response Organization, among a great many others. Special thanks today to the community on Salt Spring Island, where our ‘casualties’ were brought ashore.",[],135,5,56,129,1,5,0,0,0,0,196,Environmental,en,0.6033333333333333,CanadianCoastGuard_facebook,"['ice', 'coast', 'water', 'guard', 'mer', 'marine', 'or']",positive
13,13,242079006274865_297903747359057,2017-10-18 13:55:37,https://www.facebook.com/CanadianCoastGuard/videos/297903747359057/,"On this Persons Day, we would like to feature a very powerful woman in the Canadian Coast Guard, Assistant Commissioner Julie Gascon. Assistant Commissioner Gascon began her journey with us as a student at the Canadian Coast Guard College and is now the head of our Central & Arctic Region, which includes over 1,200 employees. She also regularly speaks at workshops designed to help empower women. Claim Your Place! Women in Canada","On this Persons Day, we would like to feature a very powerful woman in the Canadian Coast Guard, Assistant Commissioner Julie Gascon. Assistant Commissioner Gascon began her journey with us as a student at the Canadian Coast Guard College and is now the head of our Central & Arctic Region, which includes over ,200 employees. She also regularly speaks at workshops designed to help empower women. Claim Your Place! Women in Canada",[],135,11,45,122,13,0,0,0,0,0,191,Environmental,en,0.4793813131313131,CanadianCoastGuard_facebook,"['guard', 'gas', 'or', 'coast']",positive
25,25,242079006274865_298296670653098,2017-10-19 15:22:17,https://www.facebook.com/CanadianCoastGuard/photos/a.258864731262959.1073741828.242079006274865/298296603986438/?type=3,"Rare visit by two Snowy Owl that stopped to hitch a ride aboard CCGS Sir Wilfrid Laurier, in the Chukchi Sea in the Arctic . One landed near the front and one landed near the back of the ship as it was making its way further North to a mooring recovery site at 75N 168W. Once the ship turned south, the pair flew off!","Rare visit by two Snowy Owl that stopped to hitch a ride aboard CCGS Sir Wilfrid Laurier, in the Chukchi Sea in the Arctic . One landed near the front and one landed near the back of the ship as it was making its way further North to a mooring recovery site at N W. Once the ship turned south, the pair flew off!",[],119,4,12,110,4,5,0,0,0,0,135,Environmental,en,0.075,CanadianCoastGuard_facebook,"['or', 'air']",positive
44,44,242079006274865_300933467056085,2017-10-27 17:00:00,https://www.facebook.com/CanadianCoastGuard/photos/a.258864731262959.1073741828.242079006274865/300932967056135/?type=3,"Congratulations to our newest Marine Communications and Traffic Services (MCTS) graduates! 
 
MCTS Officers are incredibly vital to the Coast Guard, and to all Canadians. Their work saves lives and helps protect our environment. 
 
We are CCG Proud and wish you all the best!","Congratulations to our newest Marine Communications and Traffic Services (MCTS) graduates! MCTS Officers are incredibly vital to the Coast Guard, and to all Canadians. Their work saves lives and helps protect our environment. We are CCG Proud and wish you all the best!",[],99,4,12,95,4,0,0,0,0,0,115,Environmental,en,0.14719460227272727,CanadianCoastGuard_facebook,"['guard', 'marine', 'or', 'ice', 'coast']",positive
47,47,242079006274865_300675507081881,2017-10-26 19:45:17,https://www.facebook.com/CanadianCoastGuard/photos/a.261340221015410.1073741829.242079006274865/300675350415230/?type=3,"Today we were again on the water east of Salt Spring Island, British Columbia, with partners, participating in day two of a two-day major maritime exercise called “Exercise Salish Sea”. Our Canadian Coast Guard Ship Bartlett stood in for the ferry which was on scene yesterday. Partners practiced working together on marine environmental response techniques.

This two day exercise involved approximately 500 people from more than 20 government and non-governmental organizations – including local Indigenous peoples from several Coastal First Nations. A total of 15 vessels and four aircraft were employed. 

Big thanks to everyone who worked with us on both days! Canadian Armed Forces Transport and Infrastructure in Canada BCFerries BC Emergency Health Services, Emergency Management BC, BC Ministry of Environment, Royal Canadian Marine Search and Rescue U.S. Coast Guard Western Canada Marine Response Organization.","Today we were again on the water east of Salt Spring Island, British Columbia, with partners, participating in day two of a two-day major maritime exercise called “Exercise Salish Sea”. Our Canadian Coast Guard Ship Bartlett stood in for the ferry which was on scene yesterday. Partners practiced working together on marine environmental response techniques. This two day exercise involved approximately people from more than government and non-governmental organizations – including local Indigenous peoples from several Coastal First Nations. A total of vessels and four aircraft were employed. Big thanks to everyone who worked with us on both days! Canadian Armed Forces Transport and Infrastructure in Canada BCFerries BC Emergency Health Services, Emergency Management BC, BC Ministry of Environment, Royal Canadian Marine Search and Rescue U.S. Coast Guard Western Canada Marine Response Organization.",[],84,2,26,84,0,0,0,0,0,0,112,Environmental,en,0.5,CanadianCoastGuard_facebook,"['government', 'ice', 'coast', 'water', 'guard', 'coastal', 'mer', 'air', 'marine', 'or']",positive
50,50,242079006274865_300511523764946,2017-10-26 10:00:00,https://www.facebook.com/CanadianCoastGuard/videos/300511523764946/,Caitlin Powers is the Project Manager for CCG’s Helicopter team and has been a proud Coast Guard Employee for over 10 years! Check out her video to learn about some of her amazing experiences with the Coast Guard! Claim Your Place! Women in Canada,Caitlin Powers is the Project Manager for CCG’s Helicopter team and has been a proud Coast Guard Employee for over years! Check out her video to learn about some of her amazing eeriences with the Coast Guard! Claim Your Place! Women in Canada,[],86,4,20,74,11,1,0,0,0,0,110,Environmental,en,0.11666666666666665,CanadianCoastGuard_facebook,"['guard', 'or', 'coast']",positive
63,63,242079006274865_296136780869087,2017-10-16 08:00:00,https://www.facebook.com/CanadianCoastGuard/photos/a.258864731262959.1073741828.242079006274865/296136640869101/?type=3,"Did you know that in 2015, Jody Thomas became the first ever female Commissioner with the Canadian Coast Guard and held the position until early 2017? Claim your place! Women in Canada","Did you know that in , Jody Thomas became the first ever female Commissioner with the Canadian Coast Guard and held the position until early ? Claim your place! Women in Canada",[],84,0,6,72,12,0,0,0,0,0,90,Social,en,0.0,CanadianCoastGuard_facebook,"['guard', 'women']",neutral
71,71,242079006274865_293095967839835,2017-10-04 14:00:57,https://www.facebook.com/CanadianCoastGuard/photos/a.258864731262959.1073741828.242079006274865/293095771173188/?type=3,"Icebreakers which have spent the summer in the Arctic are beginning to return to their home ports. Tomorrow, watch the arrival of the first one, the CCGS Pierre Radisson, back in Quebec City after a trip to Iceland. As part of this expedition, the Canadian Coast Guard participated in the Arctic Coast Guard Forum. 

The live exercise allowed the Canadian Coast Guard to demonstrate its world-leading abilities in search and rescue operations in partnership with the other seven countries participating. 

Learn more about the Forum: ow.ly/VJDW30fDV7b","Icebreakers which have spent the summer in the Arctic are beginning to return to their home ports. Tomorrow, watch the arrival of the first one, the CCGS Pierre Radisson, back in Quebec City after a trip to Iceland. As part of this eedition, the Canadian Coast Guard participated in the Arctic Coast Guard Forum. The live exercise allowed the Canadian Coast Guard to demonstrate its world-leading abilities in search and rescue operations in partnership with the other seven countries participating. Learn more about the Forum:",[],63,1,20,60,3,0,0,0,0,0,84,Environmental,en,0.0,CanadianCoastGuard_facebook,"['guard', 'mer', 'or', 'ice', 'coast']",neutral
78,78,242079006274865_293725011110264,2017-10-09 08:00:00,https://www.facebook.com/CanadianCoastGuard/photos/a.258864731262959.1073741828.242079006274865/293724904443608/?type=3,"The Arctic is getting an Inshore Rescue Boat station, and we’re hiring locally to staff it! Information sessions are being held. 
Come find out more about the hiring process and requirements, and to provide your feedback. See photos for more information. Please note: dates and times are subject to change.","The Arctic is getting an Inshore Rescue Boat station, and we’re hiring locally to staff it! Information sessions are being held. Come find out more about the hiring process and requirements, and to provide your feedback. See photos for more information. Please note: dates and times are subject to change.",[],40,3,35,40,0,0,0,0,0,0,78,Social,en,0.0,CanadianCoastGuard_facebook,"['local', 'change']",neutral
81,81,242079006274865_295086010974164,2017-10-11 08:00:00,https://www.facebook.com/CanadianCoastGuard/photos/a.258864731262959.1073741828.242079006274865/295085774307521/?type=3,"The CCGS Sir Wilfrid Laurier crew recently recovered science moorings in rough seas in the western Arctic. Besides Coast Guard work (icebreaking, escorts, aids to navigation, community visits etc.), the ship supports several collaborative partnerships during its annual Arctic operations. Time in the North is maximized with this important scientific research just prior to the ship starting its return trip south, to its homeport in Victoria, BC.","The CCGS Sir Wilfrid Laurier crew recently recovered science moorings in rough seas in the western Arctic. Besides Coast Guard work (icebreaking, escorts, aids to navigation, community visits etc.), the ship supports several collaborative partnerships during its annual Arctic operations. Time in the North is maximized with this important scientific research just prior to the ship starting its return trip south, to its homeport in Victoria, BC.",[],56,4,16,52,3,1,0,0,0,0,76,Environmental,en,0.125,CanadianCoastGuard_facebook,"['guard', 'or', 'ice', 'coast']",positive
82,82,242079006274865_297184967430935,2017-10-17 13:00:00,https://www.facebook.com/CanadianCoastGuard/photos/a.258864731262959.1073741828.242079006274865/297184904097608/?type=3,"The Oceans Protection Plan will strengthen the Coast Guard across our coasts, ensuring enhanced protection in Canadian waters.","The Oceans Protection Plan will strengthen the Coast Guard across our coasts, ensuring enhanced protection in Canadian waters.",[],69,0,6,66,2,1,0,0,0,0,75,Environmental,en,0.0,CanadianCoastGuard_facebook,"['water', 'coasts', 'guard', 'oceans', 'coast']",neutral
86,86,242079006274865_291304728018959,2017-10-03 11:00:00,https://www.facebook.com/CanadianCoastGuard/photos/a.258864731262959.1073741828.242079006274865/291304624685636/?type=3,"The Jerseyman Island Light on Isle Madame, in Cape Breton NS, has been completely replaced by a brand new structure. The new structure and new light will require very little maintenance for more than 25 years.","The Jerseyman Island Light on Isle Madame, in Cape Breton NS, has been completely replaced by a brand new structure. The new structure and new light will require very little maintenance for more than years.",[],45,3,24,43,0,2,0,0,0,0,72,Environmental,en,0.3805555555555555,CanadianCoastGuard_facebook,['or'],positive
95,95,242079006274865_298300133986085,2017-10-20 06:00:00,https://www.facebook.com/CanadianCoastGuard/photos/a.258864731262959.1073741828.242079006274865/298299707319461/?type=3,"On her annual voyage south from the Arctic, CCGS Sir Wilfrid Laurier and her crew encountered the ubiquitous weather, all-too common in the Bering Sea, especially in the month of October.

Not for the faint of heart, the seasoned sailors with the Coast Guard are up for the challenge! #CCGProud.","On her annual voyage south from the Arctic, CCGS Sir Wilfrid Laurier and her crew encountered the ubiquitous weather, all-too common in the Bering Sea, especially in the month of October. Not for the faint of heart, the seasoned sailors with the Coast Guard are up for the challenge! .",['#CCGProud'],60,1,6,56,3,1,0,0,0,0,67,Environmental,en,0.0,CanadianCoastGuard_facebook,"['guard', 'or', 'coast']",neutral
98,98,242079006274865_300949523721146,2017-10-27 14:08:36,https://www.facebook.com/CanadianCoastGuard/videos/300949523721146/,"Yesterday we were practicing environmental response with partners in British Columbia. Booms, skimmers, incident command posts.","Yesterday we were practicing environmental response with partners in British Columbia. Booms, skimmers, incident command posts.",[],51,0,15,51,0,0,0,0,0,0,66,Environmental,en,0.0,CanadianCoastGuard_facebook,['mer'],neutral
105,105,242079006274865_293006371182128,2017-10-04 08:29:58,https://www.facebook.com/CanadianCoastGuard/videos/293006371182128/,This video from the Coast Guard features an inclusive rescue technique that makes it easier for smaller-statured people to rescue people of all sizes. This method is helping to eliminate gender and other diversity barriers for Coast Guard members. Claim your place! Women in Canada,This video from the Coast Guard features an inclusive rescue technique that makes it easier for smaller-statured people to rescue people of all sizes. This method is helping to eliminate gender and other diversity barriers for Coast Guard members. Claim your place! Women in Canada,[],49,1,12,46,3,0,0,0,0,0,62,Social,en,1.0,CanadianCoastGuard_facebook,"['gender', 'guard', 'diversity', 'women']",positive
110,110,242079006274865_298300973986001,2017-10-21 09:00:00,https://www.facebook.com/CanadianCoastGuard/photos/a.258864731262959.1073741828.242079006274865/298300847319347/?type=3,"Ahoy! An opportunistic meeting of two Coast Guard icebreakers in the Beaufort Sea in early October, facilitated the transfer of a hydrographer and some science samples from CCGS Sir Wilfrid Laurier to CCGS Louis S. St-Laurent. 

CCGS Sir Wilfrid Laurier had been conducting a mooring program, just prior to starting its journey south to its homeport in our Pacific Region.  CCGS Louis S. St-Laurent was finishing up a month-long science program in the Beaufort Sea before heading to Kugluktuk for a crew change and then sailing on to Milne Inlet for icebreaking operations in the Eastern Arctic before eventually heading to its homeport in our Atlantic Region. 

All missions accomplished; ships, personnel and science samples on their way to their final destinations! Bravo Zulu on a great #Arctic season. #CCG Proud.","Ahoy! An opportunistic meeting of two Coast Guard icebreakers in the Beaufort Sea in early October, facilitated the transfer of a hydrographer and some science samples from CCGS Sir Wilfrid Laurier to CCGS Louis S. St-Laurent. CCGS Sir Wilfrid Laurier had been conducting a mooring program, just prior to starting its journey south to its homeport in our Pacific Region. CCGS Louis S. St-Laurent was finishing up a month-long science program in the Beaufort Sea before heading to Kugluktuk for a crew change and then sailing on to Milne Inlet for icebreaking operations in the Eastern Arctic before eventually heading to its homeport in our Atlantic Region. All missions accomplished; ships, personnel and science samples on their way to their final destinations! Bravo Zulu on a great season. Proud.","['#Arctic', '#CCG']",47,2,10,44,1,2,0,0,0,0,59,Environmental,en,0.675,CanadianCoastGuard_facebook,"['guard', 'eau', 'or', 'ice', 'coast']",positive
109,109,242079006274865_300910980391667,2017-10-31 08:00:00,https://www.facebook.com/CanadianCoastGuard/photos/a.258864731262959.1073741828.242079006274865/300910697058362/?type=3,"Today marks the last day of women’s history month, and we are proud to have had the opportunity to feature so many of the amazing women who work for us and highlight their incredible achievements. 

We would like to finish off the month by showcasing a few more of the women who contribute to the important work of the Coast Guard. 

Claim Your Place! Women in Canada","Today marks the last day of women’s history month, and we are proud to have had the opportunity to feature so many of the amazing women who work for us and highlight their incredible achievements. We would like to finish off the month by showcasing a few more of the women who contribute to the important work of the Coast Guard. Claim Your Place! Women in Canada",[],48,1,10,46,2,0,0,0,0,0,59,Environmental,en,0.875,CanadianCoastGuard_facebook,"['guard', 'or', 'coast']",positive
113,113,242079006274865_295120214304077,2017-10-12 08:00:00,https://www.facebook.com/CanadianCoastGuard/videos/295119734304125/,"Meet René Hachey, 4th year Officer Cadet in our College’s Engineering Program. Women in Canada","Meet René Hachey, th year Officer Cadet in our College’s Engineering Program. Women in Canada",[],42,0,15,40,2,0,0,0,0,0,57,Social,en,0.0,CanadianCoastGuard_facebook,['women'],neutral
128,128,242079006274865_291305224685576,2017-10-06 08:00:00,https://www.facebook.com/CanadianCoastGuard/photos/a.258864731262959.1073741828.242079006274865/291305128018919/?type=3,Long weekend ahead. We are working 24/7 to serve Canadians and mariners. Stay Safe! http://ow.ly/SR4V30fuI0F,Long weekend ahead. We are working /7 to serve Canadians and mariners. Stay Safe!,[],41,0,9,40,1,0,0,0,0,0,50,Environmental,en,0.0,CanadianCoastGuard_facebook,"['marine', 'or']",neutral
137,137,242079006274865_302228086926623,2017-10-31 17:00:00,https://www.facebook.com/CanadianCoastGuard/photos/a.258864731262959.1073741828.242079006274865/302227966926635/?type=3,"Christian Lamar of CCGS Samuel Risley inspects the results of a pumpkin carving contest aboard the ship. 
Happy Halloween!",Christian Lamar of CCGS Samuel Risley inspects the results of a pumpkin carving contest aboard the ship. Happy Halloween!,[],38,0,8,36,0,2,0,0,0,0,46,unknown,en,0.0,CanadianCoastGuard_facebook,,neutral
140,140,242079006274865_298580757291356,2017-10-23 17:00:00,https://www.facebook.com/CanadianCoastGuard/photos/a.258864731262959.1073741828.242079006274865/298580630624702/?type=3,"Rigid Hull Inflatable Operator Training took place in Halifax, Nova Scotia last week. They paced alongside the CCGS Sir Wilfred Grenfell","Rigid Hull Inflatable Operator Training took place in Halifax, Nova Scotia last week. They paced alongside the CCGS Sir Wilfred Grenfell",[],39,0,6,34,4,1,0,0,0,0,45,Environmental,en,0.0,CanadianCoastGuard_facebook,['or'],neutral
149,149,242079006274865_291304204685678,2017-10-02 08:00:01,http://ow.ly/Kbt630dblWW,"Ann Harvey (1811-1860). Born in Isle aux Morts, Newfoundland, the daughter of a fisherman and the eldest of eight children she often spent time helping her father. While fishing in July 1828, they noticed debris floating in the water, and realized that there was a shipwreck nearby. Ann Harvey, her father, twelve year old brother, and the family dog went out in their boat to locate the wreck, and found a large group of survivors on a tiny island. The family managed to save more than 160 people, and the rescue became famous across province. Ann Harvey became known as the Grace Darling of Newfoundland (from an English woman who participated in a similar rescue). http://ow.ly/Kbt630dblWW","Ann Harvey (1811-1860). Born in Isle aux Morts, Newfoundland, the daughter of a fisherman and the eldest of eight children she often spent time helping her father. While fishing in July , they noticed debris floating in the water, and realized that there was a shipwreck nearby. Ann Harvey, her father, twelve year old brother, and the family dog went out in their boat to locate the wreck, and found a large group of survivors on a tiny island. The family managed to save more than people, and the rescue became famous across province. Ann Harvey became known as the Grace Darling of Newfoundland (from an English woman who participated in a similar rescue).",[],33,2,6,28,1,4,0,0,0,0,41,Social,en,0.37777777777777777,CanadianCoastGuard_facebook,"['ami', 'race', 'children', 'family']",positive
152,152,242079006274865_293769354439163,2017-10-06 17:08:27,https://www.facebook.com/CanadianCoastGuard/photos/a.258864731262959.1073741828.242079006274865/293769354439163/?type=3,"CCGS Des Groseilliers returns to Quebec City tomorrow after its annual Arctic mission. During its expedition, supplies were provided to the Eureka weather station on Ellesmere Island. The vessel also escorted the cruise ship Le Boréal through the ice.
To find out more about the icebreaker: ow.ly/fsFV30fHIZ0","CCGS Des Groseilliers returns to Quebec City tomorrow after its annual Arctic mission. During its eedition, supplies were provided to the Eureka weather station on Ellesmere Island. The vessel also escorted the cruise ship Le Boréal through the ice. To find out more about the icebreaker: 0",[],34,0,4,34,0,0,0,0,0,0,38,Environmental,en,0.0,CanadianCoastGuard_facebook,"['or', 'ice', 'mer']",neutral
