,Unnamed: 0,id,date_published,link,caption_original,caption_cleaned,hashtags,num_reactions,num_comments,num_shares,num_likes,num_loves,num_wows,num_hahas,num_sads,num_angrys,num_special,Reactions_SUM,category,language,average_sentiment_score,account_name,words_matched_list,sentiment
36,36,460123390028_10159551758180029,2017-11-01 15:00:57,https://www.facebook.com/EnvironnementetressourcesnaturellesauCanada/photos/a.481746145028.384353.460123390028/10159551758180029/?type=3,"Bon anniversaire au #ServiceCanadienDeLaFaune! 🎉

Le Service canadien de la faune d’Environnement et Changement climatique Canada est au service de la faune canadienne depuis 70 ans... et ça continue! 
http://ow.ly/WSQc30ghPqW",Bon anniversaire au ! Le Service canadien de la faune d’Environnement et Changement climatique Canada est au service de la faune canadienne depuis ans... et ça continue!,['#ServiceCanadienDeLaFaune'],15,0,8,13,2,0,0,0,0,0,23,Environmental,fr,0.0,EnvironnementetressourcesnaturellesauCanada_facebook,"['environnement', 'climat', 'changement climatique', 'climatique', 'air', 'ice', 'faune']",neutral
61,61,460123390028_10159599769365029,2017-11-12 16:35:41,https://www.facebook.com/EnvironnementetressourcesnaturellesauCanada/photos/a.481746145028.384353.460123390028/10159599769365029/?type=3,"C’est aujourd’hui la Journée des forêts à la COP 23. Saviez-vous que les forêts absorbent et stockent du carbone? Ces « puits de carbone » éliminent du carbone de l’atmosphère. 

Le Cadre pancanadien prévoit que le gouvernement du Canada soutiendra les efforts visant à accroître la capacité de stockage du carbone de nos forêts, milieux humides et sols agricoles. http://ow.ly/U9m430gwGVO","C’est aujourd’hui la Journée des forêts à la COP . Saviez-vous que les forêts absorbent et stockent du carbone? Ces « puits de carbone » éliminent du carbone de l’atmosphère. Le Cadre pancanadien prévoit que le gouvernement du Canada soutiendra les efforts visant à accroître la capacité de stockage du carbone de nos forêts, milieux humides et sols agricoles.",[],9,0,8,9,0,0,0,0,0,0,17,Environmental,fr,0.0,EnvironnementetressourcesnaturellesauCanada_facebook,"['carbon', 'or', 'milieux humides']",neutral
60,60,460123390028_10159615963655029,2017-11-16 12:00:31,https://www.facebook.com/EnvironnementetressourcesnaturellesauCanada/photos/a.481746145028.384353.460123390028/10159615963655029/?type=3,Joyeuse Journée mondiale de la philosophie! Faites-nous part de votre citation philosophique préférée dans les commentaires ci-dessous.,Joyeuse Journée mondiale de la philosophie! Faites-nous part de votre citation philosophique préférée dans les commentaires ci-dessous.,[],10,4,3,10,0,0,0,0,0,0,17,Economical,fr,0.0,EnvironnementetressourcesnaturellesauCanada_facebook,"['mondiale', 'mondial']",neutral
75,75,460123390028_10159643635575029,2017-11-23 12:15:00,https://www.facebook.com/EnvironnementetressourcesnaturellesauCanada/videos/10159643635575029/,"Bon 70e anniversaire au Service canadien de la faune, une direction générale d’Environnement et Changement climatique Canada qui tient le rôle d’organisme national gérant les questions fauniques depuis 1947! 🎂

Le Service est responsable de la protection et de la gestion des oiseaux migrateurs, des espèces en péril et de leurs habitats. De plus, il gère 54 réserves nationales de faune et 92 refuges d’oiseaux migrateurs. http://ow.ly/myXC30gLged","Bon e anniversaire au Service canadien de la faune, une direction générale d’Environnement et Changement climatique Canada qui tient le rôle d’organisme national gérant les questions fauniques depuis ! Le Service est responsable de la protection et de la gestion des oiseaux migrateurs, des espèces en péril et de leurs habitats. De plus, il gère réserves nationales de faune et refuges d’oiseaux migrateurs. d",[],9,0,6,5,4,0,0,0,0,0,15,Environmental,fr,0.0,EnvironnementetressourcesnaturellesauCanada_facebook,"['environnement', 'climat', 'oiseau', 'changement climatique', 'ice', 'air', 'oiseaux', 'climatique', 'eau', 'or', 'faune']",neutral
76,76,460123390028_10159571905975029,2017-11-06 09:15:57,https://www.facebook.com/EnvironnementetressourcesnaturellesauCanada/videos/10159571905975029/,"Bonne nouvelle! En travaillant ensemble, les gouvernements fédéraux, provinciaux et territoriaux ont réduit la pollution.","Bonne nouvelle! En travaillant ensemble, les gouvernements fédéraux, provinciaux et territoriaux ont réduit la pollution.",[],10,0,5,7,3,0,0,0,0,0,15,Environmental,fr,0.0,EnvironnementetressourcesnaturellesauCanada_facebook,"['or', 'pollution']",neutral
96,96,460123390028_10159667389310029,2017-11-28 11:00:44,https://www.facebook.com/EnvironnementetressourcesnaturellesauCanada/photos/a.481746145028.384353.460123390028/10159667389310029/?type=3,"En ce jour de « Mardi, je donne », pourquoi ne pas faire un petit don pour la Terre? La Stratégie fédérale de développement durable vous propose des mesures pour aider le Canada à atteindre ses objectifs de durabilité. 

Consultez-la dès maintenant pour en apprendre davantage et posez des gestes dans votre collectivité : 
http://ow.ly/Eq6330gQuOf
#Durabilité #FSDS #ObjectifsMondiaux","En ce jour de « Mardi, je donne », pourquoi ne pas faire un petit don pour la Terre? La Stratégie fédérale de développement durable vous propose des mesures pour aider le Canada à atteindre ses objectifs de durabilité. Consultez-la dès maintenant pour en apprendre davantage et posez des gestes dans votre collectivité : é","['#Durabilit', '#FSDS', '#ObjectifsMondiaux']",9,0,4,6,3,0,0,0,0,0,13,Environmental,fr,0.0,EnvironnementetressourcesnaturellesauCanada_facebook,"['durable', 'air']",neutral
122,122,460123390028_10159611801530029,2017-11-15 12:34:45,https://www.facebook.com/EnvironnementetressourcesnaturellesauCanada/photos/a.481746145028.384353.460123390028/10159611801530029/?type=3,"Excellentes nouvelles! Un nouveau radar météo à la fine pointe de la technologie sera installé à Radisson, en Saskatchewan! C’est le premier d’une longue série de radars qui nous permettront de moderniser notre réseau de radars météo d’ici 2023. Nous sommes peut-être à la merci des phénomènes météorologiques, mais nous pouvons mieux nous préparer pour être en sécurité! http://ow.ly/GWOW30gBidY","Excellentes nouvelles! Un nouveau radar météo à la fine pointe de la technologie sera installé à Radisson, en Saskatchewan! C’est le premier d’une longue série de radars qui nous permettront de moderniser notre réseau de radars météo d’ici . Nous sommes peut-être à la merci des phénomènes météorologiques, mais nous pouvons mieux nous préparer pour être en sécurité!",[],10,1,1,10,0,0,0,0,0,0,12,Environmental,fr,0.0,EnvironnementetressourcesnaturellesauCanada_facebook,"['eau', 'or', 'mer']",neutral
126,126,460123390028_10159599947835029,2017-11-12 17:20:05,https://www.facebook.com/EnvironnementetressourcesnaturellesauCanada/photos/a.481746145028.384353.460123390028/10159599947835029/?type=3,"C’est aujourd’hui, la Journée de l‘industrie à la COP23. Cette journée nous rappelle que la transition vers des sources d’énergie propre est profitable non seulement pour l’environnement, mais aussi pour l’économie. 

De plus en plus, les sources d’énergie renouvelables rivalisent avec les sources traditionnelles. Nous savons qu’il y a plus de 20 trillions de dollars de nouvelles possibilités d’investissements dans les marchés émergents d’ici 2030.

Les entreprises canadiennes sont bien placées pour saisir les possibilités offertes par la croissance propre et, ainsi, créer de nouveaux emplois et de nouvelles technologies, tout en réduisant la pollution. Le gouvernement du Canada investit stratégiquement afin de soutenir la croissance de tous les secteurs de l’économie.","C’est aujourd’hui, la Journée de l‘industrie à la COP23. Cette journée nous rappelle que la transition vers des sources d’énergie propre est profitable non seulement pour l’environnement, mais aussi pour l’économie. De plus en plus, les sources d’énergie renouvelables rivalisent avec les sources traditionnelles. Nous savons qu’il y a plus de trillions de dollars de nouvelles possibilités d’investissements dans les marchés émergents d’ici . Les entreprises canadiennes sont bien placées pour saisir les possibilités offertes par la croissance propre et, ainsi, créer de nouveaux emplois et de nouvelles technologies, tout en réduisant la pollution. Le gouvernement du Canada investit stratégiquement afin de soutenir la croissance de tous les secteurs de l’économie.",[],6,6,0,6,0,0,0,0,0,0,12,Economical,fr,0.0,EnvironnementetressourcesnaturellesauCanada_facebook,"['emplois', 'invest', 'croissance', 'secteur', 'technologies', 'technologie', 'industrie']",neutral
154,154,460123390028_10159677203375029,2017-11-30 15:12:05,https://www.facebook.com/EnvironnementetressourcesnaturellesauCanada/videos/10159677203375029/,"Les changements climatiques touchent nos trésors naturels comme les Monts-Torngat. Paul Smith, scientifique à Environnement et Changement climatique Canada, explique! http://ow.ly/s1F430gVBPg","Les changements climatiques touchent nos trésors naturels comme les Monts-Torngat. Paul Smith, scientifique à Environnement et Changement climatique Canada, elique!",[],3,0,8,3,0,0,0,0,0,0,11,Environmental,fr,0.0,EnvironnementetressourcesnaturellesauCanada_facebook,"['environnement', 'climat', 'nature', 'changement climatique', 'climatique', 'or']",neutral
162,162,460123390028_10159602563995029,2017-11-13 10:00:25,https://www.facebook.com/EnvironnementetressourcesnaturellesauCanada/photos/a.481746145028.384353.460123390028/10159602563995029/?type=3,"Aujourd’hui est la Journée internationale de la gentillesse! Faites un effort conscient pour faire preuve de gentillesse envers vous-même, autrui et la planète. Répandez l’amour autour de vous! 💕","Aujourd’hui est la Journée internationale de la gentillesse! Faites un effort conscient pour faire preuve de gentillesse envers vous-même, autrui et la planète. Répandez l’amour autour de vous!",[],4,0,6,4,0,0,0,0,0,0,10,Environmental,fr,0.0,EnvironnementetressourcesnaturellesauCanada_facebook,"['or', 'air']",neutral
206,206,460123390028_10159633574705029,2017-11-20 10:31:35,https://www.facebook.com/EnvironnementetressourcesnaturellesauCanada/photos/a.481746145028.384353.460123390028/10159633574080029/?type=3,"À l’instant! Le très honorable Brian Mulroney, la ministre de l’Environnement et du Changement climatique, Catherine McKenna et Tina Birmpili, Secrétaire exécutive du Secrétariat de l’ozone représentant UN Environment lors de la conférence du #ProtocoleDeMontréal. http://ow.ly/X6HY30gHeeK","À l’instant! Le très honorable Brian Mulroney, la ministre de l’Environnement et du Changement climatique, Catherine McKenna et Tina Birmpili, Secrétaire exécutive du Secrétariat de l’ozone représentant UN Environment lors de la conférence du éal.",['#ProtocoleDeMontr'],8,1,0,7,1,0,0,0,0,0,9,Environmental,fr,0.0,EnvironnementetressourcesnaturellesauCanada_facebook,"['environnement', 'climat', 'changement climatique', 'climatique', 'air', 'or']",neutral
220,220,460123390028_10159634645625029,2017-11-20 15:45:00,https://www.facebook.com/EnvironnementetressourcesnaturellesauCanada/photos/a.481746145028.384353.460123390028/10159634644685029/?type=3,"La ministre canadienne de l’Environnement et du Changement climatique, Catherine McKenna, est l’hôte cette semaine d’une réunion internationale à Montréal axée en partie sur la mise en œuvre de la plus grande mesure mondiale de lutte contre les changements climatiques jamais prise : l’élimination progressive des hydrofluorocarbures (HFC). 

Nous utilisons tous des HFC dans les appareils tels que les réfrigérateurs et les climatiseurs, et ils nous refroidissent avec une très grande efficacité. Malheureusement, ils réchauffent aussi la planète. Les délégués à la réunion du Protocole de Montréal travaillent à la mise en œuvre de l’amendement de Kigali au Protocole de Montréal, qui appelle à une élimination progressive mondiale des HFC. Les pays ont adopté l’amendement l’année passée, et le Canada est récemment devenu l’un des premiers pays à le ratifier. 

Le Canada prend d’énormes mesures pour assurer un avenir propre à nos enfants et à nos petits-enfants et, dans le cadre de ces efforts, conseille vivement aux autres pays de ratifier l’amendement de Kigali.","La ministre canadienne de l’Environnement et du Changement climatique, Catherine McKenna, est l’hôte cette semaine d’une réunion internationale à Montréal axée en partie sur la mise en œuvre de la plus grande mesure mondiale de lutte contre les changements climatiques jamais prise : l’élimination progressive des hydrofluorocarbures (HFC). Nous utilisons tous des HFC dans les appareils tels que les réfrigérateurs et les climatiseurs, et ils nous refroidissent avec une très grande efficacité. Malheureusement, ils réchauffent aussi la planète. Les délégués à la réunion du Protocole de Montréal travaillent à la mise en œuvre de l’amendement de Kigali au Protocole de Montréal, qui appelle à une élimination progressive mondiale des HFC. Les pays ont adopté l’amendement l’année passée, et le Canada est récemment devenu l’un des premiers pays à le ratifier. Le Canada prend d’énormes mesures pour assurer un avenir propre à nos enfants et à nos petits-enfants et, dans le cadre de ces efforts, conseille vivement aux autres pays de ratifier l’amendement de Kigali.",[],4,1,4,3,1,0,0,0,0,0,9,Environmental,fr,0.0,EnvironnementetressourcesnaturellesauCanada_facebook,"['environnement', 'climat', 'changement climatique', 'climatique', 'propre', 'or']",neutral
210,210,460123390028_10159676572065029,2017-11-30 12:00:30,https://www.facebook.com/EnvironnementetressourcesnaturellesauCanada/photos/a.481746145028.384353.460123390028/10159676572065029/?type=3,"À la COP23 BONN, la ministre de l’Environnement et du Changement climatique, Catherine McKenna, a rencontré le cinéaste canadien, Mark Terry, qui a créé un projet visant à présenter environ 300 vidéos de recherche sur le climat. Consultez la carte pour explorer ces vidéos produites dans le monde entier!
http://ow.ly/4O6B30gU4ub","À la COP23 BONN, la ministre de l’Environnement et du Changement climatique, Catherine McKenna, a rencontré le cinéaste canadien, Mark Terry, qui a créé un projet visant à présenter environ vidéos de recherche sur le climat. Consultez la carte pour elorer ces vidéos produites dans le monde entier!",[],7,2,0,6,1,0,0,0,0,0,9,Environmental,fr,0.0,EnvironnementetressourcesnaturellesauCanada_facebook,"['environnement', 'climat', 'cop23', 'changement climatique', 'climatique', 'or']",neutral
199,199,460123390028_10159612330705029,2017-11-15 15:26:06,https://www.facebook.com/EnvironnementetressourcesnaturellesauCanada/videos/10159612330705029/,"Regardez les faits saillants du jour à la COP23 présentés par la ministre de l’Environnement et du Changement climatique, Catherine McKenna : les impacts des changements climatiques sur les sexes et les peuples autochtones.","Regardez les faits saillants du jour à la COP23 présentés par la ministre de l’Environnement et du Changement climatique, Catherine McKenna : les impacts des changements climatiques sur les sexes et les peuples autochtones.",[],8,1,0,8,0,0,0,0,0,0,9,Environmental,fr,0.0,EnvironnementetressourcesnaturellesauCanada_facebook,"['environnement', 'cop23', 'changement climatique', 'climatique', 'climat']",neutral
205,205,460123390028_10159648265135029,2017-11-23 17:47:40,https://www.facebook.com/EnvironnementetressourcesnaturellesauCanada/photos/a.481746145028.384353.460123390028/10159648265135029/?type=3,"Le caribou est une espèce canadienne emblématique qui se retrouve partout au pays. Cependant, de nombreuses populations, y compris le caribou des montagnes du Sud, sont en déclin et sous pression.

Aujourd'hui, les gouvernements du Canada et de la Colombie-Britannique travaillent ensemble à un nouvel accord de conservation en vertu de la Loi sur les espèces en péril, avec l'intention de collaborer avec les Premières Nations sur la planification de rétablissement et les efforts de rétablissement sur le terrain.

Pour en connaître davantage : http://ow.ly/osW830gMxAT","Le caribou est une espèce canadienne emblématique qui se retrouve partout au pays. Cependant, de nombreuses populations, y compris le caribou des montagnes du Sud, sont en déclin et sous pression. Aujourd'hui, les gouvernements du Canada et de la Colombie-Britannique travaillent ensemble à un nouvel accord de conservation en vertu de la Loi sur les espèces en péril, avec l'intention de collaborer avec les Premières Nations sur la planification de rétablissement et les efforts de rétablissement sur le terrain. Pour en connaître davantage :",[],7,0,2,7,0,0,0,0,0,0,9,Environmental,fr,0.0,EnvironnementetressourcesnaturellesauCanada_facebook,"['conservation', 'or', 'vert', 'populations']",neutral
187,187,460123390028_10159604900350029,2017-11-13 20:54:31,https://www.facebook.com/EnvironnementetressourcesnaturellesauCanada/photos/a.481746145028.384353.460123390028/10159604897960029/?type=3,"Le Canada joue un rôle actif et important au pays et à l’étranger afin de promouvoir la tarification du carbone. La ministre McKenna a coprésidé en compagnie du président de la Royal DSM, Feike Sijbesma, la dernière rencontre de la Coalition pour le leadership en matière de tarification du carbone composée de représentants des gouvernements, d’entreprises et d’autres intervenants du milieu de l’environnement, dans le but de montrer au monde les possibilités économiques et environnementales.

http://ow.ly/u61g30gyIs1","Le Canada joue un rôle actif et important au pays et à l’étranger afin de promouvoir la tarification du carbone. La ministre McKenna a coprésidé en compagnie du président de la Royal DSM, Feike Sijbesma, la dernière rencontre de la Coalition pour le leadership en matière de tarification du carbone composée de représentants des gouvernements, d’entreprises et d’autres intervenants du milieu de l’environnement, dans le but de montrer au monde les possibilités économiques et environnementales. 1",[],6,0,3,6,0,0,0,0,0,0,9,Environmental,fr,0.0,EnvironnementetressourcesnaturellesauCanada_facebook,"['carbon', 'tarification du carbone', 'or', 'environnement']",neutral
264,264,460123390028_10159635114735029,2017-11-20 17:30:09,https://www.facebook.com/EnvironnementetressourcesnaturellesauCanada/photos/a.481746145028.384353.460123390028/10159635114735029/?type=3,"C’est la Journée internationale de l’enfance! Que faites-vous pour préserver la santé de notre planète et la garder propre, aujourd’hui et pour demain? 

Une des choses que vous pouvez faire est d’en apprendre davantage sur le plan du Canada pour un avenir durable en consultant la Stratégie fédérale de développement durable. Voyez quelles mesures vous pouvez prendre : http://ow.ly/jIQT30gHN0G 
#Durabilité #FSDS #ObjectifsMondiaux","C’est la Journée internationale de l’enfance! Que faites-vous pour préserver la santé de notre planète et la garder propre, aujourd’hui et pour demain? Une des choses que vous pouvez faire est d’en apprendre davantage sur le plan du Canada pour un avenir durable en consultant la Stratégie fédérale de développement durable. Voyez quelles mesures vous pouvez prendre : é","['#Durabilit', '#FSDS', '#ObjectifsMondiaux']",6,0,2,5,1,0,0,0,0,0,8,Environmental,fr,0.0,EnvironnementetressourcesnaturellesauCanada_facebook,"['durable', 'propre', 'air']",neutral
265,265,460123390028_10159588661745029,2017-11-10 06:15:04,https://www.facebook.com/EnvironnementetressourcesnaturellesauCanada/photos/a.481746145028.384353.460123390028/10159588661745029/?type=3,"Quatrième arrêt de la tournée #CampusClimat avec la ministre de l’Environnement et Changement climatique, Catherine McKenna. Elle a parlé lors de l'événement Innovation Jam - Ottawa Sustainability Challenge de Student Energy Carleton à Carleton University (Official). Les étudiants jouent un rôle très important dans la création de solutions novatrices pour lutter contre les changements climatiques.","Quatrième arrêt de la tournée avec la ministre de l’Environnement et Changement climatique, Catherine McKenna. Elle a parlé lors de l'événement Innovation Jam - Ottawa Sustainability Challenge de Student Energy Carleton à Carleton University (Official). Les étudiants jouent un rôle très important dans la création de solutions novatrices pour lutter contre les changements climatiques.",['#CampusClimat'],7,1,0,7,0,0,0,0,0,0,8,Economical,fr,0.0,EnvironnementetressourcesnaturellesauCanada_facebook,"['novatrice', 'import', 'energy', 'ministre', 'innovation']",neutral
269,269,460123390028_10159663739180029,2017-11-27 14:22:29,https://www.facebook.com/EnvironnementetressourcesnaturellesauCanada/photos/a.481746145028.384353.460123390028/10159663739180029/?type=3,"Cette carte interactive incroyable présente environ 300 vidéos de recherche sur le climat produites par des jeunes du monde entier! 

Ce projet médiatique d’externalisation, Youth Climate Report, a été produit par un cinéaste canadien et aspirant au doctorat, Mark Terry, avec la collaboration de la Convention-cadre des Nations Unies sur les changements climatiques. 
http://ow.ly/ZQ2I30gQtfr","Cette carte interactive incroyable présente environ vidéos de recherche sur le climat produites par des jeunes du monde entier! Ce projet médiatique d’externalisation, Youth Climate Report, a été produit par un cinéaste canadien et aspirant au doctorat, Mark Terry, avec la collaboration de la Convention-cadre des Nations Unies sur les changements climatiques.",[],3,1,4,2,1,0,0,0,0,0,8,Social,fr,0.0,EnvironnementetressourcesnaturellesauCanada_facebook,"['collaboration', 'jeunes', 'changement', 'change']",neutral
310,310,460123390028_10159608927065029,2017-11-14 20:25:04,https://www.facebook.com/EnvironnementetressourcesnaturellesauCanada/photos/a.481746145028.384353.460123390028/10159608927065029/?type=3,C’est aujourd’hui la Journée de la résilience à la COP23. Nous mettons à jour les codes du bâtiment du Canada et élaborons un code de rénovation pour nous adapter aux changements climatiques. Notre but : créer les bâtiments écologiques du 21e siècle.,C’est aujourd’hui la Journée de la résilience à la COP23. Nous mettons à jour les codes du bâtiment du Canada et élaborons un code de rénovation pour nous adapter aux changements climatiques. Notre but : créer les bâtiments écologiques du e siècle.,[],5,1,1,5,0,0,0,0,0,0,7,Environmental,fr,0.0,EnvironnementetressourcesnaturellesauCanada_facebook,"['cop23', 'or', 'climatique', 'climat']",neutral
348,348,460123390028_10159651402145029,2017-11-24 13:13:08,https://www.facebook.com/EnvironnementetressourcesnaturellesauCanada/videos/10159651402145029/,"Au cas où vous l’auriez manqué, la délégation du Canada a travaillé très fort à la COP23 à Bonn en Allemagne pour créer une planète durable pour les générations futures. Nous sommes tous unis pour l’#ActionClimatique.","Au cas où vous l’auriez manqué, la délégation du Canada a travaillé très fort à la COP23 à Bonn en Allemagne pour créer une planète durable pour les générations futures. Nous sommes tous unis pour l’.",['#ActionClimatique'],5,0,2,4,0,1,0,0,0,0,7,Environmental,fr,0.0,EnvironnementetressourcesnaturellesauCanada_facebook,"['cop23', 'durable', 'or']",neutral
312,312,460123390028_10159622518920029,2017-11-18 14:12:03,https://www.facebook.com/EnvironnementetressourcesnaturellesauCanada/videos/10159622518920029/,"Rencontrez Anne Marie Arko, une étudiante d'Environnement et Changement climatique Canada qui a travaillé étroitement avec l'équipe de négociation du Canada pour mobiliser l'action climatique à la Convention-cadre des Nations Unies sur les changements climatiques (COP23) à Bonn, en Allemagne. Le Canada soutient les jeunes qui prennent des mesures pour adresser le changement climatique. Les jeunes sont essentiel dans la lutte contre les changements climatiques. Nous avons besoin de leurs idées et solutions innovatrices pour aider à bâtir un Canada plus propre et plus prospère pour les générations à venir.","Rencontrez Anne Marie Arko, une étudiante d'Environnement et Changement climatique Canada qui a travaillé étroitement avec l'équipe de négociation du Canada pour mobiliser l'action climatique à la Convention-cadre des Nations Unies sur les changements climatiques (COP23) à Bonn, en Allemagne. Le Canada soutient les jeunes qui prennent des mesures pour adresser le changement climatique. Les jeunes sont essentiel dans la lutte contre les changements climatiques. Nous avons besoin de leurs idées et solutions innovatrices pour aider à bâtir un Canada plus propre et plus prospère pour les générations à venir.",[],6,0,1,6,0,0,0,0,0,0,7,Environmental,fr,0.0,EnvironnementetressourcesnaturellesauCanada_facebook,"['environnement', 'climat', 'cop23', 'changement climatique', 'climatique', 'ice', 'propre']",neutral
