,id,date_published,link,caption_original,caption_cleaned,hashtags,category,Reactions_SUM,average_sentiment_score,language,account_name
71,875464807842856960,2017-06-15 21:27:30,['https://t.co/UtAqg0Gnh'],In French only https://t.co/UtAqg0Gnh9,French https co UtAqg0Gnh9,[],Social,1,0.0,en,DFO_CCG_Quebec_tweeter
72,876898398712066050,2017-06-19 20:24:04,['https://t.co/qcOd8jGBMH'],"Review of the Magdalen Islands compliance operation on June 15-16: 44 boarded vessels, 7 offenses and 10 written warnings https://t.co/qcOd8jGBMH",Review Magdalen Islands compliance operation June 15 16 44 boarded vessels offenses 10 written warnings https co qcOd8jGBMH,[],Environmental,1,0.0,en,DFO_CCG_Quebec_tweeter
73,875466864343863296,2017-06-15 21:35:40,['https://t.co/BbG6vSDkjb'],In French only https://t.co/BbG6vSDkjb,French https co BbG6vSDkjb,[],Social,1,0.0,en,DFO_CCG_Quebec_tweeter
74,875434846499287041,2017-06-15 19:28:26,['https://t.co/z8yRnKMnbh'],In French only https://t.co/z8yRnKMnbh,French https co z8yRnKMnbh,[],Social,0,0.0,en,DFO_CCG_Quebec_tweeter
75,873344476038799361,2017-06-10 01:02:03,['https://t.co/PMZ25pbXZ'],1/2 These vehicles will increase the quality and quantity of data collected. A gain for the safety of navigation. https://t.co/PMZ25pbXZd,vehicles increase quality quantity data collected gain safety navigation https co PMZ25pbXZd,[],Social,0,0.0,en,DFO_CCG_Quebec_tweeter
76,875495744970608640,2017-06-15 23:30:26,[],Véronique Lesage + her team from Maurice Lamontagne Institute took part in the reintegration operation for the beluga #thegreatbelugarescue,ronique Lesage team Maurice Lamontagne Institute took part reintegration operation beluga thegreatbelugarescue,['#thegreatbelugarescue'],Environmental,0,0.0,fr,DFO_CCG_Quebec_tweeter
77,875743716555862017,2017-06-16 15:55:47,['https://t.co/Mcs7XWAWaZ'],2/2 A surveillance aircraft and several boats are used by Fishery Officers to conduct this operation https://t.co/Mcs7XWAWaZ,surveillance aircraft several boats used Fishery Officers conduct operation https co Mcs7XWAWaZ,[],Environmental,0,0.0,en,DFO_CCG_Quebec_tweeter
78,880486509111107586,2017-06-29 18:01:57,['https://t.co/wYMjZo9M'],#TBT No doubt: ways of #communication have changed radically since the early 1900s... https://t.co/wYMjZo9Mc2,TBT doubt ways communication changed radically since early 1900s https co wYMjZo9Mc2,"['#TBT', '#communication']",Social,0,0.1,en,DFO_CCG_Quebec_tweeter
79,880152540511440897,2017-06-28 19:54:52,"['https://t.co/3m5DdZRTan', 'https://t.co/jENuJ1FmNR']",Do blue whales make optimal choices when they dive for food in the St. Lawrence? https://t.co/3m5DdZRTan https://t.co/jENuJ1FmNR,blue whales make optimal choices dive food St Lawrence https co 3m5DdZRTan https co jENuJ1FmNR,[],Environmental,0,0.0,en,DFO_CCG_Quebec_tweeter
80,878342600788520960,2017-06-23 20:02:49,"['https://t.co/jdkX4tdqe', 'https://t.co/JKkoKOHBQn']",Infoceans: the June-July 2017 issue of our bulletin is now online! Check it out! https://t.co/jdkX4tdqed https://t.co/JKkoKOHBQn,Infoceans June July 2017 issue bulletin online Check https co jdkX4tdqed https co JKkoKOHBQn,[],Environmental,0,0.0,en,DFO_CCG_Quebec_tweeter
81,877585886069870594,2017-06-21 17:55:54,['https://t.co/sOk8INVlLH'],"2/2 Annie Biron works at the Canadian Hydrographic Service (CHS), Fisheries and Oceans Canada https://t.co/sOk8INVlLH",Annie Biron works Canadian Hydrographic Service CHS Fisheries Oceans Canada https co sOk8INVlLH,[],Environmental,0,0.0,en,DFO_CCG_Quebec_tweeter
82,877585755526266880,2017-06-21 17:55:23,['https://t.co/cOeNRbDKaM'],1/2 Annie Biron explains how to map Canada's waterways https://t.co/cOeNRbDKaM #WorldHydrographyDay,Annie Biron explains map Canada waterways https co cOeNRbDKaM WorldHydrographyDay,['#WorldHydrographyDay'],Environmental,0,0.0,en,DFO_CCG_Quebec_tweeter
83,875777191988125699,2017-06-16 18:08:48,['https://t.co/GbsBZ8rVWY'],In French only https://t.co/GbsBZ8rVWY,French https co GbsBZ8rVWY,[],Social,0,0.0,en,DFO_CCG_Quebec_tweeter
