,id,date_published,link,caption_original,caption_cleaned,hashtags,category,Reactions_SUM,average_sentiment_score,language,account_name
0,431918433581020_1009870035785854,2017-02-06 11:45:30,https://www.facebook.com/YourMoneyMattersCanada/photos/a.501487959957400.1073741828.431918433581020/1009870035785854/?type=3,"Have you heard about the 52-week money challenge? 

It may be February, but it’s not too late to commit to a new money-saving habit. Keep things simple by making a plan and setting an attainable savings goal. 
On the first week, put aside a dollar. Week two, two dollars. Week three, three dollars. Spot the trend? By the end of 2017, you’ll have saved $1,378! 
This week is the sixth week of the year, so catch up by starting with a lump sum of $21. 
More saving tips: http://ow.ly/Kwbw308FeQX","Have you heard about the -week money challenge? It may be February, but it’s not too late to commit to a new money-saving habit. Keep things simple by making a plan and setting an attainable savings goal. On the first week, put aside a dollar. Week two, two dollars. Week three, three dollars. Spot the trend? By the end of , you’ll have saved $1,378! This week is the sixth week of the year, so catch up by starting with a lump sum of $21. More saving tips:",[],Economical,94,0.0,en,YourMoneyMattersCanada_facebook
1,431918433581020_1016771938428997,2017-02-15 11:45:29,https://www.facebook.com/YourMoneyMattersCanada/photos/a.501487959957400.1073741828.431918433581020/1016771938428997/?type=3,"It’s never too early to learn the value of money. 

#ProTip: Have your kids judge the value of a purchase by looking an item’s cost and calculating the time it would take to earn the money to buy it. Is the newest gadget worth the wait for allowance, babysitting money or any number of hours spent at a part-time job? Get them in the saving habit now! 

More on teaching your kids about money: http://ow.ly/G9AB308TErX","It’s never too early to learn the value of money. : Have your kids judge the value of a purchase by looking an item’s cost and calculating the time it would take to earn the money to buy it. Is the newest gadget worth the wait for allowance, babysitting money or any number of hours spent at a part-time job? Get them in the saving habit now! More on teaching your kids about money:",['#ProTip'],Social,75,0.0,en,YourMoneyMattersCanada_facebook
2,431918433581020_1017671648339026,2017-02-16 11:45:31,https://www.facebook.com/YourMoneyMattersCanada/photos/a.501487959957400.1073741828.431918433581020/1017671648339026/?type=3,"Have you received a confirmation for an e-transfer you never sent?

Don’t panic! These types of emails are called phishing and are intended to make you act quickly before you can consider the consequences.

Avoid clicking links in unsolicited emails, no matter how legitimate the source may seem. Learn to recognize email fraud and phishing: http://ow.ly/OF0O308TES7","Have you received a confirmation for an e-transfer you never sent? Don’t panic! These types of emails are called phishing and are intended to make you act quickly before you can consider the consequences. Avoid clicking links in unsolicited emails, no matter how legitimate the source may seem. Learn to recognize email fraud and phishing:",[],Environmental,69,0.0,en,YourMoneyMattersCanada_facebook
3,431918433581020_1010884675684390,2017-02-07 14:01:37,https://www.facebook.com/YourMoneyMattersCanada/photos/a.501487959957400.1073741828.431918433581020/1010884675684390/?type=3,Struggling to pay bills? You have options—a Licensed Insolvency Trustee (LIT) can help! Find out more from the Office of the Superintendent of Bankruptcy Canada: http://ow.ly/J1mB308FhoF,Struggling to pay bills? You have options—a Licensed Insolvency Trustee (LIT) can help! Find out more from the Office of the Superintendent of Bankruptcy Canada:,[],Environmental,48,0.0,en,YourMoneyMattersCanada_facebook
4,431918433581020_1024092817696909,2017-02-24 11:45:28,https://www.facebook.com/YourMoneyMattersCanada/photos/a.501487959957400.1073741828.431918433581020/1024092817696909/?type=3,"CRA’s tax filing deadline is fast approaching!

Good news: If you tend to leave filing your tax return until the very last minute, this year you will have one extra day to get it in on time. 

Since April 30 falls on a Sunday this year, your return will be considered filed on time if it is received (or postmarked) on or before May 1, 2017. 

Find all the details you need for filing here: http://ow.ly/Ocxq3096CyV","CRA’s tax filing deadline is fast approaching! Good news: If you tend to leave filing your tax return until the very last minute, this year you will have one extra day to get it in on time. Since April falls on a Sunday this year, your return will be considered filed on time if it is received (or postmarked) on or before May , . Find all the details you need for filing here:",[],Economical,43,0.0,en,YourMoneyMattersCanada_facebook
5,431918433581020_1021157201323804,2017-02-20 15:45:20,https://www.facebook.com/YourMoneyMattersCanada/photos/a.501487959957400.1073741828.431918433581020/1021157201323804/?type=3,"Getting a paint job? Make sure to get a written contract. 

No contract means NO PROTECTION against damages or if a worker is injured at your house. We have info to help you protect yourself: http://ow.ly/t7Ui308CKam",Getting a paint job? Make sure to get a written contract. No contract means NO PROTECTION against damages or if a worker is injured at your house. We have info to help you protect yourself:,[],Environmental,41,0.0,en,YourMoneyMattersCanada_facebook
6,431918433581020_1012385955534262,2017-02-09 11:45:28,https://www.facebook.com/YourMoneyMattersCanada/photos/a.501487959957400.1073741828.431918433581020/1012385955534262/?type=3,"#LifeHack: Spending money on T-shirts that shrink? Soak your shrunken tees in warm water and 60 ml of hair conditioner, then carefully stretch the fabric back out.
Keep your money in your pocket and T-shirts in your closet by giving them a new life!",": Spending money on T-shirts that shrink? Soak your shrunken tees in warm water and ml of hair conditioner, then carefully stretch the fabric back out. Keep your money in your pocket and T-shirts in your closet by giving them a new life!",['#LifeHack'],Environmental,38,0.0,en,YourMoneyMattersCanada_facebook
7,431918433581020_1021787741260750,2017-02-21 11:45:29,https://www.facebook.com/YourMoneyMattersCanada/photos/a.501487959957400.1073741828.431918433581020/1021787741260750/?type=3,"Are you in over your head with debt?

Get help. A Licensed Insolvency Trustee (LIT) is a licensed professional regulated by the Office of the Superintendent of Bankruptcy Canada. #LITsCanHelp 

Find out more: http://ow.ly/3iCb3096nlC",Are you in over your head with debt? Get help. A Licensed Insolvency Trustee (LIT) is a licensed professional regulated by the Office of the Superintendent of Bankruptcy Canada. Find out more: C,['#LITsCanHelp'],Environmental,35,0.0,en,YourMoneyMattersCanada_facebook
8,431918433581020_1022565581182966,2017-02-22 11:45:31,https://www.facebook.com/YourMoneyMattersCanada/photos/a.501487959957400.1073741828.431918433581020/1022565581182966/?type=3,"Tired of junk mail clogging up your mailbox?

Sign up for the Canadian Marketing Association’s Do Not Mail Service and take back your mailbox! Putting your name on the list lets marketers know you no longer want to receive their unsolicited offers.

Register here: http://ow.ly/7jbE3096xD3",Tired of junk mail clogging up your mailbox? Sign up for the Canadian Marketing Association’s Do Not Mail Service and take back your mailbox! Putting your name on the list lets marketers know you no longer want to receive their unsolicited offers. Register here:,[],Environmental,34,0.0,en,YourMoneyMattersCanada_facebook
9,431918433581020_1013145805458277,2017-02-10 11:40:42,https://www.facebook.com/YourMoneyMattersCanada/videos/1013145805458277/,"On the go and need to check your tax return status?

Take advantage of the MyCRA mobile app, which allows you to securely access and view key portions of your tax info: http://ow.ly/5yCa308FnF2","On the go and need to check your tax return status? Take advantage of the MyCRA mobile app, which allows you to securely access and view key portions of your tax info: 2",[],Economical,32,0.0,en,YourMoneyMattersCanada_facebook
10,431918433581020_1010801382359386,2017-02-07 11:41:38,https://www.facebook.com/YourMoneyMattersCanada/videos/1010801382359386/,"#DYK the value of a new car can depreciate as much as 40% in the first two years!? 

Stretching out your car payments with a long-term loan can help lower your monthly payments, but the longer the loan, the longer the period in which you will owe more than your car is actually worth! 

Learn more about financing a car: http://ow.ly/hIA6308Ffux","the value of a new car can depreciate as much as % in the first two years!? Stretching out your car payments with a long-term loan can help lower your monthly payments, but the longer the loan, the longer the period in which you will owe more than your car is actually worth! Learn more about financing a car:",['#DYK'],Environmental,23,0.0,en,YourMoneyMattersCanada_facebook
11,431918433581020_1011559088950282,2017-02-08 11:45:31,https://www.facebook.com/YourMoneyMattersCanada/photos/a.501487959957400.1073741828.431918433581020/1011559088950282/?type=3,"Thinking about signing up for a free trial for computer software or an app? Once the trial period is over, “free” often gets replaced with “fee.”

Before opting in, research the company offering the free trial and read the contract’s fine print. Pay extra attention to what happens once your trial is over. 
Make sure you aren’t automatically signed up for a subscription or won’t be charged additional fees. Learn more about free trial scams: http://ow.ly/r9UL308Fn0Z","Thinking about signing up for a free trial for computer software or an app? Once the trial period is over, “free” often gets replaced with “fee.” Before opting in, research the company offering the free trial and read the contract’s fine print. Pay extra attention to what happens once your trial is over. Make sure you aren’t automatically signed up for a subscription or won’t be charged additional fees. Learn more about free trial scams:",[],Environmental,23,0.0,en,YourMoneyMattersCanada_facebook
12,431918433581020_1021930277913163,2017-02-21 15:45:26,http://www.consumerhandbook.ca/en/topics/consumer-protection/online-shopping,"Online shopping can be fast and convenient; however, it can leave you open to scams unless you know how to protect yourself. 

Follow these tips to protect yourself from fraud while shopping online: http://www.consumerhandbook.ca/en/topics/consumer-protection/online-shopping","Online shopping can be fast and convenient; however, it can leave you open to scams unless you know how to protect yourself. Follow these tips to protect yourself from fraud while shopping online:",[],Social,22,0.0,en,YourMoneyMattersCanada_facebook
13,431918433581020_1027211807385010,2017-02-28 11:45:26,https://www.facebook.com/YourMoneyMattersCanada/photos/a.501487959957400.1073741828.431918433581020/1027211807385010/?type=3,"Do you have serious financial problems? #LITsCanHelp! 

Find out what option is best for you, and how a Licensed Insolvency Trustee can help you get out of debt and back on track. http://ow.ly/uIiA309kFUh","Do you have serious financial problems? ! Find out what option is best for you, and how a Licensed Insolvency Trustee can help you get out of debt and back on track.",['#LITsCanHelp'],Environmental,21,0.0,en,YourMoneyMattersCanada_facebook
14,431918433581020_1007545512684973,2017-02-03 11:45:30,,"Are you expecting a baby?

Once your bundle of joy has arrived, use the Automated Benefits Application on the birth registration form to apply for the Canada Child Benefit, the GST/HST credit, and related provincial or territorial programs for your child.

Find out more, including which provinces and territories are offering this service: 
http://ow.ly/hnkv308qwSo","Are you eecting a baby? Once your bundle of joy has arrived, use the Automated Benefits Application on the birth registration form to apply for the Canada Child Benefit, the GST/HST credit, and related provincial or territorial programs for your child. Find out more, including which provinces and territories are offering this service:",[],Environmental,21,0.0,en,YourMoneyMattersCanada_facebook
15,431918433581020_1015289085243949,2017-02-13 11:45:25,https://www.facebook.com/YourMoneyMattersCanada/photos/a.501487959957400.1073741828.431918433581020/1015289085243949/?type=3,"Retirement can sneak up on you quicker than you think. Are you financially prepared for your future? 

March 1 is this year’s deadline for contributing to your #RRSP. To get a tax break by simply saving for retirement, contribute before the deadline. 
 
Read more about the basics of tax returns: http://ow.ly/Js0C308TCps","Retirement can sneak up on you quicker than you think. Are you financially prepared for your future? March is this year’s deadline for contributing to your . To get a tax break by simply saving for retirement, contribute before the deadline. Read more about the basics of tax returns:",['#RRSP'],Social,20,0.0,en,YourMoneyMattersCanada_facebook
16,431918433581020_1016105858495605,2017-02-14 11:45:29,https://www.facebook.com/YourMoneyMattersCanada/photos/a.501487959957400.1073741828.431918433581020/1016105858495605/?type=3,"When you’re in debt and need help, who should you turn to for qualified help? 

Understand the difference between a licensed professional and a debt consultant. #LITsCanHelp. Find out more: http://ow.ly/o7cL308Txt7","When you’re in debt and need help, who should you turn to for qualified help? Understand the difference between a licensed professional and a debt consultant. . Find out more:",['#LITsCanHelp'],Environmental,19,0.0,en,YourMoneyMattersCanada_facebook
17,431918433581020_1006010916171766,2017-02-01 16:01:34,https://www.facebook.com/YourMoneyMattersCanada/photos/a.501487959957400.1073741828.431918433581020/1006010916171766/?type=3,"We all put our faith in the banks to keep our money secure, but looking at your monthly bank statement is a good way to help ensure your money is safe.

It’s a good practice to check your statement at least once a month for any transactions you don't recognize. Plus, this habit can help you make smart decisions on how you manage your money: http://ow.ly/quil308qwB0","We all put our faith in the banks to keep our money secure, but looking at your monthly bank statement is a good way to help ensure your money is safe. It’s a good practice to check your statement at least once a month for any transactions you don't recognize. Plus, this habit can help you make smart decisions on how you manage your money: 0",[],Environmental,18,0.0,en,YourMoneyMattersCanada_facebook
18,431918433581020_1011722995600558,2017-02-08 16:30:50,http://news.gc.ca/web/article-en.do?mthd=index&crtr.page=1&nid=1184869,,,[],Social,16,0.0,tl,YourMoneyMattersCanada_facebook
19,431918433581020_1026444110795113,2017-02-27 11:45:23,https://www.facebook.com/YourMoneyMattersCanada/photos/a.501487959957400.1073741828.431918433581020/1026444110795113/?type=3,"Are you #saving for your future? The March 1st RRSP contribution deadline for the 2016 tax season is quickly approaching! 

Find out more about RRSP deductions: http://ow.ly/ECcF309kFhp",Are you for your future? The March st RRSP contribution deadline for the tax season is quickly approaching! Find out more about RRSP deductions:,['#saving'],Social,15,0.0,en,YourMoneyMattersCanada_facebook
20,431918433581020_1021010834671774,2017-02-20 11:45:35,https://www.facebook.com/YourMoneyMattersCanada/photos/a.501487959957400.1073741828.431918433581020/1021010834671774/?type=3,"Are your data overage fees higher than your actual monthly plan? Time for a new plan! 

Whether you’re streaming videos, uploading photos or playing the latest video game, what you pay for the convenience of accessing data anywhere can add up fast. To avoid data overages, review your plan to see if it still reflects your mobile habits. 
Learn more about data overage charges: http://ow.ly/DrYD3096mfT","Are your data overage fees higher than your actual monthly plan? Time for a new plan! Whether you’re streaming videos, uploading photos or playing the latest video game, what you pay for the convenience of accessing data anywhere can add up fast. To avoid data overages, review your plan to see if it still reflects your mobile habits. Learn more about data overage charges:",[],Social,15,0.0,en,YourMoneyMattersCanada_facebook
21,431918433581020_1015465458559645,2017-02-13 16:01:21,https://www.facebook.com/YourMoneyMattersCanada/photos/a.501487959957400.1073741828.431918433581020/1015465458559645/?type=3,"Need to hire a contractor? Demand a WRITTEN CONTRACT. 

Without one, you may be OUT OF POCKET for damages or unfinished work. How to protect yourself: http://ow.ly/t7Ui308CKam","Need to hire a contractor? Demand a WRITTEN CONTRACT. Without one, you may be OUT OF POCKET for damages or unfinished work. How to protect yourself:",[],Environmental,13,0.0,en,YourMoneyMattersCanada_facebook
22,431918433581020_1006752942764230,2017-02-02 13:40:50,https://www.facebook.com/YourMoneyMattersCanada/photos/a.501487959957400.1073741828.431918433581020/1006752942764230/?type=3,"Caught in an endless cycle of debt? Does the shadow of looming debt make you want to curl up and hide?

Talking to a credit counsellor can help you see the light by helping you develop a debt management program to pay off your debt.

So step out of the shadow of debt and reach out to an accredited association that offers credit counselling in your area: http://ow.ly/Bra8308qwHI #GroundhogDay",Caught in an endless cycle of debt? Does the shadow of looming debt make you want to curl up and hide? Talking to a credit counsellor can help you see the light by helping you develop a debt management program to pay off your debt. So step out of the shadow of debt and reach out to an accredited association that offers credit counselling in your area:,['#GroundhogDay'],Environmental,13,0.0,en,YourMoneyMattersCanada_facebook
23,431918433581020_1016251451814379,2017-02-14 16:01:26,https://www.facebook.com/YourMoneyMattersCanada/photos/a.501487959957400.1073741828.431918433581020/1016251451814379/?type=3,"There is one secret that is OK to keep from your partner this Valentine’s Day: Your PIN! 

Sharing is caring, but not when it comes to your PIN. Never tell your loved one—or anyone, for that matter—your private login information. 

Learn more about protecting yourself from financial fraud: http://ow.ly/P7i2308TDcF","There is one secret that is OK to keep from your partner this Valentine’s Day: Your PIN! Sharing is caring, but not when it comes to your PIN. Never tell your loved one—or anyone, for that matter—your private login information. Learn more about protecting yourself from financial fraud:",[],Environmental,12,0.0,en,YourMoneyMattersCanada_facebook
24,431918433581020_1017839994988858,2017-02-16 15:48:01,https://www.cmhc-schl.gc.ca/en/co/buho/buho_022.cfm?utm_source=facebook-main&utm_medium=link&utm_campaign=mli,,,[],Social,12,0.0,tl,YourMoneyMattersCanada_facebook
25,431918433581020_1027415104031347,2017-02-28 18:48:45,,"The new gold standard for getting new habits to stick is 66 days of effort. Have you been sticking to your resolution to get in better financial shape? 

We’ve posted some tips over the last month to help you reach your financial goals. And now it’s time for you to check in and take our quiz on good financial habits.
http://ow.ly/1Q5Q309slKA",The new gold standard for getting new habits to stick is days of effort. Have you been sticking to your resolution to get in better financial shape? We’ve posted some tips over the last month to help you reach your financial goals. And now it’s time for you to check in and take our quiz on good financial habits.,[],Environmental,11,0.0,en,YourMoneyMattersCanada_facebook
26,431918433581020_1010952499010941,2017-02-07 16:00:53,https://www.facebook.com/YourMoneyMattersCanada/photos/a.501487959957400.1073741828.431918433581020/1010952499010941/?type=3,"Home renovations? Paying cash to avoid the tax is RISKY. 

No written contract means NO PROTECTION against poor work. We have info to help you protect yourself: http://ow.ly/t7Ui308CKam",Home renovations? Paying cash to avoid the tax is RISKY. No written contract means NO PROTECTION against poor work. We have info to help you protect yourself:,[],Economical,11,0.0,en,YourMoneyMattersCanada_facebook
27,431918433581020_1023343604438497,2017-02-23 11:45:38,https://www.facebook.com/YourMoneyMattersCanada/photos/a.501487959957400.1073741828.431918433581020/1023343604438497/?type=3,"Still pretty cold out there, eh?

Maybe this hot tip will warm you up: lowering your thermostat by one degree overnight could save you up to 2% on your energy costs.

That kind of move is not only good for the environment but also good for your wallet. Sleep tight!

Here are some more green living tips: http://ow.ly/qPLc3096BJZ","Still pretty cold out there, eh? Maybe this hot tip will warm you up: lowering your thermostat by one degree overnight could save you up to % on your energy costs. That kind of move is not only good for the environment but also good for your wallet. Sleep tight! Here are some more green living tips:",[],Economical,9,0.0,en,YourMoneyMattersCanada_facebook
28,431918433581020_1018657174907140,2017-02-17 11:45:25,https://www.facebook.com/YourMoneyMattersCanada/photos/a.501487959957400.1073741828.431918433581020/1018657174907140/?type=3,"Travelling by air for business or pleasure? 

Before you travel, be sure that you know the fare rules of your ticket and understand your rights and responsibilities. Avoid unexpected fees, plan ahead and fly smart.

Top 10 fly smart tips: http://ow.ly/eCwH308XWw5","Travelling by air for business or pleasure? Before you travel, be sure that you know the fare rules of your ticket and understand your rights and responsibilities. Avoid uneected fees, plan ahead and fly smart. Top fly smart tips:",[],Environmental,9,0.0,en,YourMoneyMattersCanada_facebook
29,431918433581020_1026637090775815,2017-02-27 18:45:15,https://www.facebook.com/YourMoneyMattersCanada/photos/a.501487959957400.1073741828.431918433581020/1026637090775815/?type=3,"Hiring a contractor? 

Paying cash to avoid the tax is RISKY. No written contract means NO PROTECTION against damages or if a worker is injured at your house. How to protect yourself: http://ow.ly/t7Ui308CKam",Hiring a contractor? Paying cash to avoid the tax is RISKY. No written contract means NO PROTECTION against damages or if a worker is injured at your house. How to protect yourself:,[],Economical,9,0.0,en,YourMoneyMattersCanada_facebook
30,431918433581020_1016980801741444,2017-02-15 17:44:40,https://www.facebook.com/FCACan/photos/a.455450081187979.103116.378967748836213/1299687510097561/?type=3,,,[],Social,8,0.0,tl,YourMoneyMattersCanada_facebook
31,431918433581020_1005844756188382,2017-02-01 11:45:35,http://ow.ly/ee2N308qwdY,"How is that gym membership working out for you? 

Your resolution to hit the gym regularly may have faded, but there’s plenty of time left to meet your financial goals for 2017. 

Take our financial “resolutions” quiz and test your knowledge on the tips we shared with you this month. It’s easier than doing 20 push-ups! http://ow.ly/ee2N308qwdY","How is that gym membership working out for you? Your resolution to hit the gym regularly may have faded, but there’s plenty of time left to meet your financial goals for . Take our financial “resolutions” quiz and test your knowledge on the tips we shared with you this month. It’s easier than doing push-ups!",[],Environmental,8,0.0,en,YourMoneyMattersCanada_facebook
32,431918433581020_1023508407755350,2017-02-23 16:00:34,,"Are you on Twitter? So are we! Follow us @YourMoneyCanada for objective, credible, and reliable financial information, scam alerts and more.","Are you on Twitter? So are we! Follow us for objective, credible, and reliable financial information, scam alerts and more.",[],Economical,8,0.0,en,YourMoneyMattersCanada_facebook
33,431918433581020_1024242724348585,2017-02-24 15:45:23,https://www.facebook.com/YourMoneyMattersCanada/photos/a.501487959957400.1073741828.431918433581020/1024242724348585/?type=3,"Hiring a contractor? Paying cash to avoid the tax is RISKY. 

No written contract means NO PROTECTION against damages or if a worker is injured at your house. How to protect yourself: http://ow.ly/t7Ui308CKam",Hiring a contractor? Paying cash to avoid the tax is RISKY. No written contract means NO PROTECTION against damages or if a worker is injured at your house. How to protect yourself:,[],Economical,7,0.0,en,YourMoneyMattersCanada_facebook
34,431918433581020_1024129717693219,2017-02-24 13:04:37,https://www.facebook.com/FCACan/videos/1305089952890650/,,,[],Social,4,0.0,tl,YourMoneyMattersCanada_facebook
35,431918433581020_1013263088779882,2017-02-10 15:07:45,https://www.facebook.com/competitionbureaucanada/photos/a.474668569326214.1073741828.423314591128279/1111283568998041/?type=3,,,[],Social,2,0.0,tl,YourMoneyMattersCanada_facebook
