,Unnamed: 0,id,date_published,link,caption_original,caption_cleaned,hashtags,num_reactions,num_comments,num_shares,num_likes,num_loves,num_wows,num_hahas,num_sads,num_angrys,num_special,Reactions_SUM,category,language,average_sentiment_score,account_name,words_matched_list,sentiment
711,711,460123390028_10159612167355029,2017-11-15 14:30:04,https://www.facebook.com/EnvironnementetressourcesnaturellesauCanada/photos/a.481746145028.384353.460123390028/10159612167355029/?type=3,"Saviez-vous que le méthane représente environ 15 % des émissions de gaz à effet de serre du Canada, et que la production de pétrole et de gaz en est la principale source ?
C'est pourquoi le Canada investit 5,3 millions de dollars dans des projets de technologies propres pour réduire les émissions de méthane imputables à la production de pétrole et de gaz.
http://ow.ly/c91M30gBspW","Saviez-vous que le méthane représente environ % des émissions de gaz à effet de serre du Canada, et que la production de pétrole et de gaz en est la principale source ? C'est pourquoi le Canada investit ,3 millions de dollars dans des projets de technologies propres pour réduire les émissions de méthane imputables à la production de pétrole et de gaz.",[],4,0,0,4,0,0,0,0,0,0,4,Economical,fr,0.0,EnvironnementetressourcesnaturellesauCanada_facebook,"['invest', 'technologies', 'technologie']",neutral
713,713,460123390028_10159608702675029,2017-11-14 19:00:17,https://www.facebook.com/EnvironnementetressourcesnaturellesauCanada/photos/a.481746145028.384353.460123390028/10159608702675029/?type=3,Le Canada a l’occasion d’être un chef de file des innovations technologiques. Le plan d’action sur les changements climatiques du Canada sera un catalyseur d’innovations et créera des emplois dans le secteur des technologies propres. #COP23 http://ow.ly/XyWp30gAdOT,Le Canada a l’occasion d’être un chef de file des innovations technologiques. Le plan d’action sur les changements climatiques du Canada sera un catalyseur d’innovations et créera des emplois dans le secteur des technologies propres.,['#COP23'],4,0,0,4,0,0,0,0,0,0,4,Economical,fr,0.0,EnvironnementetressourcesnaturellesauCanada_facebook,"['secteur', 'technologies', 'technologie', 'emplois', 'innovation']",neutral
692,692,460123390028_10159647350815029,2017-11-23 13:48:40,https://www.facebook.com/EnvironnementetChangementclimatique/photos/a.377494369373762.1073741828.370233926766473/384452382011294/?type=3,,,[],4,0,0,4,0,0,0,0,0,0,4,unknown,tl,0.0,EnvironnementetressourcesnaturellesauCanada_facebook,,neutral
651,651,460123390028_10159556415925029,2017-11-02 16:52:31,https://www.facebook.com/EnvironnementetressourcesnaturellesauCanada/photos/a.481746145028.384353.460123390028/10159556415925029/?type=3,"Des stages en STIM aujourd’hui pour former une main-d’œuvre adaptée aux emplois verts de demain. À tous les récents diplômés : présentez votre candidature dans le cadre de notre programme qui vise à appuyer les emplois verts! 
http://ow.ly/yZhz30gjLpX",Des stages en STIM aujourd’hui pour former une main-d’œuvre adaptée aux emplois verts de demain. À tous les récents diplômés : présentez votre candidature dans le cadre de notre programme qui vise à appuyer les emplois verts!,[],3,0,1,3,0,0,0,0,0,0,4,Environmental,fr,0.0,EnvironnementetressourcesnaturellesauCanada_facebook,"['mer', 'or', 'vert']",neutral
650,650,460123390028_10159551665350029,2017-11-01 14:33:30,https://www.facebook.com/EnvironnementetressourcesnaturellesauCanada/videos/10159551665350029/,Parcs Canada joue un rôle clé dans l’action climatique et protège nos trésors naturels contre les effets des changements climatiques.,Parcs Canada joue un rôle clé dans l’action climatique et protège nos trésors naturels contre les effets des changements climatiques.,[],4,0,0,4,0,0,0,0,0,0,4,Environmental,fr,0.0,EnvironnementetressourcesnaturellesauCanada_facebook,"['climat', 'parc', 'or', 'climatique', 'nature']",neutral
690,690,460123390028_10159646536570029,2017-11-23 10:12:54,https://www.facebook.com/EnvironmentandClimateChange/videos/651674615221167/,"En ce moment : la ministre de l’Environnement et du Changement climatique, Catherine McKenna, prononce une allocution à la réunion du Protocole de Montréal.","En ce moment : la ministre de l’Environnement et du Changement climatique, Catherine McKenna, prononce une allocution à la réunion du Protocole de Montréal.",[],4,0,0,4,0,0,0,0,0,0,4,Environmental,fr,0.0,EnvironnementetressourcesnaturellesauCanada_facebook,"['environnement', 'changement climatique', 'climatique', 'climat']",neutral
653,653,460123390028_10159560616095029,2017-11-03 17:00:44,https://www.facebook.com/EnvironnementetressourcesnaturellesauCanada/photos/a.481746145028.384353.460123390028/10159560616095029/?type=3,"Ohé, Canada! Un nouveau radar portable sera installé à Whitehorse (Yukon) pour appuyer les activités de recherche en science météorologique. Ce nouveau radar météo aidera à déterminer quelle technologie est la plus adaptée aux conditions météorologiques de l’Arctique. Il devrait être opérationnel d’ici la mi-novembre.","Ohé, Canada! Un nouveau radar portable sera installé à Whitehorse (Yukon) pour appuyer les activités de recherche en science météorologique. Ce nouveau radar météo aidera à déterminer quelle technologie est la plus adaptée aux conditions météorologiques de l’Arctique. Il devrait être opérationnel d’ici la mi-novembre.",[],3,1,0,3,0,0,0,0,0,0,4,Environmental,fr,0.0,EnvironnementetressourcesnaturellesauCanada_facebook,"['eau', 'or']",neutral
861,861,460123390028_10159606815285029,2017-11-14 10:28:36,https://www.facebook.com/EnvironnementetressourcesnaturellesauCanada/videos/10159606815285029/,"Le ministre Carr de Ressources naturelles Canada invite les Canadiens à participer à la Semaine de l’éveil à la géographie! 

Renseignez-vous sur les façons dont vous pouvez participer : http://ow.ly/98Ho30gzv1E",Le ministre Carr de Ressources naturelles Canada invite les Canadiens à participer à la Semaine de l’éveil à la géographie! Renseignez-vous sur les façons dont vous pouvez participer :,[],3,0,0,3,0,0,0,0,0,0,3,Environmental,fr,0.0,EnvironnementetressourcesnaturellesauCanada_facebook,"['ressources naturelles', 'nature']",neutral
893,893,460123390028_10159638847445029,2017-11-21 16:09:40,https://www.facebook.com/EnvironnementetressourcesnaturellesauCanada/videos/10159638847445029/,"Regardez l’ambassadeur du Canada en Allemagne et envoyé spécial auprès de l’Union européenne et de l’Europe, Stéphane Dion, prononcer la déclaration nationale du Canada à la COP23 le 16 novembre, réitérant les engagements du gouvernement du Canada à lutter contre le changement climatique et à diriger l'action climatique mondiale.","Regardez l’ambassadeur du Canada en Allemagne et envoyé spécial auprès de l’Union européenne et de l’Europe, Stéphane Dion, prononcer la déclaration nationale du Canada à la COP23 le novembre, réitérant les engagements du gouvernement du Canada à lutter contre le changement climatique et à diriger l'action climatique mondiale.",[],1,1,1,1,0,0,0,0,0,0,3,Environmental,fr,0.0,EnvironnementetressourcesnaturellesauCanada_facebook,"['cop23', 'changement climatique', 'climatique', 'climat']",neutral
887,887,460123390028_10159647530525029,2017-11-23 14:42:31,https://www.facebook.com/EnvironmentandClimateChange/videos/651779198544042/,Joignez-vous à nous EN DIRECT pour regarder une discussion d’experts sur la science qui a contribué à rétablir la couche d’ozone et à lutter contre les changements climatiques en vertu du Protocole de Montréal.,Joignez-vous à nous EN DIRECT pour regarder une discussion d’eerts sur la science qui a contribué à rétablir la couche d’ozone et à lutter contre les changements climatiques en vertu du Protocole de Montréal.,[],3,0,0,3,0,0,0,0,0,0,3,Environmental,fr,0.0,EnvironnementetressourcesnaturellesauCanada_facebook,"['climat', 'climatique', 'vert']",neutral
884,884,460123390028_10159638581505029,2017-11-21 14:40:06,https://www.facebook.com/EnvironnementetressourcesnaturellesauCanada/photos/a.481746145028.384353.460123390028/10159638581505029/?type=3,"Bonne Journée mondiale de la télévision!
Vous prévoyez voyager durant vos vacances d’hiver? Débranchez votre télévision et les autres appareils avant de partir. 

Vous voulez économiser de l’argent et de l’énergie maintenant? Ajustez votre télévision au niveau de luminosité le plus bas possible. Plus l’image est claire, plus votre appareil consomme de l’énergie.

Voyez d’autres conseils utiles d’ ENERGY STAR au Canada qui vous aideront à économiser de l’argent et de l’énergie! http://ow.ly/K4MT30gJeW9","Bonne Journée mondiale de la télévision! Vous prévoyez voyager durant vos vacances d’hiver? Débranchez votre télévision et les autres appareils avant de partir. Vous voulez économiser de l’argent et de l’énergie maintenant? Ajustez votre télévision au niveau de luminosité le plus bas possible. Plus l’image est claire, plus votre appareil consomme de l’énergie. Voyez d’autres conseils utiles d’ ENERGY STAR au Canada qui vous aideront à économiser de l’argent et de l’énergie! 9",[],1,0,2,1,0,0,0,0,0,0,3,Economical,fr,0.0,EnvironnementetressourcesnaturellesauCanada_facebook,"['mondiale', 'energy', 'mondial']",neutral
817,817,460123390028_10159677482365029,2017-11-30 16:32:54,https://www.facebook.com/EnvironnementetressourcesnaturellesauCanada/photos/a.481746145028.384353.460123390028/10159677482365029/?type=3,"Saviez-vous que les ménages canadiens recyclent et compostent davantage leurs déchets? Grâce aux programmes de recyclage, les Canadiens envoient moins de matières recyclables dans les décharges. Toutefois, il reste encore beaucoup à faire, car la quantité totale de déchets continue à augmenter.

Consultez les indicateurs environnementaux du Canada à Environnement et Changement climatique Canada pour obtenir les derniers résultats : http://ow.ly/laPP30gVPAv","Saviez-vous que les ménages canadiens recyclent et compostent davantage leurs déchets? Grâce aux programmes de recyclage, les Canadiens envoient moins de matières recyclables dans les décharges. Toutefois, il reste encore beaucoup à faire, car la quantité totale de déchets continue à augmenter. Consultez les indicateurs environnementaux du Canada à Environnement et Changement climatique Canada pour obtenir les derniers résultats :",[],3,0,0,3,0,0,0,0,0,0,3,Environmental,fr,0.0,EnvironnementetressourcesnaturellesauCanada_facebook,"['environnement', 'climat', 'changement climatique', 'recyclage', 'air', 'compost', 'climatique', 'recycle', 'eau', 'or']",neutral
865,865,460123390028_10159580891055029,2017-11-08 10:00:41,https://www.facebook.com/EnvironnementetressourcesnaturellesauCanada/photos/a.481746145028.384353.460123390028/10159580891055029/?type=3,Notre équipe de science météorologique est actuellement à Iqaluit pour installer un  liDAR! Les liDARS sont des instruments de télédétection qui utilisent la lumière pour détecter le vent. Quel est le but de cette mission? Mettre le liDAR à l’essai pour savoir s’il peut résister aux conditions météorologiques extrêmes et continuer à fournir des données de qualité et à fonctionner sans problèmes. Cela permettra d’améliorer les prévisions à court terme et les renseignements utilisés pour les activités comme le décollage et l’atterrissage sécuritaires des aéronefs.,Notre équipe de science météorologique est actuellement à Iqaluit pour installer un liDAR! Les liDARS sont des instruments de télédétection qui utilisent la lumière pour détecter le vent. Quel est le but de cette mission? Mettre le liDAR à l’essai pour savoir s’il peut résister aux conditions météorologiques extrêmes et continuer à fournir des données de qualité et à fonctionner sans problèmes. Cela permettra d’améliorer les prévisions à court terme et les renseignements utilisés pour les activités comme le décollage et l’atterrissage sécuritaires des aéronefs.,[],3,0,0,3,0,0,0,0,0,0,3,Environmental,fr,0.0,EnvironnementetressourcesnaturellesauCanada_facebook,"['or', 'air']",neutral
862,862,460123390028_10159600330025029,2017-11-12 18:55:03,https://www.facebook.com/EnvironnementetressourcesnaturellesauCanada/photos/a.481746145028.384353.460123390028/10159600330025029/?type=3,"C’est aujourd’hui, la Journée de la santé à la COP23. Le gouvernement du Canada s’engage à réduire les polluants climatiques de courte durée qui réchauffent la planète et qui nuisent à notre santé, à la qualité de l’air que nous respirons et à l’environnement.

En recourant à des technologies propres pour réduire les polluants climatiques de courte durée, nous ferons croître l’économie, tout en respectant nos objectifs en matière de changements climatiques et de qualité de l’air. Qui dit air pur dit meilleure santé (réduction des symptômes d’asthme, des risques de décès prématuré et des problèmes cardiaques). http://ow.ly/4g4T30gwI7q","C’est aujourd’hui, la Journée de la santé à la COP23. Le gouvernement du Canada s’engage à réduire les polluants climatiques de courte durée qui réchauffent la planète et qui nuisent à notre santé, à la qualité de l’air que nous respirons et à l’environnement. En recourant à des technologies propres pour réduire les polluants climatiques de courte durée, nous ferons croître l’économie, tout en respectant nos objectifs en matière de changements climatiques et de qualité de l’air. Qui dit air pur dit meilleure santé (réduction des symptômes d’asthme, des risques de décès prématuré et des problèmes cardiaques).",[],3,0,0,3,0,0,0,0,0,0,3,Environmental,fr,0.0,EnvironnementetressourcesnaturellesauCanada_facebook,"['environnement', 'climat', 'cop23', 'polluants', 'climatique', 'air', 'propre']",neutral
879,879,460123390028_10159652150885029,2017-11-24 17:00:16,https://www.facebook.com/EnvironnementetressourcesnaturellesauCanada/photos/a.481746145028.384353.460123390028/10159652150885029/?type=3,"C’est l’heure du quiz pour les jeunes! Comment appelle-t-on les océans, les forêts et les milieux humides qui retiennent le dioxyde de carbone contenu dans l’atmosphère?
- Empreinte carbone
- Puits de carbone
- Magie de carbone

Invitez vos enfants et vos élèves à découvrir la science du climat en jouant au quiz Remue-méninges science climat sur le site Web Climat Jeunes.
https://climatjeunes.ca/ 

RÉPONSE :
Les océans, les forêts et les milieux humides qui retiennent le carbone contenu dans l’atmosphère sont appelés puits de carbone.

Les puits de carbone comme les océans, les forêts et les milieux humides retiennent le dioxyde de carbone contenu dans l’atmosphère en l’absorbant comme une éponge. Nous pouvons contribuer à réduire les effets de changements climatiques en protégeant les écosystèmes naturels que sont les puits de carbone.","C’est l’heure du quiz pour les jeunes! Comment appelle-t-on les océans, les forêts et les milieux humides qui retiennent le dioxyde de carbone contenu dans l’atmosphère? - Empreinte carbone - Puits de carbone - Magie de carbone Invitez vos enfants et vos élèves à découvrir la science du climat en jouant au quiz Remue-méninges science climat sur le site Web Climat Jeunes. RÉPONSE : Les océans, les forêts et les milieux humides qui retiennent le carbone contenu dans l’atmosphère sont appelés puits de carbone. Les puits de carbone comme les océans, les forêts et les milieux humides retiennent le dioxyde de carbone contenu dans l’atmosphère en l’absorbant comme une éponge. Nous pouvons contribuer à réduire les effets de changements climatiques en protégeant les écosystèmes naturels que sont les puits de carbone.",[],2,0,1,2,0,0,0,0,0,0,3,Environmental,fr,0.0,EnvironnementetressourcesnaturellesauCanada_facebook,"['milieux humides', 'climat', 'nature', 'climatique', 'carbon', 'or']",neutral
860,860,460123390028_10159634476795029,2017-11-20 14:43:06,https://www.facebook.com/EnvironnementetressourcesnaturellesauCanada/videos/10159634476795029/,"Le gouvernement du Canada investit 155 millions $ pour la #CroissancePropre en énergie, exploitation minière et foresterie pour créer un environnement plus propre. Ces fonds aideront les entreprises canadiennes à devenir des chefs de file mondiaux des technologies propres.
Apprenez-en plus :  
http://ow.ly/shOe30gHHt6","Le gouvernement du Canada investit millions $ pour la en énergie, eloitation minière et foresterie pour créer un environnement plus propre. Ces fonds aideront les entreprises canadiennes à devenir des chefs de file mondiaux des technologies propres. Apprenez-en plus :",['#CroissancePropre'],2,0,1,2,0,0,0,0,0,0,3,Economical,fr,0.0,EnvironnementetressourcesnaturellesauCanada_facebook,"['invest', 'technologies', 'technologie']",neutral
859,859,460123390028_10159611267745029,2017-11-15 10:01:27,https://www.facebook.com/EnvironnementetressourcesnaturellesauCanada/photos/a.481746145028.384353.460123390028/10159611267745029/?type=3,"Joyeuse journée du nettoyage de réfrigérateur!
 
Pour refaire une beauté à votre réfrigérateur, utilisez du bicarbonate de soude et une éponge humide. Voilà une solution naturelle qui fait du bien au portefeuille.
Vous aimeriez garder votre réfrigérateur propre? Préparez une solution de nettoyage écologique en diluant 1 tasse de vinaigre dans 1 tasse d’eau, et pressez-y ensuite  un citron frais.
Quels sont vos trucs de nettoyage écologique préférés? Partagez-les dans les commentaires!","Joyeuse journée du nettoyage de réfrigérateur! Pour refaire une beauté à votre réfrigérateur, utilisez du bicarbonate de soude et une éponge humide. Voilà une solution naturelle qui fait du bien au portefeuille. Vous aimeriez garder votre réfrigérateur propre? Préparez une solution de nettoyage écologique en diluant tasse de vinaigre dans tasse d’eau, et pressez-y ensuite un citron frais. Quels sont vos trucs de nettoyage écologique préférés? Partagez-les dans les commentaires!",[],2,0,1,2,0,0,0,0,0,0,3,Environmental,fr,0.0,EnvironnementetressourcesnaturellesauCanada_facebook,"['nature', 'air', 'mer', 'carbon', 'propre', 'eau', 'or']",neutral
856,856,460123390028_10159614810990029,2017-11-16 05:32:56,https://www.facebook.com/EnvironnementetressourcesnaturellesauCanada/photos/a.481746145028.384353.460123390028/10159614810990029/?type=3,"Suivez la page Environnement et Changement climatique sur Facebook à 5 h 45 HNE pour regarder en direct le Canada et le R.-U. accueillir des partenaires dans la nouvelle Alliance : Énergiser au-delà du charbon, dans la transition au-delà de l’électricité à partir du charbon traditionnel. http://ow.ly/zQjQ30gCdU4","Suivez la page Environnement et Changement climatique sur Facebook à h HNE pour regarder en direct le Canada et le R.-U. accueillir des partenaires dans la nouvelle Alliance : Énergiser au-delà du charbon, dans la transition au-delà de l’électricité à partir du charbon traditionnel.",[],2,1,0,2,0,0,0,0,0,0,3,Environmental,fr,-0.2833333333333333,EnvironnementetressourcesnaturellesauCanada_facebook,"['climat', 'environnement', 'changement climatique', 'climatique', 'air']",negative
854,854,460123390028_10159626225705029,2017-11-18 17:30:48,https://www.facebook.com/EnvironnementetressourcesnaturellesauCanada/videos/10159626225705029/,"Lors de la première rencontre de l’Alliance : #ÉnergiserAuDelàDuCharbon, la ministre de l’Environnement et du Changement climatique du Canada, Catherine McKenna, et la ministre d’État du Changement climatique et de l’Industrie du Royaume-Uni, Claire Perry, ont été rejointes par des partenaires unis pour une croissance économique propre grâce à l’élimination progressive de l’électricité à partir du charbon traditionnel.

Les partenaires #ÉnergiserAuDelàDuCharbon sont d’accord sur le fait que l’élimination progressive d’électricité à partir de charbon traditionnel est l’étape la plus importante que la communauté internationale peut prendre afin d’atteindre les objectifs de l’Accord de Paris.","Lors de la première rencontre de l’Alliance : ÉnergiserAuDelàDuCharbon, la ministre de l’Environnement et du Changement climatique du Canada, Catherine McKenna, et la ministre d’État du Changement climatique et de l’Industrie du Royaume-Uni, Claire Perry, ont été rejointes par des partenaires unis pour une croissance économique propre grâce à l’élimination progressive de l’électricité à partir du charbon traditionnel. Les partenaires ÉnergiserAuDelàDuCharbon sont d’accord sur le fait que l’élimination progressive d’électricité à partir de charbon traditionnel est l’étape la plus importante que la communauté internationale peut prendre afin d’atteindre les objectifs de l’Accord de Paris.","['#', '#']",2,0,1,2,0,0,0,0,0,0,3,Environmental,fr,0.0,EnvironnementetressourcesnaturellesauCanada_facebook,"['environnement', 'climat', 'changement climatique', 'climatique', 'air', 'propre', 'or']",neutral
850,850,460123390028_10159633519080029,2017-11-20 10:13:42,https://www.facebook.com/EnvironmentandClimateChange/videos/650044275384201/,"Mettez-vous à l’écoute dès maintenant pour voir le très honorable Brian Mulroney et la ministre de l’Environnement et du Changement climatique Catherine McKenna prendre la parole à l’occasion de l’ouverture de la conférence internationale visant à protéger la couche d’ozone et à lutter contre les changements climatiques. 

EN DIRECT de Montréal :",Mettez-vous à l’écoute dès maintenant pour voir le très honorable Brian Mulroney et la ministre de l’Environnement et du Changement climatique Catherine McKenna prendre la parole à l’occasion de l’ouverture de la conférence internationale visant à protéger la couche d’ozone et à lutter contre les changements climatiques. EN DIRECT de Montréal :,[],3,0,0,3,0,0,0,0,0,0,3,Environmental,fr,0.0,EnvironnementetressourcesnaturellesauCanada_facebook,"['environnement', 'vert', 'climat', 'changement climatique', 'climatique', 'or']",neutral
849,849,460123390028_10159611374735029,2017-11-15 10:23:41,https://www.facebook.com/EnvironnementetressourcesnaturellesauCanada/photos/a.481746145028.384353.460123390028/10159611373730029/?type=3,"Regardez en direct la rencontre de la nouvelle Alliance : Energiser au-dela du charbon qui s’engage à éliminer progressivement l’electricite du charbon traditionnel le 16 novembre à 5 h 45 (HNE).

Cette alliance s’engage à assurer la transition vers une économie à faibles émissions de carbone et une croissance économique propre. http://ow.ly/7jwr30gB37j",Regardez en direct la rencontre de la nouvelle Alliance : Energiser au-dela du charbon qui s’engage à éliminer progressivement l’electricite du charbon traditionnel le novembre à h (HNE). Cette alliance s’engage à assurer la transition vers une économie à faibles émissions de carbone et une croissance économique propre.,[],3,0,0,3,0,0,0,0,0,0,3,Environmental,fr,0.0,EnvironnementetressourcesnaturellesauCanada_facebook,"['carbon', 'propre']",neutral
863,863,460123390028_10159600172705029,2017-11-12 18:00:20,https://www.facebook.com/EnvironnementetressourcesnaturellesauCanada/photos/a.481746145028.384353.460123390028/10159600172705029/?type=3,"La lutte contre les changements climatiques est importante tant à l’échelle locale qu’à l’échelle internationale. À la COP23, nous célébrons les initiatives locales telles que le programme Halifax Solar City. Jetez y un coup d’œil! http://ow.ly/F9pL30gwHIh (anglais seulement)","La lutte contre les changements climatiques est importante tant à l’échelle locale qu’à l’échelle internationale. À la COP23, nous célébrons les initiatives locales telles que le programme Halifax Solar City. Jetez y un coup d’œil! (anglais seulement)",[],3,0,0,3,0,0,0,0,0,0,3,Environmental,fr,0.0,EnvironnementetressourcesnaturellesauCanada_facebook,"['climat', 'cop23', 'climatique', 'solar', 'or']",neutral
990,990,460123390028_10159664201895029,2017-11-27 16:52:33,https://www.facebook.com/EnvironnementetChangementclimatique/photos/a.377494369373762.1073741828.370233926766473/386279558495243/?type=3,,,[],2,0,0,2,0,0,0,0,0,0,2,unknown,tl,0.0,EnvironnementetressourcesnaturellesauCanada_facebook,,neutral
1068,1068,460123390028_10159613632885029,2017-11-15 21:38:30,https://www.facebook.com/EnvironnementetressourcesnaturellesauCanada/photos/a.481746145028.384353.460123390028/10159613629455029/?type=3,"Regardez en direct la rencontre de la nouvelle Alliance : Energiser au-dela du charbon qui s’engage à éliminer progressivement l’electricite du charbon traditionnel le 16 novembre à 5 h 45 (HNE).
Cette alliance s’engage à assurer la transition vers une économie à faibles émissions de carbone et une croissance économique propre. 

http://ow.ly/TkMO30gBV5J",Regardez en direct la rencontre de la nouvelle Alliance : Energiser au-dela du charbon qui s’engage à éliminer progressivement l’electricite du charbon traditionnel le novembre à h (HNE). Cette alliance s’engage à assurer la transition vers une économie à faibles émissions de carbone et une croissance économique propre.,[],2,0,0,2,0,0,0,0,0,0,2,Environmental,fr,0.0,EnvironnementetressourcesnaturellesauCanada_facebook,"['carbon', 'propre']",neutral
