,Unnamed: 0,id,date_published,link,caption_original,caption_cleaned,hashtags,num_comments,num_likes,Reactions_SUM,category,language,average_sentiment_score,account_name,words_matched_list,sentiment
187,187,2017-02-11_10-04-20,2017-02-11 10:04:20,https://instagram.fyvr3-1.fna.fbcdn.net/vp/b97126b24de5488ba395cbc8485517b4/5AF3FF1F/t51.2885-15/e35/25011283_148851482425742_5031311470072168448_n.jpg,Two close friends: Biologist Judith Kennedy from the Canadian Wildlife Service and Carlitos and her giant Canada Warbler.,Two close friends Biologist Judith Kennedy Canadian Wildlife Service Carlitos giant Canada Warbler WomenScienceDay WomenInScience WomenScientist BirdYear CanadienWildlifeService InstaScience BiologistsOfInstagram CanEnvironment EnvironmentCanada BirdNerds BirdLovers,"[""womenscienceday"",""womeninscience"",""womenscientist"",""birdyear"",""canadienwildlifeservice"",""instascience"",""biologistsofinstagram"",""canenvironment"",""environmentcanada"",""birdnerds"",""birdlovers""]",0,48,48,Environmental,en,0.0,canenvironment_instagram,"['wildlife', 'bird', 'ice']",neutral
189,189,2017-02-23_09-59-29,2017-02-23 09:59:29,https://instagram.fyvr3-1.fna.fbcdn.net/vp/80c596488e5ea486ef014147f4dff620/5AE812C7/t51.2885-15/e35/24846070_1999439220297062_7024457542759612416_n.jpg,"Regina, Karel, Garry, Becky, Julie and Paul were busy through the holiday season in Nova Scotia, Newfoundland and Labrador and New Brunswick collecting information about wintering birds in the area. Each year they learn a little bit about the species that decide to rough it out in some of Canada’s harshest winter climates! Stay tuned to learn more about their adventure!",Regina Karel Garry Becky Julie Paul busy holiday season Nova Scotia Newfoundland Labrador New Brunswick collecting information wintering birds area year learn little bit species decide rough harshest winter climates Stay tuned learn ChristmasBirdCount adventure BiologistsOfInstagram InstaScience BirdCount NatureLovers CanadianWildlifeService CanEnvironment HiddenGem PerksOfFieldwork EnvironmentCanada Adventures Fieldwork Canada AtlanticCanada,"[""christmasbirdcount"",""biologistsofinstagram"",""instascience"",""birdcount"",""naturelovers"",""canadianwildlifeservice"",""canenvironment"",""hiddengem"",""perksoffieldwork"",""environmentcanada"",""adventures"",""fieldwork"",""canada"",""atlanticcanada""]",0,48,48,Environmental,en,0.0,canenvironment_instagram,"['wildlife', 'or', 'climat', 'nature', 'climate', 'ice', 'bird', 'species']",neutral
215,215,2017-02-21_09-44-36,2017-02-21 09:44:36,https://instagram.fyvr3-1.fna.fbcdn.net/vp/d04956398c77647a39fb5aac136699be/5AFC277B/t51.2885-15/e35/25014399_150273702401784_3352878559063441408_n.jpg,Full house 's panel,Full house letstalkenergy TalkEnergy panel,"[""talkenergy""]",0,39,39,Economical,no,0.0,canenvironment_instagram,['energy'],neutral
224,224,2017-02-21_10-23-34,2017-02-21 10:23:34,https://instagram.fyvr3-1.fna.fbcdn.net/vp/385e2efa95004d375ca818c74fbbf80b/5AE5FAEE/t51.2885-15/e35/25014702_171706480093477_2919377232021422080_n.jpg,Very engaged students and lots of Qs in this panel discussion!,engaged students lots Qs letstalkenergy panel discussion,[],2,33,35,Social,nl,0.3,canenvironment_instagram,['students'],positive
234,234,2017-02-21_09-00-15,2017-02-21 09:00:15,https://instagram.fyvr3-1.fna.fbcdn.net/vp/7d4ce32c7fa4c02a9b1eb61beeeccb8f/5AE28D8F/t51.2885-15/e35/24332309_1767564519922776_5611724129158823936_n.jpg,Excited to be at the Aviation Museum for .,Excited Aviation Museum TalkEnergy letstalkenergy,"[""talkenergy""]",0,30,30,Economical,en,0.0,canenvironment_instagram,['energy'],neutral
240,240,2017-02-14_07-12-31,2017-02-14 07:12:31,https://instagram.fyvr3-1.fna.fbcdn.net/vp/fdfbc86707f5b82624810a1cf793ce4b/5A637CDD/t51.2885-15/e15/25014775_513329232366221_7093722226939133952_n.jpg,Let’s celebrate years of Canada. and years of nature - a part of our heritage. We want to see YOUR photos. Show us through your eyes what represents Canada’s natural heritage. Use for a chance to be featured on our feed!,celebrate 150 years Canada 150 years nature part heritage nWe want see photos Show us eyes represents natural heritage Use ECan150 chance featured feed Canada150 TimeToConnect ConnectWithNature HiddenGems ExploreCanada Canada Canadians WithNature,"[""ecan150"",""canada150"",""timetoconnect"",""connectwithnature"",""hiddengems"",""explorecanada"",""canada"",""canadians"",""withnature""]",0,26,26,Environmental,en,0.0,canenvironment_instagram,"['natural', 'or', 'nature']",neutral
