,id,date_published,link,caption_original,caption_cleaned,hashtags,category,Reactions_SUM,average_sentiment_score,language,account_name
195,930599652776431616,2017-11-15 00:53:41,"['https://t.co/ui70Gis9kk', 'https://t.co/BOAbujLoI']","En Avril 2018, le Canada, @GlobalMethane et @CCACoalition seront les hôtes du Forum mondial sur le méthane à #CityofTO. https://t.co/ui70Gis9kk (ang. seul.) https://t.co/BOAbujLoIU",En Avril 2018 le Canada GlobalMethane et CCACoalition seront les tes du Forum mondial sur le thane CityofTO https co ui70Gis9kk ang seul https co BOAbujLoIU,['#CityofTO'],Economical,1,0.0,fr,environnementca_tweeter
196,930143801905213440,2017-11-13 18:42:18,['https://t.co/YNt63ciQFJ'],"🇨🇦, 🇨🇳 et 🇪🇺 se rencontrent à #COP23 pour poursuivre la mise en œuvre de #AccordParis et prouver leur engagement envers #ActionClimat mondiale. https://t.co/YNt63ciQFJ",et se rencontrent COP23 pour poursuivre la mise en uvre de AccordParis et prouver leur engagement envers ActionClimat mondiale https co YNt63ciQFJ,"['#COP23', '#AccordParis', '#ActionClimat']",Environmental,1,0.0,fr,environnementca_tweeter
197,930588492962455552,2017-11-15 00:09:20,[],RT @salledepresseGC: Canada et Chili coprésident @CCACoalition pour lutter contre changements climatiques et améliorer qualité de l’air. ht…,RT salledepresseGC Canada et Chili sident CCACoalition pour lutter contre changements climatiques et liorer de air,[],Environmental,1,0.0,fr,environnementca_tweeter
198,930569549287653376,2017-11-14 22:54:04,['https://t.co/KGJBAn0kaq'],"À la #COP23, le 🇨🇦 favorise l’adoption d’un plan d’action sur les #genres qui soutient la représentation des femmes @CCNUCC. #JournéeDuGenre https://t.co/KGJBAn0kaq",la COP23 le favorise adoption un plan action sur les genres qui soutient la sentation des femmes CCNUCC eDuGenre https co KGJBAn0kaq,"['#COP23', '#genres', '#Journ']",Environmental,1,0.1,fr,environnementca_tweeter
199,930468096174903297,2017-11-14 16:10:56,[],RT @ministre_ec: La ministre McKenna a rencontré les peuples autochtones du 🇨🇦 pour parler de leur participation à la lutte contre les #Cha…,RT La ministre McKenna les peuples autochtones du pour parler de leur participation la lutte contre les,['#Cha'],Social,1,0.0,fr,environnementca_tweeter
200,930419043621834757,2017-11-14 12:56:01,"['https://t.co/6UQNkKj28p', 'https://t.co/YRnwuFLkpw']",#SVQ le 🇨🇦 est le 11e pays à ratifier l’#AmendementdeKigali? https://t.co/6UQNkKj28p https://t.co/YRnwuFLkpw,SVQ le est le 11e pays ratifier AmendementdeKigali https co 6UQNkKj28p https co YRnwuFLkpw,"['#SVQ', '#AmendementdeKigali']",Social,1,0.0,fr,environnementca_tweeter
201,930257761258090497,2017-11-14 02:15:08,[],L’@AmbStephaneDion a rencontré @Isamelancon à la #COP23 pour discuter d’#ActionClimat au #Québec.,AmbStephaneDion Isamelancon la COP23 pour discuter ActionClimat au bec,"['#COP23', '#ActionClimat', '#Qu']",Environmental,1,0.0,fr,environnementca_tweeter
202,932703915090567168,2017-11-20 20:15:16,"['https://t.co/7pPktlYWh7', 'https://t.co/de1669sdDG']","En cette #JournéeMondialedelEnfance, que faites-vous pour préserver la santé de notre 🌎 pour les générations à venir? https://t.co/7pPktlYWh7 #Durabilité #FSDS https://t.co/de1669sdDG",En cette eMondialedelEnfance que faites vous pour server la de notre pour les rations venir https co 7pPktlYWh7 FSDS https co de1669sdDG,"['#Journ', '#Durabilit', '#FSDS']",Economical,1,0.0,fr,environnementca_tweeter
203,930085051529875457,2017-11-13 14:48:51,[],"RT @ministre_ec: Min. McKenna a discuté #ÉnergieRenouvelable avec @rkyte365, représentante spéciale du Secrétaire général de l’@ONU_fr + PD…",RT Min McKenna nergieRenouvelable avec rkyte365 sentante ciale du taire ral de,['#'],Environmental,1,0.0,fr,environnementca_tweeter
204,930083890122973185,2017-11-13 14:44:14,"['https://t.co/5M2ZzxI9S3', 'https://t.co/jYsR39UAy']",🇨🇦 travaille avec partenaires pour accélérer la collaboration sur #ActionClimat et #ÉnergieRenouvelable en Amérique du Nord à la #COP23. https://t.co/5M2ZzxI9S3 https://t.co/jYsR39UAyd,travaille avec partenaires pour rer la collaboration sur ActionClimat et nergieRenouvelable en rique du Nord la COP23 https co 5M2ZzxI9S3 https co jYsR39UAyd,"['#ActionClimat', '#', '#COP23']",Environmental,1,0.0,fr,environnementca_tweeter
205,929846790005936128,2017-11-12 23:02:05,['https://\xe2\x80\xa6'],RT @ministre_ec: Célébrons les initiatives locales à #COP23! #Halifax Solar City Program lutte contre les #ChangementsClimatiques. https://…,RT brons les initiatives locales COP23 Halifax Solar City Program lutte contre les ChangementsClimatiques https,"['#COP23', '#Halifax', '#ChangementsClimatiques']",Social,1,0.0,fr,environnementca_tweeter
206,932738347088449537,2017-11-20 22:32:06,[],RT @salledepresseGC: Le Canada et le @GovRwanda conviennent de coopérer pour la protection de l’environnement et l’#ActionClimatique. https…,RT salledepresseGC Le Canada et le GovRwanda conviennent de rer pour la protection de environnement et ActionClimatique,['#ActionClimatique'],Environmental,1,0.0,fr,environnementca_tweeter
207,932713927288307712,2017-11-20 20:55:03,['https://t.co/zhHWBHUBFW'],Le #ProtocoleDeMontréal est l’un des accords mondiaux les plus fructueux de l’histoire. https://t.co/zhHWBHUBFW,Le al est un des accords mondiaux les plus fructueux de histoire https co zhHWBHUBFW,['#ProtocoleDeMontr'],Environmental,1,0.0,fr,environnementca_tweeter
208,932650551271133184,2017-11-20 16:43:13,['https://t.co/tt4NfcWrgF'],RT @salledepresseGC: Des pays ratifient l’Amendement de Kigali au Protocole de Montréal. https://t.co/tt4NfcWrgF,RT salledepresseGC Des pays ratifient Amendement de Kigali au Protocole de al https co tt4NfcWrgF,[],Social,1,0.0,fr,environnementca_tweeter
209,933783539493023745,2017-11-23 19:45:19,['https://t.co/FpQIfLL8Pa'],"Regardez Dre Mona Nemer, @SciChefCan, lancer la discussion sur la #science qui a contribué à rétablir la #CoucheDozone : https://t.co/FpQIfLL8Pa",Regardez Dre Mona Nemer SciChefCan lancer la discussion sur la science qui tablir la CoucheDozone https co FpQIfLL8Pa,"['#science', '#CoucheDozone']",Social,1,0.0,it,environnementca_tweeter
210,930746201330388992,2017-11-15 10:36:01,[],RT @ministre_ec: La ministre McKenna a discuté de la ratification de l’#AmendementDeKigali avec Kimmo Tiilikainen de @yministerio à la #COP…,RT La ministre McKenna de la ratification de AmendementDeKigali avec Kimmo Tiilikainen de yministerio la,"['#AmendementDeKigali', '#COP']",Economical,1,0.0,it,environnementca_tweeter
211,933692161547218944,2017-11-23 13:42:13,[],RT @environnementca: Jeudi 10 h (HNE) EN DIRECT : la @ministre_ec  McKenna prononce une allocution à la réunion du #ProtocoleDeMontréal. @U…,RT environnementca Jeudi 10 HNE EN DIRECT la McKenna prononce une allocution la union du al,['#ProtocoleDeMontr'],Economical,1,0.1,fr,environnementca_tweeter
212,933792924126601216,2017-11-23 20:22:36,[],En direct maintenant : Les membres du groupe d’experts répondent aux questions de l’auditoire.,En direct maintenant Les membres du groupe experts pondent aux questions de auditoire,[],Social,1,0.1,fr,environnementca_tweeter
213,933819868083826689,2017-11-23 22:09:40,['https://\xe2\x80\xa6'],RT @salledepresseGC: Le Canada et la #BC s’engagent à prendre des mesures de rétablissement pour le #caribou des montagnes du Sud. https://…,RT salledepresseGC Le Canada et la BC engagent prendre des mesures de tablissement pour le caribou des montagnes du Sud https,"['#BC', '#caribou']",Social,1,0.0,fr,environnementca_tweeter
214,934093095699873792,2017-11-24 16:15:23,['https://t.co/BTbE8fHC5l'],#SVQ le #caribou des montagnes du Sud fait face à de multiples menaces? #Faune #Conservation https://t.co/BTbE8fHC5l,SVQ le caribou des montagnes du Sud fait face de multiples menaces Faune Conservation https co BTbE8fHC5l,"['#SVQ', '#caribou', '#Faune', '#Conservation']",Environmental,1,0.0,fr,environnementca_tweeter
215,933713108178173953,2017-11-23 15:05:27,['https://t.co/Fj8x3a4eV'],#SVQ le #StLaurent relie l’océan Atlantique et les #GrandsLacs? https://t.co/Fj8x3a4eVc,SVQ le StLaurent relie Atlantique et les GrandsLacs https co Fj8x3a4eVc,"['#SVQ', '#StLaurent', '#GrandsLacs']",Social,1,0.0,fr,environnementca_tweeter
216,933696554761940992,2017-11-23 13:59:40,[],"RT @RNCan: Nous avons consulté les #PeuplesAutochtones, les principaux intervenants et le public 🇨🇦  au sujet de l’#ExamenEE #RésultatsGC h…",RT RNCan Nous avons les PeuplesAutochtones les principaux intervenants et le public au sujet de ExamenEE sultatsGC,"['#PeuplesAutochtones', '#ExamenEE', '#R']",Social,1,0.0,fr,environnementca_tweeter
217,931597990552395776,2017-11-17 19:00:43,[],"RT @RNCan: « Le Canada est heureux d’appuyer la vision de la plateforme Biofuture, vision qui s’accorde avec nos objectifs touchant le clim…",RT RNCan Le Canada est heureux appuyer la vision de la plateforme Biofuture vision qui accorde avec nos objectifs touchant le,[],Social,1,0.0,fr,environnementca_tweeter
218,933514274072342528,2017-11-23 01:55:21,[],"RT @Transports_gc: Depuis le lancement du #PlanDeProtectionDesOcéans en novembre 2016, diverses initiatives ont été prises au #Canada pour…",RT Depuis le lancement du ans en novembre 2016 diverses initiatives ont prises au Canada,"['#PlanDeProtectionDesOc', '#Canada']",Economical,1,0.0,fr,environnementca_tweeter
219,933496725205024768,2017-11-23 00:45:37,"['https://t.co/aPw49J0y1H', 'https://t.co/e9QW9e6zCI']",Jeudi 10 h (HNE) EN DIRECT : la @ministre_ec  McKenna prononce une allocution à la réunion du #ProtocoleDeMontréal. @UNEP https://t.co/aPw49J0y1H https://t.co/e9QW9e6zCI,Jeudi 10 HNE EN DIRECT la McKenna prononce une allocution la union du al UNEP https co aPw49J0y1H https co e9QW9e6zCI,['#ProtocoleDeMontr'],Economical,1,0.1,it,environnementca_tweeter
220,933112780345036800,2017-11-21 23:19:57,[],"Aujourd’hui, la @ministre_ec a rencontré des intervenants lors des Journées #GrandsLacs #StLaurent sur la colline parlementaire.",hui la des intervenants lors des es GrandsLacs StLaurent sur la colline parlementaire,"['#GrandsLacs', '#StLaurent']",Environmental,1,0.0,fr,environnementca_tweeter
221,933095059867631617,2017-11-21 22:09:32,[],RT @ACEE_CEAA: Comprend la modification de routes et de ponts pour protéger les habitats du poisson et les milieux aquatiques. #JournéeMond…,RT Comprend la modification de routes et de ponts pour ger les habitats du poisson et les milieux aquatiques,['#Journ'],Social,1,0.0,fr,environnementca_tweeter
222,933095047863529472,2017-11-21 22:09:30,[],RT @ACEE_CEAA: Le processus d’EE permet parfois d’adapter les projets pour mieux atténuer leurs effets et protéger les habitats. #JournéeMo…,RT Le processus EE permet parfois adapter les projets pour mieux nuer leurs effets et ger les habitats,['#Journ'],Social,1,0.0,fr,environnementca_tweeter
223,933074865745203200,2017-11-21 20:49:18,[],"RT @ACIA_Canada: Soyez à l'affût du longicorne asiatique, un des ravageurs forestiers les plus destructeurs au Canada. #MardiBestiole https…",RT Soyez du longicorne asiatique un des ravageurs forestiers les plus destructeurs au Canada MardiBestiole,['#MardiBestiole'],Environmental,1,0.0,fr,environnementca_tweeter
224,935531397455937536,2017-11-28 15:30:41,['https://t.co/XQdr6YnGJY'],"#EnCeJour en 2006, une température de -30,1C (-41C avec le facteur éolien) marque le jour le plus froid de Calgary  (#AB) en 110 ans! #Météo https://t.co/XQdr6YnGJY",EnCeJour en 2006 une rature de 30 1C 41C avec le facteur olien marque le jour le plus froid de Calgary AB en 110 ans https co XQdr6YnGJY,"['#EnCeJour', '#AB', '#M']",Social,1,0.0,fr,environnementca_tweeter
225,935497210782932992,2017-11-28 13:14:50,['https://t.co/dP0SFNLjSM'],RT @salledepresseGC: Le #GC reconnaît l’importance du travail scientifique du #COSEPAC. #COSEWIC https://t.co/dP0SFNLjSM,RT salledepresseGC Le GC importance du travail scientifique du COSEPAC COSEWIC https co dP0SFNLjSM,"['#GC', '#COSEPAC', '#COSEWIC']",Economical,1,0.0,fr,environnementca_tweeter
226,935226246845337601,2017-11-27 19:18:07,"['https://t.co/7jjqY6xGy', 'https://t.co/oc2\xe2\x80\xa6']",RT @RNCan: Le #GC aide les Canadiens à économiser tout en préservant l’environnement! #RésultatsGC https://t.co/7jjqY6xGy1 https://t.co/oc2…,RT RNCan Le GC aide les Canadiens conomiser tout en servant environnement sultatsGC https co 7jjqY6xGy1 https co,"['#GC', '#R']",Environmental,1,0.0,fr,environnementca_tweeter
227,935165398424653831,2017-11-27 15:16:20,['https://t.co/j\xe2\x80\xa6'],RT @salledepresseGC: La réunion soulignant le 30e anniversaire du #ProtocoleDeMontréal se termine sur une bonne note. #MOP29 https://t.co/j…,RT salledepresseGC La union soulignant le 30e anniversaire du al se termine sur une bonne note MOP29 https co,"['#ProtocoleDeMontr', '#MOP29']",Environmental,1,0.0,fr,environnementca_tweeter
228,933727082189901824,2017-11-23 16:00:58,['https://t.co/T8U0bWO36'],#SVQ le réseau du #StLaurent est l’une des plus importantes voies de navigation commerciale du Canada et renferme des écosystèmes riches et diversifiés? https://t.co/T8U0bWO36d,SVQ le seau du StLaurent est une des plus importantes voies de navigation commerciale du Canada et renferme des mes riches et https co T8U0bWO36d,"['#SVQ', '#StLaurent']",Environmental,1,0.0,fr,environnementca_tweeter
229,931887967546826753,2017-11-18 14:12:59,['https://t.co/SBVkNAeB4k'],RT @ParcsCanada: Conduite écologique! Découvrez nos efforts à réduire notre empreinte environnementale : https://t.co/SBVkNAeB4k #ScienceCa…,RT ParcsCanada Conduite cologique couvrez nos efforts duire notre empreinte environnementale https co SBVkNAeB4k,['#ScienceCa'],Environmental,1,0.0,fr,environnementca_tweeter
230,932783939877564416,2017-11-21 01:33:16,['https://t.co/vRGVFiAoKL'],"RT @RNCan: Le ministre Carr, sur la #CroissancePropre : https://t.co/vRGVFiAoKL",RT RNCan ministre Carr CroissancePropre https co vRGVFiAoKL,['#CroissancePropre'],Economical,1,0.0,fr,environnementca_tweeter
231,931584930441768961,2017-11-17 18:08:50,[],RT @emplois_gc: .@environnementca va de l’avant avec de nouvelles opportunités d’emploi à l’échelle nationale! Voici une opportunité: https…,RT environnementca va de avant avec de nouvelles emploi chelle nationale Voici une,[],Economical,1,0.0,fr,environnementca_tweeter
232,927906115404394498,2017-11-07 14:30:32,"['https://t.co/Uk1Q1OHmkh', 'https://t.co/zfwIOykCX']","De la sécheresse à de fortes pluies, la région du golfe du Maine a connu un mélange d’événements #météo cet été! https://t.co/Uk1Q1OHmkh https://t.co/zfwIOykCX0",De la cheresse de fortes pluies la gion du golfe du Maine connu un lange nements cet https co Uk1Q1OHmkh https co zfwIOykCX0,['#m'],Environmental,1,0.0,fr,environnementca_tweeter
233,928667324315504644,2017-11-09 16:55:18,"['https://t.co/pma6Bs5ZAj', 'https://t.co/xm5twSCC3J']",Êtes-vous collectionneur ou propriétaire de salamandres? Jetez un œil au nouveau projet de règlement et commentez : https://t.co/pma6Bs5ZAj https://t.co/xm5twSCC3J,tes vous collectionneur ou taire de salamandres Jetez un il au nouveau projet de glement et commentez https co pma6Bs5ZAj https co xm5twSCC3J,[],Environmental,1,0.0,fr,environnementca_tweeter
234,928606892703780870,2017-11-09 12:55:10,['https://t.co/8mVgJX4l1p'],#Rappel : @NCC_CNC tient un concours de photos. Montrez un espace naturel que vous aimez! #PlacesWorthProtecting https://t.co/8mVgJX4l1p,Rappel tient concours photos Montrez espace naturel aimez PlacesWorthProtecting https co 8mVgJX4l1p,"['#Rappel', '#PlacesWorthProtecting']",Environmental,1,0.0,fr,environnementca_tweeter
235,925750615485157378,2017-11-01 15:45:21,"['https://t.co/VFkIHnITFA', 'https://t.co/KE9oPvv6FH']",Permis d'amener des #salamandres au Canada. Exprimez-vous sur ce nouveau #règlement potentiel! https://t.co/VFkIHnITFA https://t.co/KE9oPvv6FH,Permis amener des salamandres au Canada Exprimez vous sur ce nouveau glement potentiel https co VFkIHnITFA https co KE9oPvv6FH,"['#salamandres', '#r']",Environmental,1,0.0,fr,environnementca_tweeter
236,927997888973672449,2017-11-07 20:35:12,"['https://t.co/V0sJQnuIH', 'https://t.co/KQrptgofGJ']",Jetez un œil au superhéros énergie sur Climat jeunes! Créez votre propre superhéros et montrez-le à vos amis! https://t.co/V0sJQnuIH2 https://t.co/KQrptgofGJ,Jetez un il au ros nergie sur Climat jeunes ez votre propre ros et montrez le vos amis https co V0sJQnuIH2 https co KQrptgofGJ,[],Social,1,0.0,fr,environnementca_tweeter
237,928018001668067329,2017-11-07 21:55:07,"['https://t.co/U5vTySQ3Va', 'https://t.co/PtQiW6xAf7']",La #COP23 passe de la parole aux actes en s’assurant de réduire les déchets au minimum durant l’événement :  https://t.co/U5vTySQ3Va https://t.co/PtQiW6xAf7,La COP23 passe de la parole aux actes en assurant de duire les chets au minimum durant nement https co U5vTySQ3Va https co PtQiW6xAf7,['#COP23'],Environmental,1,0.0,fr,environnementca_tweeter
238,929080233835327489,2017-11-10 20:16:03,"['https://t.co/4npqzhiBiS', 'https://t.co/czD85j5rf']",Voyez comment se porte le #SLaurent : Portrait global de l’état du Saint-Laurent #JournéeMondialeDeLaScience https://t.co/4npqzhiBiS https://t.co/czD85j5rf8,Voyez comment se porte le SLaurent Portrait global de tat du Saint Laurent eMondialeDeLaScience https co 4npqzhiBiS https co czD85j5rf8,"['#SLaurent', '#Journ']",Economical,1,0.0,fr,environnementca_tweeter
239,928026898218868736,2017-11-07 22:30:29,['https://t.co/XegY1qBOQH'],"#SVQ la délégation du [Canada flag] à #COP23 compte : représentants gouvernementaux, entreprises, organisations autochtones et jeunes? https://t.co/XegY1qBOQH",SVQ la gation du Canada flag COP23 compte sentants gouvernementaux entreprises organisations autochtones et jeunes https co XegY1qBOQH,"['#SVQ', '#COP23']",Environmental,1,0.0,fr,environnementca_tweeter
240,928057339021856770,2017-11-08 00:31:26,[],"RT @salledepresseGC: Le Canada ratifie l’#AmendementDeKigali, un accord mondial pouvant limiter le réchauffement planétaire à 0,5 %. https:…",RT salledepresseGC Le Canada ratifie AmendementDeKigali un accord mondial pouvant limiter le chauffement taire https,['#AmendementDeKigali'],Environmental,1,0.0,fr,environnementca_tweeter
241,926552946824876032,2017-11-03 20:53:31,[],"RT @ENERGYSTAR_CDN: #Faitduvendredi : en 2016, #ENERGYSTARCanada a évité l’émission de 532 900 tonnes de GES, soit les rejets annuels de 19…",RT Faitduvendredi en 2016 ENERGYSTARCanada mission de 532 900 tonnes de GES soit les rejets annuels de,"['#Faitduvendredi', '#ENERGYSTARCanada']",Economical,1,0.0,fr,environnementca_tweeter
242,925711742730145792,2017-11-01 13:10:53,[],RT @Transports_gc: Août: Annonce d’un investissement total de plus de 175 M$ pour protéger les eaux arctiques dans le cadre du #PlanDeProte…,RT Annonce un investissement total de plus de 175 pour ger les eaux arctiques dans le cadre du,['#PlanDeProte'],Economical,1,0.0,fr,environnementca_tweeter
243,926511855081844738,2017-11-03 18:10:14,['https://t.co/IdLisY9BYB'],.@ministre_ec sera à la réunion aujourd’hui du Conseil des ministres canadiens de l’Environnement. https://t.co/IdLisY9BYB,sera la union hui du Conseil des ministres canadiens de Environnement https co IdLisY9BYB,[],Economical,1,0.0,fr,environnementca_tweeter
244,926178510686875648,2017-11-02 20:05:39,['https://t.co/cKljadnlni'],RT @SPC_CA: #LSV SPC a une nouvelle #solution CHP? CHP = Calcul de haute performance! https://t.co/cKljadnlni #superordinateurs,RT LSV SPC nouvelle solution CHP CHP Calcul haute performance https co cKljadnlni superordinateurs,"['#LSV', '#solution', '#superordinateurs']",Environmental,1,0.0,fr,environnementca_tweeter
245,927636431471874048,2017-11-06 20:38:54,"['https://t.co/lJTa658lxe', 'https://t.co/oVcEFxiyIB']",#CdP23 commence aujourd’hui en #Allemagne. Restez informé des engagements du 🇨🇦 durant cet événement mondial! https://t.co/lJTa658lxe https://t.co/oVcEFxiyIB,CdP23 commence hui en Allemagne Restez des engagements du durant cet nement mondial https co lJTa658lxe https co oVcEFxiyIB,"['#CdP23', '#Allemagne']",Social,1,0.0,fr,environnementca_tweeter
246,925715336703422464,2017-11-01 13:25:09,['https://t.co/hRRtjebgJN'],"Pour des vols en aéronef sûrs, nous travaillons de près avec la @NASA sur l’essai de dispositifs de dégivrage. #ScienceMétéo #NASA https://t.co/hRRtjebgJN",Pour des vols en ronef rs nous travaillons de avec la NASA sur essai de dispositifs de givrage NASA https co hRRtjebgJN,"['#ScienceM', '#NASA']",Social,1,0.0,fr,environnementca_tweeter
247,931209112754548736,2017-11-16 17:15:28,['https://t.co/7ApRqf3BiH'],Joyeuse #JournéeMondialeDeLaPhilosophie! 🤔 https://t.co/7ApRqf3BiH,Joyeuse eMondialeDeLaPhilosophie https co 7ApRqf3BiH,['#Journ'],Economical,1,0.0,en,environnementca_tweeter
248,928701281593589761,2017-11-09 19:10:14,"['https://t.co/jDiltxEPHj', 'https://t.co/wZaLfmWXJB']",Comment atteindre l’ODD11 – villes et collectivités durables? Consultez l’objectif 13 de la #FSDS. https://t.co/jDiltxEPHj https://t.co/wZaLfmWXJB,Comment atteindre ODD11 villes et durables Consultez objectif 13 de la FSDS https co jDiltxEPHj https co wZaLfmWXJB,['#FSDS'],Environmental,1,0.0,fr,environnementca_tweeter
249,928033111841091584,2017-11-07 22:55:10,['https://t.co/PW2JFJpgP3'],"Les négociateurs canadiens à l’œuvre! Beth Lavender (@RNCan), co-modératrice de l’une des séances aujourd’hui #COP23 https://t.co/PW2JFJpgP3",Les gociateurs canadiens uvre Beth Lavender RNCan co ratrice de une des ances hui COP23 https co PW2JFJpgP3,['#COP23'],Environmental,1,0.0,fr,environnementca_tweeter
250,926411238615154690,2017-11-03 11:30:25,[],Vous ne le regretterai pas si vous suivez nos amis @patrimoinecdn. #FF #FollowFriday,regretterai si suivez amis patrimoinecdn FF FollowFriday,"['#FF', '#FollowFriday']",Social,1,0.0,it,environnementca_tweeter
251,935610892527521793,2017-11-28 20:46:34,[],"RT @MPO_DFO: Le sébaste canari atteint sa maturité seulement après 13 ans, ce qui rend leur rétablissement lent suite à un déclin de leur p…",RT Le baste canari atteint sa seulement 13 ans ce qui rend leur tablissement lent suite un clin de leur,[],Social,1,0.0,fr,environnementca_tweeter
252,931203121812004864,2017-11-16 16:51:39,['https://t.co/C0kh2JwCdV'],"EN DIRECT de la CCNUCC, ce soir à 14 h (HNE)/20 h (HEC) : @AmbCanAllemagne, Stéphane Dion, prononcera la déclaration du 🇨🇦 réitérant nos engagements à l’égard de l’#ActionClimatique à la #COP23. https://t.co/C0kh2JwCdV",EN DIRECT de la CCNUCC ce soir 14 HNE 20 HEC AmbCanAllemagne phane Dion prononcera la claration du rant nos engagements gard de ActionClimatique la COP23 https co C0kh2JwCdV,"['#ActionClimatique', '#COP23']",Environmental,1,0.1,fr,environnementca_tweeter
253,927512126880669696,2017-11-06 12:24:58,['https://t.co/Tm\xe2\x80\xa6'],RT @ACEE_CEAA: #SVQ nous avons un programme d’aide financière pour favoriser la participation aux EE? Pour en savoir plus : https://t.co/Tm…,RT SVQ nous avons un programme aide pour favoriser la participation aux EE Pour en savoir plus https co,['#SVQ'],Environmental,1,0.0,fr,environnementca_tweeter
254,931132124681461761,2017-11-16 12:09:32,"['https://t.co/gupvV7DOU7', 'https://t.co/SP9HMFOotq']",Le Canada et le Royaume-Uni mènent une élimination progressive à l’échelle mondiale de l'électricité à partir du charbon afin d'assurer une planète saine aux futures générations. #COP23 #EnergiserAuDelaDuCharbon https://t.co/gupvV7DOU7 https://t.co/SP9HMFOotq,Le Canada et le Royaume Uni nent une limination progressive chelle mondiale de partir du charbon afin assurer une te saine aux futures rations COP23 EnergiserAuDelaDuCharbon https co gupvV7DOU7 https co SP9HMFOotq,"['#COP23', '#EnergiserAuDelaDuCharbon']",Social,1,0.0,fr,environnementca_tweeter
255,930989698260062208,2017-11-16 02:43:35,"['https://t.co/tkU5be9vXw', 'https://t.co/tOQP5KrvcE']",Date à retenir! Rencontrez les leaders qui s’engagent à éliminer progressivement le charbon de l’evenement du Canada-R.-U. le 16 nov. à la #COP23. https://t.co/tkU5be9vXw https://t.co/tOQP5KrvcE,Date retenir Rencontrez les leaders qui engagent liminer progressivement le charbon de evenement du Canada le 16 nov la COP23 https co tkU5be9vXw https co tOQP5KrvcE,['#COP23'],Environmental,1,0.0,fr,environnementca_tweeter
256,930964761122168833,2017-11-16 01:04:30,['https://t.co/F3nGpU9hBw'],Joignez-vous à l'alliance nouvellement formée qui s'engage à abandonner la production d'électricité à partir du charbon. Venez à notre événement le 16 nov.! https://t.co/F3nGpU9hBw,Joignez vous alliance nouvellement qui engage abandonner la production partir du charbon Venez notre nement le 16 nov https co F3nGpU9hBw,[],Environmental,1,0.0,fr,environnementca_tweeter
257,929373242913099776,2017-11-11 15:40:22,"['https://t.co/ALQ7qxOxpE', 'https://t.co/t49sH3fSO']",Souvenons-nous des vétérans canadiens et rendons hommage à leur service et sacrifice. #LeCanadaseSouvient https://t.co/ALQ7qxOxpE https://t.co/t49sH3fSO9,Souvenons nous des rans canadiens et rendons hommage leur service et sacrifice LeCanadaseSouvient https co ALQ7qxOxpE https co t49sH3fSO9,['#LeCanadaseSouvient'],Environmental,1,0.0,fr,environnementca_tweeter
258,936330287000236039,2017-11-30 20:25:11,['https://t.co/eskPZ6m4Go'],"#EnCeJour en 2012, la température à Mayo, au YT, a chuté à -45oC, faisant du #Yukon l’endroit le froid au monde! #Météo https://t.co/eskPZ6m4Go",EnCeJour en 2012 la rature Mayo au YT 45oC faisant du Yukon endroit le froid au monde https co eskPZ6m4Go,"['#EnCeJour', '#Yukon', '#M']",Social,1,0.0,fr,environnementca_tweeter
