,Unnamed: 0,id,date_published,link,caption_original,caption_cleaned,hashtags,num_reactions,num_comments,num_shares,num_likes,num_loves,num_wows,num_hahas,num_sads,num_angrys,num_special,Reactions_SUM,category,language,average_sentiment_score,account_name,words_matched_list,sentiment
318,318,460123390028_10159606734000029,2017-11-14 10:02:29,https://www.facebook.com/EnvironnementetressourcesnaturellesauCanada/videos/10159606734000029/,"La ministre de l’Environnement et Changement climatique, Catherine McKenna, annonce que le député Terry Duguid dirigera nos efforts communs en vue d’améliorer la santé et la qualité de l’eau du bassin du lac Winnipeg en collaboration avec des intervenants clés. http://ow.ly/Kyx530gzrZw","La ministre de l’Environnement et Changement climatique, Catherine McKenna, annonce que le député Terry Duguid dirigera nos efforts communs en vue d’améliorer la santé et la qualité de l’eau du bassin du lac Winnipeg en collaboration avec des intervenants clés.",[],6,1,0,6,0,0,0,0,0,0,7,Environmental,fr,0.0,EnvironnementetressourcesnaturellesauCanada_facebook,"['environnement', 'climat', 'changement climatique', 'climatique', 'eau', 'or']",neutral
302,302,460123390028_10159615099845029,2017-11-16 07:55:32,https://www.facebook.com/EnvironnementetressourcesnaturellesauCanada/photos/a.481746145028.384353.460123390028/10159615098790029/?type=3,"Aujourd’hui : le Canada, le Royaume-Uni et plus de 20 gouvernements se sont unis pour accélérer une croissance économique propre grâce à l’élimination progressive de l’électricité à partir du charbon traditionnel. L’Alliance : Énergiser au-delà du charbon créera une planète saine et durable pour les générations futures! http://ow.ly/ZYpc30gCnLj","Aujourd’hui : le Canada, le Royaume-Uni et plus de gouvernements se sont unis pour accélérer une croissance économique propre grâce à l’élimination progressive de l’électricité à partir du charbon traditionnel. L’Alliance : Énergiser au-delà du charbon créera une planète saine et durable pour les générations futures!",[],7,0,0,7,0,0,0,0,0,0,7,Social,fr,0.0,EnvironnementetressourcesnaturellesauCanada_facebook,"['future', 'futur']",neutral
277,277,460123390028_10159642241400029,2017-11-22 10:01:29,https://www.facebook.com/EnvironnementetressourcesnaturellesauCanada/photos/a.481746145028.384353.460123390028/10159642241400029/?type=3,"Les ménages utilisent des pesticides et des engrais chimiques pour se débarrasser de plantes et d’insectes indésirables et conserver l’apparence de leurs pelouses et jardins. Toutefois, ces produits chimiques peuvent avoir des effets nocifs sur l’environnement et la santé; ils peuvent polluer les lacs et les rivières et mettre en danger de nombreuses formes de vie, dont les  espèces qui aident l’environnement. 

Bien que les ménages canadiens utilisent moins de pesticides et d’engrais chimiques depuis 1994, cette utilisation a augmenté au cours des dernières années. Consultez les indicateurs environnementaux d’Environnement et Changement climatique Canada pour obtenir les derniers résultats : 
http://ow.ly/J0Qo30gJk8X","Les ménages utilisent des pesticides et des engrais chimiques pour se débarrasser de plantes et d’insectes indésirables et conserver l’apparence de leurs pelouses et jardins. Toutefois, ces produits chimiques peuvent avoir des effets nocifs sur l’environnement et la santé; ils peuvent polluer les lacs et les rivières et mettre en danger de nombreuses formes de vie, dont les espèces qui aident l’environnement. Bien que les ménages canadiens utilisent moins de pesticides et d’engrais chimiques depuis , cette utilisation a augmenté au cours des dernières années. Consultez les indicateurs environnementaux d’Environnement et Changement climatique Canada pour obtenir les derniers résultats :",[],2,0,5,2,0,0,0,0,0,0,7,Environmental,fr,0.0,EnvironnementetressourcesnaturellesauCanada_facebook,"['environnement', 'plantes', 'climat', 'changement climatique', 'climatique', 'conserve', 'lacs', 'or']",neutral
281,281,460123390028_10159639493985029,2017-11-21 18:29:49,https://www.facebook.com/EnvironnementetressourcesnaturellesauCanada/photos/a.481746145028.384353.460123390028/10159639493985029/?type=3,"Dans le cadre des Journées Grands Lacs–Saint-Laurent sur la colline parlementaire de novembre 2017, la ministre de l’Environnement et du Changement climatique, Catherine McKenna, a rencontré des membres de l’initiative de collaboration Grands Lacs–Saint-Laurent et divers intervenants pour discuter de ces importantes ressources hydriques. Great Lakes-St. Lawrence Cities Initiative/Alliance Grands Lacs St-Laurent Council of the Great Lakes Region","Dans le cadre des Journées Grands Lacs–Saint-Laurent sur la colline parlementaire de novembre , la ministre de l’Environnement et du Changement climatique, Catherine McKenna, a rencontré des membres de l’initiative de collaboration Grands Lacs–Saint-Laurent et divers intervenants pour discuter de ces importantes ressources hydriques. Great Lakes-St. Lawrence Cities Initiative/Alliance Grands Lacs St-Laurent Council of the Great Lakes Region",[],5,0,2,5,0,0,0,0,0,0,7,Environmental,fr,0.0,EnvironnementetressourcesnaturellesauCanada_facebook,"['environnement', 'climat', 'changement climatique', 'climatique', 'lakes', 'lacs', 'air', 'or']",neutral
298,298,460123390028_10159612020725029,2017-11-15 13:38:37,https://www.facebook.com/EnvironnementetressourcesnaturellesauCanada/photos/a.481746145028.384353.460123390028/10159612020725029/?type=3,"Le gouvernement du Canada continue de respecter son engagement de verser 2,65 G$ pour aider les pays en voie de développement à lutter contre les changements climatiques. Le gouvernement offre 1,6 million de dollars pour aider le Chili, la Colombie, le Mexique et le Pérou, qui forment l’Alliance du Pacifique, à renforcer leurs mesures des gaz à effet de serre, leurs rapports et leurs vérifications dans ce domaine. Grâce à un suivi renforcé de la réduction des émissions, ils amélioreront l’accès à l’investissement dans la croissance propre. L’environnement et l’économie vont vraiment de pair.

Pour en savoir davantage : http://ow.ly/nZlj30gBnAL","Le gouvernement du Canada continue de respecter son engagement de verser ,65 G$ pour aider les pays en voie de développement à lutter contre les changements climatiques. Le gouvernement offre ,6 million de dollars pour aider le Chili, la Colombie, le Mexique et le Pérou, qui forment l’Alliance du Pacifique, à renforcer leurs mesures des gaz à effet de serre, leurs rapports et leurs vérifications dans ce domaine. Grâce à un suivi renforcé de la réduction des émissions, ils amélioreront l’accès à l’investissement dans la croissance propre. L’environnement et l’économie vont vraiment de pair. Pour en savoir davantage :",[],6,1,0,6,0,0,0,0,0,0,7,Environmental,fr,-0.8,EnvironnementetressourcesnaturellesauCanada_facebook,"['environnement', 'gaz', 'climat', 'climatique', 'air', 'propre', 'or']",negative
405,405,460123390028_10159583360785029,2017-11-08 21:47:55,https://www.facebook.com/EnvironnementetressourcesnaturellesauCanada/videos/10159583360785029/,En unissant nos efforts nous pouvons conserver et protéger nos espèces canadiennes en péril. Posez des gestes concrets : http://ow.ly/Lu4730gsj9X,En unissant nos efforts nous pouvons conserver et protéger nos espèces canadiennes en péril. Posez des gestes concrets :,[],4,0,2,4,0,0,0,0,0,0,6,Environmental,fr,0.0,EnvironnementetressourcesnaturellesauCanada_facebook,"['conserve', 'or']",neutral
406,406,460123390028_10159616420660029,2017-11-16 14:15:28,,"Regardez EN DIRECT l’Ambassadeur du Canada auprès de l’Allemagne et envoyé spécial auprès de l’Union européenne et de l’Europe, Stéphane Dion, prononcer la déclaration nationale du Canada à la COP23, qui réitère nos engagements dans la lutte contre les changements climatiques et l’action climatique mondiale.https://unfccc.cloud.streamworld.de/webcast/joint-high-level-segment-9th-meeting-of-the-cop-an","Regardez EN DIRECT l’Ambassadeur du Canada auprès de l’Allemagne et envoyé spécial auprès de l’Union européenne et de l’Europe, Stéphane Dion, prononcer la déclaration nationale du Canada à la COP23, qui réitère nos engagements dans la lutte contre les changements climatiques et l’action climatique mondiale.",[],5,0,1,5,0,0,0,0,0,0,6,Social,fr,0.0,EnvironnementetressourcesnaturellesauCanada_facebook,"['engagement', 'changement', 'change']",neutral
411,411,460123390028_10159638450370029,2017-11-21 15:40:00,https://www.facebook.com/EnvironnementetressourcesnaturellesauCanada/videos/10159638450370029/,"Bonne Journée mondiale des pêches! Suivez nos amis de Pêches et Océans Canada pour découvrir ce que fait le gouvernement du Canada! Au cas où vous l’auriez manqué, regardez le tout premier film de narvals utilisant leur défense pour assommer leur proie! 🦄","Bonne Journée mondiale des pêches! Suivez nos amis de Pêches et Océans Canada pour découvrir ce que fait le gouvernement du Canada! Au cas où vous l’auriez manqué, regardez le tout premier film de narvals utilisant leur défense pour assommer leur proie! 🦄",[],6,0,0,6,0,0,0,0,0,0,6,Economical,fr,0.0,EnvironnementetressourcesnaturellesauCanada_facebook,"['mondiale', 'mondial']",neutral
420,420,460123390028_10159602030970029,2017-11-13 07:15:39,https://www.facebook.com/EnvironnementetressourcesnaturellesauCanada/photos/a.481746145028.384353.460123390028/10159602030970029/?type=3,"C’est la journée financement à la COP23. L’innovation en matière de technologies propres est l’élément central du Plan pour l’innovation et les compétences du gouvernement du Canada. 

Lors du dernier budget fédéral, le gouvernement du Canada s’est engagé à investir plus de 2,3 milliards de dollars pour favoriser la croissance des technologies propres partout au pays! Le financement est un aspect crucial de la croissance des entreprises vertes. http://ow.ly/LKR230gxpQO","C’est la journée financement à la COP23. L’innovation en matière de technologies propres est l’élément central du Plan pour l’innovation et les compétences du gouvernement du Canada. Lors du dernier budget fédéral, le gouvernement du Canada s’est engagé à investir plus de ,3 milliards de dollars pour favoriser la croissance des technologies propres partout au pays! Le financement est un aspect crucial de la croissance des entreprises vertes.",[],4,1,1,4,0,0,0,0,0,0,6,Economical,fr,0.0,EnvironnementetressourcesnaturellesauCanada_facebook,"['finance', 'invest', 'croissance', 'innovation', 'financement', 'technologies', 'technologie']",neutral
421,421,460123390028_10159612018780029,2017-11-15 13:37:56,https://www.facebook.com/EnvironnementetressourcesnaturellesauCanada/photos/a.481746145028.384353.460123390028/10159612018780029/?type=3,"Qui suis-je? Je suis situé dans toutes les régions du Canada. Je fournis quotidiennement des renseignements essentiels aux Canadiens. Je suis doté d’une technologie de polarisation double pleinement intégrée. J’ai une couverture Doppler élargie de 240 km, comparativement à celle de 120 km des radars actuels. Je contribue à mieux protéger les Canadiens contre les phénomènes météorologiques violents, comme les tornades... 

Notre nouveau radar météo! http://ow.ly/cMQn30gBnxn","Qui suis-je? Je suis situé dans toutes les régions du Canada. Je fournis quotidiennement des renseignements essentiels aux Canadiens. Je suis doté d’une technologie de polarisation double pleinement intégrée. J’ai une couverture Doppler élargie de km, comparativement à celle de km des radars actuels. Je contribue à mieux protéger les Canadiens contre les phénomènes météorologiques violents, comme les tornades... Notre nouveau radar météo!",[],6,0,0,6,0,0,0,0,0,0,6,Environmental,fr,0.0,EnvironnementetressourcesnaturellesauCanada_facebook,"['eau', 'or', 'vert']",neutral
439,439,460123390028_10159672729125029,2017-11-29 14:16:38,https://www.facebook.com/EnvironnementetressourcesnaturellesauCanada/photos/a.481746145028.384353.460123390028/10159672727035029/?type=3,"La secrétaire parlementaire Celina Caesar-Chavannes a annoncé aux Nations Unies une contribution de 100 million de dollars par le Canada. Ces fonds serviront à rebâtir les collectivités qui ont subi de graves dommages au cours de la dernière saison des ouragans. Ensemble, nous pouvons bâtir un monde plus fort et meilleur pour tous! 

http://ow.ly/zdGk30gTRcy","La secrétaire parlementaire Celina Caesar-Chavannes a annoncé aux Nations Unies une contribution de million de dollars par le Canada. Ces fonds serviront à rebâtir les collectivités qui ont subi de graves dommages au cours de la dernière saison des ouragans. Ensemble, nous pouvons bâtir un monde plus fort et meilleur pour tous!",[],5,1,0,4,0,0,0,0,1,0,6,Environmental,fr,0.0,EnvironnementetressourcesnaturellesauCanada_facebook,"['or', 'air']",neutral
479,479,460123390028_10159666805940029,2017-11-28 08:44:34,https://www.facebook.com/EnvironnementetressourcesnaturellesauCanada/photos/a.481746145028.384353.460123390028/10159666805940029/?type=3,"Le comité canadien qui travaille pour protéger les espèces en péril a célébré hier ses 40 ans de conservation! Muni des meilleures données scientifiques et connaissances des collectivités et des Autochtones, il travaille avec acharnement pour protéger la faune canadienne! 👍🏼 http://ow.ly/Gb1q30gRFVs","Le comité canadien qui travaille pour protéger les espèces en péril a célébré hier ses ans de conservation! Muni des meilleures données scientifiques et connaissances des collectivités et des Autochtones, il travaille avec acharnement pour protéger la faune canadienne!",[],4,0,1,4,0,0,0,0,0,0,5,Environmental,fr,0.0,EnvironnementetressourcesnaturellesauCanada_facebook,"['conservation', 'faune']",neutral
512,512,460123390028_10159675875990029,2017-11-30 09:23:52,https://www.facebook.com/FauneFlorePays/videos/1805428042862629/,,,[],5,0,0,5,0,0,0,0,0,0,5,unknown,tl,0.0,EnvironnementetressourcesnaturellesauCanada_facebook,,neutral
509,509,460123390028_10159646116635029,2017-11-23 08:30:09,https://www.facebook.com/EnvironnementetressourcesnaturellesauCanada/photos/a.481746145028.384353.460123390028/10159646116635029/?type=3,"Le gouvernement du Canada travaille à un processus d’évaluation environnementale équitable et rigoureux.  #RésultatsGC #examenEE
http://ow.ly/ogro30gJkAy",Le gouvernement du Canada travaille à un processus d’évaluation environnementale équitable et rigoureux. ésultatsGC,"['#R', '#examenEE']",3,1,1,3,0,0,0,0,0,0,5,Environmental,fr,0.0,EnvironnementetressourcesnaturellesauCanada_facebook,['environnement'],neutral
508,508,460123390028_10159644510970029,2017-11-22 20:20:07,https://www.facebook.com/EnvironnementetChangementclimatique/photos/a.377494369373762.1073741828.370233926766473/384142418708957/?type=3,,,[],4,1,0,4,0,0,0,0,0,0,5,unknown,tl,0.5,EnvironnementetressourcesnaturellesauCanada_facebook,,positive
503,503,460123390028_10159641904745029,2017-11-22 09:01:09,https://www.facebook.com/EnvironnementetressourcesnaturellesauCanada/photos/a.481746145028.384353.460123390028/10159641904745029/?type=3,"Le gouvernement du Canada travaille avec les provinces et territoires à l’avancement de la stratégie canadienne de l’énergie. #RésultatsGC
http://ow.ly/5j1U30gJilt",Le gouvernement du Canada travaille avec les provinces et territoires à l’avancement de la stratégie canadienne de l’énergie. ésultatsGC,['#R'],4,0,1,4,0,0,0,0,0,0,5,unknown,fr,0.0,EnvironnementetressourcesnaturellesauCanada_facebook,,neutral
493,493,460123390028_10159646159910029,2017-11-23 08:43:11,https://www.facebook.com/EnvironnementetChangementclimatique/photos/a.377494369373762.1073741828.370233926766473/384139552042577/?type=3,,,[],4,1,0,1,2,0,1,0,0,0,5,unknown,tl,0.0,EnvironnementetressourcesnaturellesauCanada_facebook,,neutral
463,463,460123390028_10159594577515029,2017-11-11 13:45:00,https://www.facebook.com/EnvironnementetressourcesnaturellesauCanada/photos/a.481746145028.384353.460123390028/10159594572645029/?type=3,"À la COP23, le Canada demeure déterminé à investir dans le traitement de l’eau et de l’eau potable pour les collectivités durables. Les eaux du Canada représentent environ 7 % des réserves d’eau douce de la planète. Nous travaillons d’arrache-pied pour les protéger pour les Canadiens. 

Pour de plus amples renseignements sur les efforts du Canada pour protéger l’eau douce : http://ow.ly/9i9730gvT70","À la COP23, le Canada demeure déterminé à investir dans le traitement de l’eau et de l’eau potable pour les collectivités durables. Les eaux du Canada représentent environ % des réserves d’eau douce de la planète. Nous travaillons d’arrache-pied pour les protéger pour les Canadiens. Pour de plus amples renseignements sur les efforts du Canada pour protéger l’eau douce : 0",[],3,0,2,3,0,0,0,0,0,0,5,Environmental,fr,0.0,EnvironnementetressourcesnaturellesauCanada_facebook,"['cop23', 'eau', 'durable', 'or']",neutral
471,471,460123390028_10159608874180029,2017-11-14 20:04:28,https://www.facebook.com/EnvironnementetressourcesnaturellesauCanada/photos/a.481746145028.384353.460123390028/10159608874180029/?type=3,"Félicitations à M. Bell et à son équipe de la Memorial University de Terre-Neuve, qui ont créé SmartICE. 

À la COP23 de la Conférence des Nations Unies sur les changements climatiques, ils ont reçu le trophée Solutions climat 2017 de l’ONU pour leurs travaux exceptionnels dans le domaine de l’adaptation aux changements climatiques. Ils ont mis au point un outil qui aide les peuples autochtones à s’adapter à l’amincissement de la glace de mer. L’outil fournit de l’information qui facilite la planification de trajets sûrs, réduisant ainsi les risques liés aux déplacements sur la glace. 

SmartICE montre comment, deux ans après l’adoption universelle de l’Accord de Paris, les mesures de lutte à l’échelle internationale se multiplient. http://ow.ly/oHtV30gAhRH","Félicitations à M. Bell et à son équipe de la Memorial University de Terre-Neuve, qui ont créé SmartICE. À la COP23 de la Conférence des Nations Unies sur les changements climatiques, ils ont reçu le trophée Solutions climat de l’ONU pour leurs travaux exceptionnels dans le domaine de l’adaptation aux changements climatiques. Ils ont mis au point un outil qui aide les peuples autochtones à s’adapter à l’amincissement de la glace de mer. L’outil fournit de l’information qui facilite la planification de trajets sûrs, réduisant ainsi les risques liés aux déplacements sur la glace. SmartICE montre comment, deux ans après l’adoption universelle de l’Accord de Paris, les mesures de lutte à l’échelle internationale se multiplient.",[],4,1,0,4,0,0,0,0,0,0,5,Environmental,fr,0.0,EnvironnementetressourcesnaturellesauCanada_facebook,"['climat', 'cop23', 'climatique', 'adaptation', 'mer', 'or', 'ice']",neutral
470,470,460123390028_10159611692615029,2017-11-15 12:01:13,https://www.facebook.com/EnvironnementetressourcesnaturellesauCanada/photos/a.481746145028.384353.460123390028/10159611692615029/?type=3,C’est aujourd’hui la Journée des SIG! Saviez-vous que l’Agence canadienne d’évaluation environnementale se sert de systèmes d’information géographique durant le processus d’évaluation environnementale pour cartographier différentes parties d’une zone de projet? Consultez la carte interactive des emplacements de projets sur son site Web :http://ow.ly/7hoa30gB8mV,C’est aujourd’hui la Journée des SIG! Saviez-vous que l’Agence canadienne d’évaluation environnementale se sert de systèmes d’information géographique durant le processus d’évaluation environnementale pour cartographier différentes parties d’une zone de projet? Consultez la carte interactive des emplacements de projets sur son site Web :,[],4,1,0,4,0,0,0,0,0,0,5,Environmental,fr,0.0,EnvironnementetressourcesnaturellesauCanada_facebook,"['environnement', 'or']",neutral
465,465,460123390028_10159555896635029,2017-11-02 15:11:36,https://www.facebook.com/EnvironnementetressourcesnaturellesauCanada/photos/a.481746145028.384353.460123390028/10159555896635029/?type=3,"Aujourd’hui, la ministre de Services publics et Approvisionnement et ministre responsable de Services partagés Canada, Carla Qualtrough, a annoncé que de nouveaux superordinateurs haut de gamme contribueront aux prévisions météorologiques du Canada! http://ow.ly/mjgL30gjDQk","Aujourd’hui, la ministre de Services publics et Approvisionnement et ministre responsable de Services partagés Canada, Carla Qualtrough, a annoncé que de nouveaux superordinateurs haut de gamme contribueront aux prévisions météorologiques du Canada!",[],3,1,1,3,0,0,0,0,0,0,5,Environmental,fr,0.0,EnvironnementetressourcesnaturellesauCanada_facebook,"['eau', 'or', 'ice']",neutral
457,457,460123390028_10159596531985029,2017-11-11 22:00:24,https://www.facebook.com/EnvironnementetressourcesnaturellesauCanada/photos/a.481746145028.384353.460123390028/10159596531985029/?type=3,"C’est la Journée du transport à la COP23. Ici même au Canada, le gouvernement  s’est engagé à investir dans des projets de transport actif, ce qui permettra à nos collectivités de demeurer saines et propres. http://ow.ly/x6lT30gw8M0","C’est la Journée du transport à la COP23. Ici même au Canada, le gouvernement s’est engagé à investir dans des projets de transport actif, ce qui permettra à nos collectivités de demeurer saines et propres. 0",[],4,1,0,4,0,0,0,0,0,0,5,Environmental,fr,0.0,EnvironnementetressourcesnaturellesauCanada_facebook,"['cop23', 'or', 'propre']",neutral
451,451,460123390028_10159608071100029,2017-11-14 16:48:53,http://ow.ly/y44H30gA6Yr,"Découvrez les faits saillants de la journée touchant la ministre de l’Environnement et du Changement climatique, Catherine McKenna : http://ow.ly/y44H30gA6Yr","Découvrez les faits saillants de la journée touchant la ministre de l’Environnement et du Changement climatique, Catherine McKenna :",[],5,0,0,5,0,0,0,0,0,0,5,Environmental,fr,0.0,EnvironnementetressourcesnaturellesauCanada_facebook,"['environnement', 'changement climatique', 'climatique', 'climat']",neutral
448,448,460123390028_10159607258175029,2017-11-14 12:42:36,https://www.facebook.com/EnvironnementetressourcesnaturellesauCanada/photos/a.481746145028.384353.460123390028/10159607258175029/?type=3,"Aujourd’hui, à la COP23 à Bonn, en Allemagne, la ministre de l’Environnement et du Changement climatique du Canada, Catherine McKenna, a coprésidé l’Assemblée annuelle de haut niveau de la Coalition pour le climat et l’air pur.

L’Assemblée a réuni des pays partageant le but commun de réduire les polluants qui contribuent aux changements climatiques et qui nuisent à la qualité de l’air de millions de citoyens partout dans le monde. http://ow.ly/R7Ic30gzJYt","Aujourd’hui, à la COP23 à Bonn, en Allemagne, la ministre de l’Environnement et du Changement climatique du Canada, Catherine McKenna, a coprésidé l’Assemblée annuelle de haut niveau de la Coalition pour le climat et l’air pur. L’Assemblée a réuni des pays partageant le but commun de réduire les polluants qui contribuent aux changements climatiques et qui nuisent à la qualité de l’air de millions de citoyens partout dans le monde.",[],4,0,1,4,0,0,0,0,0,0,5,Environmental,fr,0.0,EnvironnementetressourcesnaturellesauCanada_facebook,"['environnement', 'climat', 'cop23', 'polluants', 'changement climatique', 'climatique', 'air', 'eau']",neutral
725,725,460123390028_10159634646165029,2017-11-20 15:33:12,https://www.facebook.com/EnvironnementetressourcesnaturellesauCanada/videos/10159634646165029/,"Saviez-vous que nous investissons 155 millions $ pour la #CroissancePropre en énergie, exploitation minière, foresterie? Faites une demande de participation au programme de #CroissancePropre :
http://ow.ly/WuXa30gHLYk","Saviez-vous que nous investissons millions $ pour la en énergie, eloitation minière, foresterie? Faites une demande de participation au programme de :","['#CroissancePropre', '#CroissancePropre']",4,0,0,4,0,0,0,0,0,0,4,Economical,fr,0.0,EnvironnementetressourcesnaturellesauCanada_facebook,['invest'],neutral
721,721,460123390028_10159620729035029,2017-11-17 13:46:06,https://www.facebook.com/EurekaCanadaFrancais/photos/a.117394968323851.16505.101966663200015/1622223207841012/?type=3,,,[],4,0,0,4,0,0,0,0,0,0,4,unknown,tl,0.0,EnvironnementetressourcesnaturellesauCanada_facebook,,neutral
702,702,460123390028_10159664188415029,2017-11-27 16:48:19,https://www.facebook.com/EnvironnementetChangementclimatique/photos/a.377494369373762.1073741828.370233926766473/386278275162038/?type=3,,,[],4,0,0,4,0,0,0,0,0,0,4,unknown,tl,0.0,EnvironnementetressourcesnaturellesauCanada_facebook,,neutral
