,id,date_published,link,caption_original,caption_cleaned,hashtags,category,Reactions_SUM,average_sentiment_score,language,account_name
128,931593764942032896,2017-11-17 18:43:56,['https://t.co/uZ6Qd2gZhR'],"RT @ParcsCanada: Les pistes nous appellent, c'est la #journéedelarandonnée! Évitez l’hibernation prématurée : https://t.co/uZ6Qd2gZhR @Part…",RT ParcsCanada Les pistes nous appellent est la vitez hibernation https co uZ6Qd2gZhR,['#journ'],Social,3,0.0,fr,environnementca_tweeter
129,925703605079994369,2017-11-01 12:38:32,[],RT @ministre_ec: Les changements climatiques sont réels : saviez-vous que le glacier Athabasca au @PNJasper diminue de 5 mètres par année?…,RT Les changements climatiques sont els saviez vous que le glacier Athabasca au PNJasper diminue de tres par,[],Social,3,0.0,fr,environnementca_tweeter
130,933411022290927617,2017-11-22 19:05:04,['https://t.co/IfOz5XPiYi'],Nos #GrandsLacs : Protection. Rétablissement. Exploration. https://t.co/IfOz5XPiYi,Nos GrandsLacs Protection tablissement Exploration https co IfOz5XPiYi,['#GrandsLacs'],Environmental,3,0.0,en,environnementca_tweeter
131,935575124585140226,2017-11-28 18:24:26,[],"RT @CECweb: Grâce au #ProtocoleDeMontréal, signé il y a 30 ans, + de 99% des substances appauvrissant la couche d'ozone ont été éliminées a…",RT CECweb ce au al il 30 ans de 99 des substances appauvrissant la couche ozone ont es,['#ProtocoleDeMontr'],Environmental,3,0.0,fr,environnementca_tweeter
132,935601120881336321,2017-11-28 20:07:44,[],"RT @ministre_ec: Pour souligner le #JourDuRespect à @environnementca, la ministre McKenna s’adresse aux employés dévoués d’Environnement et…",RT Pour souligner le JourDuRespect environnementca la ministre McKenna adresse aux Environnement,['#JourDuRespect'],Economical,3,0.0,fr,environnementca_tweeter
133,927537716912418816,2017-11-06 14:06:39,"['https://t.co/Nr0Yo75N0z', 'https://t.co/TTmrBYz']","En cette #SemaineDesVétérans, soulignez avec nous ceux qui ont servi notre pays. #LeCanadaseSouvient @VeteransFR_CA https://t.co/Nr0Yo75N0z https://t.co/TTmrBYzc1D",En cette rans soulignez avec nous ceux qui ont servi notre pays LeCanadaseSouvient https co Nr0Yo75N0z https co TTmrBYzc1D,"['#SemaineDesV', '#LeCanadaseSouvient']",Social,3,0.0,fr,environnementca_tweeter
134,936332261833756678,2017-11-30 20:33:02,[],RT @RNCan: Le gouvernement du Canada et la @ReseauFCM annonceront des investissements du Fonds municipal vert au #Québec #InfrastructureVer…,RT RNCan Le gouvernement du Canada et la ReseauFCM annonceront des investissements du Fonds municipal vert au bec,"['#Qu', '#InfrastructureVer']",Economical,3,0.0,fr,environnementca_tweeter
135,929022949562159104,2017-11-10 16:28:26,['https://t.co/pJNIeMLkqt'],RT @salledepresseGC: La @ministre_ec McKenna se rend en Allemagne pour la #COP23. https://t.co/pJNIeMLkqt,RT salledepresseGC McKenna rend Allemagne COP23 https co pJNIeMLkqt,['#COP23'],Environmental,2,0.0,fr,environnementca_tweeter
136,933402549507543042,2017-11-22 18:31:24,['https://t.co/9eKAKMOQdo'],Nos #GrandsLacs : Économie. Environnement. Accueil. https://t.co/9eKAKMOQdo,Nos GrandsLacs conomie Environnement Accueil https co 9eKAKMOQdo,['#GrandsLacs'],Environmental,2,0.0,fr,environnementca_tweeter
137,933405553556099072,2017-11-22 18:43:20,[],RT @ministre_ec: Un réseau d’écosystèmes résilients jouera un rôle important dans l’atténuation des effets du #Changementclimatique. Pour e…,RT Un seau mes silients jouera un le important dans nuation des effets du Changementclimatique Pour,['#Changementclimatique'],Environmental,2,0.4,fr,environnementca_tweeter
138,932717746185437186,2017-11-20 21:10:14,['https://t.co/tvjEqk7aWO'],"Grâce au #ProtocoleDeMontréal, plus de 99 % des substances appauvrissant la couche d’ozone sont éliminées au Canada. https://t.co/tvjEqk7aWO",ce au al plus de 99 des substances appauvrissant la couche ozone sont es au Canada https co tvjEqk7aWO,['#ProtocoleDeMontr'],Environmental,2,0.0,fr,environnementca_tweeter
139,933405732824862720,2017-11-22 18:44:03,[],"RT @ParcsCanada: L'une des plantes les plus rares du Canada et #EspèceEnPéril, l’airelle à longues étamines, est un petit arbuste important…",RT ParcsCanada une des plantes les plus rares du Canada et ril airelle longues tamines est un petit arbuste,['#Esp'],Environmental,2,0.0,fr,environnementca_tweeter
140,933405986114506752,2017-11-22 18:45:03,['https://t.co/24bDJNmlq'],Nos #GrandsLacs : Jouer. Se connecter. Se souvenir. https://t.co/24bDJNmlq1,GrandsLacs Jouer connecter souvenir https co 24bDJNmlq1,['#GrandsLacs'],Social,2,0.0,fr,environnementca_tweeter
141,930841772267360256,2017-11-15 16:55:47,"['https://t.co/YQYKblTn', 'https://t.co/n8Hiy1Cei']",Le lien corrigé : https://t.co/YQYKblTn8d https://t.co/n8Hiy1Cei8,Le lien https co YQYKblTn8d https co n8Hiy1Cei8,[],Environmental,2,0.0,fr,environnementca_tweeter
142,926622819810766855,2017-11-04 01:31:10,['https://t.co/SE3cpf9BG'],RT @salledepresseGC: Les ministres canadiens de l’Environnement se réunissent pour leur conférence annuelle : https://t.co/SE3cpf9BG8,RT salledepresseGC Les ministres canadiens de Environnement se unissent pour leur rence annuelle https co SE3cpf9BG8,[],Economical,2,0.0,fr,environnementca_tweeter
143,928314913180782595,2017-11-08 17:34:57,[],RT @RNCan: Le 🇨🇦 versera 50 000 $ pour des activités C3E qui permettront aux femmes de jouer pleinement leur rôle dans une économie à #Éner…,RT RNCan Le versera 50 000 pour des C3E qui permettront aux femmes de jouer pleinement leur le dans une conomie,['#'],Social,2,0.0,fr,environnementca_tweeter
144,930888716700344325,2017-11-15 20:02:19,['https://t.co/rBB7ZliOQ'],Ohé Canadiens! Voyez comment les nouveaux radars #météo peuvent vous aider? https://t.co/rBB7ZliOQ8,Canadiens Voyez comment les nouveaux radars peuvent vous aider https co rBB7ZliOQ8,['#m'],Environmental,2,0.0,fr,environnementca_tweeter
145,932740829227167744,2017-11-20 22:41:57,"['https://t.co/7yBhYXHlBK', 'https://t.co/8opXq69roN']",".@ministre_ec McKenna a signé aujourd’hui, un protocole d’entente sur la coopération environnementale et l’#ActionClimatique avec le ministre de l’Environnement du @GovRwanda, Vincent Biruta. https://t.co/7yBhYXHlBK https://t.co/8opXq69roN",McKenna hui un protocole entente sur la ration environnementale et ActionClimatique avec le ministre de Environnement du GovRwanda Vincent Biruta https co 7yBhYXHlBK https co 8opXq69roN,['#ActionClimatique'],Environmental,2,0.0,fr,environnementca_tweeter
146,931888546201456647,2017-11-18 14:15:17,['https://t.co/SfktJrVEM'],RT @RNCan: Besoin d’une #carte des #AiresMarines protégées et des espèces en péril? https://t.co/SfktJrVEM8 #CartesOuvertes #SemaineGéo htt…,RT RNCan Besoin une carte des AiresMarines es et des ces en ril https co SfktJrVEM8 CartesOuvertes,"['#carte', '#AiresMarines', '#CartesOuvertes', '#SemaineG']",Environmental,2,0.0,fr,environnementca_tweeter
147,926435475119857664,2017-11-03 13:06:44,[],RT @SPC_CA: Min. Qualtrough a visité le nouveau site de #superordinateurs de SPC avec @_RonParker. Un grand projet collaboratif avec @envir…,RT Min Qualtrough le nouveau site de superordinateurs de SPC avec Un grand projet collaboratif avec,['#superordinateurs'],Environmental,2,0.5,fr,environnementca_tweeter
148,933696667257376768,2017-11-23 14:00:07,['https://t.co/\xe2\x80\xa6'],RT @ParcsCanada: Livraison de bisons! Découvrez comment la #science contribue au déplacement des bisons d’Elk Island à Banff! https://t.co/…,RT ParcsCanada Livraison de bisons couvrez comment la science contribue au placement des bisons Elk Island Banff https co,['#science'],Social,2,0.0,fr,environnementca_tweeter
149,926593619435323392,2017-11-03 23:35:08,"['https://t.co/jEAmbDu5Y7', 'https://t.co/RsDncn59jY']",La #QualitéDeLair s’améliore au Canada. Renseignez-vous et faites votre part! Rapport sur l’état de l’air. https://t.co/jEAmbDu5Y7 https://t.co/RsDncn59jY,La DeLair liore au Canada Renseignez vous et faites votre part Rapport sur tat de air https co jEAmbDu5Y7 https co RsDncn59jY,['#Qualit'],Environmental,2,0.0,fr,environnementca_tweeter
150,933696529327632384,2017-11-23 13:59:34,[],RT @RNCan: Notre collaboration avec les provinces et les territoires nous aidera à relever des défis environnementaux pressants #Croissance…,RT RNCan Notre collaboration avec les provinces et les territoires nous aidera relever des fis environnementaux pressants,['#Croissance'],Social,2,0.0,fr,environnementca_tweeter
151,926503263071096832,2017-11-03 17:36:06,"['https://t.co/eTSEnjdEgh', 'https://t.co/TswyttV1R5']","Aujourd’hui, dévoilement du 1er camion de livraison complètement électrique @LoblawsON https://t.co/eTSEnjdEgh (ang. seul.) https://t.co/TswyttV1R5",hui voilement du 1er camion de livraison tement lectrique LoblawsON https co eTSEnjdEgh ang seul https co TswyttV1R5,[],Social,2,0.0,fr,environnementca_tweeter
152,933440289636802560,2017-11-22 21:01:22,['https://t.co/sJ8D57pk'],RT @ACIA_Canada: Des mesures de #biosécurité adéquates sont un bon moyen de protéger les cultures en serre. https://t.co/sJ8D57pkD1 https:/…,RT Des mesures de quates sont un bon moyen de ger les cultures en serre https co sJ8D57pkD1 https,['#bios'],Social,2,0.0,fr,environnementca_tweeter
153,930495874681073665,2017-11-14 18:01:18,['https://t.co/yyJYtx2E4f'],#SVQ le #LacWinnipeg est le 6e plus grand lac au Canada et le 10e plus grand lac d’eau douce au monde? #MB https://t.co/yyJYtx2E4f,SVQ le LacWinnipeg est le 6e plus grand lac au Canada et le 10e plus grand lac eau douce au monde MB https co yyJYtx2E4f,"['#SVQ', '#LacWinnipeg', '#MB']",Environmental,2,0.5,fr,environnementca_tweeter
154,933050059226337280,2017-11-21 19:10:44,['https://t.co/03kPTrxxBJ'],"RT @RNCan: La ministre McKenna, de @environnementca, sur la #CroissancePropre : https://t.co/03kPTrxxBJ",RT RNCan ministre McKenna environnementca CroissancePropre https co 03kPTrxxBJ,['#CroissancePropre'],Economical,2,0.0,fr,environnementca_tweeter
155,930489151090315266,2017-11-14 17:34:35,"['https://t.co/BjuD6FisT3', 'https://t.co/WOY0ldRvkK']","Le 🇨🇦 met en œuvre sa stratégie contre les polluants climatiques de courte durée, lancée plus tôt cette année. https://t.co/BjuD6FisT3 #COP23 https://t.co/WOY0ldRvkK",Le met en uvre sa gie contre les polluants climatiques de courte plus cette https co BjuD6FisT3 COP23 https co WOY0ldRvkK,['#COP23'],Environmental,2,0.0,fr,environnementca_tweeter
156,933009768368795648,2017-11-21 16:30:37,['https://t.co/BDJ875fhif'],Bonne #JournéeMondialeDesPêches! Suivez nos amis du @MPO_DFO pour découvrir le travail du #GC! 🐟 🐠 🐡 🐳 https://t.co/BDJ875fhif,Bonne Suivez nos amis du pour couvrir le travail du GC https co BDJ875fhif,"['#Journ', '#GC']",Economical,2,0.0,fr,environnementca_tweeter
157,933005929703989251,2017-11-21 16:15:22,['https://t.co\xe2\x80\xa6'],"RT @RNCan: Le Programme de #CroissancePropre cofinance des projets avec les provinces et territoires, une première pour le #GC https://t.co…",RT RNCan Le Programme de CroissancePropre cofinance des projets avec les provinces et territoires une pour le GC https,"['#CroissancePropre', '#GC']",Economical,2,0.0,fr,environnementca_tweeter
158,933095170211438598,2017-11-21 22:09:59,[],RT @MPO_Pacifique: Bonne #JournéeMondialeDesPêches!  Consultez notre Guide de la pêche sportive de la C.-B. pour obtenez des renseignements…,RT Bonne Consultez notre Guide de la sportive de la pour obtenez des,['#Journ'],Economical,2,0.0,fr,environnementca_tweeter
159,933069091073609728,2017-11-21 20:26:21,[],RT @RNCan: Nous investissons 155 millions $ pour la #CroissancePropre. Faites une demande de financement au programme de Croissance Propre…,RT RNCan Nous investissons 155 millions pour la CroissancePropre Faites une demande de financement au programme de Croissance,['#CroissancePropre'],Economical,2,0.0,fr,environnementca_tweeter
160,936249503291707392,2017-11-30 15:04:10,['https://t.co/nYzYupyFt6'],Soyons toujours prudents et respectons la #faune! https://t.co/nYzYupyFt6,toujours prudents respectons faune https co nYzYupyFt6,['#faune'],Environmental,2,0.0,fr,environnementca_tweeter
161,936235435931643904,2017-11-30 14:08:16,[],"RT @ministre_ec: #SVQ la @CECweb travaille pour améliorer l’efficacité, la performance environnementale et la compétitivité du transport ma…",RT SVQ la CECweb travaille pour liorer la performance environnementale et la du transport,['#SVQ'],Economical,2,0.0,fr,environnementca_tweeter
162,936040111703252993,2017-11-30 01:12:08,['https://t.co/cfWc6b48jR'],RT @emplois_gc: Travaillez comme chercheur scientifique @environnementca à #Burlington. Postulez: https://t.co/cfWc6b48jR,RT Travaillez comme chercheur scientifique environnementca Burlington Postulez https co cfWc6b48jR,['#Burlington'],Economical,2,0.0,fr,environnementca_tweeter
163,929084199482650625,2017-11-10 20:31:49,[],"RT @ministre_ec: Merci aux scientifiques d’@environnementca qui appuient le climat, la météo, faune et nombreux autres domaines! #JournéeMo…",RT Merci aux scientifiques environnementca qui appuient le climat la faune et nombreux autres domaines,['#Journ'],Environmental,2,0.0,fr,environnementca_tweeter
164,927512468531892225,2017-11-06 12:26:19,['https://t.co/TOJScx8U\xe2\x80\xa6'],RT @ReseauFCM: Voyez comment votre #munican peut transformer les déchets en ressources dans notre webinaire gratuit : https://t.co/TOJScx8U…,RT ReseauFCM Voyez comment votre munican peut transformer les chets en ressources dans notre webinaire gratuit https co,['#munican'],Environmental,2,0.0,fr,environnementca_tweeter
165,935238222304686080,2017-11-27 20:05:42,[],RT @RNCan: À inscrire à votre agenda! Soyez des nôtres le 30 nov à 13 h HNE pour notre WebEx sur comment recevoir du financement avec le pr…,RT RNCan inscrire votre agenda Soyez des tres le 30 nov 13 HNE pour notre WebEx sur comment recevoir du financement avec le,[],Economical,2,0.0,fr,environnementca_tweeter
166,927512256887345152,2017-11-06 12:25:29,['https://t.\xe2\x80\xa6'],RT @ACIA_Canada: La vidéo «Quel est le lien?» vous influenzera à adopter des mesures de #biosécurité contre l'influenza aviaire. https://t.…,RT La Quel est le lien vous influenzera adopter des mesures de contre influenza aviaire https,['#bios'],Environmental,2,0.0,fr,environnementca_tweeter
167,933755086945292288,2017-11-23 17:52:15,[],"RT @ENERGYSTAR_CDN: Vous fêtez la #CoupeGrey en fin de semaine? Suivez ces astuces #écoénergétiques pour préserver l’environnement : 
https…",RT Vous la CoupeGrey en fin de semaine Suivez ces astuces tiques pour server environnement,"['#CoupeGrey', '#']",Economical,2,0.0,fr,environnementca_tweeter
168,931888756742909952,2017-11-18 14:16:07,[],"RT @GouvCanSante: .@SanteCanada est devenu @GouvCanSante. Nouveau nom, encore plus de contenu intéressant sur la santé! Suivez-nous pour re…",RT GouvCanSante SanteCanada est devenu GouvCanSante Nouveau nom encore plus de contenu ressant sur la Suivez nous pour,[],Environmental,2,0.0,fr,environnementca_tweeter
169,930080821364580353,2017-11-13 14:32:02,[],"RT @ministre_ec: Ministre McKenna est arrivée à la #COP23, une conférence de l’@ONU_fr sur les #ChangementsClimatiques présidée cette année…",RT Ministre McKenna est la COP23 une rence de sur les ChangementsClimatiques cette,"['#COP23', '#ChangementsClimatiques']",Environmental,2,0.0,fr,environnementca_tweeter
170,929074978426847233,2017-11-10 19:55:10,[],"RT @MPO_Science: C’est la #JournéeMondialedelaScience! 🌎Découvrez ce que nous faisons pour protéger nos océans, nos côtes &amp; la vie marine :…",RT est la eMondialedelaScience couvrez ce que nous faisons pour ger nos ans nos tes amp la vie marine,['#Journ'],Economical,2,0.0,fr,environnementca_tweeter
171,925711856798494722,2017-11-01 13:11:20,['https://t\xe2\x80\xa6'],"RT @Transports_gc: C’est l’anniversaire du #PlanDeProtectionDesOcéans du 🇨🇦, le plus gros investissement pour protéger #NosCôtes. https://t…",RT est anniversaire du ans du le plus gros investissement pour ger tes https,"['#PlanDeProtectionDesOc', '#NosC']",Economical,2,0.0,fr,environnementca_tweeter
172,933745723559919617,2017-11-23 17:15:03,"['https://t.co/eekWM7GcXK', 'https://t.co/KICgOcaWzS']",Joyeux 70e anniversaire au #ServiceCanadienDeLaFaune! 🎂 L’agence nationale de #faune du Canada depuis 1947. https://t.co/eekWM7GcXK https://t.co/KICgOcaWzS,Joyeux 70e anniversaire au ServiceCanadienDeLaFaune agence nationale de faune du Canada depuis 1947 https co eekWM7GcXK https co KICgOcaWzS,"['#ServiceCanadienDeLaFaune', '#faune']",Environmental,2,0.0,fr,environnementca_tweeter
173,930084167609737216,2017-11-13 14:45:20,['https://t.co/iWxsip\xe2\x80\xa6'],"RT @ministre_ec: La ministre McKenna a discuté d’#ActionClimat avec le président de @GRI_LSE, @lordstern1, à la #COP23. https://t.co/iWxsip…",RT La ministre McKenna ActionClimat avec le sident de lordstern1 la COP23 https co,"['#ActionClimat', '#COP23']",Environmental,2,0.0,fr,environnementca_tweeter
174,926178548511109120,2017-11-02 20:05:48,[],"RT @SPC_CA: #LSV Les #superordinateurs de SPC améliorent les efforts d’avertissement, d’intervention et de rétablissement en cas de temps v…",RT LSV Les superordinateurs de SPC liorent les efforts avertissement intervention et de tablissement en cas de temps,"['#LSV', '#superordinateurs']",Environmental,2,0.0,fr,environnementca_tweeter
175,926094233345318912,2017-11-02 14:30:45,"['https://t.co/tHODHgAZ67', 'https://t.co/ma5ywBKo2k']","Comment allons-nous réaliser #ODD7 : Énergie propre + coût abordable? Objectif 5 de #FSDS, plan #GC sur ODD #enviro: https://t.co/tHODHgAZ67 https://t.co/ma5ywBKo2k",Comment allons nous aliser ODD7 nergie propre abordable Objectif de FSDS plan GC sur ODD enviro https co tHODHgAZ67 https co ma5ywBKo2k,"['#ODD7', '#FSDS', '#GC', '#enviro']",Environmental,2,-0.16666666666666666,fr,environnementca_tweeter
176,925743044820897792,2017-11-01 15:15:16,['https://t.co/LtPDWpvvqH'],RT @emplois_gc: .@environnementca est à la recherche d'un technologue principal à #Whitehorse #Yukon - Postulez: https://t.co/LtPDWpvvqH,RT environnementca est la recherche un technologue principal Whitehorse Yukon Postulez https co LtPDWpvvqH,"['#Whitehorse', '#Yukon']",Economical,2,0.0,fr,environnementca_tweeter
177,933824982148362240,2017-11-23 22:30:00,"['https://t.co/9On3LkCick', 'https://t.co/Su9NUUxOWR']",La C.-B. et le Canada travaillent ensemble pour le rétablissement du #caribou. https://t.co/9On3LkCick https://t.co/Su9NUUxOWR,La et le Canada travaillent ensemble pour le tablissement du caribou https co 9On3LkCick https co Su9NUUxOWR,['#caribou'],Social,2,0.0,fr,environnementca_tweeter
178,933803635183706114,2017-11-23 21:05:10,"['https://t.co/671NxX3J3', 'https://t.co/0LHqDrAJlJ']",Faites participer vos enfants à l’#ActionClimatique à la maison! Visitez le site Web Climat Jeunes pour obtenir des idées : https://t.co/671NxX3J30 https://t.co/0LHqDrAJlJ,Faites participer vos enfants ActionClimatique la maison Visitez le site Web Climat Jeunes pour obtenir des es https co 671NxX3J30 https co 0LHqDrAJlJ,['#ActionClimatique'],Social,2,0.0,fr,environnementca_tweeter
179,929879157596712960,2017-11-13 01:10:42,['https://t.c\xe2\x80\xa6'],RT @ministre_ec: Journée de la santé à #COP23. Le Canada réduit les polluants climatiques de courte durée nocifs pour la santé. https://t.c…,RT de la COP23 Le Canada duit les polluants climatiques de courte nocifs pour la https,['#COP23'],Environmental,2,0.0,fr,environnementca_tweeter
180,933790398539018246,2017-11-23 20:12:34,[],Dre Anne Thompson de la @NASAGoddard discute de la surveillance de la #CoucheDozone — plus importante que jamais.,Dre Anne Thompson de la NASAGoddard discute de la surveillance de la CoucheDozone plus importante que jamais,['#CoucheDozone'],Economical,2,0.0,fr,environnementca_tweeter
181,929056750879297537,2017-11-10 18:42:45,"['https://t.co/Nm32o7NlEV', 'https://t.co/crPYscOnLk']",C'est la #JournéeMondialeDeLaScience! Découvrez les 38 projets scientifiques du Plan #StLaurent 2016-21. https://t.co/Nm32o7NlEV https://t.co/crPYscOnLk,est la eMondialeDeLaScience couvrez les 38 projets scientifiques du Plan StLaurent 2016 21 https co Nm32o7NlEV https co crPYscOnLk,"['#Journ', '#StLaurent']",Economical,2,0.0,fr,environnementca_tweeter
182,935611107791785985,2017-11-28 20:47:25,[],"RT @ministre_ec: Investir 155 M$ dans les secteurs de l’énergie, des mines et de la foresterie aidera encore davantage les entreprises du…",RT Investir 155 dans les secteurs de nergie des mines et de la foresterie aidera encore davantage les entreprises,[],Economical,2,0.0,fr,environnementca_tweeter
183,929550145687052290,2017-11-12 03:23:19,[],"RT @ministre_ec: Les participants du Canada à la #COP23 ont eu une 3e séance pour intervenants avec la négociatrice en chef, Catherine Stew…",RT Les participants du Canada la COP23 ont eu une 3e ance pour intervenants avec la gociatrice en chef Catherine,['#COP23'],Environmental,2,0.0,fr,environnementca_tweeter
184,931960403189551107,2017-11-18 19:00:49,['https://t.co/Aoba74lgVF'],Voici une étudiante canadienne inspirante qui élève l’#ActionClimatique à un autre niveau. #COP23 #JournéeInternationalesDesÉtudiants https://t.co/Aoba74lgVF,Voici une tudiante canadienne inspirante qui ActionClimatique un autre niveau COP23 tudiants https co Aoba74lgVF,"['#ActionClimatique', '#COP23', '#Journ']",Environmental,2,0.0,fr,environnementca_tweeter
185,929523360761032704,2017-11-12 01:36:53,['https://t.c\xe2\x80\xa6'],RT @ministre_ec: Journée des établissements humains [villes] à la #COP23. #SVQ le Canada élabore de nouveaux codes du bâtiment? https://t.c…,RT des tablissements humains villes la COP23 SVQ le Canada labore de nouveaux codes du timent https,"['#COP23', '#SVQ']",Environmental,2,0.0,fr,environnementca_tweeter
186,928571362163265536,2017-11-09 10:33:59,['https://t.co/yJybwssoKJ'],RT @CCNUCC: Alimentation et restauration à la #COP23: le #durable tous les jours au menu https://t.co/yJybwssoKJ #ActionClimat #Bonn #MiamM…,RT CCNUCC Alimentation et restauration la COP23 le durable tous les jours au menu https co yJybwssoKJ ActionClimat Bonn,"['#COP23', '#durable', '#ActionClimat', '#Bonn', '#MiamM']",Environmental,2,0.0,fr,environnementca_tweeter
187,930613862856056834,2017-11-15 01:50:09,['https://t.co/AzSvqxHLNX'],Échanger les perspectives sur les #genres et le savoir autochtone sur les #ChangementsClimatiques est crucial. #COP23 https://t.co/AzSvqxHLNX,changer les perspectives sur les genres et le savoir autochtone sur les ChangementsClimatiques est crucial COP23 https co AzSvqxHLNX,"['#genres', '#ChangementsClimatiques', '#COP23']",Environmental,2,0.0,fr,environnementca_tweeter
188,935550187183005697,2017-11-28 16:45:20,"['https://t.co/rDi4DCK7y', 'https://t.co/d3mwS80e']","Pour la journée « Mardi, je donne », pourquoi ne pas donner à la 🌎? La #FSDS du Canada offre des idées : https://t.co/rDi4DCK7y9  #Durabilité #GivingTuesdayCA https://t.co/d3mwS80eUu",Pour la Mardi je donne pourquoi ne pas donner la La FSDS du Canada offre des es https co rDi4DCK7y9 GivingTuesdayCA https co d3mwS80eUu,"['#FSDS', '#Durabilit', '#GivingTuesdayCA']",Social,2,0.0,fr,environnementca_tweeter
189,929826977879650304,2017-11-12 21:43:21,"['https://t.co/HIVJiMxi0R', 'https://t.co/0Q\xe2\x80\xa6']","RT @ministre_ec: Journée des forêts à #COP23. #SVQ les forêts éliminent le carbone de l’atmosphère?
https://t.co/HIVJiMxi0R https://t.co/0Q…",RT des COP23 SVQ les liminent le carbone de https co HIVJiMxi0R https co,"['#COP23', '#SVQ']",Environmental,2,0.0,fr,environnementca_tweeter
190,935202887067684865,2017-11-27 17:45:18,"['https://t.co/9S8Mo3sZNl', 'https://t.co/QlxoOMPJ9v']",Vous vous rendez au travail en voiture? Soyez prêt pour l’#hiver! Vérifiez la #météo. Planifiez votre trajet. Soyez #MétéoLogique! @Transports_gc https://t.co/9S8Mo3sZNl https://t.co/QlxoOMPJ9v,Vous vous rendez au travail en voiture Soyez pour hiver rifiez la Planifiez votre trajet Soyez oLogique https co 9S8Mo3sZNl https co QlxoOMPJ9v,"['#hiver', '#m', '#M']",Economical,2,0.0,fr,environnementca_tweeter
191,935238128864038912,2017-11-27 20:05:20,['https://t.co/t5H44ASNnz'],"RT @RNCan: Leader climatique, le 🇨🇦 est en position d’atteindre ses cibles de l’#AccordDeParis #RésultatsGC https://t.co/t5H44ASNnz",RT RNCan Leader climatique le est en position atteindre ses cibles de AccordDeParis sultatsGC https co t5H44ASNnz,"['#AccordDeParis', '#R']",Environmental,2,0.0,fr,environnementca_tweeter
192,929095543321743360,2017-11-10 21:16:53,[],RT @salledepresseGC: .@ministre_ec rencontre des étudiants de @Carleton_U pour parler de #ChangementsClimatiques à @StudentEnergy Jam. http…,RT salledepresseGC rencontre des tudiants de pour parler de ChangementsClimatiques StudentEnergy Jam,['#ChangementsClimatiques'],Social,2,0.0,fr,environnementca_tweeter
193,935949362534010882,2017-11-29 19:11:31,[],"RT @soistoimeme_ca: Hier le @PMCanadien a présenté ses excuses aux communautés LGBTQ2, afin que l'oppression et le mal commandités par l'Ét…",RT Hier le PMCanadien ses excuses aux LGBTQ2 afin que oppression et le mal par,[],Social,2,0.0,fr,environnementca_tweeter
194,929529783532294144,2017-11-12 02:02:24,[],"RT @ministre_ec: Journée des océans et zones côtières à la #COP23. #SVQ le Canada investit 1,5 G$ pour protéger nos océans et restaurer les…",RT des ans et zones res la COP23 SVQ le Canada investit pour ger nos ans et restaurer,"['#COP23', '#SVQ']",Economical,2,0.0,fr,environnementca_tweeter
