status_id,status_message,link_name,status_type,status_link,status_published,num_reactions,num_comments,num_shares,num_likes,num_loves,num_wows,num_hahas,num_sads,num_angrys,num_special
242079006274865_303411090141656,"During Women’s History Month, we had the opportunity to feature many women from all across the Coast Guard and highlight their incredible achievements. Check out our Women’s History Month in review – one month of pictures in one minute! Claim Your Place! Women in Canada",Women's History Month in review!,video,https://www.facebook.com/CanadianCoastGuard/videos/303411090141656/,2017-11-03 15:14:46,93,8,76,80,8,5,0,0,0,0
242079006274865_302257206923711,"The Coast Guard: Our history, our future! Incorporating a blend of both historical and modern photos and video, we are proud to serve Canadians.","Our History, Our Future",video,https://www.facebook.com/CanadianCoastGuard/videos/302257206923711/,2017-11-02 12:00:00,86,3,32,80,4,2,0,0,0,0
242079006274865_300916670391098,"Regional Superintendent Marine Division, Wade Stagg represented the Canadian Coast Guard’s Atlantic Region at the Navy League of Canada’s Annual Awards banquet in St. John’s, NL on October 21, 2017.  

During this event he met with Sea Cadet Chief Petty Officer 1st Class Madelyn Drover of RCSCC Fort Townshend, who is the 2016 Division Sea Cadet of the Year.",,photo,https://www.facebook.com/CanadianCoastGuard/photos/a.258864731262959.1073741828.242079006274865/300916543724444/?type=3,2017-11-01 08:40:00,46,3,13,43,3,0,0,0,0,0
242079006274865_302228086926623,"Christian Lamar of CCGS Samuel Risley inspects the results of a pumpkin carving contest aboard the ship. 
Happy Halloween!",,photo,https://www.facebook.com/CanadianCoastGuard/photos/a.258864731262959.1073741828.242079006274865/302227966926635/?type=3,2017-10-31 17:00:00,38,0,8,36,0,2,0,0,0,0
242079006274865_300910980391667,"Today marks the last day of women’s history month, and we are proud to have had the opportunity to feature so many of the amazing women who work for us and highlight their incredible achievements. 

We would like to finish off the month by showcasing a few more of the women who contribute to the important work of the Coast Guard. 

Claim Your Place! Women in Canada",Photos from Canadian Coast Guard's post,photo,https://www.facebook.com/CanadianCoastGuard/photos/a.258864731262959.1073741828.242079006274865/300910697058362/?type=3,2017-10-31 08:00:00,48,1,10,46,2,0,0,0,0,0
242079006274865_298606380622127,"We spoke with 300 First Nations students during an annual Aboriginal Youth Career Awareness. 

This year, the Chippewas of Kettle and Stony Point hosted the two-day event on the powwow grounds along the shores of Lake Huron at Kettle Point. 

We look forward to participating again next year!",Photos from Canadian Coast Guard's post,photo,https://www.facebook.com/CanadianCoastGuard/photos/a.258864731262959.1073741828.242079006274865/298605827288849/?type=3,2017-10-29 09:00:00,33,0,4,33,0,0,0,0,0,0
242079006274865_300933467056085,"Congratulations to our newest Marine Communications and Traffic Services (MCTS) graduates! 
 
MCTS Officers are incredibly vital to the Coast Guard, and to all Canadians. Their work saves lives and helps protect our environment. 
 
We are CCG Proud and wish you all the best!",Photos from Canadian Coast Guard's post,photo,https://www.facebook.com/CanadianCoastGuard/photos/a.258864731262959.1073741828.242079006274865/300932967056135/?type=3,2017-10-27 17:00:00,99,4,12,95,4,0,0,0,0,0
242079006274865_300949523721146,"Yesterday we were practicing environmental response with partners in British Columbia. Booms, skimmers, incident command posts.",,video,https://www.facebook.com/CanadianCoastGuard/videos/300949523721146/,2017-10-27 14:08:36,51,0,15,51,0,0,0,0,0,0
242079006274865_300930673723031,,Canada C3,video,https://www.facebook.com/CanadaC3/videos/438360289895477/,2017-10-27 12:48:59,10,0,0,9,1,0,0,0,0,0
242079006274865_300675507081881,"Today we were again on the water east of Salt Spring Island, British Columbia, with partners, participating in day two of a two-day major maritime exercise called “Exercise Salish Sea”. Our Canadian Coast Guard Ship Bartlett stood in for the ferry which was on scene yesterday. Partners practiced working together on marine environmental response techniques.

This two day exercise involved approximately 500 people from more than 20 government and non-governmental organizations – including local Indigenous peoples from several Coastal First Nations. A total of 15 vessels and four aircraft were employed. 

Big thanks to everyone who worked with us on both days! Canadian Armed Forces Transport and Infrastructure in Canada BCFerries BC Emergency Health Services, Emergency Management BC, BC Ministry of Environment, Royal Canadian Marine Search and Rescue U.S. Coast Guard Western Canada Marine Response Organization.",Photos from Canadian Coast Guard's post,photo,https://www.facebook.com/CanadianCoastGuard/photos/a.261340221015410.1073741829.242079006274865/300675350415230/?type=3,2017-10-26 19:45:17,84,2,26,84,0,0,0,0,0,0
242079006274865_300511523764946,Caitlin Powers is the Project Manager for CCG’s Helicopter team and has been a proud Coast Guard Employee for over 10 years! Check out her video to learn about some of her amazing experiences with the Coast Guard! Claim Your Place! Women in Canada,"Caitlin Powers, Project Manager for CCG's Helicopter Team",video,https://www.facebook.com/CanadianCoastGuard/videos/300511523764946/,2017-10-26 10:00:00,86,4,20,74,11,1,0,0,0,0
242079006274865_300322253783873,"Today we were on the water east of Salt Spring Island, British Columbia, with partners, participating in day one of a two-day major maritime incident training exercise called “Exercise Salish Sea”. This training exercise is the largest major exercise in Canadian Coast Guard history. Today’s scenario involved the evacuation of 100 ‘survivors’ from a participating BC Ferries’ vessel. Some were evacuated into vessels in the water, and some hoists of evacuees were simulated by our colleagues in the Canadian Armed Forces and US Coast Guard. 

Environmental Response will be the focus of tomorrow’s activities. Partners participating in Exercise Salish Sea include: Canadian Armed Forces, Canadian Coast Guard, Transport and Infrastructure in Canada, BC Ferries, BC Emergency Health Services, Emergency Management BC, BC Ministry of Environment, Royal Canadian Marine Search and Rescue, the U.S. Coast Guard and Western Canada Marine Response Organization, among a great many others. Special thanks today to the community on Salt Spring Island, where our ‘casualties’ were brought ashore.",Photos from Canadian Coast Guard's post,photo,https://www.facebook.com/CanadianCoastGuard/photos/a.261340221015410.1073741829.242079006274865/300322143783884/?type=3,2017-10-25 18:25:37,135,5,56,129,1,5,0,0,0,0
242079006274865_299946113821487,"The Canadian Coast Guard, together with the Canadian Armed Forces – Joint Task Force Pacific, Emergency Management BC, British Columbia Emergency Health Services, Public Safety Canada and BC Ferries, among other partners, will be leading a major maritime disaster exercise called “Exercise Salish Sea” east of Salt Spring Island, British Columbia on October 25 & 26. Tomorrow we will share highlights from Day 1, which will focus on the rescue of over 100 “survivors” from a BC Ferries’ vessel M/V Coastal Renaissance. A total of 15 vessels and four aircraft are being employed. BC Ferries Royal Canadian Marine Search & Rescue • Station 1 - West Vancouver Maritime Forces Pacific / Forces maritimes du Pacifique",Photos from Canadian Coast Guard's post,photo,https://www.facebook.com/CanadianCoastGuard/photos/a.258864731262959.1073741828.242079006274865/299945950488170/?type=3,2017-10-24 13:25:29,137,8,73,129,4,4,0,0,0,0
242079006274865_298580757291356,"Rigid Hull Inflatable Operator Training took place in Halifax, Nova Scotia last week. They paced alongside the CCGS Sir Wilfred Grenfell",Photos from Canadian Coast Guard's post,photo,https://www.facebook.com/CanadianCoastGuard/photos/a.258864731262959.1073741828.242079006274865/298580630624702/?type=3,2017-10-23 17:00:00,39,0,6,34,4,1,0,0,0,0
242079006274865_298300973986001,"Ahoy! An opportunistic meeting of two Coast Guard icebreakers in the Beaufort Sea in early October, facilitated the transfer of a hydrographer and some science samples from CCGS Sir Wilfrid Laurier to CCGS Louis S. St-Laurent. 

CCGS Sir Wilfrid Laurier had been conducting a mooring program, just prior to starting its journey south to its homeport in our Pacific Region.  CCGS Louis S. St-Laurent was finishing up a month-long science program in the Beaufort Sea before heading to Kugluktuk for a crew change and then sailing on to Milne Inlet for icebreaking operations in the Eastern Arctic before eventually heading to its homeport in our Atlantic Region. 

All missions accomplished; ships, personnel and science samples on their way to their final destinations! Bravo Zulu on a great #Arctic season. #CCG Proud.",Photos from Canadian Coast Guard's post,photo,https://www.facebook.com/CanadianCoastGuard/photos/a.258864731262959.1073741828.242079006274865/298300847319347/?type=3,2017-10-21 09:00:00,47,2,10,44,1,2,0,0,0,0
242079006274865_298300133986085,"On her annual voyage south from the Arctic, CCGS Sir Wilfrid Laurier and her crew encountered the ubiquitous weather, all-too common in the Bering Sea, especially in the month of October.

Not for the faint of heart, the seasoned sailors with the Coast Guard are up for the challenge! #CCGProud.",Photos from Canadian Coast Guard's post,photo,https://www.facebook.com/CanadianCoastGuard/photos/a.258864731262959.1073741828.242079006274865/298299707319461/?type=3,2017-10-20 06:00:00,60,1,6,56,3,1,0,0,0,0
242079006274865_298296670653098,"Rare visit by two Snowy Owl that stopped to hitch a ride aboard CCGS Sir Wilfrid Laurier, in the Chukchi Sea in the Arctic . One landed near the front and one landed near the back of the ship as it was making its way further North to a mooring recovery site at 75N 168W. Once the ship turned south, the pair flew off!",Photos from Canadian Coast Guard's post,photo,https://www.facebook.com/CanadianCoastGuard/photos/a.258864731262959.1073741828.242079006274865/298296603986438/?type=3,2017-10-19 15:22:17,119,4,12,110,4,5,0,0,0,0
242079006274865_297903747359057,"On this Persons Day, we would like to feature a very powerful woman in the Canadian Coast Guard, Assistant Commissioner Julie Gascon. Assistant Commissioner Gascon began her journey with us as a student at the Canadian Coast Guard College and is now the head of our Central & Arctic Region, which includes over 1,200 employees. She also regularly speaks at workshops designed to help empower women. Claim Your Place! Women in Canada","Assistant Commissioner of the Canadian Coast Guard, Julie Gascon",video,https://www.facebook.com/CanadianCoastGuard/videos/297903747359057/,2017-10-18 13:55:37,135,11,45,122,13,0,0,0,0,0
242079006274865_297184967430935,"The Oceans Protection Plan will strengthen the Coast Guard across our coasts, ensuring enhanced protection in Canadian waters.",,photo,https://www.facebook.com/CanadianCoastGuard/photos/a.258864731262959.1073741828.242079006274865/297184904097608/?type=3,2017-10-17 13:00:00,69,0,6,66,2,1,0,0,0,0
242079006274865_296136780869087,"Did you know that in 2015, Jody Thomas became the first ever female Commissioner with the Canadian Coast Guard and held the position until early 2017? Claim your place! Women in Canada",,photo,https://www.facebook.com/CanadianCoastGuard/photos/a.258864731262959.1073741828.242079006274865/296136640869101/?type=3,2017-10-16 08:00:00,84,0,6,72,12,0,0,0,0,0
242079006274865_296078744208224,"Dr. Viola Davidson conducted the research for her M.Sc. and Ph.D. degrees on marine phytoplankton at the St. Andrews Biological Station from 1924-1932 as a volunteer investigator. At this time it was unusual for a woman to do graduate studies in marine science. Her later volunteer work (1947-48) was on salmon and eel movement at the Grand Lake rearing ponds at Wellington Station, Nova Scotia. Dr. Davidson was also a teacher at Central High School of Commerce in Toronto through the 1920s-1940s. She was a passionate and dedicated marine scientist. http://ow.ly/NVQt30fAgHI",Photos from Canadian Coast Guard's post,photo,https://www.facebook.com/CanadianCoastGuard/photos/a.258864731262959.1073741828.242079006274865/296078407541591/?type=3,2017-10-14 10:00:00,20,0,2,18,2,0,0,0,0,0
242079006274865_296077334208365,"FBF. On September 21, 2017, our Assistant Commissioner for the Central and Arctic Region, Julie Gascon, participated in the launch of the new, progressive Canada-EU Trade Agreement held at the Port of Montreal. Part of Coast Guard’s mandate is to ensure safe and efficient navigation of international merchant ships in Canada. As the new agreement is expected to result in increased ship traffic in the coming years, demand for Canadian Coast Guard services is also expected to increase.  Canada’s International Trade - Global Affairs Canada Find out about the Agreement here: http://ow.ly/vUMG30fR4A1",,photo,https://www.facebook.com/CanadianCoastGuard/photos/a.258864731262959.1073741828.242079006274865/296077207541711/?type=3,2017-10-13 09:23:02,23,0,0,22,1,0,0,0,0,0
242079006274865_295120214304077,"Meet René Hachey, 4th year Officer Cadet in our College’s Engineering Program. Women in Canada",,video,https://www.facebook.com/CanadianCoastGuard/videos/295119734304125/,2017-10-12 08:00:00,42,0,15,40,2,0,0,0,0,0
242079006274865_295385674277531,,Public Services and Procurement Canada,link,http://ow.ly/DWHP30fMguY,2017-10-11 08:15:14,27,0,0,26,0,1,0,0,0,0
242079006274865_295086010974164,"The CCGS Sir Wilfrid Laurier crew recently recovered science moorings in rough seas in the western Arctic. Besides Coast Guard work (icebreaking, escorts, aids to navigation, community visits etc.), the ship supports several collaborative partnerships during its annual Arctic operations. Time in the North is maximized with this important scientific research just prior to the ship starting its return trip south, to its homeport in Victoria, BC.",Photos from Canadian Coast Guard's post,photo,https://www.facebook.com/CanadianCoastGuard/photos/a.258864731262959.1073741828.242079006274865/295085774307521/?type=3,2017-10-11 08:00:00,56,4,16,52,3,1,0,0,0,0
242079006274865_295085360974229,"The the CCGS Amundsen is returning home (Quebec City) on October 12, after having supported the 2nd edition of the Inuit Health Survey, in Nunavik, conducted by the Institut national de santé publique du Québec. It also enabled the BriGHT (Bridging Global Change, Inuit Health and Transforming Arctic Ocean) project of the Northern Sentinel Strategy, developed at Université Laval. It was its 13th scientific expendition in the Arctic.

To find out more: http://www.marinfo.gc.ca/en/Flotte/Amundsen.asp",Canadian Coast Guard - Central and Arctic Region (Marinfo) - Canadian Coast Guard Fleet - CCGS Amundsen,link,http://www.marinfo.gc.ca/en/Flotte/Amundsen.asp,2017-10-10 15:00:00,29,1,2,28,1,0,0,0,0,0
242079006274865_295125464303552,"We’re holding information sessions in multiple Arctic communities to ask college students how we can best spread the word about our recruitment efforts for the new Inshore Rescue Boat stations! Interested student can attend information sessions
Come find out more about the hiring process and requirements, and to provide your feedback. See photos for more information.  Please note: dates and times are subject to change.

ᑐᓴᐅᒪᑎᑦᑎᓂᐊᕋᑦᑕ ᓄᓇᓕᓂ ᐅᑭᐅᕐᑕᕐᑐᒥ ᐊᐱᕆᓂᐊᕐᕋᑎᒍ ᓯᓚᑐᓴᕐᕕᒃᒥᑐ ᐃᓕᓂᐊᕐᑐᑦ ᖃᓄᕐ ᖃᐅᔨᒪᑎᑎᒐᔭᕐᒪᖔᑦᑕ ᐃᖃᓇᐃᔭᕈᒪᔪᓂ ᕿᓂᕐᑎᓪᓗᑕ ᓄᑖᖑᔪᒧ ᓯᒃᔭᖓᓂ ᐸᕐᓴᐃᓂᕐᒧᑦ ᐅᒥᐊᑯᑦ ᓴᕿᑦᑐᖃᕐᓂᐊᕐᒪᑦ ᐃᓂᖃᕐᑎᑕᐅᓗᓂ! ᐃᓕᓂᐊᕐᑐᑦ ᐱᔪᒪᓂ ᐅᐸᖃᑕᐅᔪᓐᓇᕐᑐᑦ ᐅᑯᓇᓂ ᓄᓇᓕᒃᓂ. ᑕᑯᔭᕐᑐᕐᓂᐊᕐᐳᑎᑦ ᖃᐅᔨᔭᕐᑐᕐᓗᑎ ᐃᖃᓇᐃᔭᕈᒪᔪᑦ ᖃᓄᐃᓕᐅᕆᐊᖃᕐᒪᖔᑕ, ᐊᒻᒪᓗ ᐅᖃᐅᓯᓴᖃᕈᕕᑦ ᑐᓴᕈᒪᔪᒍ. ᐊᔾᔨᖑᓪᓗ ᑕᑯᓗᑦ ᑐᑭᓯᓂᐊᕐᕋᕕᑦᑦ. ᖃᐅᔨᒪᓗᑎ ᐅᓪᓗᖏᑦ ᐃᑲᕋᓪᓗ ᐊᓯᓪᓕᑐᐃᓐᓇᕆᐊᓖᑦ",Photos from Canadian Coast Guard's post,photo,https://www.facebook.com/CanadianCoastGuard/photos/a.258864731262959.1073741828.242079006274865/295125234303575/?type=3,2017-10-10 15:00:00,14,0,5,14,0,0,0,0,0,0
242079006274865_295066937642738,"On September 14, 2017, a delegation of 43 distinguished visitors from 19 countries toured CCGS Henry Larsen in Resolute Bay, Nunavut, while the icebreaker stopped there for a scheduled crew change. Most of the international visitors represented the NATO Parliamentary Assembly. Led by the Department of National Defence, this northern tour provided delegates with an opportunity to study and discuss Arctic issues related to climate change, international relations, security and cooperation.",,photo,https://www.facebook.com/CanadianCoastGuard/photos/a.258864731262959.1073741828.242079006274865/295067354309363/?type=3,2017-10-10 13:00:00,25,0,5,24,0,1,0,0,0,0
242079006274865_293725011110264,"The Arctic is getting an Inshore Rescue Boat station, and we’re hiring locally to staff it! Information sessions are being held. 
Come find out more about the hiring process and requirements, and to provide your feedback. See photos for more information. Please note: dates and times are subject to change.",Photos from Canadian Coast Guard's post,photo,https://www.facebook.com/CanadianCoastGuard/photos/a.258864731262959.1073741828.242079006274865/293724904443608/?type=3,2017-10-09 08:00:00,40,3,35,40,0,0,0,0,0,0
242079006274865_291305641352201,"During a search and rescue exercise in Hamilton, Ontario @CanadianForces SAR technicians successfully dropped a pack to the CCGS Cape Lambton from over 300 metres! For more info about search and rescue visit: http://ow.ly/oXYZ30fsWVk",Photos from Canadian Coast Guard's post,photo,https://www.facebook.com/CanadianCoastGuard/photos/a.258864731262959.1073741828.242079006274865/291305498018882/?type=3,2017-10-07 10:00:00,31,0,5,31,0,0,0,0,0,0
242079006274865_293769354439163,"CCGS Des Groseilliers returns to Quebec City tomorrow after its annual Arctic mission. During its expedition, supplies were provided to the Eureka weather station on Ellesmere Island. The vessel also escorted the cruise ship Le Boréal through the ice.
To find out more about the icebreaker: ow.ly/fsFV30fHIZ0",Timeline Photos,photo,https://www.facebook.com/CanadianCoastGuard/photos/a.258864731262959.1073741828.242079006274865/293769354439163/?type=3,2017-10-06 17:08:27,34,0,4,34,0,0,0,0,0,0
242079006274865_291305224685576,Long weekend ahead. We are working 24/7 to serve Canadians and mariners. Stay Safe! http://ow.ly/SR4V30fuI0F,,photo,https://www.facebook.com/CanadianCoastGuard/photos/a.258864731262959.1073741828.242079006274865/291305128018919/?type=3,2017-10-06 08:00:00,41,0,9,40,1,0,0,0,0,0
242079006274865_293095967839835,"Icebreakers which have spent the summer in the Arctic are beginning to return to their home ports. Tomorrow, watch the arrival of the first one, the CCGS Pierre Radisson, back in Quebec City after a trip to Iceland. As part of this expedition, the Canadian Coast Guard participated in the Arctic Coast Guard Forum. 

The live exercise allowed the Canadian Coast Guard to demonstrate its world-leading abilities in search and rescue operations in partnership with the other seven countries participating. 

Learn more about the Forum: ow.ly/VJDW30fDV7b",,photo,https://www.facebook.com/CanadianCoastGuard/photos/a.258864731262959.1073741828.242079006274865/293095771173188/?type=3,2017-10-04 14:00:57,63,1,20,60,3,0,0,0,0,0
242079006274865_293006371182128,This video from the Coast Guard features an inclusive rescue technique that makes it easier for smaller-statured people to rescue people of all sizes. This method is helping to eliminate gender and other diversity barriers for Coast Guard members. Claim your place! Women in Canada,,video,https://www.facebook.com/CanadianCoastGuard/videos/293006371182128/,2017-10-04 08:29:58,49,1,12,46,3,0,0,0,0,0
242079006274865_291304728018959,"The Jerseyman Island Light on Isle Madame, in Cape Breton NS, has been completely replaced by a brand new structure. The new structure and new light will require very little maintenance for more than 25 years.",Photos from Canadian Coast Guard's post,photo,https://www.facebook.com/CanadianCoastGuard/photos/a.258864731262959.1073741828.242079006274865/291304624685636/?type=3,2017-10-03 11:00:00,45,3,24,43,0,2,0,0,0,0
242079006274865_291304204685678,"Ann Harvey (1811-1860). Born in Isle aux Morts, Newfoundland, the daughter of a fisherman and the eldest of eight children she often spent time helping her father. While fishing in July 1828, they noticed debris floating in the water, and realized that there was a shipwreck nearby. Ann Harvey, her father, twelve year old brother, and the family dog went out in their boat to locate the wreck, and found a large group of survivors on a tiny island. The family managed to save more than 160 people, and the rescue became famous across province. Ann Harvey became known as the Grace Darling of Newfoundland (from an English woman who participated in a similar rescue). http://ow.ly/Kbt630dblWW",Vessel - CCG Fleet,link,http://ow.ly/Kbt630dblWW,2017-10-02 08:00:01,33,2,6,28,1,4,0,0,0,0
242079006274865_288776568271775,October is Women’s History Month! Stay tuned all month as we celebrate the achievements of women in the Canadian Coast Guard. Women in Canada,,photo,https://www.facebook.com/CanadianCoastGuard/photos/a.258864731262959.1073741828.242079006274865/288776644938434/?type=3,2017-10-01 08:00:00,15,1,4,14,1,0,0,0,0,0
242079006274865_292378391244926,"CCGS GC-03 returns to Quebec harbour after its day of operations on the St. Lawrence River. This small vessel, designed for hydrographic surveys and channel surveys, is used to monitor the depth of water in the St. Lawrence Seaway between Sault-au-Cochon and Montreal. Its work contributes to the safety of navigation. Like the Morillon and the CCGS F.C.G. Smith, CCGS GC-03 is in operation annually during the spring thaw to the end of November. http://ow.ly/XZze30flRoH",,video,https://www.facebook.com/CanadianCoastGuard/videos/292378144578284/,2017-10-02 11:02:20,29,0,4,29,0,0,0,0,0,0
242079006274865_291194231363342,Canadians wear orange to raise awareness of the tragic legacy of Residential Schools.,Photos from Canadian Coast Guard's post,photo,https://www.facebook.com/CanadianCoastGuard/photos/a.258864731262959.1073741828.242079006274865/291193831363382/?type=3,2017-09-29 11:30:00,36,0,5,32,4,0,0,0,0,0
242079006274865_290896771393088,"CCGS Limnos docked at the Coast Guard base in Parry Sound, Ontario earlier this month. Thanks to the Helicopter Operations Group for sharing these great photos with us!
Pictured from left are CCGS Constable Carrière, CCGS Samuel Risley, CCGS Limnos and CCGS Cove Isle.",,photo,https://www.facebook.com/CanadianCoastGuard/photos/a.258864731262959.1073741828.242079006274865/290896604726438/?type=3,2017-09-28 13:50:34,50,5,14,49,0,1,0,0,0,0
242079006274865_288774231605342,"Today is World Maritime Day! The theme this year set by the United Nations is Connecting Ships, Ports and People. http://www.un.org/en/events/maritimeday/index.shtml",,photo,https://www.facebook.com/CanadianCoastGuard/photos/a.258864731262959.1073741828.242079006274865/288774144938684/?type=3,2017-09-28 07:00:00,48,1,3,47,1,0,0,0,0,0
242079006274865_290560134760085,Looking to for a career change? We recognize your skills! Visit us at our booth tomorrow!,,status,,2017-09-27 11:41:32,12,0,0,12,0,0,0,0,0,0
242079006274865_290534718095960,"In 1997, a team of hydrographers conducted survey work of Allen Bay, aboard CCGS Henry Larsen. They left a time capsule, ashore, beside one of the benchmarks that they used during the survey. It contained a full crew list and a list of the names of the hydrographic team. Byron Briggs, the current Commanding Officer of CCGS Henry Larsen, was part of that 1997 crew list as the Second Officer. The time capsule was later discovered in 2016 by the Bulford family that was hiking in the area. They contacted the Coast Guard shortly after the discovery, to share news of their find. 

In 2017, the Bulfords will complete the last year of deployment in Resolute Bay and wondered if CCGS Henry Larsen was going to be in the area this summer, and if the ship’s crew wanted to see the time capsule before returning it safely to where it was found before winter set in. A crew change in mid-September of 2017 enabled Captain Briggs to return to the ship, in Resolute Bay, in time to welcome all five Bulford family members onboard the icebreaker.  The time capsule was updated with a 2017 ship’s crew list and a list of CHS hydrographers. The Bulfords also included the story of how/when they found it. Who knows when it will be “rediscovered” or by who? 

Photo caption: A photographic keepsake of a great visit aboard CCGS Henry Larsen. Captain Byron Briggs and the Bulford family. In purple, young Lily is seen holding the time capsule she discovered in 2016.",,photo,https://www.facebook.com/CanadianCoastGuard/photos/a.258864731262959.1073741828.242079006274865/290534614762637/?type=3,2017-09-27 09:48:38,85,7,12,76,5,4,0,0,0,0
