status_id,status_message,link_name,status_type,status_link,status_published,num_reactions,num_comments,num_shares,num_likes,num_loves,num_wows,num_hahas,num_sads,num_angrys,num_special
242079006274865_313195612496537,"Bravo Zulu to the 2017 recipients of the Canadian Coast Guard Exemplary Service Medal in Fredericton, New Brunswick. 

This honour recognizes employees who have completed at least 20 years of service with the Canadian Coast Guard, and have spent 10 of these years working in a position that involves potential risk. These brave and dedicated employees have demonstrated exemplary service through their industrious attitudes, effective work ethics and admirable conduct throughout their careers.",,photo,https://www.facebook.com/CanadianCoastGuard/photos/a.258864731262959.1073741828.242079006274865/313195485829883/?type=3,2017-11-28 16:30:00,84,9,9,80,2,2,0,0,0,0
242079006274865_313101322505966,"We are currently doing the fall markup on the St. Lawrence River. We remove summer buoys and replace some with winter buoys. Since buoys are installed at the safe limits of the channels the marking is a risky operation. It is necessary to maneuver the ship in all kinds of conditions, while considering the risks incurred by the crew. Especially when the bridge is iced, water is dripping from the buoys and the ship is moving, the safety of the crew must remain a priority.",Photos from Canadian Coast Guard's post,photo,https://www.facebook.com/CanadianCoastGuard/photos/a.258864731262959.1073741828.242079006274865/313100172506081/?type=3,2017-11-28 10:50:42,91,3,18,86,4,1,0,0,0,0
242079006274865_311593739323391,"Congratulations to Frédérick-Sébastien Doucet, seaman on the CCGS Pierre-Radisson! The Quebec government awarded him the medal of good citizenship for an act of bravery during a rescue in -30° C weather on the St. Lawrence River, in February 2015.",,photo,https://www.facebook.com/CanadianCoastGuard/photos/a.258864731262959.1073741828.242079006274865/311593655990066/?type=3,2017-11-27 10:00:01,58,2,6,57,1,0,0,0,0,0
242079006274865_308879556261476,One of the four cornerstones of the Oceans Protection Plan is to foster reconciliation with Indigenous peoples. We want to strengthen our partnerships by working closely with them and the coastal communities particularly for local marine emergency response. To learn more about this: http://ow.ly/r3al30gEz5h,,photo,https://www.facebook.com/CanadianCoastGuard/photos/a.258864731262959.1073741828.242079006274865/308879499594815/?type=3,2017-11-26 13:00:00,24,0,5,23,1,0,0,0,0,0
242079006274865_312037492612349,Are you in Ottawa for the Grey Cup? Don’t forget to stop by The Family Fun Zone at Lansdowne Park and visit us! We’re here until 7pm!,,photo,https://www.facebook.com/CanadianCoastGuard/photos/a.261340221015410.1073741829.242079006274865/312037402612358/?type=3,2017-11-25 14:03:04,87,4,3,83,4,0,0,0,0,0
242079006274865_308852586264173,"In Newfoundland and Labrador the Canadian Coast Guard has 21 light stations with solar charging arrays and battery banks. Two of these stations have hybrid systems that use both wind and solar charging. The hybrid systems are located at Green Island in Fortune Bay and Puffin Island in Bonavista Bay.

A fully operational hybrid system, at a staffed light station, can save approximately 25,000 litres of fuel per year. By using the power of the sun and the wind, we can save from 4,000 to 8,000 litres of fuel annually at each site because fewer helicopter and vessel visits are required.

The Government of Canada is committed to a clean environment and reduced carbon pollution. By utilizing greener power sources, we can help reduce Canada’s carbon footprint.","Green Island, Fortune Bay, Newfoundland and Labrador",video,https://www.facebook.com/CanadianCoastGuard/videos/308852586264173/,2017-11-24 13:00:00,34,0,10,32,1,1,0,0,0,0
242079006274865_308847852931313,Then & now! For Evolution Day - check out the evolution of Canadian Coast Guard vessels over the years!,Photos from Canadian Coast Guard's post,photo,https://www.facebook.com/CanadianCoastGuard/photos/a.258864731262959.1073741828.242079006274865/308847632931335/?type=3,2017-11-24 09:00:00,50,0,5,49,1,0,0,0,0,0
242079006274865_311372376012194,We were thrilled to have Rick Mercer join our crew off the coast of British Columbia where he challenged himself to be a Canadian Coast Guard member for the day!,Rick Mercer Report,photo,https://www.facebook.com/rickmercerreport/photos/a.10155051046682196.1073741953.28103132195/10155051047032196/?type=3,2017-11-23 19:29:19,98,2,0,91,6,1,0,0,0,0
242079006274865_311343066015125,"Last month we participated in “Exercise Salish Sea,” which was the largest largest major incident exercise in Canadian Coast Guard history! The two-day major maritime incident training exercise took place east of Salt Spring Island, British Columbia. Day one focused on search and rescue and involved the evacuation of 100 survivors from a BC Ferry. Canadian Armed Forces Transport and Infrastructure in Canada BC Ferries Royal Canadian Marine Search and Rescue U.S. Coast Guard",Exercise Salish Sea,video,https://www.facebook.com/CanadianCoastGuard/videos/311343066015125/,2017-11-23 17:12:58,163,17,153,157,4,2,0,0,0,0
242079006274865_308799932936105,Come visit us Thursday from 4pm to 7pm and Friday-Saturday from11am-7pm at the Family Fun Zone for the 105th Grey Cup Festival in Ottawa at Lansdowne Park! http://ow.ly/x6vq30guH5w,Family Fun Zone Presented by Canada 150 - 105th Grey Cup Festival Website,link,http://ow.ly/x6vq30guH5w,2017-11-22 10:00:01,7,0,0,6,1,0,0,0,0,0
242079006274865_308789832937115,"Our MCI team has begun work to rebuild the Swift Point Lighthouse in Saint John, New Brunswick. A new foundation has been poured and a path has been cleared to make way for the installation of the new structure.",Photos from Canadian Coast Guard's post,photo,https://www.facebook.com/CanadianCoastGuard/photos/a.258864731262959.1073741828.242079006274865/308787489604016/?type=3,2017-11-20 18:00:00,18,0,3,17,0,1,0,0,0,0
242079006274865_310169329465832,"Today is Navy and Coast Guard Day! On this day, we recognize the important work performed by Canada’s sailors and celebrate Canada as a maritime nation. Three of our Coast Guard colleagues are being recognized for their contributions to maritime safety and security.

Greg Lick is being recognized for his long-standing career achievements and dedicated service to the Coast Guard. Greg joined the CCG in 1985 as an Engineering Officer Cadet at the Canadian Coast Guard College and is now Director General of Ops of the CCG in the NCR! 

Pamela McLaren, an environmental response specialist in the Central and Artic Region, is being recognized for her work during refloat, recovery and spill response missions in the Arctic and Great Lakes. 

Bruce Marsh is being recognized for his consistent demonstration of outstanding leadership in providing Officer Cadets with an exceptional role model. He continually strives to improve Cadets’ Coast Guard College experience by being a coach and mentor. 

Bravo Zulu to all! 

The Navy League of Canada La Ligue navale du Canada",Photos from Canadian Coast Guard's post,photo,https://www.facebook.com/CanadianCoastGuard/photos/a.258864731262959.1073741828.242079006274865/310168939465871/?type=3,2017-11-20 17:18:43,184,26,31,173,9,2,0,0,0,0
242079006274865_305919996557432,"Our ability to ensure the safety of marine traffic would be nearly impossible without our helicopters. 

Roughly 7 million Canadians live in coastal areas, where many people in smaller communities depend of the oceans' resources and tourism to make a living. In order to protect and serve these Canadians, the Coast Guard must rely on its air transportation services to respond to the challenges of this rugged and harsh environment. Learn more: ow.ly/LwwH30groJe",Photos from Canadian Coast Guard's post,photo,https://www.facebook.com/CanadianCoastGuard/photos/a.258864731262959.1073741828.242079006274865/305919819890783/?type=3,2017-11-19 15:00:00,76,4,13,72,4,0,0,0,0,0
242079006274865_305917559891009,"Did you know, our Marine Communications & Traffic Services ensures reliable 24/7 communication, contributing to the safety of life at sea.

Marine Communications and Traffic Services provide distress and safety call monitoring and coordinate responses, broadcast maritime safety information (weather and navigational warnings), screen vessels entering canadian waters, deliver information and advice to regulate marine traffic movement, and take appropriate action to ensure the safe and efficient movement of vessels in Canadian waters. ow.ly/8g1230gq17a
Library and Archives Canada",Photos from Canadian Coast Guard's post,photo,https://www.facebook.com/CanadianCoastGuard/photos/a.258864731262959.1073741828.242079006274865/305917339891031/?type=3,2017-11-18 12:00:00,68,4,14,64,4,0,0,0,0,0
242079006274865_305974303218668,"Fun Fact Friday:
We are proud to have 114 ships, 23 helos, & 4,500 members working 24/7 to protect & secure the largest coastline in the world.

We are the leading maritime authority in the country, operating 24/7 in some of the most challenging conditions on the earth to provide services that are critical to safety, security and economic growth.",We Are The Canadian Coast Guard,video,https://www.facebook.com/CanadianCoastGuard/videos/305974303218668/,2017-11-17 09:00:00,139,13,159,132,7,0,0,0,0,0
242079006274865_308458886303543,"In collaboration with Transport and Infrastructure in Canada, the Canadian Coast Guard holds bi-annual sessions with key #Arctic stakeholders. These conferences are opportunities for representatives from different levels of government, federal departments, Inuit communities, industry, civil society and academia to exchange information on a wide range of topics relative to marine-related affairs in the Arctic, voice concerns and share perspectives. The “Fall 2017 Arctic Week” meetings were held in Iqaluit, Nunavut, from November 14-16. The number of participants varies from 80 – 150 depending on location. The next bi-annual meeting will take place in May 2018 in Montreal. #OurCoasts",,photo,https://www.facebook.com/CanadianCoastGuard/photos/a.258864731262959.1073741828.242079006274865/308458692970229/?type=3,2017-11-16 16:10:19,7,0,0,7,0,0,0,0,0,0
242079006274865_308443736305058,"“It’s cool being here, I’m really glad we got the opportunity,” said Nunavut Fisheries and Marine Training Consortium student Aningmiuq. “I can see myself working on a boat like this.” 

We are Coast Guard Proud!",NunatsiaqOnline 2017-11-16: NEWS: Down to the sea in ships: Nunavut trainees learn about maritime jobs,link,http://www.nunatsiaqonline.ca/stories/article/65674down_to_the_sea_in_ships_nunavut_trainees_learn_about_maritime_jobs/,2017-11-16 15:06:05,27,1,5,26,1,0,0,0,0,0
242079006274865_308328909649874,Join the Coast Guard! The Coast Guard is hiring. Be part of our team and live a life less ordinary! Apply now: ow.ly/bucb30gCsYE,,photo,https://www.facebook.com/CanadianCoastGuard/photos/a.258864731262959.1073741828.242079006274865/308328482983250/?type=3,2017-11-16 09:30:00,33,8,20,31,2,0,0,0,0,0
242079006274865_305906323225466,"We’re recruiting! Are you a reservist seeking a challenging and rewarding civilian career change? 

Find out how you can join our team ashore or aboard a Canadian Coast Guard ship:  ow.ly/pLcb30gpXGY",Photos from Canadian Coast Guard's post,photo,https://www.facebook.com/CanadianCoastGuard/photos/a.258864731262959.1073741828.242079006274865/305906006558831/?type=3,2017-11-15 13:00:00,39,1,14,38,0,1,0,0,0,0
242079006274865_307652663050832,"After a mandatory safety briefing, on the ground in Iqaluit, #Arctic, Canadian Coast Guard Helicopter 442 , transported a second group of 11 students and two staff from the Nunavut Fisheries and Marine Training Consortium, #NFMTC, to ship from shore, to participate in a day at sea, aboard CCGS Henry Larsen in Frobisher Bay, on Friday, November 10.
 
Following a schedule similar to the one executed earlier in the week, all NFMTC participants were once again engaged by the proud crew in shipboard operations, hands-on training, introduction to engine room machinery and discussions about life on board the ship. This full day of training also included an opportunity for crew to share a meal with the eager students and staff. Of note, CCGS Henry Larsen’s 1ST Engineer Dan White not only eagerly explained the duties of an engine room officer on watch to the students but also celebrated 35 years of service with Coast Guard that very same day!
 
Captain Peter Richards, NFMTC, expressed in a note to Captain MacDonald afterwards, that the entire class was extremely pleased with the day onboard the ship. He said that the crew did a fantastic job showing the workings of the ship, were informative, engaging and very keen to share their knowledge and experiences. Citing this as an immense learning opportunity, Captain Richards feels this will give the students other career options when considering a future in the marine industry. Bravo Zulu CCGS Henry Larsen! #CCGProud!",Photos from Canadian Coast Guard's post,photo,https://www.facebook.com/CanadianCoastGuard/photos/a.258864731262959.1073741828.242079006274865/307652526384179/?type=3,2017-11-15 09:00:00,17,0,2,17,0,0,0,0,0,0
242079006274865_307652229717542,"Weeks of planning paid off for the Nunavut Fisheries and Marine Training Consortium, NFMTC, in Iqaluit and the Canadian Coast Guard. Starting with a visit to the NFMTC college by CCGS Henry Larsen’s Commanding Officer Neil MacDonald, it was followed up by two days of shipboard training and information sharing. 
 
On Wednesday, November 8th, the NFMTC Bridge Watch Rating class was enthusiastically welcomed aboard CCGS Henry Larsen by Captain MacDonald and his crew. A total of 14 students and staff were divided into three groups and sent to various work stations onboard the icebreaker. They learned about anchoring operations and how a windlass works. They were briefed on launching lifeboats during rescue operations; and about the safe operation of deck machinery including mooring and towing winches. As well, they learned how to steer a large vessel while underway as they pulled up the anchor and sailed in Frobisher Bay for a few hours. The enthusiastic and supportive crew were also able to describe shipboard life and share their experiences working with the Coast Guard. 
 
Captain Phil Hillier, NFMTC, noted that for many students, being on board a vessel of this size was a first for most and that being able not only see how the ship operates but also to actually have hands-on experience was very important in supplementing what is taught at the marine college. Captain Hillier was confident that this experience will motivate the students to want to further a career in the marine industry.",Photos from Canadian Coast Guard's post,photo,https://www.facebook.com/CanadianCoastGuard/photos/a.258864731262959.1073741828.242079006274865/307651843050914/?type=3,2017-11-14 18:00:00,23,0,12,23,0,0,0,0,0,0
242079006274865_305903926559039,"We welcome home the CCGS Hudson to the Bedford Institute of Oceanography in Dartmouth, Nova Scotia.",Photos from Canadian Coast Guard's post,photo,https://www.facebook.com/CanadianCoastGuard/photos/a.258864731262959.1073741828.242079006274865/307545989728166/?type=3,2017-11-14 10:30:00,65,2,17,58,6,1,0,0,0,0
242079006274865_307539679728797,,Canadian Coast Guard's cover photo,photo,https://www.facebook.com/CanadianCoastGuard/photos/a.258074648008634.1073741827.242079006274865/258074598008639/?type=3,2017-11-14 10:08:47,29,1,0,26,3,0,0,0,0,0
242079006274865_305901586559273,Do you have what you need to apply to the Canadian Coast Guard College? See if you are eligible: ow.ly/TKHn302Y4JO,Photos from Canadian Coast Guard's post,photo,https://www.facebook.com/CanadianCoastGuard/photos/a.258864731262959.1073741828.242079006274865/305901386559293/?type=3,2017-11-14 09:00:02,38,2,24,37,0,0,0,0,1,0
242079006274865_305896289893136,"We proudly participated with partners from Demark, Finland, Iceland, Norway, Russia, Sweden and the USA during the Arctic Coast Guard Forum held in September 2017 in Iceland.  Watch highlights of the 3-day Arctic Guardian exercise:",Arctic Guardian,video,https://www.facebook.com/CanadianCoastGuard/videos/305896289893136/,2017-11-13 13:00:00,119,9,30,115,4,0,0,0,0,0
242079006274865_305882733227825,"Motivation Monday
From engineering cadet to Deputy Commissioner of Coast Guard! Mario Pelletier began his career path as an engineering cadet at Coast Guard College. Now, he’s our Deputy Commissioner of Operations.",Photos from Canadian Coast Guard's post,photo,https://www.facebook.com/CanadianCoastGuard/photos/a.258864731262959.1073741828.242079006274865/305881769894588/?type=3,2017-11-13 08:00:00,125,13,6,120,5,0,0,0,0,0
242079006274865_306001206549311,"Today on Remembrance Day, we say thank you to those who bravely serve Canada. Lest we forget.",Photos from Canadian Coast Guard's post,photo,https://www.facebook.com/CanadianCoastGuard/photos/a.258864731262959.1073741828.242079006274865/306001069882658/?type=3,2017-11-11 11:57:33,41,0,1,41,0,0,0,0,0,0
242079006274865_305913663224732,"Lieutenant-Commander Dussault joined the Naval Reserve in 1993.  She started her reserve career as a Naval Control of Shipping (NCS) officer, participating in and planning NATO and domestic NCS exercises, and holding various divisional positions at HMCS RADISSON, HMCS DONNACONA, HMCS CARLETON and HMCS CATARAQUI. In 2003, she was appointed Deputy Commander of Naval Cooperation and Guidance for Shipping Unit 2, and then transferred in the same position for Unit 3 to thereafter take command of this unit under Maritime Operational Group 5 in 2007. Since, she re-trained as an Intelligence Officer, has held staff and academic positions at the Toronto Canadian Forces College, and has recently completed a term as Executive Officer of HMCS CARLETON.
 
In 2007-08 she deployed to Kabul, Afghanistan, as the Deputy Commander of the HQ Support Group. During her deployment, she led a support battalion of 400 persons from 40 different countries, looking after the life necessities and security in the NATO Headquarters. During her tour, she completed the rebuilding of an Afghan memorial destroyed by camp construction activity, and led a charity fund raiser for a local orphanage.
 
Her career as a public servant started at Treasury Board Secretariat and Department of Finance. Later, she joined the Department of National Defence, coordinating Army international interoperability programs. Since February 2017 she has joined us as the Manager of Search and Rescue, at the Canadian Coast Guard. 
 
Thank you for your service, Sheyla. 

Veterans Affairs Canada",,photo,https://www.facebook.com/CanadianCoastGuard/photos/a.258864731262959.1073741828.242079006274865/305913583224740/?type=3,2017-11-10 10:21:11,172,49,22,151,20,1,0,0,0,0
242079006274865_305530886596343,"On November 8, 2017, Eric Nickerson received the Nova Scotia Medal of Bravery for his heroic rescue last year. 

The CCGS Spray and the G Peddle SC responded to call off Southwest Nova Scotia. Mr. Nickerson performed an in-the-water rescue of a sailor while transferring from a sinking sailboat.",Medal of Bravery,video,https://www.facebook.com/CanadianCoastGuard/videos/305530886596343/,2017-11-09 13:00:00,159,7,70,149,9,1,0,0,0,0
242079006274865_303351103480988,"Eric Arsenault grew up in Quebec City and at the age of 17, enrolled in the Canadian Armed Forces as a Communications Research Operator. 

During his career, he specialized in Languages and Electronic Warfare. He did two six month tours in Alert, NU and a seven month tour in Afghanistan.  After more than 20 years of service, he retired from the Canadian Forces. Later, he joined Public Safety Canada as a Watch Officer. 

Eric now works for Coast Guard as a National Project Manager for the Oceans Protection Plan to strengthen the National Marine Communications and Traffic Services Radar Network. 

Thank you for your service, Eric.

Veterans Affairs Canada",,photo,https://www.facebook.com/CanadianCoastGuard/photos/a.258864731262959.1073741828.242079006274865/303350883481010/?type=3,2017-11-09 10:00:00,139,14,9,126,10,3,0,0,0,0
242079006274865_305268696622562,We apply GBA+ in the Canadian Coast Guard across everything we do; it’s one of our guiding principles. Video Credit: Women in Canada,,video,https://www.facebook.com/CanadianCoastGuard/videos/305268696622562/,2017-11-08 17:00:00,32,0,13,32,0,0,0,0,0,0
242079006274865_305230983293000,Commissioner Hutchinson speaking during the Gender Summit on the use of Gender-Based Analysis Plus (GBA+).,Women in Canada,video,https://www.facebook.com/womencanada/videos/914955668658772/,2017-11-08 14:01:06,7,0,0,6,1,0,0,0,0,0
242079006274865_303345503481548,"Rob Justice joined the Canadian Coast Guard in 2013, following a lengthy career in the Canadian Armed Forces. He enrolled in the Royal Canadian Navy in February 1981. 

Rob served in numerous HMC Ships, in various roles such as Bridge Watch-keeper, Communications Officer, Diving Officer, Air Control Officer, and Combat Officer.  

Rob also served in a number of positions ashore such as Flag Lieutenant to the Commander of the Navy, Fleet Scheduler, Domestic Operations Officer and Deputy Director Operational Test and Evaluation.

After retiring from his last post at the Canadian Joint Operations Command, Rob joined Coast Guard as Manager, Office of Incident Management.  He is responsible for implementing the Incident Command System nationally across Coast Guard.

Thank you for your service, Rob.

Veterans Affairs Canada",,photo,https://www.facebook.com/CanadianCoastGuard/photos/a.258864731262959.1073741828.242079006274865/303345393481559/?type=3,2017-11-08 13:00:00,63,2,5,62,1,0,0,0,0,0
242079006274865_304819483334150,,Canadian Coast Guard's cover photo,photo,https://www.facebook.com/CanadianCoastGuard/photos/a.258074648008634.1073741827.242079006274865/304819440000821/?type=3,2017-11-07 11:50:39,3,0,0,3,0,0,0,0,0,0
242079006274865_303340913482007,"Evan Boettger enrolled in the Canadian Armed Forces as a Reservist in 1976 and served until his retirement from the Royal Canadian Navy in 2015. Evan joined the Public Service at National Defence in 1989 but decided to remain an active Reservist. From 1989 until 2015 Evan balanced parallel military and civilian careers, and since his retirement from the military, is now relieved to have only one career to focus on. 

Evan served in numerous Canadian naval ships, in roles such as a Signalman, Bridge Watch-keeper, Navigation Officer, Deck Officer, Operations Officer, and Executive Officer, in addition to short service in ships of United Kingdom and France.  Evan was honoured to command several ships and units including HMC Ships Fort Steele and Porte St. Louis at sea, HMCS Carleton in Ottawa and Port Security Units in Maritime Forces Atlantic. Evan also served in several overseas missions and special assignments outside the Navy including service in Afghanistan, Kosovo, and South Sudan, as well as in Canadian Special Operations Forces Command. 

At National Defence, Evan worked in major shipbuilding and aerospace projects for the Navy and the Air Force. In 2002, Evan joined the Canadian Coast Guard as the Manager of Project Management in Integrated Technical Services. Evan is currently Project Director for two Incident Command System projects, as well as National Project Manager for the 24/7 Regional Operations Centre and National Command Centre Project. 

Thank you for your service, Evan. 

Veterans Affairs Canada",,photo,https://www.facebook.com/CanadianCoastGuard/photos/a.258864731262959.1073741828.242079006274865/303340430148722/?type=3,2017-11-07 10:00:00,57,2,7,57,0,0,0,0,0,0
242079006274865_304404536708978,,Canadian Coast Guard's cover photo,photo,https://www.facebook.com/CanadianCoastGuard/photos/a.258074648008634.1073741827.242079006274865/304404513375647/?type=3,2017-11-06 10:53:52,14,0,0,13,1,0,0,0,0,0
242079006274865_303328553483243,"Rick Fougère grew up in Shediac, New-Brunswick. In 1991, at the age of 20, he enrolled in the Canadian Armed Forces as an Armoured Crewman. 

During his career, he specialized in light armoured reconnaissance with the Royal Canadian Dragoons until 2016. He completed 4 tours in the former Yugoslavia and retired in 2016. After 25 years of service, he transfered to the Coast Guard and is now working as an Incident Command System Officer. 

Thank you for your service, Rick.

Veterans Affairs Canada",,photo,https://www.facebook.com/CanadianCoastGuard/photos/a.258864731262959.1073741828.242079006274865/303328310149934/?type=3,2017-11-06 10:00:00,94,7,6,91,3,0,0,0,0,0
242079006274865_300928493723249,"Earlier this month, we participated in the national job fair in Montreal at Place Bonaventure in order to recruit potential employees.  

To find out how to apply for a job:",Current job openings - Jobs open to the public - College and Careers,link,http://www.ccg-gcc.gc.ca/College-and-Careers/Job-openings,2017-11-05 13:00:00,41,1,28,41,0,0,0,0,0,0
242079006274865_300926020390163,We participated in a training exercise with Halifax Search and Rescue last weekend at Crystal Crescent. Regular training with our partners ensures we are ready to respond to all incidents on or near the water.,Photos from Canadian Coast Guard's post,photo,https://www.facebook.com/CanadianCoastGuard/photos/a.258864731262959.1073741828.242079006274865/300925637056868/?type=3,2017-11-04 09:00:00,37,0,5,35,1,1,0,0,0,0
