,Unnamed: 0,id,date_published,link,caption_original,caption_cleaned,hashtags,num_comments,num_shares,num_likes,Reactions_SUM,category,matched_keywords,language,average_sentiment_score,sentiment,account_name
43370,1049,377625007887_10154102319932888,2016-04-02 07:01:49,https://www.facebook.com/TransportsetInfrastructureauCanada/photos/a.10151491514147888.1073741825.377625007887/10154102319932888/?type=3,Brillez par votre intelligence! Renseignez-vous sur le voyant des coussins gonflables : http://t.co/eZ1gkMPhTt,Brillez par votre intelligence! Renseignez-vous sur le voyant des coussins gonflables :,[],1.0,0.0,0,1,['other'],[],fr,0.0,neutral,TransportsetInfrastructureauCanada_facebook
43375,1054,377625007887_10154100105017888,2016-04-07 16:00:00,https://www.facebook.com/TransportsetInfrastructureauCanada/videos/10154100105017888/,"Avec le Guide de sécurité nautique de Transports Canada, vous resterez à flot cet été. http://www.tc.gc.ca/aqc1c","Avec le Guide de sécurité nautique de Transports Canada, vous resterez à flot cet été. c1c",[],0.0,1.0,0,1,['Economical'],['transport'],fr,0.0,neutral,TransportsetInfrastructureauCanada_facebook
3757,833,798775163588850_833249340141432,2016-04-21 11:00:56,,Vous pensez vous lancer en agriculture? Nous avons beaucoup d’information et de programmes pour les jeunes agriculteurs et les agriculteurs débutants. Découvrez comment nous pouvons vous aider : ow.ly/4mWomg,Vous pensez vous lancer en agriculture? Nous avons beaucoup d’information et de programmes pour les jeunes agriculteurs et les agriculteurs débutants. Découvrez comment nous pouvons vous aider :,[],0.0,0.0,1,1,"['Economical', 'Environmental', 'Social']","['agriculture', 'agriculture', 'jeune', 'agriculteur', 'agriculteur', 'découvrez', 'aider']",fr,0.0,neutral,AgricultureCanadienne_facebook
3760,836,798775163588850_833745153425184,2016-04-22 13:20:16,http://www.agr.gc.ca/fra/nouvelles/science-de-l-innovation-agricole/approfondissement-de-nos-connaissances-sur-les-sols-agriculture-et-agroalimentaire-canada-cree-un-reseau-de-stations-de-surveillance/?id=1430169113736,"Utilisez-vous notre réseau RSISTA? Ce réseau de surveillance des sols peut vous donner des données sur l’humidité ou la température concernant les principaux types de cultures, de textures des sols et d’écozones partout au pays. Apprenez-en davantage au sujet du RSISTA : http://ow.ly/4mZiJZ","Utilisez-vous notre réseau RSISTA? Ce réseau de surveillance des sols peut vous donner des données sur l’humidité ou la température concernant les principaux types de cultures, de textures des sols et d’écozones partout au pays. Apprenez-en davantage au sujet du RSISTA :",[],0.0,0.0,1,1,"['Economical', 'Social']","['sol', 'culture', 'sol', 'pays']",fr,0.0,neutral,AgricultureCanadienne_facebook
4183,163,719606004690862080,2016-04-11 19:20:15,['https://t.co/C8S7I6V4LO'],"Occasion d’#emploi à Québec: Enquêteur(e) principal(e) régional(e), Service nautique. Date limite : 22 avril ! https://t.co/C8S7I6V4LO",Occasion emploi bec principal gional Service nautique Date limite 22 avril https co C8S7I6V4LO,['#emploi'],,0.0,1,1,['Economical'],['occasion'],fr,0.0,Neutral,BSTCanada_tweeter
45653,2003,717427371230564352,2016-04-05 19:03:09,[],Le ministre Garneau a discuté de la recherche sur la salubrité de l’eau faite par @Ocean_Networks à @UVic.,Le ministre Garneau de la recherche sur la de eau faite par UVic,[],,0.0,1,1,['Economical'],"['ministre', 'garneau']",fr,0.0,Neutral,Transports_gc_tweeter
4191,171,723167362514583552,2016-04-21 15:11:49,['https://t.co/LAgHBHr3wJ'],Envoie une équipe sur les lieux d’un accident aéronautique survenu à Gander (Terre-Neuve-et-Labrador) https://t.co/LAgHBHr3wJ,Envoie une quipe sur les lieux un accident ronautique survenu Gander Terre Neuve et Labrador https co LAgHBHr3wJ,[],,1.0,0,1,['other'],[],fr,0.0,Neutral,BSTCanada_tweeter
4193,173,723238712717545473,2016-04-21 19:55:20,"['https://t.co/t4hHC2dxXL', 'https://t.co/p71OPwm0K']",Nouvelles #photos de l’aéronef ayant subi un accident à Gander https://t.co/t4hHC2dxXL https://t.co/p71OPwm0Kd,Nouvelles photos de ronef ayant subi un accident Gander https co t4hHC2dxXL https co p71OPwm0Kd,['#photos'],,1.0,0,1,['other'],[],fr,0.0,Neutral,BSTCanada_tweeter
38893,924,485734081568161_707770096031224,2016-04-05 08:58:54,https://www.facebook.com/YourMoneyMattersCanada/videos/796019837170876/,,,[],1.0,0.0,0,1,['other'],[],tl,0.305,positive,QuestionsdargentCanada_facebook
38897,928,485734081568161_717217495086484,2016-04-26 17:45:31,https://www.ic.gc.ca/eic/site/icgc.nsf/fra/h_07535.html#step6,"Vous souhaitez formuler une plainte au sujet d’un produit ou d’un service? La feuille de route des plaintes vous propose un exemple de lettre de plainte qui pourra guider la rédaction de votre propre lettre.

Obtenez le gabarit de lettre: http://ow.ly/4n3LIn",Vous souhaitez formuler une plainte au sujet d’un produit ou d’un service? La feuille de route des plaintes vous propose un exemple de lettre de plainte qui pourra guider la rédaction de votre propre lettre. Obtenez le gabarit de lettre:,[],0.0,0.0,1,1,"['Economical', 'Environmental', 'Social']","['plainte', 'produit', 'plainte', 'plainte', 'propre']",fr,0.0,neutral,QuestionsdargentCanada_facebook
13119,2513,723165691126394880,2016-04-21 15:05:11,['https://t.co/K6JSnGnAY3'],"Aujourd'hui : venez discuter de l'intégration de  l'art à la SCREA, 10h à 13h (HNR) au 29C, rue Mitik #CambridgeBay! https://t.co/K6JSnGnAY3",Aujourd hui venez discuter de gration de art la SCREA 10h 13h HNR au 29C rue Mitik CambridgeBay https co K6JSnGnAY3,['#CambridgeBay'],,1.0,0,1,['other'],[],fr,0.0,Neutral,GCAutochtones_tweeter
13117,2511,723261471434653696,2016-04-21 21:25:46,"['https://t.co/5wbxrIQk5e', 'https://t.co/cBco46ByL', 'https://t.c\xe2\x80\xa6']",RT @BiblioArchives: Reconnaissez-vous quelqu’un ici? https://t.co/5wbxrIQk5e #UnVisageUnNom https://t.co/cBco46ByLd @AADNCanada https://t.c…,RT BiblioArchives Reconnaissez vous un ici https co 5wbxrIQk5e UnVisageUnNom https co cBco46ByLd AADNCanada https,['#UnVisageUnNom'],,1.0,0,1,['Social'],['#unvisageunnom'],en,0.0,Neutral,GCAutochtones_tweeter
13116,2510,723496743044825090,2016-04-22 13:00:40,['https://t.co/IPsc6l2Bm'],Besoin d'info sur les déductions pour les habitants de régions éloignées? @AgenceRevCan : https://t.co/IPsc6l2BmD,Besoin info sur les ductions pour les habitants de gions es AgenceRevCan https co IPsc6l2BmD,[],,1.0,0,1,['other'],[],fr,0.0,Neutral,GCAutochtones_tweeter
13111,2505,720311284244328448,2016-04-13 18:02:47,[],RT @salledepresseGC: Le point sur l'examen des demandes liées au processus d'inscription à la PN #Qalipu Mi'kmaq @AADNCanada @Qalipu2011 ht…,RT salledepresseGC Le point sur examen des demandes es au processus inscription la PN Qalipu Mi kmaq AADNCanada Qalipu2011,['#Qalipu'],,1.0,0,1,['Social'],['pn'],fr,0.0,Neutral,GCAutochtones_tweeter
13110,2504,719959218258882560,2016-04-12 18:43:48,['https://t.co/\xe2\x80\xa6'],"RT @ReseauFCM: Commissaire de la CVR, Chef Littlechild, salue les efforts de CEDI à créer des partenariats FN-#munican forts. https://t.co/…",RT ReseauFCM Commissaire de la CVR Chef Littlechild salue les efforts de CEDI er des partenariats FN munican forts https co,['#munican'],,1.0,0,1,['Economical'],['partenariat'],fr,0.0,Neutral,GCAutochtones_tweeter
13102,2496,716007405746798593,2016-04-01 21:00:42,['https://t.co/uyZPaoES'],Le Dictionnaire vivant de l'#inuktitut présente des mots en inuktitut et leur définition : https://t.co/uyZPaoESuC,Le Dictionnaire vivant de inuktitut sente des mots en inuktitut et leur finition https co uyZPaoESuC,['#inuktitut'],,1.0,0,1,['other'],[],fr,0.0,Neutral,GCAutochtones_tweeter
13100,2494,716294525493374976,2016-04-02 16:01:37,"['https://t.co/tFdPe0thLn', 'https://t.co/qpXOcjI']",La poète Marilyn Dumont au #VERSeFest. Lisez ses poèmes (angl.): #lecturesautochtones #NPM16 https://t.co/tFdPe0thLn https://t.co/qpXOcjIuU1,La te Marilyn Dumont au VERSeFest Lisez ses mes angl lecturesautochtones NPM16 https co tFdPe0thLn https co qpXOcjIuU1,"['#VERSeFest', '#lecturesautochtones', '#NPM16']",,1.0,0,1,['other'],[],fr,0.0,Neutral,GCAutochtones_tweeter
13098,2492,717373666028359682,2016-04-05 15:29:44,['https://t.co/wk5XZ\xe2\x80\xa6'],RT @CanadaOEA: Audience publique jeudi @CIDH sur les femmes autochtones disparues ou assassinées au Canada. En direct au https://t.co/wk5XZ…,RT CanadaOEA Audience publique jeudi CIDH sur les femmes autochtones disparues ou es au Canada En direct au https co,[],,1.0,0,1,['Social'],"['publique', 'femme', 'autochtone']",fr,0.1,Neutral,GCAutochtones_tweeter
13096,2490,718055264449138689,2016-04-07 12:38:10,"['https://t.co/1Fy65JTB', 'https://t.co/bHar41EOMB']",RT @BiblioArchives: Connaissez-vous Eegyvudluk Pootoogook? https://t.co/1Fy65JTBCU #UnVisageUnNom https://t.co/bHar41EOMB @AADNCanada https…,RT BiblioArchives Connaissez vous Eegyvudluk Pootoogook https co 1Fy65JTBCU UnVisageUnNom https co bHar41EOMB AADNCanada,['#UnVisageUnNom'],,1.0,0,1,['Social'],['#unvisageunnom'],en,0.0,Neutral,GCAutochtones_tweeter
13095,2489,718471006294294528,2016-04-08 16:10:11,['https://t.co/ajBzSeYPuX'],.@NAFC_ANCA fait la promotion de la santé spirituelle et physique. Découvrez comment : https://t.co/ajBzSeYPuX,fait la promotion de la spirituelle et physique couvrez comment https co ajBzSeYPuX,[],,1.0,0,1,"['Environmental', 'Social']","['santé', 'santé', 'découvrez']",fr,0.0,Neutral,GCAutochtones_tweeter
13094,2488,718568424776036352,2016-04-08 22:37:17,[],RT @salledepresseGC: Accord GC/GY/PN relatif aux préoccupations des PN sur : Loi sur l'évaluation environnementale au Yukon: @AADNCanada ht…,RT salledepresseGC Accord GC GY PN relatif aux occupations des PN sur Loi sur valuation environnementale au Yukon AADNCanada,[],,1.0,0,1,['Social'],['pn'],fr,0.0,Neutral,GCAutochtones_tweeter
13091,2485,717083222463684608,2016-04-04 20:15:37,['https://t.co/eJCsrQaEW'],RT @salledepresseGC: Les Innus du Labrador assureront la prestation du Programme d'aide au revenu https://t.co/eJCsrQaEWu,RT salledepresseGC Les Innus Labrador assureront prestation Programme aide revenu https co eJCsrQaEWu,[],,1.0,0,1,['Economical'],['revenu'],fr,0.0,Neutral,GCAutochtones_tweeter
13088,2482,724606889422630912,2016-04-25 14:31:59,[],RT @salledepresseGC: La min. Bennett parle de réconciliation avec les Autochtones et des investissements historiques dans le #budget2016 ht…,RT salledepresseGC La min Bennett parle de conciliation avec les Autochtones et des investissements historiques dans le budget2016,['#budget2016'],,1.0,0,1,"['Economical', 'Social']","['autochtone', 'investissement', 'historique', '#budget2016']",fr,0.0,Neutral,GCAutochtones_tweeter
13059,2453,725291050085011456,2016-04-27 11:50:36,"['https://t.co/5wbxrIQk5e', 'https://t.co/cBco46ByL', 'https://t.c\xe2\x80\xa6']",RT @BiblioArchives: Reconnaissez-vous quelqu’un sur cette photo? https://t.co/5wbxrIQk5e #UnVisageUnNom https://t.co/cBco46ByLd https://t.c…,RT BiblioArchives Reconnaissez vous un sur cette photo https co 5wbxrIQk5e UnVisageUnNom https co cBco46ByLd https,['#UnVisageUnNom'],,1.0,0,1,['Social'],['#unvisageunnom'],fr,0.0,Neutral,GCAutochtones_tweeter
13052,2446,725707095002206209,2016-04-28 15:23:49,[],RT @salledepresseGC: La min Bennett et @ccab_national parlent de l'importance d'investir dans les collectivités autochtones. @AADNCanada ht…,RT salledepresseGC La min Bennett et parlent de importance investir dans les autochtones AADNCanada,[],,1.0,0,1,['Social'],"['collectivité', 'autochtone']",fr,0.0,Neutral,GCAutochtones_tweeter
13049,2443,726057666229985280,2016-04-29 14:36:51,[],RT @salledepresseGC: Le #budget2016 renouvelle les investissements pour soutenir les Autochtones vivant en milieu urbain. @AADNCanada https…,RT salledepresseGC Le budget2016 renouvelle les investissements pour soutenir les Autochtones vivant en milieu urbain AADNCanada,['#budget2016'],,1.0,0,1,"['Economical', 'Social']","['#budget2016', 'investissement', 'autochtone']",fr,0.0,Neutral,GCAutochtones_tweeter
12954,2348,726417112445665281,2016-04-30 14:25:10,['https://t.co/476UxsfjEo'],Regardez cette vidéo pour avoir une idée ce que c'est qu'être un étudiant Coop à AANC : https://t.co/476UxsfjEo,Regardez cette pour avoir une ce que est qu un tudiant Coop AANC https co 476UxsfjEo,[],,1.0,0,1,['Social'],['étudiant'],fr,0.0,Neutral,GCAutochtones_tweeter
13126,2520,721095931379232768,2016-04-15 22:00:42,"['https://t.co/QzDVHpxBeT', 'https://t.co/IabZSLIv47']",Informez-vous sur la #culture et l'#histoire des #Mikmaq au pn Kejimkujik: @ParcsCanada_NE https://t.co/QzDVHpxBeT https://t.co/IabZSLIv47,Informez culture histoire Mikmaq pn Kejimkujik https co QzDVHpxBeT https co IabZSLIv47,"['#culture', '#histoire', '#Mikmaq']",,1.0,0,1,['Social'],['pn'],en,0.0,Neutral,GCAutochtones_tweeter
13127,2521,721069250539057152,2016-04-15 20:14:40,['https://t.co/n\xe2\x80\xa6'],RT @DEO_Canada: Inscrivez-vous au forum de la #MB #Indigenous Foresight Initiative d’ici au 22 avril! Pour plus de détails : https://t.co/n…,RT Inscrivez vous au forum de la MB Indigenous Foresight Initiative ici au 22 avril Pour plus de tails https co,"['#MB', '#Indigenous']",,1.0,0,1,['other'],[],fr,0.0,Neutral,GCAutochtones_tweeter
13128,2522,720970862371934208,2016-04-15 13:43:43,[],"Le bureau d'AANC de Winnipeg, MB, est fermé aujourd'hui, le 15 avril. Pour info : 1-800-567-9604",Le bureau AANC de Winnipeg MB est aujourd hui le 15 avril Pour info 800 567 9604,[],,1.0,0,1,['other'],[],fr,0.0,Neutral,GCAutochtones_tweeter
10088,1106,460123390028_10156793640530029,2016-04-12 10:50:13,https://www.facebook.com/EnvironnementetressourcesnaturellesauCanada/photos/a.481746145028.384353.460123390028/10156793640530029/?type=3,"Prenez une grande respiration! La qualité de l’air est essentielle à notre qualité de vie et à la santé de notre environnement. Les Indicateurs canadiens de durabilité de l’environnement mesurent nos progrès dans la lutte contre les facteurs qui menacent la qualité de l’air, pour que l’air que nous respirons soit propre et soutienne des écosystèmes en santé. http://ow.ly/10zVPs","Prenez une grande respiration! La qualité de l’air est essentielle à notre qualité de vie et à la santé de notre environnement. Les Indicateurs canadiens de durabilité de l’environnement mesurent nos progrès dans la lutte contre les facteurs qui menacent la qualité de l’air, pour que l’air que nous respirons soit propre et soutienne des écosystèmes en santé.",[],0.0,0.0,1,1,"['Economical', 'Environmental', 'Social']","[""qualité_de_l'air"", 'vie', 'santé', 'santé', 'environnement', 'durabilité', 'progrès', 'propre', 'écosystème', 'écosystème', 'santé', 'santé']",fr,0.0,neutral,EnvironnementetressourcesnaturellesauCanada_facebook
4243,223,725023219133108224,2016-04-26 18:06:20,['https://t.co/19rKxyWyT'],Assemblée générale de #NATA : La prés. du BST aborde l'utilisation &amp; la ciculation des données de sécurité #aviation https://t.co/19rKxyWyT0,rale de NATA La du BST aborde utilisation amp la ciculation des es de aviation https co 19rKxyWyT0,"['#NATA', '#aviation']",,1.0,0,1,['other'],[],fr,0.0,Neutral,BSTCanada_tweeter
4245,225,724971428962045953,2016-04-26 14:40:32,['https://t.co/n6b2wgrJ2g'],#Saviez-vs que vs pouvez obtenir des détails sur les incidents de nos données ferroviaire? Mises-à-jour mensuelles : https://t.co/n6b2wgrJ2g,Saviez vs que vs pouvez obtenir des tails sur les incidents de nos es ferroviaire Mises jour mensuelles https co n6b2wgrJ2g,['#Saviez'],,0.0,1,1,['other'],[],fr,0.0,Neutral,BSTCanada_tweeter
4267,247,717436691389222912,2016-04-05 19:40:11,['https://t.co/3p4LHYqx6P'],Abonnez-vous à l'un ou plusieurs de nos fils RSS pour rester branché en tout temps! https://t.co/3p4LHYqx6P,Abonnez vous un ou plusieurs de nos fils RSS pour rester en tout temps https co 3p4LHYqx6P,[],,1.0,0,1,['other'],[],fr,0.0,Neutral,BSTCanada_tweeter
4396,376,717015885169487874,2016-04-04 15:48:03,['https://t.co/leIP5gidTZ'],"Ns avons bouclé notre anniversaire BST@25. Au cas où vs l'auriez manqué nos #videos, #photos et + sur notre site https://t.co/leIP5gidTZ",Ns avons notre anniversaire BST 25 Au cas vs auriez nos videos photos et sur notre site https co leIP5gidTZ,"['#videos', '#photos']",,1.0,0,1,['other'],[],fr,0.0,Neutral,BSTCanada_tweeter
4401,381,715916253152600064,2016-04-01 14:58:30,"['https://t.co/RW9uCNdedG', 'https://t.co/6x32dJm7bb']",#Photo Enquêteurs du BST préparent l'aéronef pour le transport à notre Labo à Ottawa https://t.co/RW9uCNdedG https://t.co/6x32dJm7bb,Photo du BST parent ronef pour le transport notre Labo Ottawa https co RW9uCNdedG https co 6x32dJm7bb,['#Photo'],,0.0,1,1,['Economical'],['transport'],fr,0.0,Neutral,BSTCanada_tweeter
4403,383,715859224396324866,2016-04-01 11:11:53,['https://t.co/BAVvkirio7'],"Pour + d'info sur notre enquête sur l'accident aux #îlesdelamadeleine, ajoutez notre page d'enquête à vos signets https://t.co/BAVvkirio7",Pour info sur notre sur accident aux lesdelamadeleine ajoutez notre page vos signets https co BAVvkirio7,['#'],,0.0,1,1,['other'],[],fr,0.0,Neutral,BSTCanada_tweeter
10104,1122,460123390028_10156853362135029,2016-04-29 07:50:19,https://www.facebook.com/EnvironnementetressourcesnaturellesauCanada/photos/a.481746145028.384353.460123390028/10156853362135029/?type=3,"Les déchets dans les sites d’enfouissement peuvent produire des émissions atmosphériques, polluer l’eau et perturber les terres. Cependant, le recyclage et le compostage nous permettent de réduire le volume de déchets dans les sites d’enfouissement et de conserver nos ressources naturelles. Bien que le volume total de déchets ait augmenté au Canada depuis 2002, les ménages canadiens envoient moins de déchets dans les sites d’enfouissement. 

Consultez le nouvel indicateur de durabilité d’Environnement et Changement climatique Canada qui permet de suivre la quantité de déchets éliminés et qui sont détournés des sites d’enfouissement, et contribuez à réduire davantage la quantité de déchets. http://ow.ly/4neJDH","Les déchets dans les sites d’enfouissement peuvent produire des émissions atmosphériques, polluer l’eau et perturber les terres. Cependant, le recyclage et le compostage nous permettent de réduire le volume de déchets dans les sites d’enfouissement et de conserver nos ressources naturelles. Bien que le volume total de déchets ait augmenté au Canada depuis , les ménages canadiens envoient moins de déchets dans les sites d’enfouissement. Consultez le nouvel indicateur de durabilité d’Environnement et Changement climatique Canada qui permet de suivre la quantité de déchets éliminés et qui sont détournés des sites d’enfouissement, et contribuez à réduire davantage la quantité de déchets.",[],0.0,0.0,1,1,"['Environmental', 'Social']","['émission', 'terre', 'recyclage', 'compostage', 'compostage', 'réduire', 'ressource', 'ménage', 'durabilité', 'changement', 'climatique', 'réduire']",fr,0.0,neutral,EnvironnementetressourcesnaturellesauCanada_facebook
10090,1108,460123390028_10156770061915029,2016-04-06 14:45:40,https://www.facebook.com/EnvironnementetressourcesnaturellesauCanada/photos/a.481746145028.384353.460123390028/10156770061915029/?type=3,"Saviez-vous que vous pouvez consulter vos prévisions météorologiques locales en appelant la ligne d’information automatisée d’Environnement et Changement climatique Canada? Ce service téléphonique vous permet d’obtenir, en français et en anglais, les prévisions météorologiques, les conditions météo actuelles, les avis de tempêtes et d’autres renseignements environnementaux pour votre région. http://ow.ly/10i3bp","Saviez-vous que vous pouvez consulter vos prévisions météorologiques locales en appelant la ligne d’information automatisée d’Environnement et Changement climatique Canada? Ce service téléphonique vous permet d’obtenir, en français et en anglais, les prévisions météorologiques, les conditions météo actuelles, les avis de tempêtes et d’autres renseignements environnementaux pour votre région.",[],0.0,0.0,1,1,"['Environmental', 'Social']","['locale', 'changement', 'climatique', 'environnementaux']",fr,0.0,neutral,EnvironnementetressourcesnaturellesauCanada_facebook
10086,1104,460123390028_10156801075785029,2016-04-14 09:35:13,https://www.facebook.com/EnvironnementetressourcesnaturellesauCanada/photos/a.481746145028.384353.460123390028/10156801075785029/?type=3,Vous aimez passer du temps en plein air et écouter les oiseaux? Participez au Relevé des oiseaux nicheurs ou à un recensement des oiseaux. Nos recherches dépendent de bénévoles comme vous! http://ow.ly/10EOa5,Vous aimez passer du temps en plein air et écouter les oiseaux? Participez au Relevé des oiseaux nicheurs ou à un recensement des oiseaux. Nos recherches dépendent de bénévoles comme vous!,[],0.0,0.0,1,1,"['Environmental', 'Social']","['air', 'oiseau', 'participez', 'oiseau', 'oiseau']",fr,0.0,neutral,EnvironnementetressourcesnaturellesauCanada_facebook
13129,2523,720756092507156480,2016-04-14 23:30:18,['https://t.co/cpkUjxgK6t'],Plus de détails sur la décision de la #CSC dans l'affaire CAP/Daniel. #Métis Plus: https://t.co/cpkUjxgK6t,Plus de tails sur la cision de la CSC dans affaire CAP Daniel tis Plus https co cpkUjxgK6t,"['#CSC', '#M']",,1.0,0,1,['other'],[],fr,0.0,Neutral,GCAutochtones_tweeter
10084,1102,460123390028_10156805596525029,2016-04-15 14:00:29,https://www.facebook.com/EnvironnementetressourcesnaturellesauCanada/photos/a.481746145028.384353.460123390028/10156805596525029/?type=3,"Les chercheurs et les biologistes d’Environnement et Changement climatique Canada ont passé une semaine fantastique à la Conférence sur l’écosystème de la mer des Salish 2016. Plus de 1 100 spécialistes réputés des sciences de la mer, de dirigeants de Premières Nations et de tribus, de cadres de l’industrie et de décideurs se sont réunis pour parler de cet écosystème transfrontalier important. Félicitations aux organisateurs!","Les chercheurs et les biologistes d’Environnement et Changement climatique Canada ont passé une semaine fantastique à la Conférence sur l’écosystème de la mer des Salish . Plus de spécialistes réputés des sciences de la mer, de dirigeants de Premières Nations et de tribus, de cadres de l’industrie et de décideurs se sont réunis pour parler de cet écosystème transfrontalier important. Félicitations aux organisateurs!",[],0.0,0.0,1,1,"['Economical', 'Environmental', 'Social']","['changement', 'climatique', 'mer', 'mer', 'écosystème', 'écosystème']",fr,0.0,neutral,EnvironnementetressourcesnaturellesauCanada_facebook
10083,1101,460123390028_10156805807200029,2016-04-15 15:15:16,https://www.facebook.com/EnvironnementetressourcesnaturellesauCanada/photos/a.481746145028.384353.460123390028/10156805807200029/?type=3,"Saviez-vous que la région de la baie Lobster, près de Yarmouth, en Nouvelle-Écosse, est le seul endroit au Canada où vous pouvez trouver le baccharis à feuilles d’arroches, une espèce d’arbuste rare? Cette espèce est un membre de la flore des plaines côtières de l’Atlantique, composée de plantes à fleurs, d’arbustes et de plantes herbacées, dont un grand nombre figurent sur la liste de la Loi sur les espèces en péril. En fait, il ne reste que 3 000 baccharis à feuilles d’arroches matures aujourd’hui.

Environnement et Changement climatique Canada travaille avec Conservation de la nature Canada à protéger 20 hectares de terres marécageuses sur l’île Roberts, dans la baie Lobster. Ces terres n’abritent pas que le baccharis à feuilles d’arroches; elles fournissent aussi un habitat important aux oiseaux aquatiques, dont le Canard noir, le Harelde kakawi et la Sarcelle d’hiver. http://ow.ly/4mKjDK","Saviez-vous que la région de la baie Lobster, près de Yarmouth, en Nouvelle-Écosse, est le seul endroit au Canada où vous pouvez trouver le baccharis à feuilles d’arroches, une espèce d’arbuste rare? Cette espèce est un membre de la flore des plaines côtières de l’Atlantique, composée de plantes à fleurs, d’arbustes et de plantes herbacées, dont un grand nombre figurent sur la liste de la Loi sur les espèces en péril. En fait, il ne reste que baccharis à feuilles d’arroches matures aujourd’hui. Environnement et Changement climatique Canada travaille avec Conservation de la nature Canada à protéger hectares de terres marécageuses sur l’île Roberts, dans la baie Lobster. Ces terres n’abritent pas que le baccharis à feuilles d’arroches; elles fournissent aussi un habitat important aux oiseaux aquatiques, dont le Canard noir, le Harelde kakawi et la Sarcelle d’hiver.",[],0.0,0.0,1,1,"['Environmental', 'Social']","['espèce', 'espèce', 'flore', 'plante', 'plante', 'espèce', 'environnement', 'changement', 'climatique', 'conservation', 'nature', 'protéger', 'terre', 'terre', 'oiseau']",fr,0.0,neutral,EnvironnementetressourcesnaturellesauCanada_facebook
