,Unnamed: 0,id,date_published,link,caption_original,caption_cleaned,hashtags,num_comments,num_shares,num_likes,Reactions_SUM,category,matched_keywords,language,average_sentiment_score,sentiment,account_name
38472,503,485734081568161_717976598343907,2016-04-28 10:45:48,https://www.facebook.com/QuestionsdargentCanada/photos/a.534106823397553.1073741828.485734081568161/717976598343907/?type=3,"Le printemps est bel et bien arrivé et les soirées barbecue commenceront bientôt.

 
Vous avez besoin de nouveaux meubles pour l’extérieur, mais vous n’avez pas les moyens de tout payer d’un coup? Pensez-y à deux fois avant d’opter pour la location-achat. Cette formule coûte généralement plus cher à la longue qu’un achat comptant. 

Renseignements supplémentaires: http://ow.ly/4n3NBM","Le printemps est bel et bien arrivé et les soirées barbecue commenceront bientôt. Vous avez besoin de nouveaux meubles pour l’extérieur, mais vous n’avez pas les moyens de tout payer d’un coup? Pensez-y à deux fois avant d’opter pour la location-achat. Cette formule coûte généralement plus cher à la longue qu’un achat comptant. Renseignements supplémentaires:",[],0.0,2.0,5,7,['other'],[],fr,0.0,neutral,QuestionsdargentCanada_facebook
38476,507,485734081568161_711457992329101,2016-04-13 12:32:54,https://www.facebook.com/ACFCan/videos/777134929085647/,,,[],0.0,0.0,7,7,['other'],[],tl,0.0,neutral,QuestionsdargentCanada_facebook
11240,634,721352732301533184,2016-04-16 15:01:08,"['https://t.co/QIJXMxxXt', 'https://t.co/c8VhFpsF7W']",Des partenaires autochtones et @ParcsCanada collaborent pour gérer et conserver les parcs: https://t.co/QIJXMxxXt9 https://t.co/c8VhFpsF7W,Des partenaires autochtones et ParcsCanada collaborent pour rer et conserver les parcs https co QIJXMxxXt9 https co c8VhFpsF7W,[],,3.0,4,7,"['Environmental', 'Social']","['autochtone', 'parcscanada', 'parc']",fr,0.0,Neutral,GCAutochtones_tweeter
11175,569,725399175358205952,2016-04-27 19:00:15,[],RT @PMcanadien: Le gouvernement du Canada investit 2.6G$ sur 5 ans afin d’améliorer l’éducation primaire et secondaire dans les réserves.,RT PMcanadien Le gouvernement du Canada investit 6G sur ans afin liorer ducation primaire et secondaire dans les serves,[],,7.0,0,7,['other'],[],fr,0.0,Neutral,GCAutochtones_tweeter
11172,566,725741420708028417,2016-04-28 17:40:12,['https://t.co/plyCz26YQb'],Min. Bennett parle de voir les choses à travers les yeux des Autochtones au symposium « Roots of Empathy ». https://t.co/plyCz26YQb,Min Bennett parle de voir les choses travers les yeux des Autochtones au symposium Roots Empathy https co plyCz26YQb,[],,2.0,5,7,['Social'],['autochtone'],fr,0.0,Neutral,GCAutochtones_tweeter
38503,534,485734081568161_716732858468281,2016-04-25 17:45:26,https://www.facebook.com/QuestionsdargentCanada/photos/a.534106823397553.1073741828.485734081568161/716732858468281/?type=3,"Vous arrive-t-il souvent de jeter des aliments qui ne sont plus comestibles?

Cessez de gaspiller votre argent durement gagné: avant de vous rendre à l’épicerie, jetez un coup d’œil à ce qui reste dans votre frigo et votre garde-manger. Vous pourrez ainsi mitonner des repas à l’aide des ingrédients dont vous disposez déjà. 

Consultez cette page interactive pour obtenir d’autres conseils qui vous feront économiser à l’épicerie: http://ow.ly/4n3KVm","Vous arrive-t-il souvent de jeter des aliments qui ne sont plus comestibles? Cessez de gaspiller votre argent durement gagné: avant de vous rendre à l’épicerie, jetez un coup d’œil à ce qui reste dans votre frigo et votre garde-manger. Vous pourrez ainsi mitonner des repas à l’aide des ingrédients dont vous disposez déjà. Consultez cette page interactive pour obtenir d’autres conseils qui vous feront économiser à l’épicerie:",[],0.0,3.0,3,7,['Social'],['aliment'],fr,0.0,neutral,QuestionsdargentCanada_facebook
38504,535,485734081568161_707281522746748,2016-04-04 09:31:57,https://www.facebook.com/QuestionsdargentCanada/photos/a.534106823397553.1073741828.485734081568161/707281522746748/?type=3,"Le ministre des Finances Morneau tiendra une séance de discussion avec des étudiants des universités St. Thomas et du Nouveau-Brunswick. 

Joignez-vous à cette discussion ouverte en direct sur Facebook le mardi 5 avril 2016 à 11 h (heure avancée de l’Atlantique). #Budget2016",Le ministre des Finances Morneau tiendra une séance de discussion avec des étudiants des universités St. Thomas et du Nouveau-Brunswick. Joignez-vous à cette discussion ouverte en direct sur Facebook le mardi avril à h (heure avancée de l’Atlantique).,['#Budget2016'],3.0,0.0,4,7,"['Economical', 'Social']","['ministre', 'morneau', 'discussion', 'étudiant', 'discussion', '#budget2016']",fr,0.07166666666666667,positive,QuestionsdargentCanada_facebook
42641,320,377625007887_10154126152262888,2016-04-11 14:23:56,https://www.facebook.com/TransportsetInfrastructureauCanada/photos/a.10151491514147888.1073741825.377625007887/10154126152262888/?type=3,"Depuis 2002, les projets et programmes d’Infrastructure Canada ont investi 39 G$ à travers le Canada. Nous avons financé plus de 8 200 projets allant des eaux usées au transport au commun en passant par les infrastructures récréatives et plus! Pour un portrait interactif des projets financés depuis 2002 par Infrastructure Canada, visitez : http://ow.ly/10xMuc","Depuis , les projets et programmes d’Infrastructure Canada ont investi G$ à travers le Canada. Nous avons financé plus de projets allant des eaux usées au transport au commun en passant par les infrastructures récréatives et plus! Pour un portrait interactif des projets financés depuis par Infrastructure Canada, visitez : uc",[],0.0,2.0,4,7,"['Economical', 'Environmental', 'Social']","['projet', 'projet', 'eau', 'transport', 'infrastructure', 'projet', 'infrastructure']",fr,0.0,neutral,TransportsetInfrastructureauCanada_facebook
27959,102,725318525875830784,2016-04-27 13:39:46,['https://t.co/aIJ\xe2\x80\xa6'],RT @salledepresseGC: .@DFO_MPO #MinTootoo va en Belgique pour promouv. #l'indust. can. des prod. de la mer au salon #SEG16 https://t.co/aIJ…,RT salledepresseGC MinTootoo va en Belgique pour promouv indust des prod de la mer au salon SEG16 https co,"['#MinTootoo', '#l', '#SEG16']",,7.0,0,7,['Environmental'],['mer'],fr,0.0,Neutral,MPO_Science_tweeter
28051,194,718556239903506432,2016-04-08 21:48:52,[],"RT @RPNIlesGulf: #PointeEast à l'#îleSaturna est un endroit parfait pour observer des épaulards. #Mercredibaleine 
Photo : M.Ritter https:/…",RT RPNIlesGulf PointeEast leSaturna est un endroit parfait pour observer des paulards Mercredibaleine Photo Ritter https,"['#PointeEast', '#', '#Mercredibaleine']",,6.0,0,6,['other'],[],fr,0.0,Neutral,MPO_Science_tweeter
44113,463,726116399115059200,2016-04-29 18:30:14,['https://t.co/ElpujnLRcQ'],Drones près des aéroports: illégal et dangereux @FlyYOW @AirCanada. Distance d’au moins 9km requise #Ottawa #ottnews https://t.co/ElpujnLRcQ,Drones des roports gal et dangereux FlyYOW AirCanada Distance au moins 9km requise Ottawa ottnews https co ElpujnLRcQ,"['#Ottawa', '#ottnews']",,3.0,3,6,['other'],[],fr,0.0,Neutral,Transports_gc_tweeter
9416,434,460123390028_10156760889430029,2016-04-04 09:25:14,https://www.facebook.com/EnvironnementetressourcesnaturellesauCanada/photos/a.481746145028.384353.460123390028/10156760889430029/?type=3,"Saviez-vous que le Centre d’interprétation de la réserve nationale de faune du Cap-Tourmente de la province de Québec dispose de fenêtres qui permettent d’atténuer les risques de collision des oiseaux? À partir du 23 avril, rendez-vous au Centre pour apprendre comment, vous aussi, vous pouvez les protéger.
http://ow.ly/10glMG","Saviez-vous que le Centre d’interprétation de la réserve nationale de faune du Cap-Tourmente de la province de Québec dispose de fenêtres qui permettent d’atténuer les risques de collision des oiseaux? À partir du avril, rendez-vous au Centre pour apprendre comment, vous aussi, vous pouvez les protéger.",[],0.0,1.0,5,6,['Environmental'],"['faune', 'oiseau', 'protéger']",fr,0.0,neutral,EnvironnementetressourcesnaturellesauCanada_facebook
9413,431,460123390028_10156848144870029,2016-04-27 18:05:21,https://www.facebook.com/EnvironnementetressourcesnaturellesauCanada/photos/a.481746145028.384353.460123390028/10156848144870029/?type=3,"Saviez-vous qu’à la réserve du Cap-Tourmente, Québec, au poste d’observation du sentier Bois-sent-Bon situé en bordure du fleuve, les enfants peuvent s’initier à l’observation avec des télescopes installés à leur hauteur? http://ow.ly/4n9wLk","Saviez-vous qu’à la réserve du Cap-Tourmente, Québec, au poste d’observation du sentier Bois-sent-Bon situé en bordure du fleuve, les enfants peuvent s’initier à l’observation avec des télescopes installés à leur hauteur?",[],2.0,0.0,4,6,"['Environmental', 'Social']","['fleuve', 'enfant']",fr,0.33125,positive,EnvironnementetressourcesnaturellesauCanada_facebook
38541,572,485734081568161_718842674923966,2016-04-30 10:45:32,http://www.cra-arc.gc.ca/gncy/t1gtrdy/menu-fra.html,"RAPPEL: C’est aujourd’hui la date limite pour produire votre déclaration de revenus!

Si vous n’avez pas encore envoyé votre déclaration, ne vous en faites pas! L’Agence du revenu du Canada considérera votre déclaration et votre paiement comme étant reçus à temps si elle les reçoit au plus tard le 2 mai 2016, à minuit ou si le cachet de la poste est le 2 mai 2016. http://ow.ly/4n3PJC","RAPPEL: C’est aujourd’hui la date limite pour produire votre déclaration de revenus! Si vous n’avez pas encore envoyé votre déclaration, ne vous en faites pas! L’Agence du revenu du Canada considérera votre déclaration et votre paiement comme étant reçus à temps si elle les reçoit au plus tard le mai , à minuit ou si le cachet de la poste est le mai . C",[],0.0,4.0,2,6,['Economical'],"['revenu', 'revenu']",fr,0.0,neutral,QuestionsdargentCanada_facebook
28037,180,725318574622040064,2016-04-27 13:39:58,['https://t.co/lRSK9Jd46I'],RT @MPO_DFO: SVQ le #homard est un des plus gros crustacés qui vit le plus longtemps? Certains vivent 50 ans! https://t.co/lRSK9Jd46I,RT SVQ le homard est un des plus gros qui vit le plus longtemps Certains vivent 50 ans https co lRSK9Jd46I,['#homard'],,6.0,0,6,['other'],[],fr,0.0,Neutral,MPO_Science_tweeter
44112,462,725112381458796545,2016-04-27 00:00:38,"['https://t.co/OOXdjVJ4jn', 'https://t.co/ErKuPjVlvo']","#AvisConsommateurs: remplacement possible de vis, certains sièges d’auto Evenflo 2013-2015. https://t.co/OOXdjVJ4jn https://t.co/ErKuPjVlvo",AvisConsommateurs remplacement possible de vis certains ges auto Evenflo 2013 2015 https co OOXdjVJ4jn https co ErKuPjVlvo,['#AvisConsommateurs'],,6.0,0,6,['other'],[],fr,0.0,Neutral,Transports_gc_tweeter
44111,461,724613391181029376,2016-04-25 14:57:49,"['https://t.co/fkwHaOhCUI', 'https://t.co/\xe2\x80\xa6']","RT @CN_CommFR: Prenez et partagez l'Engagement pour la Sécurité dès maintenant! https://t.co/fkwHaOhCUI

#SecuriteFerroviaire https://t.co/…",RT Prenez et partagez Engagement pour la maintenant https co fkwHaOhCUI SecuriteFerroviaire https co,['#SecuriteFerroviaire'],,6.0,0,6,['other'],[],fr,0.0,Neutral,Transports_gc_tweeter
9406,424,460123390028_10156798025330029,2016-04-13 12:30:50,https://www.facebook.com/EnvironnementetressourcesnaturellesauCanada/photos/a.481746145028.384353.460123390028/10156798025330029/?type=3,"À bord d’un hélicoptère ou d’un hydravion et munis de cuissardes et de jumelles, à tous les printemps, les biologistes d’Environnement et Changement climatique Canada vont sur le terrain en compagnie de partenaires des provinces et des États-Unis pour recueillir des données visant à vérifier que les populations d’oiseaux sont saines et que les taux de récolte sont durables. Pour en apprendre plus sur ces relevés qui nous aident à comprendre les oiseaux migrateurs considérés comme gibier, visitez : http://ow.ly/10Cd8t","À bord d’un hélicoptère ou d’un hydravion et munis de cuissardes et de jumelles, à tous les printemps, les biologistes d’Environnement et Changement climatique Canada vont sur le terrain en compagnie de partenaires des provinces et des États-Unis pour recueillir des données visant à vérifier que les populations d’oiseaux sont saines et que les taux de récolte sont durables. Pour en apprendre plus sur ces relevés qui nous aident à comprendre les oiseaux migrateurs considérés comme gibier, visitez :",[],0.0,3.0,3,6,"['Economical', 'Environmental', 'Social']","['changement', 'climatique', 'compagnie', 'population', 'oiseau']",fr,0.0,neutral,EnvironnementetressourcesnaturellesauCanada_facebook
4036,16,717439829970182146,2016-04-05 19:52:39,['https://t.co/h1FdXk3ct4'],"En plus des photos, notre page d'enquête en cour a été mise à jour pour notre enquête aux îlesdelamadeleine https://t.co/h1FdXk3ct4",En plus des photos notre page en cour mise jour pour notre aux lesdelamadeleine https co h1FdXk3ct4,[],,4.0,2,6,['other'],[],fr,0.0,Neutral,BSTCanada_tweeter
38520,551,485734081568161_717642295044004,2016-04-27 17:45:30,https://www.facebook.com/QuestionsdargentCanada/photos/a.534106823397553.1073741828.485734081568161/717642295044004/?type=3,"Le temps passe… Avez-vous négligé de soumettre votre déclaration de revenus? 

Si vous avez un compte Mon dossier de l’Agence du revenu du Canada avec tous les droits, vous pouvez gagner du temps en choisissant l’option « préremplir ma déclaration » au moment de soumettre votre déclaration en ligne.

Renseignements : http://ow.ly/4n3N3s","Le temps passe… Avez-vous négligé de soumettre votre déclaration de revenus? Si vous avez un compte Mon dossier de l’Agence du revenu du Canada avec tous les droits, vous pouvez gagner du temps en choisissant l’option « préremplir ma déclaration » au moment de soumettre votre déclaration en ligne. Renseignements :",[],0.0,1.0,5,6,['Economical'],"['revenu', 'revenu', 'droit']",fr,0.0,neutral,QuestionsdargentCanada_facebook
20308,193,716282453497876480,2016-04-02 15:13:39,['https://t.co/AOpkMQ7VeL'],"Ces 5 bases de ReS ouvrent le 1 avril : Amherstburg, Port Dover, Port Weller, Coburg et Kingston. #GCC_CGG #SAR https://t.co/AOpkMQ7VeL",bases ReS ouvrent avril Amherstburg Port Dover Port Weller Coburg Kingston SAR https co AOpkMQ7VeL,"['#GCC_CGG', '#SAR']",,4.0,2,6,['other'],[],no,0.0,Neutral,MPO_Centre_tweeter
20306,191,719643627971080193,2016-04-11 21:49:45,"['https://t.co/bg1oDi6m0Z', 'https://t.co/PHbfyKKbqB']",Déglaçage par la GCC cette semaine dans le chenal nord du lac Huron.  Détails ici https://t.co/bg1oDi6m0Z https://t.co/PHbfyKKbqB,age par la GCC cette semaine dans le chenal nord du lac Huron tails ici https co bg1oDi6m0Z https co PHbfyKKbqB,[],,4.0,2,6,"['Environmental', 'Social']","['nord', 'lac']",fr,0.0,Neutral,MPO_Centre_tweeter
20271,156,725047346040590336,2016-04-26 19:42:12,['https://t.co/lRSK9Jd46I'],RT @MPO_DFO: SVQ le #homard est un des plus gros crustacés qui vit le plus longtemps? Certains vivent 50 ans! https://t.co/lRSK9Jd46I,RT SVQ le homard est un des plus gros qui vit le plus longtemps Certains vivent 50 ans https co lRSK9Jd46I,['#homard'],,6.0,0,6,['other'],[],fr,0.0,Neutral,MPO_Centre_tweeter
38515,546,485734081568161_710650442409856,2016-04-11 17:45:27,https://www.facebook.com/QuestionsdargentCanada/photos/a.534106823397553.1073741828.485734081568161/710650442409856/?type=3,"Vous avez besoin d’aide pour produire votre déclaration de revenus? Les entreprises offrant des services de préparation de déclarations de revenus peuvent vous aider efficacement et à bas coût.

Toutefois, soyez circonspect si ces entreprises vous proposent de vous remettre votre remboursement d’impôt tout de suite. Vous pourriez avoir à payer des frais élevés pour un remboursement que vous obtiendriez GRATUITEMENT quelques semaines plus tard.

Renseignez-vous sur les différents types de conseillers financiers : http://ow.ly/10wuW6","Vous avez besoin d’aide pour produire votre déclaration de revenus? Les entreprises offrant des services de préparation de déclarations de revenus peuvent vous aider efficacement et à bas coût. Toutefois, soyez circonspect si ces entreprises vous proposent de vous remettre votre remboursement d’impôt tout de suite. Vous pourriez avoir à payer des frais élevés pour un remboursement que vous obtiendriez GRATUITEMENT quelques semaines plus tard. Renseignez-vous sur les différents types de conseillers financiers :",[],2.0,1.0,3,6,"['Economical', 'Social']","['revenu', 'entreprise', 'revenu', 'aider', 'entreprise']",fr,0.0,neutral,QuestionsdargentCanada_facebook
42719,398,377625007887_10154153719227888,2016-04-23 07:01:35,https://www.facebook.com/TransportsetInfrastructureauCanada/photos/a.10151491514147888.1073741825.377625007887/10154153719227888/?type=3,Savez-vous comment vous défaire de vos fusées de détresse marine périmées? Retournez-les au distributeur.,Savez-vous comment vous défaire de vos fusées de détresse marine périmées? Retournez-les au distributeur.,[],0.0,2.0,4,6,['Environmental'],['marine'],fr,0.0,neutral,TransportsetInfrastructureauCanada_facebook
42710,389,377625007887_10154106065607888,2016-04-03 17:00:59,https://www.facebook.com/TransportsetInfrastructureauCanada/photos/a.10151491514147888.1073741825.377625007887/10154106065607888/?type=3,"Vous contemplez les étoiles? Pointez-les du doigt, pas avec un #laser. #PasBrillant
http://www.tc.gc.ca/Pasbrillant","Vous contemplez les étoiles? Pointez-les du doigt, pas avec un .","['#laser', '#PasBrillant']",0.0,3.0,3,6,['Social'],"['#laser', '#pasbrillant']",fr,0.0,neutral,TransportsetInfrastructureauCanada_facebook
11373,767,715948417290276864,2016-04-01 17:06:19,"['https://t.co/zGRNmzysqN', 'https://t.co/6NjCsgoA1n']",Apprendre une langue autochtone grâce aux jeux linguistiques pour enfants de FirstVoices : https://t.co/zGRNmzysqN https://t.co/6NjCsgoA1n,Apprendre une langue autochtone ce aux jeux linguistiques pour enfants de FirstVoices https co zGRNmzysqN https co 6NjCsgoA1n,[],,4.0,2,6,['Social'],"['autochtone', 'enfant']",fr,0.0,Neutral,GCAutochtones_tweeter
44108,458,719615958986420224,2016-04-11 19:59:49,"['https://t.co/U7aLvr4T2x', 'https://t.co/P2oKPK5qbZ']",#Rappel: Hyundai Elantra 2008-2010. Déploiement imprévu possible #CoussinsGonflables avant. https://t.co/U7aLvr4T2x https://t.co/P2oKPK5qbZ,Rappel Hyundai Elantra 2008 2010 ploiement vu possible CoussinsGonflables avant https co U7aLvr4T2x https co P2oKPK5qbZ,"['#Rappel', '#CoussinsGonflables']",,5.0,1,6,['other'],[],fr,0.0,Neutral,Transports_gc_tweeter
42716,395,377625007887_10154136205732888,2016-04-15 19:01:29,https://www.facebook.com/TransportsetInfrastructureauCanada/photos/a.10151491514147888.1073741825.377625007887/10154136205732888/?type=3,Les avions et les oiseaux n’ont en commun que le vol. Les plans de gestion de la faune aux aéroports contribuent à la sécurité des oiseaux et des passagers. http://t.co/xHLq1A1Cqt,Les avions et les oiseaux n’ont en commun que le vol. Les plans de gestion de la faune aux aéroports contribuent à la sécurité des oiseaux et des passagers.,[],0.0,2.0,4,6,"['Environmental', 'Social']","['oiseau', 'faune', 'oiseau', 'passager']",fr,0.0,neutral,TransportsetInfrastructureauCanada_facebook
44107,457,718770883029049344,2016-04-09 12:01:47,"['https://t.co/8GRfkyAIJs', 'https://t.co/Zdbcql9d43']",Nous réglementons les #drones pour votre sécurité et celle de l’espace aérien. https://t.co/8GRfkyAIJs https://t.co/Zdbcql9d43,Nous glementons les drones pour votre et celle de espace rien https co 8GRfkyAIJs https co Zdbcql9d43,['#drones'],,5.0,1,6,['other'],[],fr,0.0,Neutral,Transports_gc_tweeter
21954,369,720270275787505664,2016-04-13 15:19:50,[],RT @Securite_Canada: 2 élèves can. ont inspiré la #journéerose internat.! Nous avons tous un rôle à jouer pour enrayer la discrimination ht…,RT ves ont la erose internat Nous avons tous un le jouer pour enrayer la discrimination,['#journ'],,6.0,0,6,['Social'],['discrimination'],fr,0.0,Neutral,MPO_DFO_tweeter
21947,362,725707461399842817,2016-04-28 15:25:16,['https://t\xe2\x80\xa6'],RT @CanadaUE: .@MPO_DFO Min Tootoo salue la politique arctique #UE &amp; possibilités accrues de coopération #CanadaUE dans la région https://t…,RT CanadaUE Min Tootoo salue la politique arctique UE amp accrues de ration CanadaUE dans la gion https,"['#UE', '#CanadaUE']",,6.0,0,6,['Economical'],"['politique', '#ue']",fr,0.0,Neutral,MPO_DFO_tweeter
21942,357,725044353601822720,2016-04-26 19:30:19,['https://t.co/lRSK9Jd46I'],SVQ le #homard est un des plus gros crustacés qui vit le plus longtemps? Certains vivent 50 ans! https://t.co/lRSK9Jd46I,SVQ le homard est un des plus gros qui vit le plus longtemps Certains vivent 50 ans https co lRSK9Jd46I,['#homard'],,6.0,0,6,['other'],[],fr,0.0,Neutral,MPO_DFO_tweeter
21927,342,718156747370860544,2016-04-07 19:21:25,[],"RT @RPNIlesGulf: #PointeEast à l'#îleSaturna est un endroit parfait pour observer des épaulards. #Mercredibaleine 
Photo : M.Ritter https:/…",RT RPNIlesGulf PointeEast leSaturna est un endroit parfait pour observer des paulards Mercredibaleine Photo Ritter https,"['#PointeEast', '#', '#Mercredibaleine']",,6.0,0,6,['other'],[],fr,0.0,Neutral,MPO_DFO_tweeter
3180,256,798775163588850_833226426810390,2016-04-21 10:00:44,https://www.youtube.com/watch?v=LSyQz3ObRhM,Nous possédons un flacon contenant un échantillon daté d’il y a 100 ans. Pourquoi? Parce que le sol est important! Nous travaillons avec les producteurs depuis un siècle pour en apprendre sur le riche héritage des sols du Canada et pour les conserver en tant que ressource naturelle. ow.ly/4mWo91,Nous possédons un flacon contenant un échantillon daté d’il y a ans. Pourquoi? Parce que le sol est important! Nous travaillons avec les producteurs depuis un siècle pour en apprendre sur le riche héritage des sols du Canada et pour les conserver en tant que ressource naturelle. 91,[],0.0,1.0,5,6,"['Economical', 'Environmental']","['sol', 'sol', 'ressource']",fr,0.0,neutral,AgricultureCanadienne_facebook
3177,253,798775163588850_828317277301305,2016-04-11 13:02:08,https://www.facebook.com/AgricultureCanadienne/photos/a.803710926428607.1073741828.798775163588850/828317277301305/?type=3,"Nos chercheurs ont fait une découverte qui aide nos producteurs de lait à économiser et à protéger l’environnement. De combien de tonnes cette découverte pourrait-elle faire baisser nos émissions annuelles d’azote?

A) 10 000 tonnes B) 15 000 tonnes C) 17 000 tonnes",Nos chercheurs ont fait une découverte qui aide nos producteurs de lait à économiser et à protéger l’environnement. De combien de tonnes cette découverte pourrait-elle faire baisser nos émissions annuelles d’azote? A) tonnes B) tonnes C) tonnes,[],3.0,1.0,2,6,['Environmental'],"['protéger', 'émission']",fr,0.0,neutral,AgricultureCanadienne_facebook
44109,459,722068697964285952,2016-04-18 14:26:07,"['https://t.co/GmZc47B8HP', 'https://t.co/t7CPGDWc4s']",Allez voir nos initiatives en transport écologique : https://t.co/GmZc47B8HP https://t.co/t7CPGDWc4s,Allez voir nos initiatives en transport cologique https co GmZc47B8HP https co t7CPGDWc4s,[],,3.0,3,6,"['Economical', 'Environmental']","['transport', 'écologique']",fr,0.0,Neutral,Transports_gc_tweeter
11488,882,725754082204487680,2016-04-28 18:30:31,['https://t.co/GriN30Sy6'],La min. Bennett et le Conseil canadien pour le commerce autochtone veulent développer l'entrepreneuriat autochtone. https://t.co/GriN30Sy6u,La min Bennett et le Conseil canadien pour le commerce autochtone veulent velopper entrepreneuriat autochtone https co GriN30Sy6u,[],,1.0,5,6,"['Economical', 'Social']","['commerce', 'autochtone', 'autochtone']",fr,0.0,Neutral,GCAutochtones_tweeter
11449,843,725391753356939264,2016-04-27 18:30:45,"['https://t.co/xn5Eb5DuA4', 'https://t.co/C7qPDFgbnG']",#budget2016 : investissements pour l'éducation des PN; construction et réparation d'écoles. https://t.co/xn5Eb5DuA4 https://t.co/C7qPDFgbnG,budget2016 investissements pour ducation des PN construction et paration coles https co xn5Eb5DuA4 https co C7qPDFgbnG,['#budget2016'],,3.0,3,6,"['Economical', 'Social']","['#budget2016', 'investissement', 'pn']",fr,0.0,Neutral,GCAutochtones_tweeter
11489,883,726031035465605120,2016-04-29 12:51:02,['https://t\xe2\x80\xa6'],RT @GGInnovation: Lauréate #GGInnovation : @christibelcourt  - L’artiste métisse fait la une grâce à ses collaborations inédites. https://t…,RT GGInnovation ate GGInnovation christibelcourt artiste tisse fait la une ce ses collaborations dites https,['#GGInnovation'],,6.0,0,6,['Social'],"['métis', 'collaboration']",fr,0.0,Neutral,GCAutochtones_tweeter
11367,761,718921671080611840,2016-04-09 22:00:57,['https://t.co/93AYJkiqLn'],"Aujourd'hui, la min. Bennett a rencontré les Tla'amins en C.-B. pour souligner l'entrée en vigueur de leur traité. https://t.co/93AYJkiqLn",Aujourd hui la min Bennett les Tla amins en pour souligner en vigueur de leur https co 93AYJkiqLn,[],,4.0,2,6,['other'],[],fr,0.0,Neutral,GCAutochtones_tweeter
11320,714,720235591384854533,2016-04-13 13:02:00,"['https://t.co/iP3vUlAw5G', 'https://t.co/ipcUBkrcj6']","#MardiQuiz : Naats'ihch'oh, le 44e parc du Canada, aux T.-N.O.,  créé en 2012: @ParcsCanada https://t.co/iP3vUlAw5G https://t.co/ipcUBkrcj6",MardiQuiz Naats ihch oh le 44e parc du Canada aux en 2012 ParcsCanada https co iP3vUlAw5G https co ipcUBkrcj6,['#MardiQuiz'],,1.0,5,6,['Environmental'],"['parc', 'parcscanada']",ca,0.0,Neutral,GCAutochtones_tweeter
