,Unnamed: 0,id,date_published,link,caption_original,caption_cleaned,hashtags,num_comments,num_shares,num_likes,Reactions_SUM,category,matched_keywords,language,average_sentiment_score,sentiment,account_name
12337,1731,724964369663168512,2016-04-26 14:12:29,[],RT @salledepresseGC: La ministre Bennett : Les investissements dans l'infrastructure aident les Autochtones. #budget2016 @AADNCanada https:…,RT salledepresseGC La ministre Bennett Les investissements dans infrastructure aident les Autochtones budget2016 AADNCanada https,['#budget2016'],,3.0,0,3,"['Economical', 'Social']","['ministre', 'investissement', 'autochtone', '#budget2016']",fr,0.0,Neutral,GCAutochtones_tweeter
12358,1752,726094244004417539,2016-04-29 17:02:12,['https://t.co/cMZMbs1M4W'],Min. Bennett discute avec les intervenants du #Budget2016 et enjeux qui touchent les Autochtones en milieu urbain. https://t.co/cMZMbs1M4W,Min Bennett discute les intervenants Budget2016 enjeux touchent les Autochtones milieu urbain https co cMZMbs1M4W,['#Budget2016'],,1.0,2,3,"['Economical', 'Social']","['#budget2016', 'autochtone']",fr,0.0,Neutral,GCAutochtones_tweeter
29793,465,715952000916172800,2016-04-01 17:20:33,['https://t.co/OhXnQS1rLs'],La #GCC est prête pour la saison des glaces! Composez le 1-709-772-2078 pour toute aide de #déglaçage https://t.co/OhXnQS1rLs,La GCC est pour la saison des glaces Composez le 709 772 2078 pour toute aide de age https co OhXnQS1rLs,"['#GCC', '#d']",,2.0,1,3,['other'],[],fr,0.0,Neutral,MPO_TNL_tweeter
28385,528,719529434655694848,2016-04-11 14:16:00,"['https://t.co/m1rEKp9QB', 'https://t.co/PfbHxgerXA']",RT @MPO_DFO: Galerie de photos : Le poisson le plus étrange! https://t.co/m1rEKp9QB8 https://t.co/PfbHxgerXA,RT Galerie de photos Le poisson le plus trange https co m1rEKp9QB8 https co PfbHxgerXA,[],,3.0,0,3,"['Environmental', 'Social']","['galerie', 'poisson']",fr,0.0,Neutral,MPO_Science_tweeter
3537,613,798775163588850_833736546759378,2016-04-22 12:54:02,http://nouvelles.gc.ca/web/article-fr.do?mthd=index&crtr.page=1&nid=1053209&_ga=1.1337266.282167464.1431699462,Merci pour tous vos « J’aime » et commentaires de cette semaine! Rappel – notre nouvelle la plus populaire de la semaine a été :,Merci pour tous vos « J’aime » et commentaires de cette semaine! Rappel – notre nouvelle la plus populaire de la semaine a été :,[],0.0,0.0,3,3,['other'],[],fr,0.0,neutral,AgricultureCanadienne_facebook
3505,581,798775163588850_829780483821651,2016-04-14 10:30:27,https://www.youtube.com/watch?v=wbARKZ1JQco,L’équipe du Centre de recherche et de développement de Saint-Hyacinthe a collaboré avec des partenaires de l’industrie de la transformation des aliments pour mettre au point un procédé de fermentation des légumes qui est à base de légumes. Pour en savoir plus sur les travaux de l’équipe :,L’équipe du Centre de recherche et de développement de Saint-Hyacinthe a collaboré avec des partenaires de l’industrie de la transformation des aliments pour mettre au point un procédé de fermentation des légumes qui est à base de légumes. Pour en savoir plus sur les travaux de l’équipe :,[],0.0,0.0,3,3,"['Economical', 'Social']","['développement', 'aliment']",fr,0.0,neutral,AgricultureCanadienne_facebook
3498,574,798775163588850_825778184221881,2016-04-06 10:50:19,http://ow.ly/10m4qP,Le programme de la de la Loi canadienne sur les prêts agricoles (LCPA) peut vous aider à améliorer votre ferme. Pour en savoir plus : http://ow.ly/10m4qP,Le programme de la de la Loi canadienne sur les prêts agricoles (LCPA) peut vous aider à améliorer votre ferme. Pour en savoir plus :,[],0.0,2.0,1,3,"['Economical', 'Social']","['aider', 'ferme']",fr,0.0,neutral,AgricultureCanadienne_facebook
3497,573,798775163588850_825379040928462,2016-04-05 14:45:38,https://www.facebook.com/AgricultureCanadienne/photos/a.798777310255302.1073741827.798775163588850/825379010928465/?type=3,,,[],0.0,0.0,3,3,['other'],[],tl,0.0,neutral,AgricultureCanadienne_facebook
12359,1753,725826979765870592,2016-04-28 23:20:11,['https://t.co/u4pOrphtZm'],"La min. Bennett souhaite une excellente retraite à Gary Lipinski, président du « Métis Nation of Ontario ». https://t.co/u4pOrphtZm",La min Bennett souhaite une excellente retraite Gary Lipinski sident du tis Nation Ontario https co u4pOrphtZm,[],,1.0,2,3,['Social'],['métis'],fr,0.0,Neutral,GCAutochtones_tweeter
12366,1760,723626311508484097,2016-04-22 21:35:31,[],RT @ministre_ec: #Budget2016 : 5 G$ d’investissements dans des projets axés sur l’eau/les eaux usées/des projets d’infrastructures vertes.…,RT Budget2016 investissements dans des projets sur eau les eaux es des projets infrastructures vertes,['#Budget2016'],,3.0,0,3,"['Economical', 'Environmental', 'Social']","['#budget2016', 'projet', 'eau', 'projet']",fr,0.0,Neutral,GCAutochtones_tweeter
22574,989,719159324690497536,2016-04-10 13:45:18,"['https://t.co/M3tP7ULS1w', 'https://t.co/4Z87EIZ0ry']","Mardi, les élèves ont relâché 20000 saumons dans le Guichon Creek du BCIT https://t.co/M3tP7ULS1w @MPO_Pacifique https://t.co/4Z87EIZ0ry",Mardi les ves ont 20000 saumons dans le Guichon Creek du BCIT https co M3tP7ULS1w https co 4Z87EIZ0ry,[],,2.0,1,3,['other'],[],fr,0.0,Neutral,MPO_DFO_tweeter
22573,988,719265023810531328,2016-04-10 20:45:19,"['https://t.co/m1rEKp9QB', 'https://t.co/PfbHxgerXA']",Galerie de photos : Le poisson le plus étrange! https://t.co/m1rEKp9QB8 https://t.co/PfbHxgerXA,Galerie de photos Le poisson le plus trange https co m1rEKp9QB8 https co PfbHxgerXA,[],,3.0,0,3,"['Environmental', 'Social']","['galerie', 'poisson']",fr,0.0,Neutral,MPO_DFO_tweeter
22572,987,719568233347555328,2016-04-11 16:50:10,['https://t.co/y2RsXhZsbA'],RT @GCC_CCG: M/V Silver King remorqué en toute sécurité à Ladysmith en attente de déconstruction #CB #GCCsurplace https://t.co/y2RsXhZsbA,RT Silver King en toute Ladysmith en attente de construction CB GCCsurplace https co y2RsXhZsbA,"['#CB', '#GCCsurplace']",,3.0,0,3,['other'],[],en,0.0,Neutral,MPO_DFO_tweeter
22570,985,719890598828863488,2016-04-12 14:11:08,[],RT @GCC_CCG: Bonne semaine des bénévoles! Merci à tous les bénévoles #GCCAuxiliaire à travers le pays pour leur dévouement #SAB2016,RT Bonne semaine des voles Merci tous les voles GCCAuxiliaire travers le pays pour leur vouement SAB2016,"['#GCCAuxiliaire', '#SAB2016']",,3.0,0,3,['Social'],['pays'],fr,0.0,Neutral,MPO_DFO_tweeter
22476,891,725773622653161475,2016-04-28 19:48:10,['https://t.co/\xe2\x80\xa6'],RT @GCC_CCG: Le Collège de la #GCC a également tenu une cérémonie du #jourdedeuil auj pour honorer ceux qui ont perdu la vie. https://t.co/…,RT Le ge de la GCC galement tenu une monie du jourdedeuil auj pour honorer ceux qui ont perdu la vie https co,"['#GCC', '#jourdedeuil']",,3.0,0,3,['Social'],"['cérémonie', 'vie']",fr,0.0,Neutral,MPO_DFO_tweeter
22478,893,725773604454076416,2016-04-28 19:48:06,['https://t.co/Dr0k6ZRPmY'],RT @GCC_CCG: Officier Arsenault de la #GCC &amp; Officier MacLean du #MPO déposent des couronnes #jourdedeuil https://t.co/Dr0k6ZRPmY,RT Officier Arsenault de la GCC amp Officier MacLean du MPO posent des couronnes jourdedeuil https co Dr0k6ZRPmY,"['#GCC', '#MPO', '#jourdedeuil']",,3.0,0,3,['other'],[],fr,0.0,Neutral,MPO_DFO_tweeter
22481,896,725723902618537985,2016-04-28 16:30:36,['https://t.co/zK1k13dILq'],"SVQ selon les experts, la pêche illégale, non déclarée et non réglementée coûte 10 à 23 G$US par an https://t.co/zK1k13dILq",SVQ selon les experts la gale non et non te 10 23 US par https co zK1k13dILq,[],,3.0,0,3,['other'],[],fr,0.0,Neutral,MPO_DFO_tweeter
22482,897,725693645920305152,2016-04-28 14:30:22,['https://t.co/0VJzeSxQeN'],"Près de 30 % du total des captures globales de poisson provient de la pêche illégale, non déclarée + non réglementée https://t.co/0VJzeSxQeN",de 30 du total des captures globales de poisson provient de la gale non non https co 0VJzeSxQeN,[],,3.0,0,3,['Environmental'],['poisson'],fr,0.0,Neutral,MPO_DFO_tweeter
22483,898,725366922628456448,2016-04-27 16:52:05,['https://t.co/X3hjIF\xe2\x80\xa6'],RT @salledepresseGC: #MinTootoo tiendra une conférence de presse à #SeafoodGlobal le 28 avril à 11h30 HAE (17:30h HEEC) https://t.co/X3hjIF…,RT salledepresseGC MinTootoo tiendra une rence de presse SeafoodGlobal le 28 avril 11h30 HAE 17 30h HEEC https co,"['#MinTootoo', '#SeafoodGlobal']",,3.0,0,3,['other'],[],fr,0.0,Neutral,MPO_DFO_tweeter
22517,932,724962463633035265,2016-04-26 14:04:55,"['https://t.co/7cQcvtut', 'https://t.co/E\xe2\x80\xa6']",RT @MPO_GCC_Quebec: Combien de temps un loup de mer peut-il survivre hors de l’eau? Pour le savoir…  https://t.co/7cQcvtut8U https://t.co/E…,RT Combien de temps un loup de mer peut il survivre hors de eau Pour le https co 7cQcvtut8U https co,[],,3.0,0,3,['Environmental'],['mer'],fr,0.0,Neutral,MPO_DFO_tweeter
22518,933,724684834602389504,2016-04-25 19:41:43,['https://t.co/ck2vctIrh'],RT @Transports_gc: Ns investissons ds l’alimentation à quai pr réduire les émissions aux ports #ActionClimatCAN https://t.co/ck2vctIrhD htt…,RT Ns investissons ds alimentation quai pr duire les missions aux ports ActionClimatCAN https co ck2vctIrhD,['#ActionClimatCAN'],,3.0,0,3,"['Economical', 'Environmental']","['investissons', 'réduire', 'émission', '#actionclimatcan']",fr,0.0,Neutral,MPO_DFO_tweeter
22555,970,723570834682580994,2016-04-22 17:55:04,['https://t.co/plkeNb9oqk'],Joyeux JourDeLaTerre “Plongez” dans les services d'adaptation aux changements climatiques en milieu aquatique du MPO https://t.co/plkeNb9oqk,Joyeux JourDeLaTerre dans les services adaptation aux changements climatiques en milieu aquatique du MPO https co plkeNb9oqk,[],,2.0,1,3,"['Environmental', 'Social']","['changement', 'mpo']",fr,0.0,Neutral,MPO_DFO_tweeter
22557,972,723563538569125889,2016-04-22 17:26:05,['https://t.co/gcqe\xe2\x80\xa6'],RT @MPO_Pacifique: .@MPO_DFO engagé à réduire son empreinte:Repensez l'énergie coupe 2000 t de carbone #JourdelaTerre2016 https://t.co/gcqe…,RT duire son empreinte Repensez nergie coupe 2000 de carbone JourdelaTerre2016 https co,['#JourdelaTerre2016'],,3.0,0,3,['Environmental'],['réduire'],fr,0.0,Neutral,MPO_DFO_tweeter
22559,974,723496450114617344,2016-04-22 12:59:30,[],"RT @MPO_Centre: Programme sur la carpe asiatique et formation avec @TRCA_Monitoring dans la baie Ashbridge, Toronto. #carpeasiatique https:…",RT Programme sur la carpe asiatique et formation avec dans la baie Ashbridge Toronto carpeasiatique https,['#carpeasiatique'],,3.0,0,3,['Social'],['formation'],fr,0.0,Neutral,MPO_DFO_tweeter
22560,975,722854668829720577,2016-04-20 18:29:17,['https://t.co/OsorBW0IjB'],RT @CanadaUE: Seulement 1 semaine avant #SEG16! Venez nous voir au Pavillon 9 et dire bonjour au #Canada https://t.co/OsorBW0IjB,RT CanadaUE Seulement semaine avant SEG16 Venez voir Pavillon dire bonjour Canada https co OsorBW0IjB,"['#SEG16', '#Canada']",,3.0,0,3,['other'],[],fr,0.0,Neutral,MPO_DFO_tweeter
22561,976,722528298706857986,2016-04-19 20:52:24,"['https://t.co/do3TDp1ddF', 'https://\xe2\x80\xa6']",RT @Transports_gc: Réunion du Conseil consultatif maritime can. au sujet de l’industrie maritime #CMAC2016 https://t.co/do3TDp1ddF https://…,RT union du Conseil consultatif maritime au sujet de industrie maritime CMAC2016 https co do3TDp1ddF https,['#CMAC2016'],,3.0,0,3,['Environmental'],"['maritime', 'maritime']",fr,0.0,Neutral,MPO_DFO_tweeter
22562,977,722177970018852864,2016-04-18 21:40:20,['https://t.co/9klRMGPla7'],RT @MPO_MAR: Le SeaCycler est récupéré sans problème dans le bassin de Bedford le jeudi https://t.co/9klRMGPla7,RT Le SeaCycler est sans dans le bassin de Bedford le jeudi https co 9klRMGPla7,[],,3.0,0,3,['other'],[],fr,0.0,Neutral,MPO_DFO_tweeter
22563,978,722115151370043392,2016-04-18 17:30:42,['https://t.co/rf\xe2\x80\xa6'],RT @MPO_MAR: L'équipe de l'IOB et l'Université Dalhousie plonge l'instrument de 5 000 lb dans le bassin de Bedford le mardi https://t.co/rf…,RT quipe de IOB et Dalhousie plonge instrument de 000 lb dans le bassin de Bedford le mardi https co,[],,3.0,0,3,['other'],[],fr,0.0,Neutral,MPO_DFO_tweeter
22567,982,721712606080327681,2016-04-17 14:51:08,['https://t.co/MwDyAX4CIW'],RT @GCC_CCG: Les Gardes côtières de 6 pays se sont rencontrées la sem. dernière lors du #FGCPN en #CB https://t.co/MwDyAX4CIW,RT Les Gardes res de pays se sont es la sem lors du FGCPN en CB https co MwDyAX4CIW,"['#FGCPN', '#CB']",,3.0,0,3,['Social'],['pays'],fr,0.0,Neutral,MPO_DFO_tweeter
12379,1773,718438325326127104,2016-04-08 14:00:19,"['https://t.co/9TGRd09K1K', 'https://t.co/cBco46ByL']",RT @BiblioArchives: Connaissez-vous un de ces hommes? https://t.co/9TGRd09K1K #Banff #UnVisageUnNom https://t.co/cBco46ByLd @AADNCanada htt…,RT BiblioArchives Connaissez vous un de ces hommes https co 9TGRd09K1K Banff UnVisageUnNom https co cBco46ByLd AADNCanada,"['#Banff', '#UnVisageUnNom']",,3.0,0,3,['Social'],['#unvisageunnom'],fr,0.0,Neutral,GCAutochtones_tweeter
12409,1803,716702122444726272,2016-04-03 19:01:16,"['https://t.co/wMsOawwthK', 'https://t.co/6HxqkrIP']",Écrivains/conteurs: bourses du @conseilartscan pour proj. littéraires en #languesautochtones https://t.co/wMsOawwthK https://t.co/6HxqkrIPd2,crivains conteurs bourses du conseilartscan pour proj raires en languesautochtones https co wMsOawwthK https co 6HxqkrIPd2,['#languesautochtones'],,2.0,1,3,['other'],[],fr,0.0,Neutral,GCAutochtones_tweeter
28386,529,718556227068932097,2016-04-08 21:48:49,['https://t.co/CVuiilWN5'],RT @MPO_TNL: Le #NGCC George R Pearkes effectue ce matin le #déglaçage à Fortune Harbour. Quelle vue! https://t.co/CVuiilWN59,RT Le NGCC George Pearkes effectue ce matin le age Fortune Harbour Quelle vue https co CVuiilWN59,"['#NGCC', '#d']",,3.0,0,3,['other'],[],fr,0.0,Neutral,MPO_Science_tweeter
26688,282,722910452997496832,2016-04-20 22:10:57,['https://t.co/EwTOi5mljE'],Regardez comment le Service hydrographique du Canada va au fond des choses au #LacCultus pour la première fois https://t.co/EwTOi5mljE,Regardez comment le Service hydrographique du Canada va au fond des choses au LacCultus pour la fois https co EwTOi5mljE,['#LacCultus'],,2.0,1,3,['other'],[],fr,0.0,Neutral,MPO_Pacifique_tweeter
44687,1037,726045838326304768,2016-04-29 13:49:51,[],RT @environnementca: Vous lisez ceci en chemin? Nos amis @BSTCanada et @Transports_gc et nous vous souhaitons BONNE ROUTE! #FF,RT environnementca lisez ceci chemin amis BSTCanada souhaitons BONNE ROUTE FF,['#FF'],,3.0,0,3,['Social'],['ami'],fr,0.0,Neutral,Transports_gc_tweeter
44685,1035,720706980449529856,2016-04-14 20:15:08,"['https://t.co/IxxiWldPel', 'https://t.co/z1NFhesxLi']","#Rappel: RAM Promaster 2015-2016 avec moteurs 2,4L. Le véhicule pourrait passer au neutre. https://t.co/IxxiWldPel https://t.co/z1NFhesxLi",Rappel RAM Promaster 2015 2016 avec moteurs 4L Le hicule pourrait passer au neutre https co IxxiWldPel https co z1NFhesxLi,['#Rappel'],,3.0,0,3,['Economical'],['véhicule'],fr,0.0,Neutral,Transports_gc_tweeter
43052,731,377625007887_10154144153282888,2016-04-19 07:02:08,https://www.facebook.com/TransportsetInfrastructureauCanada/photos/a.10151491514147888.1073741825.377625007887/10154144153282888/?type=3,"Quelle ville canadienne a le plus de kilomètres de pistes cyclables? http://ow.ly/YTn5H
A. Montréal
B. Toronto
C. Vancouver
D. Calgary",Quelle ville canadienne a le plus de kilomètres de pistes cyclables? A. Montréal B. Toronto C. Vancouver D. Calgary,[],2.0,0.0,1,3,['other'],[],fr,0.0,neutral,TransportsetInfrastructureauCanada_facebook
43058,737,377625007887_10154149797922888,2016-04-21 13:38:38,https://www.facebook.com/TransportsetInfrastructureauCanada/photos/a.10151491514147888.1073741825.377625007887/10154149797922888/?type=3,Les ministres Garneau et Sohi font équipe pour soutenir les collectivités canadiennes!,Les ministres Garneau et Sohi font équipe pour soutenir les collectivités canadiennes!,[],0.0,1.0,2,3,"['Economical', 'Social']","['ministre', 'garneau', 'collectivité']",fr,0.0,neutral,TransportsetInfrastructureauCanada_facebook
44683,1033,721066103355662336,2016-04-15 20:02:10,"['https://t.co/1Nf7C1qv6a', 'https://t.co/tTnQZx7ERx']",#Éphéméride Le #Titanic a sombré le 15 avr. 1912. La #SécuritéMaritime a bien évolué depuis: https://t.co/1Nf7C1qv6a https://t.co/tTnQZx7ERx,ride Le Titanic le 15 avr 1912 La Maritime bien depuis https co 1Nf7C1qv6a https co tTnQZx7ERx,"['#', '#Titanic', '#S']",,2.0,1,3,['other'],[],fr,0.0,Neutral,Transports_gc_tweeter
44675,1025,722824720287014917,2016-04-20 16:30:17,['https://t.co/p\xe2\x80\xa6'],RT @salledepresseGC: .@Transports_gc a identifié des problèmes de sécurité sur quatre modèles de #véhicules de Fiat Chrysler https://t.co/p…,RT salledepresseGC des mes de sur quatre les de hicules de Fiat Chrysler https co,['#v'],,3.0,0,3,['other'],[],fr,0.0,Neutral,Transports_gc_tweeter
44665,1015,722938258339012608,2016-04-21 00:01:26,"['https://t.co/dZZGF2qpaJ', 'https://t.co/oW5xTBRJmZ']",Vs voulez suivre un cours sur la #SécuritéNautique? Trouvez un prestataire de cours : https://t.co/dZZGF2qpaJ https://t.co/oW5xTBRJmZ,Vs voulez suivre un cours sur la Nautique Trouvez un prestataire de cours https co dZZGF2qpaJ https co oW5xTBRJmZ,['#S'],,2.0,1,3,['other'],[],fr,0.0,Neutral,Transports_gc_tweeter
26674,268,719591030434217985,2016-04-11 18:20:45,['https://t.co/y2RsXhZsbA'],RT @GCC_CCG: M/V Silver King remorqué en toute sécurité à Ladysmith en attente de déconstruction #CB #GCCsurplace https://t.co/y2RsXhZsbA,RT Silver King en toute Ladysmith en attente de construction CB GCCsurplace https co y2RsXhZsbA,"['#CB', '#GCCsurplace']",,3.0,0,3,['other'],[],en,0.0,Neutral,MPO_Pacifique_tweeter
43059,738,377625007887_10154142394927888,2016-04-22 11:00:00,https://www.facebook.com/TransportsetInfrastructureauCanada/videos/10154142394927888/,"Utiliser un drone près d’un aéronef ou d’un aéroport, c’est dangereux et illégal.","Utiliser un drone près d’un aéronef ou d’un aéroport, c’est dangereux et illégal.",[],0.0,1.0,2,3,['other'],[],fr,0.0,neutral,TransportsetInfrastructureauCanada_facebook
43068,747,377625007887_10154114952852888,2016-04-07 07:02:27,https://www.facebook.com/TransportsetInfrastructureauCanada/photos/a.10151491514147888.1073741825.377625007887/10154114952852888/?type=3,"Jeudi Rétro : Le C.D. Howe, navire mis en service en 1950 et nommé en l’honneur du 1er min des Transports, servait à ravitailler l’Arctique.","Jeudi Rétro : Le C.D. Howe, navire mis en service en et nommé en l’honneur du er min des Transports, servait à ravitailler l’Arctique.",[],0.0,1.0,2,3,['Economical'],['transport'],fr,0.0,neutral,TransportsetInfrastructureauCanada_facebook
43073,752,377625007887_10154117461317888,2016-04-08 07:02:28,https://www.facebook.com/TransportsetInfrastructureauCanada/photos/a.10151491514147888.1073741825.377625007887/10154117461317888/?type=3,"Vive Vendredi : Saviez-vous que nous sommes aussi sur Twitter? 
http://ow.ly/XWCh5",Vive Vendredi : Saviez-vous que nous sommes aussi sur Twitter?,[],0.0,1.0,1,3,['other'],[],en,0.0,neutral,TransportsetInfrastructureauCanada_facebook
29803,475,725368639914921984,2016-04-27 16:58:55,['https://t.co/X3hjIF\xe2\x80\xa6'],RT @salledepresseGC: #MinTootoo tiendra une conférence de presse à #SeafoodGlobal le 28 avril à 11h30 HAE (17:30h HEEC) https://t.co/X3hjIF…,RT salledepresseGC MinTootoo tiendra une rence de presse SeafoodGlobal le 28 avril 11h30 HAE 17 30h HEEC https co,"['#MinTootoo', '#SeafoodGlobal']",,3.0,0,3,['other'],[],fr,0.0,Neutral,MPO_TNL_tweeter
9757,775,460123390028_10156805532835029,2016-04-15 13:35:56,https://www.facebook.com/EnvironnementetressourcesnaturellesauCanada/photos/a.481746145028.384353.460123390028/10156805532835029/?type=3,"Le 15 avril 1972, le premier ministre du Canada, le très honorable Pierre Elliot Trudeau, et le président des États Unis, Richard Nixon, ont signé un accord historique relatif à la qualité de l’eau dans les Grands Lacs. Quarante-quatre ans plus tard, cet engagement binational est plus fort que jamais. 

Du 4 au 6 octobre 2016, le Canada et les États Unis tiendront le Forum public sur les Grands Lacs à Toronto (Canada). Vous pouvez vous joindre aux experts du gouvernement fédéral dans le cadre des discussions sur l’état des Grands Lacs et les priorités en matière de science et d’action, et célébrer tout ce qui fait de nos grands lacs une région extraordinaire. Dates à retenir! http://ow.ly/4mK6rL","Le avril , le premier ministre du Canada, le très honorable Pierre Elliot Trudeau, et le président des États Unis, Richard Nin, ont signé un accord historique relatif à la qualité de l’eau dans les Grands Lacs. Quarante-quatre ans plus tard, cet engagement binational est plus fort que jamais. Du au octobre , le Canada et les États Unis tiendront le Forum public sur les Grands Lacs à Toronto (Canada). Vous pouvez vous joindre aux eerts du gouvernement fédéral dans le cadre des discussions sur l’état des Grands Lacs et les priorités en matière de science et d’action, et célébrer tout ce qui fait de nos grands lacs une région extraordinaire. Dates à retenir!",[],0.0,1.0,2,3,"['Economical', 'Environmental', 'Social']","['ministre', 'historique', 'lac', 'engagement', 'lac', 'fédéral', 'discussion', 'lac', 'célébrer', 'lac']",fr,0.0,neutral,EnvironnementetressourcesnaturellesauCanada_facebook
9774,792,460123390028_10156772667820029,2016-04-07 07:01:57,https://www.facebook.com/EnvironnementetressourcesnaturellesauCanada/photos/a.481746145028.384353.460123390028/10156772667820029/?type=3,"Saviez-vous que les castors sont des ingénieurs hors pair? En effet, ils contruisent des barrages, huttes et canaux impressionnants. S’ils se déplacent lentement et peu gracieusement sur terre, c’est tout le contraire lorsqu’ils nagent dans l’eau. Et notre castor préféré, Parka, mascotte de Parcs Canada, est tout aussi amusant! Bonne Journée internationale du castor! http://ow.ly/10keNz","Saviez-vous que les castors sont des ingénieurs hors pair? En effet, ils contruisent des barrages, huttes et canaux impressionnants. S’ils se déplacent lentement et peu gracieusement sur terre, c’est tout le contraire lorsqu’ils nagent dans l’eau. Et notre castor préféré, Parka, mascotte de Parcs Canada, est tout aussi amusant! Bonne Journée internationale du castor!",[],0.0,0.0,2,3,['Environmental'],"['terre', 'parc']",fr,0.0,neutral,EnvironnementetressourcesnaturellesauCanada_facebook
9776,794,460123390028_10156777411075029,2016-04-08 11:14:00,https://www.facebook.com/EnvironnementetressourcesnaturellesauCanada/photos/a.481746145028.384353.460123390028/10156777411075029/?type=3,"Hé, les passionnés d’oiseaux! Voici le Macareux moine, la seule des quatre espèces de macareux qui vit dans l’océan Atlantique Nord. Ses touches colorées en font un candidat idéal pour orner des calendriers et des affiches. Tout un séducteur! http://ow.ly/10rZif","Hé, les passionnés d’oiseaux! Voici le Macareux moine, la seule des quatre espèces de macareux qui vit dans l’océan Atlantique Nord. Ses touches colorées en font un candidat idéal pour orner des calendriers et des affiches. Tout un séducteur!",[],0.0,0.0,3,3,"['Environmental', 'Social']","['espèce', 'nord']",fr,0.0,neutral,EnvironnementetressourcesnaturellesauCanada_facebook
9777,795,460123390028_10156778007060029,2016-04-08 14:25:12,https://www.facebook.com/EnvironnementetressourcesnaturellesauCanada/photos/a.481746145028.384353.460123390028/10156778007060029/?type=3,"Saviez-vous que les ampoules fluorescentes contiennent du mercure? S’il n’est pas éliminé correctement, le mercure peut s’introduire dans l’environnement. Donnez-nous votre avis sur le code de pratique proposé pour la gestion de ces ampoules. http://ow.ly/10sff2","Saviez-vous que les ampoules fluorescentes contiennent du mercure? S’il n’est pas éliminé correctement, le mercure peut s’introduire dans l’environnement. Donnez-nous votre avis sur le code de pratique proposé pour la gestion de ces ampoules. 2",[],0.0,1.0,2,3,['Environmental'],"['ampoule', 'ampoule']",fr,0.0,neutral,EnvironnementetressourcesnaturellesauCanada_facebook
29798,470,715957923852206081,2016-04-01 17:44:05,['https://t.co\xe2\x80\xa6'],RT @GCC_CCG: Le Collège de la GCC recrute pour son prog. Francophone. Joignez-vous à la @GCC_CCG pour une carrière gratifiante https://t.co…,RT Le ge de la GCC recrute pour son prog Francophone Joignez vous la pour une gratifiante https,[],,3.0,0,3,['Economical'],['carrière'],fr,0.0,Neutral,MPO_TNL_tweeter
45148,1498,722779414786940928,2016-04-20 13:30:15,['https://t.co/do3TDp1ddF'],"Ajd et demain, de 8h30 à 16h30, réunions du #CMAC2016. Pour en savoir plus : https://t.co/do3TDp1ddF",Ajd et demain de 8h30 16h30 unions du CMAC2016 Pour en savoir plus https co do3TDp1ddF,['#CMAC2016'],,1.0,1,2,['other'],[],fr,0.0,Neutral,Transports_gc_tweeter
45097,1447,718589632208879616,2016-04-09 00:01:33,"['https://t.co/bR8eOWHAt3', 'https://t.co/BsAgbnkcVz']","#LeSaviezVous, les routes du @AuCanada font plus d’un million de km. 
https://t.co/bR8eOWHAt3 https://t.co/BsAgbnkcVz",LeSaviezVous les routes du AuCanada font plus un million de km https co bR8eOWHAt3 https co BsAgbnkcVz,['#LeSaviezVous'],,1.0,1,2,['other'],[],fr,0.0,Neutral,Transports_gc_tweeter
